paperId,externalIds,title,venue,year,openAccessPdf,authors,abstract
3b51c6906e3294c35dfb36adedb7facb8ba8bd82,"{'MAG': '2581904482', 'DBLP': 'conf/cscw/PorcheronFS17', 'DOI': '10.1145/2998181.2998298', 'CorpusId': 24973803}","""Do Animals Have Accents?"": Talking with Agents in Multi-Party Conversation",Conference on Computer Supported Cooperative Work,2017,"{'url': 'http://eprints.nottingham.ac.uk/38039/', 'status': 'GREEN', 'license': None, 'disclaimer': ""Notice: The following paper fields have been elided by the publisher: {'abstract'}. Paper or abstract available at https://api.unpaywall.org/v2/10.1145/2998181.2998298?email=<INSERT_YOUR_EMAIL> or https://doi.org/10.1145/2998181.2998298, which is subject to the license by the author or copyright owner provided with this content. Please go to the source to verify the license and copyright information for your use.""}","[{'authorId': '1714888', 'name': 'Martin Porcheron'}, {'authorId': '3111124', 'name': 'J. Fischer'}, {'authorId': '144429627', 'name': 'S. Sharples'}]",
3b7b9b8f7ff94e47e8d0f928976e11f1a0122668,"{'MAG': '2588312088', 'DBLP': 'conf/cscw/PinaSWYMFK17', 'DOI': '10.1145/2998181.2998362', 'CorpusId': 27870702}",From Personal Informatics to Family Informatics: Understanding Family Practices around Health Monitoring,Conference on Computer Supported Cooperative Work,2017,"{'url': 'http://dl.acm.org/ft_gateway.cfm?id=2998362&type=pdf', 'status': 'GOLD', 'license': None, 'disclaimer': 'Notice: Paper or abstract available at https://api.unpaywall.org/v2/10.1145/2998181.2998362?email=<INSERT_YOUR_EMAIL> or https://doi.org/10.1145/2998181.2998362, which is subject to the license by the author or copyright owner provided with this content. Please go to the source to verify the license and copyright information for your use.'}","[{'authorId': '2285910', 'name': 'Laura R. Pina'}, {'authorId': '9033724', 'name': 'Sang-Wha Sien'}, {'authorId': '1885673', 'name': 'T. Ward'}, {'authorId': '145964520', 'name': 'Jason C. Yip'}, {'authorId': '6452115', 'name': 'Sean A Munson'}, {'authorId': '145504534', 'name': 'J. Fogarty'}, {'authorId': '1738606', 'name': 'J. Kientz'}]","In families composed of parents and children, the health of parents and children is often interrelated: the health of children can have an impact on the health of parents, and vice versa. However, the design of health tracking technologies typically focuses on individual self-tracking and self-management, not yet addressing family health in a unified way. To examine opportunities for family-centered health informatics, we interviewed 14 typically healthy families, interviewed 10 families with a child with a chronic condition, and conducted three participatory design sessions with children aged 7 to 11. Although we identified similarities between family-centered tracking and personal self-tracking, we also found families want to: (1) identify ripple effects between family members; (2) consider both caregivers and children as trackers to support distributing the burdens of tracking across family members; and (3) identify and pursue health guidelines that consider the state of their family (e.g., specific health guidelines for families that include a child with a chronic condition). We contribute to expanding the design lens from self-tracking to family-centered health tracking."
3bd8390ee80f51acbae03ac9351540070cce1960,"{'MAG': '2587969630', 'DBLP': 'conf/cscw/KimEWLMM17', 'DOI': '10.1145/2998181.2998185', 'CorpusId': 3348421}",What Makes a Strong Team?: Using Collective Intelligence to Predict Team Performance in League of Legends,Conference on Computer Supported Cooperative Work,2017,"{'url': 'http://dl.acm.org/ft_gateway.cfm?id=2998185&type=pdf', 'status': 'BRONZE', 'license': None, 'disclaimer': ""Notice: The following paper fields have been elided by the publisher: {'abstract'}. Paper or abstract available at https://api.unpaywall.org/v2/10.1145/2998181.2998185?email=<INSERT_YOUR_EMAIL> or https://doi.org/10.1145/2998181.2998185, which is subject to the license by the author or copyright owner provided with this content. Please go to the source to verify the license and copyright information for your use.""}","[{'authorId': '20241698', 'name': 'Young Ji Kim'}, {'authorId': '2068931882', 'name': 'David Engel'}, {'authorId': '2696361', 'name': 'A. Woolley'}, {'authorId': '48208330', 'name': 'J. Lin'}, {'authorId': '40230375', 'name': 'Naomi McArthur'}, {'authorId': '145850249', 'name': 'T. Malone'}]",
3cd874cc001d032ebadc5b64d117270b05c68d36,"{'MAG': '2588602204', 'DBLP': 'conf/cscw/Vigil-HayesDPB17', 'DOI': '10.1145/2998181.2998194', 'CorpusId': 14702685}",#Indigenous: Tracking the Connective Actions of Native American Advocates on Twitter,Conference on Computer Supported Cooperative Work,2017,"{'url': 'http://dl.acm.org/ft_gateway.cfm?id=2998194&type=pdf', 'status': 'GOLD', 'license': None, 'disclaimer': 'Notice: Paper or abstract available at https://api.unpaywall.org/v2/10.1145/2998181.2998194?email=<INSERT_YOUR_EMAIL> or https://doi.org/10.1145/2998181.2998194, which is subject to the license by the author or copyright owner provided with this content. Please go to the source to verify the license and copyright information for your use.'}","[{'authorId': '2252662425', 'name': 'Morgan Vigil-Hayes'}, {'authorId': '1403677275', 'name': 'M. Duarte'}, {'authorId': '2914671', 'name': 'N. D. Parkhurst'}, {'authorId': '1397933253', 'name': 'E. Belding-Royer'}]","With fewer than 66% of eligible voters registered and voter turnout rates 5-14 percentage points lower than any other ethnic group, Native Americans comprise the least participatory ethnic group in U.S. political elections [42, 57, 49, 25]. While discourse surrounding Native American issues and interests has increasingly moved to social media [55, 56], there is a lack of data about Native American political discourse on these platforms. Given the heterogeneity of Native American peoples in the U.S., one way to begin approaching a holistic understanding of Native American political discourse on social media is to characterize how Native American advocates utilize social media platforms for connective action. Using a post-structural, interdisciplinary, mixed methods approach, we use theories of connective action [5] and media richness [14] to analyze a Twitter data set culled from influential Native American advocates and their followers during the 2016 primary presidential election season. Our study sheds light on how Native American advocates use social media to propagate political information and identifies which issues are central to the political discourse of Native American advocates. Furthermore, we demonstrate how the bandwidth characteristics of content impact its propagation and we discuss this in the context of pernicious digital divide effects present in Indian Country."
3e812ffbc5d88d6d53e630db80910a99543aa0c0,"{'MAG': '2588847508', 'DBLP': 'conf/cscw/PaterM17', 'DOI': '10.1145/2998181.2998224', 'CorpusId': 207244185}",Defining Digital Self-Harm,Conference on Computer Supported Cooperative Work,2017,"{'url': 'http://dl.acm.org/ft_gateway.cfm?id=2998224&type=pdf', 'status': 'GOLD', 'license': None, 'disclaimer': 'Notice: Paper or abstract available at https://api.unpaywall.org/v2/10.1145/2998181.2998224?email=<INSERT_YOUR_EMAIL> or https://doi.org/10.1145/2998181.2998224, which is subject to the license by the author or copyright owner provided with this content. Please go to the source to verify the license and copyright information for your use.'}","[{'authorId': '50624238', 'name': 'Jessica A. Pater'}, {'authorId': '1752751', 'name': 'Elizabeth D. Mynatt'}]","Self-harm is the infliction of pain or injury onto oneself. Though historically these behaviors were relegated to the fringes of communities, information technology now enables new ways to foster and encourage these dangerous activities. This paper defines the concept of digital self-harm as the online communication and activity that leads to, supports, or exacerbates, non-suicidal yet intentional harm or impairment of an individual's physical wellbeing. We outline a research agenda for the CSCW community to understand the correlation and possible causation of offline self-harm behaviors due to online activities, and to design and assess technologies focused on prevention, mitigation and treatment. CAUTION: This paper includes media that could potentially be triggering to those dealing with an eating disorder or with other self-harm related illnesses. Please use caution when reading or disseminating this paper."
40e0d123357d4d3028ae8630da8a7f30e70f141b,"{'MAG': '2588206467', 'PubMedCentral': '5565732', 'DBLP': 'conf/cscw/ChoudhuryKW17', 'DOI': '10.1145/2998181.2998219', 'CorpusId': 6515206, 'PubMed': '28840199'}",Computational Approaches Toward Integrating Quantified Self Sensing and Social Media,Conference on Computer Supported Cooperative Work,2017,"{'url': 'https://europepmc.org/articles/pmc5565732?pdf=render', 'status': 'GREEN', 'license': None, 'disclaimer': 'Notice: Paper or abstract available at https://pmc.ncbi.nlm.nih.gov/articles/PMC5565732, which is subject to the license by the author or copyright owner provided with this content. Please go to the source to verify the license and copyright information for your use.'}","[{'authorId': '2583473', 'name': 'M. D. Choudhury'}, {'authorId': '2109676973', 'name': 'Mrinal Kumar'}, {'authorId': '1684687', 'name': 'Ingmar Weber'}]","The growing amount of data collected by quantified self tools and social media hold great potential for applications in personalized medicine. Whereas the first includes health-related physiological signals, the latter provides insights into a user's behavior. However, the two sources of data have largely been studied in isolation. We analyze public data from users who have chosen to connect their MyFitnessPal and Twitter accounts. We show that a user's diet compliance success, measured via their self-logged food diaries, can be predicted using features derived from social media: linguistic, activity, and social capital. We find that users with more positive affect and a larger social network are more successful in succeeding in their dietary goals. Using a Granger causality methodology, we also show that social media can help predict daily changes in diet compliance success or failure with an accuracy of 77%, that improves over baseline techniques by 17%. We discuss the implications of our work in the design of improved health interventions for behavior change."
411ca948c7ba610b7dd34353d948618a9ecc29ba,"{'MAG': '2546112086', 'DBLP': 'conf/cscw/SobelKMCCRCM17', 'DOI': '10.1145/2998181.2998231', 'CorpusId': 16353505}",EduFeed: A Social Feed to Engage Preliterate Children in Educational Activities,Conference on Computer Supported Cooperative Work,2017,"{'url': '', 'status': 'CLOSED', 'license': None, 'disclaimer': ""Notice: The following paper fields have been elided by the publisher: {'abstract'}. Paper or abstract available at https://api.unpaywall.org/v2/10.1145/2998181.2998231?email=<INSERT_YOUR_EMAIL> or https://doi.org/10.1145/2998181.2998231, which is subject to the license by the author or copyright owner provided with this content. Please go to the source to verify the license and copyright information for your use.""}","[{'authorId': '1841016', 'name': 'Kiley Sobel'}, {'authorId': '2064565683', 'name': 'G. Kovács'}, {'authorId': '9039017', 'name': 'Galen McQuillen'}, {'authorId': '144633112', 'name': 'Andrew Cross'}, {'authorId': '2065608510', 'name': 'N. Chandrasekaran'}, {'authorId': '1692395', 'name': 'N. Riche'}, {'authorId': '1722375', 'name': 'E. Cutrell'}, {'authorId': '144844426', 'name': 'M. Morris'}]",
4835d9633db98e323e5ff79500b06f1e9c520fff,"{'MAG': '2588172982', 'DBLP': 'conf/cscw/MitraWG17', 'DOI': '10.1145/2998181.2998351', 'CorpusId': 2037448}",A Parsimonious Language Model of Social Media Credibility Across Disparate Events,Conference on Computer Supported Cooperative Work,2017,"{'url': '', 'status': 'CLOSED', 'license': None, 'disclaimer': ""Notice: The following paper fields have been elided by the publisher: {'abstract'}. Paper or abstract available at https://api.unpaywall.org/v2/10.1145/2998181.2998351?email=<INSERT_YOUR_EMAIL> or https://doi.org/10.1145/2998181.2998351, which is subject to the license by the author or copyright owner provided with this content. Please go to the source to verify the license and copyright information for your use.""}","[{'authorId': '3019719', 'name': 'Tanushree Mitra'}, {'authorId': '2070127694', 'name': 'G. P. Wright'}, {'authorId': '145280613', 'name': 'Eric Gilbert'}]",
497d8594b4dc222e34cf02df2f9b70ed5cfca4ee,"{'MAG': '2588571538', 'DBLP': 'conf/cscw/HaratyMB17', 'DOI': '10.1145/2998181.2998289', 'CorpusId': 11673036}","Online Customization Sharing Ecosystems: Components, Roles, and Motivations",Conference on Computer Supported Cooperative Work,2017,"{'url': '', 'status': 'CLOSED', 'license': None, 'disclaimer': ""Notice: The following paper fields have been elided by the publisher: {'abstract'}. Paper or abstract available at https://api.unpaywall.org/v2/10.1145/2998181.2998289?email=<INSERT_YOUR_EMAIL> or https://doi.org/10.1145/2998181.2998289, which is subject to the license by the author or copyright owner provided with this content. Please go to the source to verify the license and copyright information for your use.""}","[{'authorId': '3189911', 'name': 'M. Haraty'}, {'authorId': '1713735', 'name': 'Joanna McGrenere'}, {'authorId': '144479941', 'name': 'Andrea Bunt'}]",
49c8885f91edcaa3ff44f25e940c0ba798e2e664,"{'MAG': '2529137305', 'DBLP': 'conf/cscw/KaneMPC17', 'DOI': '10.1145/2998181.2998284', 'CorpusId': 16747498}","""At times avuncular and cantankerous, with the reflexes of a mongoose"": Understanding Self-Expression through Augmentative and Alternative Communication Devices",Conference on Computer Supported Cooperative Work,2017,"{'url': '', 'status': 'CLOSED', 'license': None, 'disclaimer': ""Notice: The following paper fields have been elided by the publisher: {'abstract'}. Paper or abstract available at https://api.unpaywall.org/v2/10.1145/2998181.2998284?email=<INSERT_YOUR_EMAIL> or https://doi.org/10.1145/2998181.2998284, which is subject to the license by the author or copyright owner provided with this content. Please go to the source to verify the license and copyright information for your use.""}","[{'authorId': '2893996', 'name': 'Shaun K. Kane'}, {'authorId': '144844426', 'name': 'M. Morris'}, {'authorId': '40115811', 'name': 'A. Paradiso'}, {'authorId': '151473689', 'name': 'Jon Campbell'}]",
4a0c0b77f2c6cc9d1e4d6409a48adf02a9cbe0a5,"{'DBLP': 'conf/cscw/KukkaPBO17', 'MAG': '2588065765', 'DOI': '10.1145/2998181.2998341', 'CorpusId': 16899202}",Immersive Street-level Social Media in the 3D Virtual City: Anticipated User Experience and Conceptual Development,Conference on Computer Supported Cooperative Work,2017,"{'url': '', 'status': 'CLOSED', 'license': None, 'disclaimer': ""Notice: The following paper fields have been elided by the publisher: {'abstract'}. Paper or abstract available at https://api.unpaywall.org/v2/10.1145/2998181.2998341?email=<INSERT_YOUR_EMAIL> or https://doi.org/10.1145/2998181.2998341, which is subject to the license by the author or copyright owner provided with this content. Please go to the source to verify the license and copyright information for your use.""}","[{'authorId': '2220949', 'name': 'H. Kukka'}, {'authorId': '1854339', 'name': 'Minna Pakanen'}, {'authorId': '39083033', 'name': 'Mahmoud Badri'}, {'authorId': '144522420', 'name': 'T. Ojala'}]",
4a81ce66dcfceced343ac2338f7751f983b97b76,"{'MAG': '2613295443', 'CorpusId': 67439125}",Conveying Sense of Force Explicitly: Designing Future E-Reading Systems to Support Subjective Knowledge Sharing,Conference on Computer Supported Cooperative Work,2017,"{'url': '', 'status': None, 'license': None}","[{'authorId': '1756589', 'name': 'Chunming Gao'}]",
517e70697f9e7b02766591ab5339e8e3ce0438be,"{'MAG': '2587961353', 'DBLP': 'conf/cscw/SemaanBD17', 'DOI': '10.1145/2998181.2998221', 'CorpusId': 15501877}",Military Masculinity and the Travails of Transitioning: Disclosure in Social Media,Conference on Computer Supported Cooperative Work,2017,"{'url': '', 'status': 'CLOSED', 'license': None, 'disclaimer': ""Notice: The following paper fields have been elided by the publisher: {'abstract'}. Paper or abstract available at https://api.unpaywall.org/v2/10.1145/2998181.2998221?email=<INSERT_YOUR_EMAIL> or https://doi.org/10.1145/2998181.2998221, which is subject to the license by the author or copyright owner provided with this content. Please go to the source to verify the license and copyright information for your use.""}","[{'authorId': '3356301', 'name': 'Bryan C. Semaan'}, {'authorId': '3397152', 'name': 'Lauren M. Britton'}, {'authorId': '1909948', 'name': 'Bryan Dosono'}]",
518aef9c8c0940b370b52c55e66d0d5e57d823d9,"{'DBLP': 'conf/cscw/HeYHCH17', 'MAG': '2588077759', 'DOI': '10.1145/2998181.2998205', 'CorpusId': 7814941}",Why Did They Do That?: Exploring Attribution Mismatches Between Native and Non-Native Speakers Using Videoconferencing,Conference on Computer Supported Cooperative Work,2017,"{'url': '', 'status': 'CLOSED', 'license': None, 'disclaimer': ""Notice: The following paper fields have been elided by the publisher: {'abstract'}. Paper or abstract available at https://api.unpaywall.org/v2/10.1145/2998181.2998205?email=<INSERT_YOUR_EMAIL> or https://doi.org/10.1145/2998181.2998205, which is subject to the license by the author or copyright owner provided with this content. Please go to the source to verify the license and copyright information for your use.""}","[{'authorId': '2703330', 'name': 'Helen Ai He'}, {'authorId': '1696689', 'name': 'Naomi Yamashita'}, {'authorId': '2696202', 'name': 'Ari Hautasaari'}, {'authorId': '2118457865', 'name': 'Xun Cao'}, {'authorId': '27334995', 'name': 'E. Huang'}]",
5297d33f4bb5ffbc7a8a3321683435ed517af22d,"{'DBLP': 'conf/cscw/MurphyR17', 'MAG': '2588678436', 'DOI': '10.1145/2998181.2998315', 'CorpusId': 6102446}",Ambiguous Accountability: The Challenges of Identifying and Managing Patient-Related Information Problems in Collaborative Patient-Care Teams,Conference on Computer Supported Cooperative Work,2017,"{'url': '', 'status': 'CLOSED', 'license': None, 'disclaimer': ""Notice: The following paper fields have been elided by the publisher: {'abstract'}. Paper or abstract available at https://api.unpaywall.org/v2/10.1145/2998181.2998315?email=<INSERT_YOUR_EMAIL> or https://doi.org/10.1145/2998181.2998315, which is subject to the license by the author or copyright owner provided with this content. Please go to the source to verify the license and copyright information for your use.""}","[{'authorId': '25076279', 'name': 'Alison R. Murphy'}, {'authorId': '145526578', 'name': 'Madhu C. Reddy'}]",
52c3248151e1d1bee68eb1d9507bf4edcffff0bb,"{'MAG': '2588107045', 'DBLP': 'conf/cscw/VitakCSA17', 'DOI': '10.1145/2998181.2998337', 'CorpusId': 18959864}",Identifying Women's Experiences With and Strategies for Mitigating Negative Effects of Online Harassment,Conference on Computer Supported Cooperative Work,2017,"{'url': '', 'status': 'CLOSED', 'license': None, 'disclaimer': ""Notice: The following paper fields have been elided by the publisher: {'abstract'}. Paper or abstract available at https://api.unpaywall.org/v2/10.1145/2998181.2998337?email=<INSERT_YOUR_EMAIL> or https://doi.org/10.1145/2998181.2998337, which is subject to the license by the author or copyright owner provided with this content. Please go to the source to verify the license and copyright information for your use.""}","[{'authorId': '2538266', 'name': 'Jessica Vitak'}, {'authorId': '35107716', 'name': 'Kalyani Chadha'}, {'authorId': '152174307', 'name': 'Linda Steiner'}, {'authorId': '2220428', 'name': 'Zahra Ashktorab'}]",
538072a000b77b06b8516ff870fef71b417e7d7e,"{'MAG': '2587878468', 'DBLP': 'conf/cscw/Cingel17', 'DOI': '10.1145/2998181.2998240', 'CorpusId': 9512523}",How Parents Engage Children in Tablet-Based Reading Experiences: An Exploration of Haptic Feedback,Conference on Computer Supported Cooperative Work,2017,"{'url': '', 'status': 'CLOSED', 'license': None, 'disclaimer': ""Notice: The following paper fields have been elided by the publisher: {'abstract'}. Paper or abstract available at https://api.unpaywall.org/v2/10.1145/2998181.2998240?email=<INSERT_YOUR_EMAIL> or https://doi.org/10.1145/2998181.2998240, which is subject to the license by the author or copyright owner provided with this content. Please go to the source to verify the license and copyright information for your use.""}","[{'authorId': '2138257', 'name': 'Drew P. Cingel'}]",
54c3c7b4b4253a4fa2d8548bbacfe2503398f414,"{'MAG': '2588954567', 'DBLP': 'conf/cscw/AmesB17', 'DOI': '10.1145/2998181.2998318', 'CorpusId': 19654526}",'Connected Learning' and the Equity Agenda: A Microsociology of Minecraft Play,Conference on Computer Supported Cooperative Work,2017,"{'url': '', 'status': 'CLOSED', 'license': None, 'disclaimer': ""Notice: The following paper fields have been elided by the publisher: {'abstract'}. Paper or abstract available at https://api.unpaywall.org/v2/10.1145/2998181.2998318?email=<INSERT_YOUR_EMAIL> or https://doi.org/10.1145/2998181.2998318, which is subject to the license by the author or copyright owner provided with this content. Please go to the source to verify the license and copyright information for your use.""}","[{'authorId': '34764282', 'name': 'Morgan G. Ames'}, {'authorId': '48129731', 'name': 'Jenna Burrell'}]",
55049ac72bcea234cec51f087945a9347fb61bc9,"{'DBLP': 'conf/cscw/HannakWGMSW17', 'MAG': '2588799281', 'DOI': '10.1145/2998181.2998327', 'CorpusId': 4868043}",Bias in Online Freelance Marketplaces: Evidence from TaskRabbit and Fiverr,Conference on Computer Supported Cooperative Work,2017,"{'url': 'http://dl.acm.org/ft_gateway.cfm?id=2998327&type=pdf', 'status': 'GOLD', 'license': None, 'disclaimer': 'Notice: Paper or abstract available at https://api.unpaywall.org/v2/10.1145/2998181.2998327?email=<INSERT_YOUR_EMAIL> or https://doi.org/10.1145/2998181.2998327, which is subject to the license by the author or copyright owner provided with this content. Please go to the source to verify the license and copyright information for your use.'}","[{'authorId': '46886279', 'name': 'Anikó Hannák'}, {'authorId': '144065562', 'name': 'Claudia Wagner'}, {'authorId': '144240725', 'name': 'David García'}, {'authorId': '1729928', 'name': 'A. Mislove'}, {'authorId': '1743043', 'name': 'M. Strohmaier'}, {'authorId': '35497150', 'name': 'Christo Wilson'}]","Online freelancing marketplaces have grown quickly in recent years. In theory, these sites offer workers the ability to earn money without the obligations and potential social biases associated with traditional employment frameworks. In this paper, we study whether two prominent online freelance marketplaces - TaskRabbit and Fiverr - are impacted by racial and gender bias. From these two platforms, we collect 13,500 worker profiles and gather information about workers' gender, race, customer reviews, ratings, and positions in search rankings. In both marketplaces, we find evidence of bias: we find that gender and race are significantly correlated with worker evaluations, which could harm the employment opportunities afforded to the workers. We hope that our study fuels more research on the presence and implications of discrimination in online environments."
55a929b20175bb651e353033060c48ece691b940,"{'DBLP': 'conf/cscw/ZhangVK17', 'MAG': '2588775355', 'DOI': '10.1145/2998181.2998235', 'CorpusId': 15721684}",Wikum: Bridging Discussion Forums and Wikis Using Recursive Summarization,Conference on Computer Supported Cooperative Work,2017,"{'url': 'https://dspace.mit.edu/bitstream/1721.1/112676/1/Karger_wikum.pdf', 'status': 'GREEN', 'license': 'CCBYNCSA', 'disclaimer': 'Notice: Paper or abstract available at https://api.unpaywall.org/v2/10.1145/2998181.2998235?email=<INSERT_YOUR_EMAIL> or https://doi.org/10.1145/2998181.2998235, which is subject to the license by the author or copyright owner provided with this content. Please go to the source to verify the license and copyright information for your use.'}","[{'authorId': '144518215', 'name': 'Amy X. Zhang'}, {'authorId': '3492189', 'name': 'Lea Verou'}, {'authorId': '1743286', 'name': 'David R Karger'}]","Large-scale discussions between many participants abound on the internet today, on topics ranging from political arguments to group coordination. But as these discussions grow to tens of thousands of posts, they become ever more difficult for a reader to digest. In this article, we describe a workflow called recursive summarization, implemented in our Wikum prototype, that enables a large population of readers or editors to work in small doses to refine out the main points of the discussion. More than just a single summary, our workflow produces a summary tree that enables a reader to explore distinct subtopics at multiple levels of detail based on their interests. We describe lab evaluations showing that (i) Wikum can be used more effectively than a control to quickly construct a summary tree and (ii) the summary tree is more effective than the original discussion in helping readers identify and explore the main topics."
