paperId,externalIds,title,venue,year,openAccessPdf,authors,abstract
a8f5b10ef728a5eb7ff8c9e82bb4ce10eaae6c7b,"{'DBLP': 'conf/cscw/CavalcantiPBD17', 'MAG': '2795450318', 'DOI': '10.1145/2998181.2998266', 'CorpusId': 4269275}","Media, Meaning, and Context Loss in Ephemeral Communication Platforms: A Qualitative Investigation on Snapchat",Conference on Computer Supported Cooperative Work,2017,"{'url': 'https://scholarworks.indianapolis.iu.edu/bitstreams/a4c7491f-582d-4fcd-83bb-19c2e5f36f80/download', 'status': 'GREEN', 'license': 'other-oa', 'disclaimer': ""Notice: The following paper fields have been elided by the publisher: {'abstract'}. Paper or abstract available at https://api.unpaywall.org/v2/10.1145/2998181.2998266?email=<INSERT_YOUR_EMAIL> or https://doi.org/10.1145/2998181.2998266, which is subject to the license by the author or copyright owner provided with this content. Please go to the source to verify the license and copyright information for your use.""}","[{'authorId': '29817154', 'name': 'L. Cavalcanti'}, {'authorId': '2082409129', 'name': 'Alita Pinto'}, {'authorId': '3299367', 'name': 'Jed R. Brubaker'}, {'authorId': '2513003', 'name': 'Lynn S. Dombrowski'}]",
a936b3abc5306104785e0c82ae97319c36d35f45,"{'MAG': '2588389399', 'DBLP': 'conf/cscw/Ma17', 'DOI': '10.1145/2998181.2998241', 'CorpusId': 12890539}",What Happens in Happn: The Warranting Powers of Location History in Online Dating,Conference on Computer Supported Cooperative Work,2017,"{'url': '', 'status': 'CLOSED', 'license': None, 'disclaimer': ""Notice: The following paper fields have been elided by the publisher: {'abstract'}. Paper or abstract available at https://api.unpaywall.org/v2/10.1145/2998181.2998241?email=<INSERT_YOUR_EMAIL> or https://doi.org/10.1145/2998181.2998241, which is subject to the license by the author or copyright owner provided with this content. Please go to the source to verify the license and copyright information for your use.""}","[{'authorId': '2317911329', 'name': 'Xiao Ma'}]",
ad47387303260e0b2a2393af792ef6ac5706ebee,"{'MAG': '2588505903', 'DBLP': 'conf/cscw/ArifRSFTWS17', 'DOI': '10.1145/2998181.2998294', 'CorpusId': 15167363}",A Closer Look at the Self-Correcting Crowd: Examining Corrections in Online Rumors,Conference on Computer Supported Cooperative Work,2017,"{'url': 'http://dl.acm.org/ft_gateway.cfm?id=2998294&type=pdf', 'status': 'GOLD', 'license': None, 'disclaimer': 'Notice: Paper or abstract available at https://api.unpaywall.org/v2/10.1145/2998181.2998294?email=<INSERT_YOUR_EMAIL> or https://doi.org/10.1145/2998181.2998294, which is subject to the license by the author or copyright owner provided with this content. Please go to the source to verify the license and copyright information for your use.'}","[{'authorId': '3379899', 'name': 'Ahmer Arif'}, {'authorId': '2115466406', 'name': 'John J. Robinson'}, {'authorId': '2207331', 'name': 'Stephanie A. Stanek'}, {'authorId': '3365413', 'name': 'Elodie S. Fichet'}, {'authorId': '2058585902', 'name': 'Paul Townsend'}, {'authorId': '9035603', 'name': 'Zena Worku'}, {'authorId': '3181624', 'name': 'Kate Starbird'}]","This paper examines how users of social media correct online rumors during crisis events. Focusing on Twitter, we identify different patterns of information correcting behaviors and describe the actions, motivations, rationalizations and experiences of people who exhibited them. To do this, we analyze digital traces across two separate crisis events and interviews of fifteen individuals who generated some of those traces. Salient themes ensuing from this work help us describe: 1) different mechanisms of corrective action with respect to who gets corrected and how; 2) how responsibility is positioned for verifying and correcting information; and 3) how users' imagined audience influences their corrective strategy. We synthesize these three components into a preliminary model and explore the role of imagined audiences-both who those audiences are and how they react to and interact with shared information-in shaping users' decisions about whether and how to correct rumors."
b06020cb743b86893d8fe5e76cfaf2fa538b4a2d,"{'DBLP': 'conf/cscw/StisenV17', 'MAG': '2588600587', 'DOI': '10.1145/2998181.2998333', 'CorpusId': 13702073}",Clinical and Non-Clinical Handovers: Designing for Critical Moments,Conference on Computer Supported Cooperative Work,2017,"{'url': '', 'status': 'CLOSED', 'license': None, 'disclaimer': ""Notice: The following paper fields have been elided by the publisher: {'abstract'}. Paper or abstract available at https://api.unpaywall.org/v2/10.1145/2998181.2998333?email=<INSERT_YOUR_EMAIL> or https://doi.org/10.1145/2998181.2998333, which is subject to the license by the author or copyright owner provided with this content. Please go to the source to verify the license and copyright information for your use.""}","[{'authorId': '2753042', 'name': 'Allan Stisen'}, {'authorId': '2261922', 'name': 'N. Verdezoto'}]",
b0cf4b4417596fe91b68128273126d2405311d8a,"{'MAG': '2588112558', 'DBLP': 'conf/cscw/WongN17', 'DOI': '10.1145/2998181.2998355', 'CorpusId': 19114916}",Collaboration And Awareness Amongst Flight Attendants,Conference on Computer Supported Cooperative Work,2017,"{'url': 'https://summit.sfu.ca/_flysystem/fedora/sfu_migrate/17238/etd10024_SWong.pdf', 'status': 'GREEN', 'license': None, 'disclaimer': ""Notice: The following paper fields have been elided by the publisher: {'abstract'}. Paper or abstract available at https://api.unpaywall.org/v2/10.1145/2998181.2998355?email=<INSERT_YOUR_EMAIL> or https://doi.org/10.1145/2998181.2998355, which is subject to the license by the author or copyright owner provided with this content. Please go to the source to verify the license and copyright information for your use.""}","[{'authorId': '144146593', 'name': 'Stephanie Wong'}, {'authorId': '1688400', 'name': 'Carman Neustaedter'}]",
b1c5077200ebe0424a67e6a8c6620fca5b4bd347,"{'MAG': '2589063696', 'DBLP': 'conf/cscw/McGregorT17', 'DOI': '10.1145/2998181.2998335', 'CorpusId': 14238404}",More to Meetings: Challenges in Using Speech-Based Technology to Support Meetings,Conference on Computer Supported Cooperative Work,2017,"{'url': '', 'status': 'CLOSED', 'license': None, 'disclaimer': ""Notice: The following paper fields have been elided by the publisher: {'abstract'}. Paper or abstract available at https://api.unpaywall.org/v2/10.1145/2998181.2998335?email=<INSERT_YOUR_EMAIL> or https://doi.org/10.1145/2998181.2998335, which is subject to the license by the author or copyright owner provided with this content. Please go to the source to verify the license and copyright information for your use.""}","[{'authorId': '1752334', 'name': 'Moira Mcgregor'}, {'authorId': '8877278', 'name': 'John C. Tang'}]",
b49162dc174969dbeac3c8dd5a6523777f53b779,"{'MAG': '2589088084', 'DBLP': 'conf/cscw/Pfister17', 'DOI': '10.1145/2998181.2998262', 'CorpusId': 16426599}","""This will cause a lot of work."": Coping with Transferring Files and Passwords as Part of a Personal Digital Legacy",Conference on Computer Supported Cooperative Work,2017,"{'url': '', 'status': 'CLOSED', 'license': None, 'disclaimer': ""Notice: The following paper fields have been elided by the publisher: {'abstract'}. Paper or abstract available at https://api.unpaywall.org/v2/10.1145/2998181.2998262?email=<INSERT_YOUR_EMAIL> or https://doi.org/10.1145/2998181.2998262, which is subject to the license by the author or copyright owner provided with this content. Please go to the source to verify the license and copyright information for your use.""}","[{'authorId': '15795072', 'name': 'Joachim Pfister'}]",
b5618bbadd9f26745d646d16c0f036e26d4b1cc7,"{'MAG': '2588780661', 'DBLP': 'conf/cscw/Snyder17', 'DOI': '10.1145/2998181.2998239', 'CorpusId': 25886247}",Vernacular Visualization Practices in a Citizen Science Project,Conference on Computer Supported Cooperative Work,2017,"{'url': '', 'status': 'CLOSED', 'license': None, 'disclaimer': ""Notice: The following paper fields have been elided by the publisher: {'abstract'}. Paper or abstract available at https://api.unpaywall.org/v2/10.1145/2998181.2998239?email=<INSERT_YOUR_EMAIL> or https://doi.org/10.1145/2998181.2998239, which is subject to the license by the author or copyright owner provided with this content. Please go to the source to verify the license and copyright information for your use.""}","[{'authorId': '2280093', 'name': 'Jaime Snyder'}]",
b5ed0dd78ea33893f920f597387b051962cafa66,"{'MAG': '2588122555', 'DBLP': 'conf/cscw/HardyL17', 'DOI': '10.1145/2998181.2998347', 'CorpusId': 17400726}","Constructing a Desiring User: Discourse, Rurality, and Design in Location-Based Social Networks",Conference on Computer Supported Cooperative Work,2017,"{'url': 'http://dl.acm.org/ft_gateway.cfm?id=2998347&type=pdf', 'status': 'GOLD', 'license': None, 'disclaimer': 'Notice: Paper or abstract available at https://api.unpaywall.org/v2/10.1145/2998181.2998347?email=<INSERT_YOUR_EMAIL> or https://doi.org/10.1145/2998181.2998347, which is subject to the license by the author or copyright owner provided with this content. Please go to the source to verify the license and copyright information for your use.'}","[{'authorId': '144350403', 'name': 'Jean Hardy'}, {'authorId': '1724052', 'name': 'S. Lindtner'}]","A growing body of literature addresses the use of Grindr and SCRUFF, location-based networking applications for gay, bisexual, and queer men. This study builds on that work, asking whose sexuality is produced in the design and use of these applications. Drawing from ethnographic research and discourse analysis, we build on analytical frames from science and technology studies, feminist HCI, and sexuality studies, proposing what we call the desiring user: a user whose desires and sexuality are mediated through technological devices in particular ways. In doing so, we demonstrate how the discursive constructions of the user put forth by the creators of Grindr and SCRUFF clash with the lived reality of our rural interlocutors. We address emerging themes in CSCW and HCI related to the construction of sexual subjectivities and social computing in rural settings."
b67c72bf379a9d6d25d8bfb29fb06d941af89d0f,"{'MAG': '2588334051', 'DBLP': 'conf/cscw/YaoR017', 'DOI': '10.1145/2998181.2998316', 'CorpusId': 14737040}",Folk Models of Online Behavioral Advertising,Conference on Computer Supported Cooperative Work,2017,"{'url': '', 'status': 'CLOSED', 'license': None, 'disclaimer': ""Notice: The following paper fields have been elided by the publisher: {'abstract'}. Paper or abstract available at https://api.unpaywall.org/v2/10.1145/2998181.2998316?email=<INSERT_YOUR_EMAIL> or https://doi.org/10.1145/2998181.2998316, which is subject to the license by the author or copyright owner provided with this content. Please go to the source to verify the license and copyright information for your use.""}","[{'authorId': '2170740', 'name': 'Yaxing Yao'}, {'authorId': '8697938', 'name': 'D. Re'}, {'authorId': '2153675536', 'name': 'Yang Wang'}]",
b6b719d2d3471649bca35ecb49457fe2b8a5f576,"{'MAG': '2587999266', 'DBLP': 'conf/cscw/ForteAG17', 'DOI': '10.1145/2998181.2998273', 'CorpusId': 16197512}","Privacy, Anonymity, and Perceived Risk in Open Collaboration: A Study of Tor Users and Wikipedians",Conference on Computer Supported Cooperative Work,2017,"{'url': 'http://dl.acm.org/ft_gateway.cfm?id=2998273&type=pdf', 'status': 'GOLD', 'license': None, 'disclaimer': 'Notice: Paper or abstract available at https://api.unpaywall.org/v2/10.1145/2998181.2998273?email=<INSERT_YOUR_EMAIL> or https://doi.org/10.1145/2998181.2998273, which is subject to the license by the author or copyright owner provided with this content. Please go to the source to verify the license and copyright information for your use.'}","[{'authorId': '35751319', 'name': 'Andrea Forte'}, {'authorId': '2471896', 'name': 'Nazanin Andalibi'}, {'authorId': '1754991', 'name': 'R. Greenstadt'}]","This qualitative study examines privacy practices and concerns among contributors to open collaboration projects. We collected interview data from people who use the anonymity network Tor who also contribute to online projects and from Wikipedia editors who are concerned about their privacy to better understand how privacy concerns impact participation in open collaboration projects. We found that risks perceived by contributors to open collaboration projects include threats of surveillance, violence, harassment, opportunity loss, reputation loss, and fear for loved ones. We explain participants' operational and technical strategies for mitigating these risks and how these strategies affect their contributions. Finally, we discuss chilling effects associated with privacy loss, the need for open collaboration projects to go beyond attracting and educating participants to consider their privacy, and some of the social and technical approaches that could be explored to mitigate risk at a project or community level."
b93b947006ebcca4c4ef4f62f12c84987e44534a,"{'DBLP': 'conf/cscw/KellyGPW17', 'MAG': '2562939785', 'DOI': '10.1145/2998181.2998184', 'CorpusId': 14189450}",Demanding by Design: Supporting Effortful Communication Practices in Close Personal Relationships,Conference on Computer Supported Cooperative Work,2017,"{'url': 'https://oro.open.ac.uk/50899/1/EffortfulPractices.pdf', 'status': 'GREEN', 'license': None, 'disclaimer': ""Notice: The following paper fields have been elided by the publisher: {'abstract'}. Paper or abstract available at https://api.unpaywall.org/v2/10.1145/2998181.2998184?email=<INSERT_YOUR_EMAIL> or https://doi.org/10.1145/2998181.2998184, which is subject to the license by the author or copyright owner provided with this content. Please go to the source to verify the license and copyright information for your use.""}","[{'authorId': '144288689', 'name': 'R. Kelly'}, {'authorId': '144524233', 'name': 'D. Gooch'}, {'authorId': '2057606321', 'name': 'Bhagyashree Patil'}, {'authorId': '49409850', 'name': 'L. Watts'}]",
ba7c3de0102b3092f9b99b715a38ed46d173ccd5,"{'DBLP': 'conf/cscw/YeR17', 'MAG': '2526685122', 'DOI': '10.1145/2998181.2998261', 'CorpusId': 1869062}",Does Collectivism Inhibit Individual Creativity?: The Effects of Collectivism and Perceived Diversity on Individual Creativity and Satisfaction in Virtual Ideation Teams,Conference on Computer Supported Cooperative Work,2017,"{'url': 'http://dl.acm.org/ft_gateway.cfm?id=2998261&type=pdf', 'status': 'GOLD', 'license': None, 'disclaimer': 'Notice: Paper or abstract available at https://api.unpaywall.org/v2/10.1145/2998181.2998261?email=<INSERT_YOUR_EMAIL> or https://doi.org/10.1145/2998181.2998261, which is subject to the license by the author or copyright owner provided with this content. Please go to the source to verify the license and copyright information for your use.'}","[{'authorId': '37366924', 'name': 'T. Ye'}, {'authorId': '145543300', 'name': 'L. Robert'}]","One particular problem CSCW and HCI scholars have sought to address through the design of collaborative systems is the issues associated with diversity and creativity. Diversity can promote creativity by exposing individuals to different perspectives and at the same time make it difficult for teams to leverage their differences to be more creative. This paper asserts that through the promotion of cooperation, collectivism will help ideation team members overcome the challenges associated with diversity and promote creativity. To examine this assertion, we conducted an experimental study involving 107 individuals in 33 idea-generation teams. Collectivism was promoted through priming. The results confirm our assertion: collectivism created conditions that facilitated creativity when teams were high in perceived diversity. Collectivism also facilitated more satisfaction among teammates by offsetting negative perceptions of diversity. These results offer new insights on collectivism, perceived diversity and creativity."
ba7f936f82e1e3376db8ce7943d1289d070496cd,"{'MAG': '2588775374', 'DBLP': 'conf/cscw/GugenheimerPSVD17', 'DOI': '10.1145/2998181.2998203', 'CorpusId': 1121965}",The Impact of Assistive Technology on Communication Quality Between Deaf and Hearing Individuals,Conference on Computer Supported Cooperative Work,2017,"{'url': '', 'status': 'CLOSED', 'license': None, 'disclaimer': ""Notice: The following paper fields have been elided by the publisher: {'abstract'}. Paper or abstract available at https://api.unpaywall.org/v2/10.1145/2998181.2998203?email=<INSERT_YOUR_EMAIL> or https://doi.org/10.1145/2998181.2998203, which is subject to the license by the author or copyright owner provided with this content. Please go to the source to verify the license and copyright information for your use.""}","[{'authorId': '3186723', 'name': 'Jan Gugenheimer'}, {'authorId': '2514828', 'name': 'Katrin Plaumann'}, {'authorId': '34949741', 'name': 'F. Schaub'}, {'authorId': '40416217', 'name': 'Patrizia Di Campli San Vito'}, {'authorId': '48898291', 'name': 'Saskia Duck'}, {'authorId': '40953638', 'name': 'M. Rabus'}, {'authorId': '2021950', 'name': 'E. Rukzio'}]",
bb2f40fdd3eb34063db25d3968bee6be22b1e6eb,"{'DBLP': 'conf/cscw/LiuWC17', 'CorpusId': 288401140}",Assessing Behavior Stage Progression From Social Media Data,Conference on Computer Supported Cooperative Work,2017,"{'url': '', 'status': None, 'license': None, 'disclaimer': ""Notice: The following paper fields have been elided by the publisher: {'abstract'}. Paper or abstract available at https://www.wikidata.org/entity/Q89641673, which is subject to the license by the author or copyright owner provided with this content. Please go to the source to verify the license and copyright information for your use.""}","[{'authorId': '2299746734', 'name': 'Jiaxin Liu'}, {'authorId': '1929547', 'name': 'E. Weitzman'}, {'authorId': '3144230', 'name': 'R. Chunara'}]",
bce84d1efec8fbeb597f20eb13448074db216571,"{'MAG': '2587836231', 'DBLP': 'conf/cscw/AhmedF17', 'DOI': '10.1145/2998181.2998249', 'CorpusId': 18394254}",Capturing Winning Ideas in Online Design Communities,Conference on Computer Supported Cooperative Work,2017,"{'url': '', 'status': 'CLOSED', 'license': None, 'disclaimer': ""Notice: The following paper fields have been elided by the publisher: {'abstract'}. Paper or abstract available at https://api.unpaywall.org/v2/10.1145/2998181.2998249?email=<INSERT_YOUR_EMAIL> or https://doi.org/10.1145/2998181.2998249, which is subject to the license by the author or copyright owner provided with this content. Please go to the source to verify the license and copyright information for your use.""}","[{'authorId': '1976481', 'name': 'Faez Ahmed'}, {'authorId': '1875472', 'name': 'M. Fuge'}]",
bd81415ffe0b3fc663ea895f751a29d70bab1125,"{'MAG': '2588888822', 'DBLP': 'conf/cscw/OLearyBMWP17', 'DOI': '10.1145/2998181.2998349', 'CorpusId': 18121261}",Design Opportunities for Mental Health Peer Support Technologies,Conference on Computer Supported Cooperative Work,2017,"{'url': '', 'status': 'CLOSED', 'license': None, 'disclaimer': ""Notice: The following paper fields have been elided by the publisher: {'abstract'}. Paper or abstract available at https://api.unpaywall.org/v2/10.1145/2998181.2998349?email=<INSERT_YOUR_EMAIL> or https://doi.org/10.1145/2998181.2998349, which is subject to the license by the author or copyright owner provided with this content. Please go to the source to verify the license and copyright information for your use.""}","[{'authorId': '1404390670', 'name': ""Katie O'Leary""}, {'authorId': '49696412', 'name': 'Arpita Bhattacharya'}, {'authorId': '6452115', 'name': 'Sean A Munson'}, {'authorId': '1796045', 'name': 'J. Wobbrock'}, {'authorId': '144476960', 'name': 'W. Pratt'}]",
be1fa7a4319c7207b8fc1a99cdefe59e25d14f91,"{'MAG': '2588753892', 'DBLP': 'conf/cscw/ChenCRGP17', 'DOI': '10.1145/2998181.2998350', 'CorpusId': 18746150}",Design Considerations for Social Fitness Applications: Comparing Chronically Ill Patients and Healthy Adults,Conference on Computer Supported Cooperative Work,2017,"{'url': '', 'status': 'CLOSED', 'license': None, 'disclaimer': ""Notice: The following paper fields have been elided by the publisher: {'abstract'}. Paper or abstract available at https://api.unpaywall.org/v2/10.1145/2998181.2998350?email=<INSERT_YOUR_EMAIL> or https://doi.org/10.1145/2998181.2998350, which is subject to the license by the author or copyright owner provided with this content. Please go to the source to verify the license and copyright information for your use.""}","[{'authorId': '2269081528', 'name': 'Yu Chen'}, {'authorId': '2267873285', 'name': 'Yunan Chen'}, {'authorId': '1902454', 'name': 'M. Randriambelonoro'}, {'authorId': '1792536', 'name': 'A. Geissbühler'}, {'authorId': '1781996', 'name': 'P. Pu'}]",
bf2a139c8280dc9d51978cebe9a3f380821590c1,"{'DBLP': 'conf/cscw/LazarDBKP17', 'MAG': '2589030362', 'DOI': '10.1145/2998181.2998275', 'CorpusId': 13290511}","Going Gray, Failure to Hire, and the Ick Factor: Analyzing How Older Bloggers Talk about Ageism",Conference on Computer Supported Cooperative Work,2017,"{'url': 'http://dl.acm.org/ft_gateway.cfm?id=2998275&type=pdf', 'status': 'GOLD', 'license': None, 'disclaimer': 'Notice: Paper or abstract available at https://api.unpaywall.org/v2/10.1145/2998181.2998275?email=<INSERT_YOUR_EMAIL> or https://doi.org/10.1145/2998181.2998275, which is subject to the license by the author or copyright owner provided with this content. Please go to the source to verify the license and copyright information for your use.'}","[{'authorId': '29898555', 'name': 'Amanda Lazar'}, {'authorId': '145457966', 'name': 'Mark Diaz'}, {'authorId': '145664318', 'name': 'Robin N. Brewer'}, {'authorId': '9043646', 'name': 'Chelsea Kim'}, {'authorId': '2373998', 'name': 'Anne Marie Piper'}]","Ageism is a pervasive, and often invisible, form of discrimination. Though it can affect people of all ages, older adults in particular face age-related stereotypes and bias in their everyday lives. In this paper, we describe the ways in which older bloggers articulate a collective narrative on ageism as it appears in their lives, develop a community with anti-ageist interests, and discuss strategies to navigate and change societal views and institutions. Bloggers criticize stereotypical notions that focus exclusively on losses that occur with age and advocate a view that takes into account the complexity and positive aspects of older adulthood. This paper contributes a unique case of online collective action among older adults while drawing on their online discourse as a way of understanding what ageism means for CSCW."
c2d6bfea98d9dc0adc55781ed354ca4456953638,"{'DBLP': 'conf/cscw/BuyukturA17', 'MAG': '2587897132', 'DOI': '10.1145/2998181.2998361', 'CorpusId': 18604414}",Information Work in Bone Marrow Transplant: Reducing Misalignment of Perspectives,Conference on Computer Supported Cooperative Work,2017,"{'url': '', 'status': 'CLOSED', 'license': None, 'disclaimer': ""Notice: The following paper fields have been elided by the publisher: {'abstract'}. Paper or abstract available at https://api.unpaywall.org/v2/10.1145/2998181.2998361?email=<INSERT_YOUR_EMAIL> or https://doi.org/10.1145/2998181.2998361, which is subject to the license by the author or copyright owner provided with this content. Please go to the source to verify the license and copyright information for your use.""}","[{'authorId': '3357912', 'name': 'Ayse G. Büyüktür'}, {'authorId': '1797833', 'name': 'M. Ackerman'}]",
c32637e87219cd09a7e8b5747d3d57e807c4b387,"{'MAG': '2588716556', 'DBLP': 'conf/cscw/EschlerP17', 'DOI': '10.1145/2998181.2998326', 'CorpusId': 5938872}","""I'm so glad I met you"": Designing Dynamic Collaborative Support for Young Adult Cancer Survivors",Conference on Computer Supported Cooperative Work,2017,"{'url': '', 'status': 'CLOSED', 'license': None, 'disclaimer': ""Notice: The following paper fields have been elided by the publisher: {'abstract'}. Paper or abstract available at https://api.unpaywall.org/v2/10.1145/2998181.2998326?email=<INSERT_YOUR_EMAIL> or https://doi.org/10.1145/2998181.2998326, which is subject to the license by the author or copyright owner provided with this content. Please go to the source to verify the license and copyright information for your use.""}","[{'authorId': '35182924', 'name': 'J. Eschler'}, {'authorId': '144476960', 'name': 'W. Pratt'}]",
c6d8a0cb46079d9ae862b74c44ac1aca120c5cc1,"{'MAG': '2588355074', 'DBLP': 'conf/cscw/NakikjM17', 'DOI': '10.1145/2998181.2998339', 'CorpusId': 17711854}",A Park or A Highway: Overcoming Tensions in Designing for Socio-emotional and Informational Needs in Online Health Communities,Conference on Computer Supported Cooperative Work,2017,"{'url': '', 'status': 'CLOSED', 'license': None, 'disclaimer': ""Notice: The following paper fields have been elided by the publisher: {'abstract'}. Paper or abstract available at https://api.unpaywall.org/v2/10.1145/2998181.2998339?email=<INSERT_YOUR_EMAIL> or https://doi.org/10.1145/2998181.2998339, which is subject to the license by the author or copyright owner provided with this content. Please go to the source to verify the license and copyright information for your use.""}","[{'authorId': '2625049', 'name': 'Drashko Nakikj'}, {'authorId': '3245570', 'name': 'Lena Mamykina'}]",
