paperId,externalIds,title,venue,year,openAccessPdf,authors,abstract
6bd2a1f05f9b38f646c8fd37cc6621eb175fc5c8,"{'MAG': '2589016589', 'DBLP': 'conf/cscw/LykourentzouKD17', 'DOI': '10.1145/2998181.2998322', 'CorpusId': 2266366}",Team Dating Leads to Better Online Ad Hoc Collaborations,Conference on Computer Supported Cooperative Work,2017,"{'url': 'http://dl.acm.org/ft_gateway.cfm?id=2998322&type=pdf', 'status': 'GOLD', 'license': None, 'disclaimer': 'Notice: Paper or abstract available at https://api.unpaywall.org/v2/10.1145/2998181.2998322?email=<INSERT_YOUR_EMAIL> or https://doi.org/10.1145/2998181.2998322, which is subject to the license by the author or copyright owner provided with this content. Please go to the source to verify the license and copyright information for your use.'}","[{'authorId': '3229142', 'name': 'Ioanna Lykourentzou'}, {'authorId': '1702853', 'name': 'R. Kraut'}, {'authorId': '48256159', 'name': 'Steven W. Dow'}]","Forming work teams involves matching people with complementary skills and personalities, but requires obtaining such data a priori. We introduce team dating, where people interact on brief tasks before working with a dedicated partner for longer, more complex tasks. We studied team dating through two online experiments. In Experiment 1, workers from a crowd platform independently wrote an ad slogan, discussed it with three consecutive people and evaluated their team date interactions. They then selected preferred teammates from a list showing average ratings for people they had dated and not dated. Results show that participants evaluated their dates based on evidence beyond externally judged slogan quality, and relied heavily on their dyad-specific judgments in selecting teammates. In Experiment 2, we replicated the individual and team dating tasks, and formed teams, either i) by honoring pairwise team dating preferences, ii) randomly from their pool of dates, or iii) randomly from those not dated. Results show that teams formed from preferred dates performed better on a final creative task compared to random dates or non-dates. Team dating provides a dynamic technique for forming ad hoc teams accounting for interpersonal dynamics. The initial interactions provided information that helped people select and work with an appropriate teammate."
6c29e1b735b45352f35db098bc96649d40c4494b,"{'MAG': '2587859801', 'DBLP': 'conf/cscw/GrinbergKAN17', 'DOI': '10.1145/2998181.2998320', 'CorpusId': 17906617}",Understanding Feedback Expectations on Facebook,Conference on Computer Supported Cooperative Work,2017,"{'url': '', 'status': 'CLOSED', 'license': None, 'disclaimer': ""Notice: The following paper fields have been elided by the publisher: {'abstract'}. Paper or abstract available at https://api.unpaywall.org/v2/10.1145/2998181.2998320?email=<INSERT_YOUR_EMAIL> or https://doi.org/10.1145/2998181.2998320, which is subject to the license by the author or copyright owner provided with this content. Please go to the source to verify the license and copyright information for your use.""}","[{'authorId': '145836652', 'name': 'Nir Grinberg'}, {'authorId': '40413877', 'name': 'Shankar Kalyanaraman'}, {'authorId': '1778398', 'name': 'Lada A. Adamic'}, {'authorId': '1687465', 'name': 'Mor Naaman'}]",
72a62ff0f100dc138ec52e2756671cabb18651e4,"{'DBLP': 'conf/cscw/MaHMN17', 'MAG': '2588243197', 'DOI': '10.1145/2998181.2998269', 'CorpusId': 12325246}",Self-Disclosure and Perceived Trustworthiness of Airbnb Host Profiles,Conference on Computer Supported Cooperative Work,2017,"{'url': '', 'status': 'CLOSED', 'license': None, 'disclaimer': ""Notice: The following paper fields have been elided by the publisher: {'abstract'}. Paper or abstract available at https://api.unpaywall.org/v2/10.1145/2998181.2998269?email=<INSERT_YOUR_EMAIL> or https://doi.org/10.1145/2998181.2998269, which is subject to the license by the author or copyright owner provided with this content. Please go to the source to verify the license and copyright information for your use.""}","[{'authorId': '2317911329', 'name': 'Xiao Ma'}, {'authorId': '1697703', 'name': 'Jeffrey T. Hancock'}, {'authorId': '9034051', 'name': 'Kenneth Lim Mingjie'}, {'authorId': '1687465', 'name': 'Mor Naaman'}]",
7343660955f913ce1e2abe914b725ce725aef4a6,"{'MAG': '2588061156', 'DBLP': 'conf/cscw/ShiWQCXM17', 'DOI': '10.1145/2998181.2998208', 'CorpusId': 207244134}",IdeaWall: Improving Creative Collaboration through Combinatorial Visual Stimuli,Conference on Computer Supported Cooperative Work,2017,"{'url': '', 'status': 'CLOSED', 'license': None, 'disclaimer': ""Notice: The following paper fields have been elided by the publisher: {'abstract'}. Paper or abstract available at https://api.unpaywall.org/v2/10.1145/2998181.2998208?email=<INSERT_YOUR_EMAIL> or https://doi.org/10.1145/2998181.2998208, which is subject to the license by the author or copyright owner provided with this content. Please go to the source to verify the license and copyright information for your use.""}","[{'authorId': '2119037273', 'name': 'Yang Shi'}, {'authorId': '2153675714', 'name': 'Yang Wang'}, {'authorId': '145270896', 'name': 'Ye Qi'}, {'authorId': None, 'name': 'John Chen'}, {'authorId': '2112247690', 'name': 'Xiaoyao Xu'}, {'authorId': '1707383', 'name': 'K. Ma'}]",
7489dacdc91b32d3967db059c6282c7845d481b5,"{'MAG': '2588290933', 'DBLP': 'conf/cscw/KwonKSB17', 'DOI': '10.1145/2998181.2998225', 'CorpusId': 18883394}","""It's Not Yet A Gift"": Understanding Digital Gifting",Conference on Computer Supported Cooperative Work,2017,"{'url': 'https://dspace.lboro.ac.uk/2134/36230', 'status': 'GREEN', 'license': 'CCBYNCND', 'disclaimer': 'Notice: Paper or abstract available at https://api.unpaywall.org/v2/10.1145/2998181.2998225?email=<INSERT_YOUR_EMAIL> or https://doi.org/10.1145/2998181.2998225, which is subject to the license by the author or copyright owner provided with this content. Please go to the source to verify the license and copyright information for your use.'}","[{'authorId': '33891384', 'name': 'H. Kwon'}, {'authorId': '1711147', 'name': 'B. Koleva'}, {'authorId': '1683674', 'name': 'Holger Schnädelbach'}, {'authorId': '1738239', 'name': 'S. Benford'}]","A myriad of digital artifacts are routinely exchanged online. While previous studies suggest that these are sometimes considered to be gifts, CSCW has largely overlooked explicit digital gifting where people deliberately choose to give digital media as gifts. We present an interview study that systematically analyzes the nature of digital gifting in comparison to conventional physical gifting. A five-stage gift exchange model, synthesized from the literature, frames this study. Findings reveal that there are distinctive gaps in people's engagement with the digital gifting process compared to physical gifting. Participants' accounts show how digital gifts often involve less labor, are sometimes not perceived as gifts by the recipient and are rarely reflected on and reciprocated. We conclude by drawing out design implications for digital gifting services and rituals."
75501b7cbf2daac3e6948e0bc57012b714725d67,"{'MAG': '2620196181', 'CorpusId': 38496588}",Towards Socially Assistive Robotics for Inter-Generational Family Groups,Conference on Computer Supported Cooperative Work,2017,"{'url': '', 'status': None, 'license': None, 'disclaimer': ""Notice: The following paper fields have been elided by the publisher: {'abstract'}. Paper or abstract available at http://robotics.usc.edu/publications/downloads/pub/975/, which is subject to the license by the author or copyright owner provided with this content. Please go to the source to verify the license and copyright information for your use.""}","[{'authorId': '32775309', 'name': 'Elaine Schaertl Short'}, {'authorId': '1742183', 'name': 'M. Matarić'}]",
770ecb860fd0e541ccb57d1feb7292fcc33960be,"{'MAG': '2587979677', 'DBLP': 'conf/cscw/ClearFOC17', 'DOI': '10.1145/2998181.2998188', 'CorpusId': 21768708}","""I'd Want to Burn the Data or at Least Nobble the Numbers"": Towards Data-mediated Building Management for Comfort and Energy Use",Conference on Computer Supported Cooperative Work,2017,"{'url': 'http://nrl.northumbria.ac.uk/id/eprint/30344/1/cscw2017-data-comfort-negotiation%20%28CR%29.pdf', 'status': 'GREEN', 'license': None, 'disclaimer': ""Notice: The following paper fields have been elided by the publisher: {'abstract'}. Paper or abstract available at https://api.unpaywall.org/v2/10.1145/2998181.2998188?email=<INSERT_YOUR_EMAIL> or https://doi.org/10.1145/2998181.2998188, which is subject to the license by the author or copyright owner provided with this content. Please go to the source to verify the license and copyright information for your use.""}","[{'authorId': '1679883', 'name': 'A. Clear'}, {'authorId': '40963881', 'name': 'S. Finnigan'}, {'authorId': '145171812', 'name': 'P. Olivier'}, {'authorId': '2573595', 'name': 'R. Comber'}]",
796e2af5def39be37ca82967a119e9da1fe6f66d,"{'MAG': '2587829195', 'DBLP': 'conf/cscw/MenkingMZ17', 'DOI': '10.1145/2998181.2998254', 'CorpusId': 18378479}",Who Wants to Read This?: A Method for Measuring Topical Representativeness in User Generated Content Systems,Conference on Computer Supported Cooperative Work,2017,"{'url': 'http://dl.acm.org/ft_gateway.cfm?id=2998254&type=pdf', 'status': 'GOLD', 'license': None, 'disclaimer': 'Notice: Paper or abstract available at https://api.unpaywall.org/v2/10.1145/2998181.2998254?email=<INSERT_YOUR_EMAIL> or https://doi.org/10.1145/2998181.2998254, which is subject to the license by the author or copyright owner provided with this content. Please go to the source to verify the license and copyright information for your use.'}","[{'authorId': None, 'name': 'Amanda Menking'}, {'authorId': '144541497', 'name': 'David W. Mcdonald'}, {'authorId': '1706438', 'name': 'M. Zachry'}]","This methods paper details an approach for identifying the representativeness of content in a user generated content (UGC) system while also accounting for endogeneity bias. We leverage metadata from an independent content provider to generate sets of commercially viable terms presumed to be of interest to specific audiences linking those terms to UGC. We describe our method and heuristics at a level of detail allowing others to follow or modify it to study both content representativeness and content gaps in UGC systems. We illustrate the method by investigating how well the English language Wikipedia addresses the content interests of four sample audiences: readers of men's and women's periodicals, and readers of political periodicals geared toward either liberal or conservative ideologies. We also share preliminary findings from each case study to demonstrate our method."
79ccd5a88532e284d7462da5ca872be56d2d6a5c,"{'DBLP': 'conf/cscw/YuRTZ17', 'MAG': '2587943151', 'DOI': '10.1145/2998181.2998227', 'CorpusId': 2977225}",Predicting Member Productivity and Withdrawal from Pre-Joining Attachments in Online Production Groups,Conference on Computer Supported Cooperative Work,2017,"{'url': '', 'status': 'CLOSED', 'license': None, 'disclaimer': ""Notice: The following paper fields have been elided by the publisher: {'abstract'}. Paper or abstract available at https://api.unpaywall.org/v2/10.1145/2998181.2998227?email=<INSERT_YOUR_EMAIL> or https://doi.org/10.1145/2998181.2998227, which is subject to the license by the author or copyright owner provided with this content. Please go to the source to verify the license and copyright information for your use.""}","[{'authorId': '2110705794', 'name': 'Bowen Yu'}, {'authorId': '145217085', 'name': 'Yuqing Ren'}, {'authorId': '1739628', 'name': 'L. Terveen'}, {'authorId': '1742431', 'name': 'Haiyi Zhu'}]",
7d71f79bc16146b6492ba3cf2da1438f2c68fdf5,"{'MAG': '2587786618', 'DBLP': 'conf/cscw/ArawjoYG17', 'DOI': '10.1145/2998181.2998260', 'CorpusId': 6804569}",TypeTalker: A Speech Synthesis-Based Multi-Modal Commenting System,Conference on Computer Supported Cooperative Work,2017,"{'url': '', 'status': 'CLOSED', 'license': None, 'disclaimer': ""Notice: The following paper fields have been elided by the publisher: {'abstract'}. Paper or abstract available at https://api.unpaywall.org/v2/10.1145/2998181.2998260?email=<INSERT_YOUR_EMAIL> or https://doi.org/10.1145/2998181.2998260, which is subject to the license by the author or copyright owner provided with this content. Please go to the source to verify the license and copyright information for your use.""}","[{'authorId': '9046119', 'name': 'Ian A. Arawjo'}, {'authorId': '2055005', 'name': 'Dongwook Yoon'}, {'authorId': '2539134', 'name': 'François Guimbretière'}]",
7ea92f6adaf1fd48dc81c1468690b17e9dd85db5,"{'MAG': '2588853767', 'DBLP': 'conf/cscw/ChangWCLW17', 'DOI': '10.1145/2998181.2998258', 'CorpusId': 13384014}",AlphaRead: Support Unambiguous Referencing in Remote Collaboration with Readable Object Annotation,Conference on Computer Supported Cooperative Work,2017,"{'url': '', 'status': 'CLOSED', 'license': None, 'disclaimer': ""Notice: The following paper fields have been elided by the publisher: {'abstract'}. Paper or abstract available at https://api.unpaywall.org/v2/10.1145/2998181.2998258?email=<INSERT_YOUR_EMAIL> or https://doi.org/10.1145/2998181.2998258, which is subject to the license by the author or copyright owner provided with this content. Please go to the source to verify the license and copyright information for your use.""}","[{'authorId': '2140047234', 'name': 'Yuan-Chia Chang'}, {'authorId': '2145335447', 'name': 'Hao-Chuan Wang'}, {'authorId': '1771281', 'name': 'Hung-Kuo Chu'}, {'authorId': '9040701', 'name': 'Shung-Ying Lin'}, {'authorId': '2097040', 'name': 'Shuo-Ping Wang'}]",
7ef1f637c1ec58baa42236949666f95c0641cc0f,"{'DBLP': 'conf/cscw/GutwinBAC17', 'MAG': '2588314311', 'DOI': '10.1145/2998181.2998226', 'CorpusId': 18655232}",Looking Away and Catching Up: Dealing with Brief Attentional Disconnection in Synchronous Groupware,Conference on Computer Supported Cooperative Work,2017,"{'url': '', 'status': 'CLOSED', 'license': None, 'disclaimer': ""Notice: The following paper fields have been elided by the publisher: {'abstract'}. Paper or abstract available at https://api.unpaywall.org/v2/10.1145/2998181.2998226?email=<INSERT_YOUR_EMAIL> or https://doi.org/10.1145/2998181.2998226, which is subject to the license by the author or copyright owner provided with this content. Please go to the source to verify the license and copyright information for your use.""}","[{'authorId': '1693768', 'name': 'C. Gutwin'}, {'authorId': '1770919', 'name': 'Scott Bateman'}, {'authorId': '144478637', 'name': 'G. Arora'}, {'authorId': '9027100', 'name': 'A. Coveney'}]",
7f449b9c1cec753013295ca5393c2b3149a8f031,"{'MAG': '2588743120', 'DBLP': 'conf/cscw/Arciniegas-Mendez17', 'DOI': '10.1145/2998181.2998360', 'CorpusId': 7688234}",Using the Model of Regulation to Understand Software Development Collaboration Practices and Tool Support,Conference on Computer Supported Cooperative Work,2017,"{'url': '', 'status': 'CLOSED', 'license': None, 'disclaimer': ""Notice: The following paper fields have been elided by the publisher: {'abstract'}. Paper or abstract available at https://api.unpaywall.org/v2/10.1145/2998181.2998360?email=<INSERT_YOUR_EMAIL> or https://doi.org/10.1145/2998181.2998360, which is subject to the license by the author or copyright owner provided with this content. Please go to the source to verify the license and copyright information for your use.""}","[{'authorId': '1413605674', 'name': 'Maryi Arciniegas-Mendez'}]",
7fc8af8422d071fd89d4e311686a7526629a71b9,"{'MAG': '2588559064', 'DBLP': 'conf/cscw/SunMN17', 'DOI': '10.1145/2998181.2998202', 'CorpusId': 1556055}",TAMIES: A Study and Model of Adoption in P2P Resource Sharing and Indirect Exchange Systems,Conference on Computer Supported Cooperative Work,2017,"{'url': '', 'status': 'CLOSED', 'license': None, 'disclaimer': ""Notice: The following paper fields have been elided by the publisher: {'abstract'}. Paper or abstract available at https://api.unpaywall.org/v2/10.1145/2998181.2998202?email=<INSERT_YOUR_EMAIL> or https://doi.org/10.1145/2998181.2998202, which is subject to the license by the author or copyright owner provided with this content. Please go to the source to verify the license and copyright information for your use.""}","[{'authorId': '4913893', 'name': 'E. Sun'}, {'authorId': '8272456', 'name': 'Ross McLachlan'}, {'authorId': '1687465', 'name': 'Mor Naaman'}]",
81c3a172e2cd01bcfd7d0bcaa96ea63e248db14a,"{'MAG': '2588526411', 'DBLP': 'conf/cscw/AmmariSL17', 'DOI': '10.1145/2998181.2998270', 'CorpusId': 15109490}",The Crafting of DIY Fatherhood,Conference on Computer Supported Cooperative Work,2017,"{'url': '', 'status': 'CLOSED', 'license': None, 'disclaimer': ""Notice: The following paper fields have been elided by the publisher: {'abstract'}. Paper or abstract available at https://api.unpaywall.org/v2/10.1145/2998181.2998270?email=<INSERT_YOUR_EMAIL> or https://doi.org/10.1145/2998181.2998270, which is subject to the license by the author or copyright owner provided with this content. Please go to the source to verify the license and copyright information for your use.""}","[{'authorId': '2468251', 'name': 'Tawfiq Ammari'}, {'authorId': '1844852', 'name': 'S. Schoenebeck'}, {'authorId': '1724052', 'name': 'S. Lindtner'}]",
843497599c2f0c423018d8c542c7c6944a3ca0a4,"{'MAG': '2739188164', 'CorpusId': 64774094}",Understanding the Work Habits of Online Citizen Scientists,Conference on Computer Supported Cooperative Work,2017,"{'url': '', 'status': None, 'license': None}","[{'authorId': '1891998', 'name': 'C. Jennett'}, {'authorId': '65830292', 'name': 'Sjj Gould'}, {'authorId': '8400117', 'name': 'Laure Kloetzer'}, {'authorId': '1707941', 'name': 'A. Cox'}]",
844aa07fbe2a5d7ef12d471e27f0e36ecd1ea68b,"{'DBLP': 'conf/cscw/BaumerXCGG17', 'MAG': '2588033008', 'DOI': '10.1145/2998181.2998182', 'CorpusId': 2244220}",When Subjects Interpret the Data: Social Media Non-use as a Case for Adapting the Delphi Method to CSCW,Conference on Computer Supported Cooperative Work,2017,"{'url': 'http://dl.acm.org/ft_gateway.cfm?id=2998182&type=pdf', 'status': 'GOLD', 'license': None, 'disclaimer': 'Notice: Paper or abstract available at https://api.unpaywall.org/v2/10.1145/2998181.2998182?email=<INSERT_YOUR_EMAIL> or https://doi.org/10.1145/2998181.2998182, which is subject to the license by the author or copyright owner provided with this content. Please go to the source to verify the license and copyright information for your use.'}","[{'authorId': '144392313', 'name': 'E. Baumer'}, {'authorId': '47158816', 'name': 'Xiaotong Tone Xu'}, {'authorId': '2072702373', 'name': 'Christine Chu'}, {'authorId': '2345714', 'name': 'Shion Guha'}, {'authorId': '40413539', 'name': 'Geri Gay'}]","This paper describes the use of the Delphi method as a means of incorporating study participants into the processes of data analysis and interpretation. As a case study, it focuses on perceptions about use and non-use of the social media site Facebook. The work presented here involves three phases. First, a large survey included both a demographically representative sample and a convenience sample. Second, a smaller follow-up survey presented results from that survey back to survey respondents. Third, a series of qualitative member checking interviews with additional survey respondents served to validate the findings of the follow-up survey. This paper demonstrates the utility of Delphi by highlighting the ways that it enables us to synthesize across these three study phases, advancing understanding of perceptions about social media use and non-use. The paper concludes by discussing the broader applicability of the Delphi method across CSCW research."
858db51279ceddb45bb8dc45e711d7ea69c2c7cc,"{'MAG': '2588376876', 'DBLP': 'conf/cscw/MaudetLBM17', 'DOI': '10.1145/2998181.2998190', 'CorpusId': 14682858}",Design Breakdowns: Designer-Developer Gaps in Representing and Interpreting Interactive Systems,Conference on Computer Supported Cooperative Work,2017,"{'url': 'https://hal.inria.fr/hal-01614250/file/p630-maudet.pdf', 'status': 'GREEN', 'license': None, 'disclaimer': ""Notice: The following paper fields have been elided by the publisher: {'abstract'}. Paper or abstract available at https://api.unpaywall.org/v2/10.1145/2998181.2998190?email=<INSERT_YOUR_EMAIL> or https://doi.org/10.1145/2998181.2998190, which is subject to the license by the author or copyright owner provided with this content. Please go to the source to verify the license and copyright information for your use.""}","[{'authorId': '25226061', 'name': 'Nolwenn Maudet'}, {'authorId': '145479124', 'name': 'Germán Leiva'}, {'authorId': '1401678555', 'name': 'M. Beaudouin-Lafon'}, {'authorId': '1732917', 'name': 'W. Mackay'}]",
86e42c2918142a2d6420606352fe4b676d2d81a8,"{'MAG': '2588235398', 'DBLP': 'conf/cscw/HsiaoD17', 'DOI': '10.1145/2998181.2998280', 'CorpusId': 16439335}",People-Nearby Applications: How Newcomers Move Their Relationships Offline and Develop Social and Cultural Capital,Conference on Computer Supported Cooperative Work,2017,"{'url': '', 'status': 'CLOSED', 'license': None, 'disclaimer': ""Notice: The following paper fields have been elided by the publisher: {'abstract'}. Paper or abstract available at https://api.unpaywall.org/v2/10.1145/2998181.2998280?email=<INSERT_YOUR_EMAIL> or https://doi.org/10.1145/2998181.2998280, which is subject to the license by the author or copyright owner provided with this content. Please go to the source to verify the license and copyright information for your use.""}","[{'authorId': '3190031', 'name': 'J. Hsiao'}, {'authorId': '2232047', 'name': 'Tawanna R. Dillahunt'}]",
8b38ec3a9fc7e467421085bfaf1637f01046ae8a,"{'MAG': '2588458760', 'DBLP': 'conf/cscw/GeorgiouAY17', 'DOI': '10.1145/2998181.2998259', 'CorpusId': 6686283}",Extracting Topics with Focused Communities for Social Content Recommendation,Conference on Computer Supported Cooperative Work,2017,"{'url': 'http://dl.acm.org/ft_gateway.cfm?id=2998259&type=pdf', 'status': 'GOLD', 'license': None, 'disclaimer': 'Notice: Paper or abstract available at https://api.unpaywall.org/v2/10.1145/2998181.2998259?email=<INSERT_YOUR_EMAIL> or https://doi.org/10.1145/2998181.2998259, which is subject to the license by the author or copyright owner provided with this content. Please go to the source to verify the license and copyright information for your use.'}","[{'authorId': '38746746', 'name': 'T. Georgiou'}, {'authorId': '1709353', 'name': 'A. El Abbadi'}, {'authorId': '1740249', 'name': 'Xifeng Yan'}]","A thorough understanding of social media discussions and the demographics of the users involved in these discussions has become critical for many applications like business or political analysis. Such an understanding and its ramifications on the real world can be enabled through the automatic summarization of Social Media. Trending topics are offered as a high level content recommendation system where users are suggested to view related content if they deem the displayed topics interesting. However, identifying the characteristics of the users focused on each topic can boost the importance even for topics that might not be popular or bursty. We define a way to characterize groups of users that are focused in such topics and propose an efficient and accurate algorithm to extract such communities. Through qualitative and quantitative experimentation we observe that topics with a strong community focus are interesting and more likely to catch the attention of users."
8be8e06187a11dd143b959a5d68f2516777c0877,"{'MAG': '2588382500', 'PubMedCentral': '5640447', 'DOI': '10.1145/2998181.2998336', 'CorpusId': 17623364, 'PubMed': '29034371'}",Assessing Behavioral Stages From Social Media Data,Conference on Computer Supported Cooperative Work,2017,"{'url': 'http://dl.acm.org/ft_gateway.cfm?id=2998336&type=pdf', 'status': 'BRONZE', 'license': None, 'disclaimer': 'Notice: Paper or abstract available at https://pmc.ncbi.nlm.nih.gov/articles/PMC5640447, which is subject to the license by the author or copyright owner provided with this content. Please go to the source to verify the license and copyright information for your use.'}","[{'authorId': '2248041765', 'name': 'Jason J. Liu'}, {'authorId': '1929547', 'name': 'E. Weitzman'}, {'authorId': '3144230', 'name': 'R. Chunara'}]","Important work rooted in psychological theory posits that health behavior change occurs through a series of discrete stages. Our work builds on the field of social computing by identifying how social media data can be used to resolve behavior stages at high resolution (e.g. hourly/daily) for key population subgroups and times. In essence this approach opens new opportunities to advance psychological theories and better understand how our health is shaped based on the real, dynamic, and rapid actions we make every day. To do so, we bring together domain knowledge and machine learning methods to form a hierarchical classification of Twitter data that resolves different stages of behavior. We identify and examine temporal patterns of the identified stages, with alcohol as a use case (planning or looking to drink, currently drinking, and reflecting on drinking). Known seasonal trends are compared with findings from our methods. We discuss the potential health policy implications of detecting high frequency behavior stages."
