paperId,externalIds,title,venue,year,openAccessPdf,authors,abstract
00428bc871ef22d9107bff3fd5e370d40b6dee44,"{'DBLP': 'conf/cscw/CheonS17', 'MAG': '2588287986', 'DOI': '10.1145/2998181.2998329', 'CorpusId': 13883402}","Configuring the User: ""Robots have Needs Too""",Conference on Computer Supported Cooperative Work,2017,"{'url': '', 'status': 'CLOSED', 'license': None, 'disclaimer': ""Notice: The following paper fields have been elided by the publisher: {'abstract'}. Paper or abstract available at https://api.unpaywall.org/v2/10.1145/2998181.2998329?email=<INSERT_YOUR_EMAIL> or https://doi.org/10.1145/2998181.2998329, which is subject to the license by the author or copyright owner provided with this content. Please go to the source to verify the license and copyright information for your use.""}","[{'authorId': '5189789', 'name': 'E. Cheon'}, {'authorId': '2974427', 'name': 'N. Su'}]",
017ad741678f25b055d8d11239c39907e91bdc6c,"{'MAG': '3024347583', 'CorpusId': 226937421}",Micro-NGO: Crowd-Driven Social Activism via a Chat-Based Online Platform,Conference on Computer Supported Cooperative Work,2017,"{'url': '', 'status': None, 'license': None, 'disclaimer': ""Notice: The following paper fields have been elided by the publisher: {'abstract'}. Paper or abstract available at http://juhokim.com/files/CSCW2017-Workshop-MicroNGO.pdf, which is subject to the license by the author or copyright owner provided with this content. Please go to the source to verify the license and copyright information for your use.""}","[{'authorId': '2108162544', 'name': 'Sung-Chul Lee'}, {'authorId': '120086176', 'name': 'Jihee Kim'}, {'authorId': '1800981', 'name': 'Juho Kim'}]",
0397dd030975410ee3c14e0b84f882abb9984008,"{'MAG': '2528259719', 'DBLP': 'conf/cscw/FiannacaPSM17', 'DOI': '10.1145/2998181.2998215', 'CorpusId': 14200587}",AACrobat: Using Mobile Devices to Lower Communication Barriers and Provide Autonomy with Gaze-Based AAC,Conference on Computer Supported Cooperative Work,2017,"{'url': '', 'status': 'CLOSED', 'license': None, 'disclaimer': ""Notice: The following paper fields have been elided by the publisher: {'abstract'}. Paper or abstract available at https://api.unpaywall.org/v2/10.1145/2998181.2998215?email=<INSERT_YOUR_EMAIL> or https://doi.org/10.1145/2998181.2998215, which is subject to the license by the author or copyright owner provided with this content. Please go to the source to verify the license and copyright information for your use.""}","[{'authorId': '1988208', 'name': 'A. Fiannaca'}, {'authorId': '40115811', 'name': 'A. Paradiso'}, {'authorId': '2237093783', 'name': 'M. Shah'}, {'authorId': '144844426', 'name': 'M. Morris'}]",
03a173f578fb7d8e5ab11ada8aa0a0b8b69daf37,"{'MAG': '2588173118', 'DBLP': 'conf/cscw/FieslerDFHHMRPB17', 'DOI': '10.1145/2998181.2998223', 'CorpusId': 12463417}",What (or Who) Is Public?: Privacy Settings and Social Media Content Sharing,Conference on Computer Supported Cooperative Work,2017,"{'url': '', 'status': 'CLOSED', 'license': None, 'disclaimer': ""Notice: The following paper fields have been elided by the publisher: {'abstract'}. Paper or abstract available at https://api.unpaywall.org/v2/10.1145/2998181.2998223?email=<INSERT_YOUR_EMAIL> or https://doi.org/10.1145/2998181.2998223, which is subject to the license by the author or copyright owner provided with this content. Please go to the source to verify the license and copyright information for your use.""}","[{'authorId': '1844816', 'name': 'Casey Fiesler'}, {'authorId': '36282304', 'name': 'Michaelanne Dye'}, {'authorId': '2146189', 'name': 'Jessica L. Feuston'}, {'authorId': '2710020', 'name': 'Chaya Hiruncharoenvate'}, {'authorId': '40320059', 'name': 'C. J. Hutto'}, {'authorId': '2056433522', 'name': 'Shannon Morrison'}, {'authorId': '2891238', 'name': 'P. Roshan'}, {'authorId': '2112284', 'name': 'Umashanthi Pavalanathan'}, {'authorId': '143709703', 'name': 'A. Bruckman'}, {'authorId': '2583473', 'name': 'M. D. Choudhury'}, {'authorId': '145280613', 'name': 'Eric Gilbert'}]",
04dfd7d55a32c57699f58d3d96626662eeb4ca48,"{'MAG': '2587916182', 'DBLP': 'conf/cscw/DeyDKF17', 'DOI': '10.1145/2998181.2998229', 'CorpusId': 3525221}",The Art and Science of Persuasion: Not All Crowdfunding Campaign Videos are The Same,Conference on Computer Supported Cooperative Work,2017,"{'url': '', 'status': 'CLOSED', 'license': None, 'disclaimer': ""Notice: The following paper fields have been elided by the publisher: {'abstract'}. Paper or abstract available at https://api.unpaywall.org/v2/10.1145/2998181.2998229?email=<INSERT_YOUR_EMAIL> or https://doi.org/10.1145/2998181.2998229, which is subject to the license by the author or copyright owner provided with this content. Please go to the source to verify the license and copyright information for your use.""}","[{'authorId': '39710593', 'name': 'S. Dey'}, {'authorId': '39556143', 'name': 'Brittany R. L. Duff'}, {'authorId': '1680270', 'name': 'K. Karahalios'}, {'authorId': '1947334', 'name': 'Wai-Tat Fu'}]",
07d560e75739328d79f9f957aac82f67ee7ae798,"{'DBLP': 'conf/cscw/SinghRHF17', 'MAG': '2587856214', 'DOI': '10.1145/2998181.2998279', 'CorpusId': 14393275}","""They basically like destroyed the school one day"": On Newer App Features and Cyberbullying in Schools",Conference on Computer Supported Cooperative Work,2017,"{'url': 'http://dl.acm.org/ft_gateway.cfm?id=2998279&type=pdf', 'status': 'GOLD', 'license': None, 'disclaimer': 'Notice: Paper or abstract available at https://api.unpaywall.org/v2/10.1145/2998181.2998279?email=<INSERT_YOUR_EMAIL> or https://doi.org/10.1145/2998181.2998279, which is subject to the license by the author or copyright owner provided with this content. Please go to the source to verify the license and copyright information for your use.'}","[{'authorId': '144724775', 'name': 'V. Singh'}, {'authorId': '1767245', 'name': 'M. Radford'}, {'authorId': '1830706', 'name': 'Qianjia Huang'}, {'authorId': '9008089', 'name': 'Susan Furrer'}]","This exploratory work studies the effects of emerging app features on the cyberbullying practices in high school settings. These include the increasing prevalence of image/video content, perceived ephemerality, anonymity, and hyperlocal communication. Based on qualitative analysis of focus groups and follow-up individual interviews with high school students, these features were found to influence the practice of cyberbullying, as well as creating negative socio-psychological effects. For example, visual data was found to be used in cyberbullying settings as evidence of contentious events, a repeated reminder, and caused a graphic impact on recipients. Similarly, perceived ephemerality of content was found to be associated with ""broken expectations"" with respect to the apps and severe bullying outcomes for those affected. Results shed light on an important technology-mediated social phenomenon of cyberbullying, improve understanding of app use (and abuse) by the teenage user population, and pave the way for future research on countering appcentric cyberbullying."
0807becf53f15fa609e503e3dfe5ceb7e3cb332c,"{'MAG': '2588485469', 'DBLP': 'conf/cscw/FreemanBB17', 'DOI': '10.1145/2998181.2998291', 'CorpusId': 17924509}","Aspirational Design and Messy Democracy: Partisanship, Policy, and Hope in an Asian City",Conference on Computer Supported Cooperative Work,2017,"{'url': 'http://dl.acm.org/ft_gateway.cfm?id=2998291&type=pdf', 'status': 'GOLD', 'license': None, 'disclaimer': 'Notice: Paper or abstract available at https://api.unpaywall.org/v2/10.1145/2998181.2998291?email=<INSERT_YOUR_EMAIL> or https://doi.org/10.1145/2998181.2998291, which is subject to the license by the author or copyright owner provided with this content. Please go to the source to verify the license and copyright information for your use.'}","[{'authorId': '51182865', 'name': 'Guo Freeman'}, {'authorId': '1804390', 'name': 'Jeffrey Bardzell'}, {'authorId': '1800842', 'name': 'Shaowen Bardzell'}]","Recent research in CSCW, urban informatics, and sociotechnical systems has proposed new framings and emphases of the city as a locus of research on computing and called for a heightened focus on the entanglements of social policy and design. Yet there are relatively few empirical investigations of actual policy-design entanglements in specific cities, and of those available, non-Western cities are underrepresented. We report an empirical study of the 2010 Taipei International Flora Expo (TIFE) as a case to explore these urban informatics/social computing issues. Specifically, we offer an empirically grounded analysis of design as a mechanism of public futuring and debates, which contributes to a better understanding of ""participatory urbanship"" [6]; and we do so focusing on a non-Western city, both to ensure a broader representation of urban ways of life and also to de-center Western experiences as the primary basis of urban informatics theory in CSCW."
08488d3a0d9cbf4fe0e7dac763755c8dccbe91b8,"{'DBLP': 'conf/cscw/JosephWC17', 'MAG': '2588473639', 'DOI': '10.1145/2998181.2998187', 'CorpusId': 16266375}","Girls Rule, Boys Drool: Extracting Semantic and Affective Stereotypes from Twitter",Conference on Computer Supported Cooperative Work,2017,"{'url': '', 'status': 'CLOSED', 'license': None, 'disclaimer': ""Notice: The following paper fields have been elided by the publisher: {'abstract'}. Paper or abstract available at https://api.unpaywall.org/v2/10.1145/2998181.2998187?email=<INSERT_YOUR_EMAIL> or https://doi.org/10.1145/2998181.2998187, which is subject to the license by the author or copyright owner provided with this content. Please go to the source to verify the license and copyright information for your use.""}","[{'authorId': '3306556', 'name': 'K. Joseph'}, {'authorId': '2149191324', 'name': 'Wei Wei'}, {'authorId': '1702030', 'name': 'Kathleen M. Carley'}]",
0b8aec78c1d09b8ab275cd1b6c9b7430614c0237,"{'MAG': '2600126995', 'CorpusId': 151507601}",Why criteria of decision fairness should be considered in robot design,Conference on Computer Supported Cooperative Work,2017,"{'url': '', 'status': None, 'license': None, 'disclaimer': ""Notice: The following paper fields have been elided by the publisher: {'abstract'}. Paper or abstract available at https://sites.coecis.cornell.edu/hri/files/2017/01/%C3%96tting-Gopinathan-Maier-and-Steil-2e7dua8.pdf, which is subject to the license by the author or copyright owner provided with this content. Please go to the source to verify the license and copyright information for your use.""}","[{'authorId': '8142672', 'name': 'Sonja K. Ötting'}, {'authorId': '29843437', 'name': 'Sugeeth Gopinathan'}, {'authorId': '2057084930', 'name': 'G. Maier'}, {'authorId': '27551792', 'name': 'Jochen J. Steil'}]",
0c7a6322230b83d481ae7116106995acbfdbc619,"{'DBLP': 'conf/cscw/WangM17', 'MAG': '2587871321', 'DOI': '10.1145/2998181.2998295', 'CorpusId': 15936553}",Engaging with Political and Social Issues on Facebook in College Life,Conference on Computer Supported Cooperative Work,2017,"{'url': 'http://dl.acm.org/ft_gateway.cfm?id=2998295&type=pdf', 'status': 'BRONZE', 'license': None, 'disclaimer': ""Notice: The following paper fields have been elided by the publisher: {'abstract'}. Paper or abstract available at https://api.unpaywall.org/v2/10.1145/2998181.2998295?email=<INSERT_YOUR_EMAIL> or https://doi.org/10.1145/2998181.2998295, which is subject to the license by the author or copyright owner provided with this content. Please go to the source to verify the license and copyright information for your use.""}","[{'authorId': '2107920311', 'name': 'Yiran Wang'}, {'authorId': '143750317', 'name': 'Gloria Mark'}]",
0eff2bb61612abe140ae23e2acb2d542954b5d1f,"{'MAG': '2589092053', 'DBLP': 'conf/cscw/NarayanOMHS17', 'DOI': '10.1145/2998181.2998307', 'CorpusId': 16428297}",The Wikipedia Adventure: Field Evaluation of an Interactive Tutorial for New Users,Conference on Computer Supported Cooperative Work,2017,"{'url': 'http://dl.acm.org/ft_gateway.cfm?id=2998307&type=pdf', 'status': 'GOLD', 'license': None, 'disclaimer': 'Notice: Paper or abstract available at https://api.unpaywall.org/v2/10.1145/2998181.2998307?email=<INSERT_YOUR_EMAIL> or https://doi.org/10.1145/2998181.2998307, which is subject to the license by the author or copyright owner provided with this content. Please go to the source to verify the license and copyright information for your use.'}","[{'authorId': '39683929', 'name': 'Sneha Narayan'}, {'authorId': '1900754', 'name': 'Jake Orlowitz'}, {'authorId': '143759133', 'name': 'Jonathan T. Morgan'}, {'authorId': '37264444', 'name': 'Benjamin Mako Hill'}, {'authorId': '144824439', 'name': 'Aaron Shaw'}]","Integrating new users into a community with complex norms presents a challenge for peer production projects like Wikipedia. We present The Wikipedia Adventure (TWA): an interactive tutorial that offers a structured and gamified introduction to Wikipedia. In addition to describing the design of the system, we present two empirical evaluations. First, we report on a survey of users, who responded very positively to the tutorial. Second, we report results from a large-scale invitation-based field experiment that tests whether using TWA increased newcomers' subsequent contributions to Wikipedia. We find no effect of either using the tutorial or of being invited to do so over a period of 180 days. We conclude that TWA produces a positive socialization experience for those who choose to use it, but that it does not alter patterns of newcomer activity. We reflect on the implications of these mixed results for the evaluation of similar social computing systems."
1228bd56cd36b76aff1db2904a990f810e926702,"{'MAG': '2588327946', 'DBLP': 'conf/cscw/GunaratneBN17', 'DOI': '10.1145/2998181.2998253', 'CorpusId': 17946970}",Empowering Investors with Social Annotation When Saving for Retirement,Conference on Computer Supported Cooperative Work,2017,"{'url': '', 'status': 'CLOSED', 'license': None, 'disclaimer': ""Notice: The following paper fields have been elided by the publisher: {'abstract'}. Paper or abstract available at https://api.unpaywall.org/v2/10.1145/2998181.2998253?email=<INSERT_YOUR_EMAIL> or https://doi.org/10.1145/2998181.2998253, which is subject to the license by the author or copyright owner provided with this content. Please go to the source to verify the license and copyright information for your use.""}","[{'authorId': '1935275', 'name': 'J. Gunaratne'}, {'authorId': '145521402', 'name': 'Jeremy Burke'}, {'authorId': '71575036', 'name': 'O. Nov'}]",
161adf65c288819299b9b8986ca18a169bf77bb2,"{'MAG': '2588098783', 'DBLP': 'conf/cscw/SeeringKD17', 'DOI': '10.1145/2998181.2998277', 'CorpusId': 207244260}",Shaping Pro and Anti-Social Behavior on Twitch Through Moderation and Example-Setting,Conference on Computer Supported Cooperative Work,2017,"{'url': 'http://dl.acm.org/ft_gateway.cfm?id=2998277&type=pdf', 'status': 'GOLD', 'license': None, 'disclaimer': 'Notice: Paper or abstract available at https://api.unpaywall.org/v2/10.1145/2998181.2998277?email=<INSERT_YOUR_EMAIL> or https://doi.org/10.1145/2998181.2998277, which is subject to the license by the author or copyright owner provided with this content. Please go to the source to verify the license and copyright information for your use.'}","[{'authorId': '9045295', 'name': 'Joseph Seering'}, {'authorId': '1702853', 'name': 'R. Kraut'}, {'authorId': '1784365', 'name': 'Laura A. Dabbish'}]","Online communities have the potential to be supportive, cruel, or anywhere in between. The development of positive norms for interaction can help users build bonds, grow, and learn. Using millions of messages sent in Twitch chatrooms, we explore the effectiveness of methods for encouraging and discouraging specific behaviors, including taking advantage of imitation effects through setting positive examples and using moderation tools to discourage antisocial behaviors. Consistent with aspects of imitation theory and deterrence theory, users imitated examples of behavior that they saw, and more so for behaviors from high status users. Proactive moderation tools, such as chat modes which restricted the ability to post certain content, proved effective at discouraging spam behaviors, while reactive bans were able to discourage a wider variety of behaviors. This work considers the intersection of tools, authority, and types of behaviors, offering a new frame through which to consider the development of moderation strategies."
1633418f0b319f0f2d2973b000b98d625dfc19bd,"{'MAG': '2588538616', 'DBLP': 'conf/cscw/Liang17', 'DOI': '10.1145/2998181.2998217', 'CorpusId': 13043280}",Knowledge Sharing in Online Discussion Threads: What Predicts the Ratings?,Conference on Computer Supported Cooperative Work,2017,"{'url': '', 'status': 'CLOSED', 'license': None, 'disclaimer': ""Notice: The following paper fields have been elided by the publisher: {'abstract'}. Paper or abstract available at https://api.unpaywall.org/v2/10.1145/2998181.2998217?email=<INSERT_YOUR_EMAIL> or https://doi.org/10.1145/2998181.2998217, which is subject to the license by the author or copyright owner provided with this content. Please go to the source to verify the license and copyright information for your use.""}","[{'authorId': '2581642', 'name': 'Yuyang Liang'}]",
189a25d7a20518631b4584787935d68134a0c866,"{'MAG': '2588948966', 'DBLP': 'conf/cscw/PanYW17', 'DOI': '10.1145/2998181.2998304', 'CorpusId': 17167316}",Task Rebalancing: Improving Multilingual Communication with Native Speakers-Generated Highlights on Automated Transcripts,Conference on Computer Supported Cooperative Work,2017,"{'url': '', 'status': 'CLOSED', 'license': None, 'disclaimer': ""Notice: The following paper fields have been elided by the publisher: {'abstract'}. Paper or abstract available at https://api.unpaywall.org/v2/10.1145/2998181.2998304?email=<INSERT_YOUR_EMAIL> or https://doi.org/10.1145/2998181.2998304, which is subject to the license by the author or copyright owner provided with this content. Please go to the source to verify the license and copyright information for your use.""}","[{'authorId': '2061164370', 'name': 'Mei-Hua Pan'}, {'authorId': '1696689', 'name': 'Naomi Yamashita'}, {'authorId': '2145335447', 'name': 'Hao-Chuan Wang'}]",
1950541c2cc4667e90720aa4d5ccb11eb8cde7c6,"{'DBLP': 'conf/cscw/CulbertsonSAJ17', 'MAG': '2588040260', 'DOI': '10.1145/2998181.2998268', 'CorpusId': 4093592}",Have your Cake and Eat it Too: Foreign Language Learning with a Crowdsourced Video Captioning System,Conference on Computer Supported Cooperative Work,2017,"{'url': '', 'status': 'CLOSED', 'license': None, 'disclaimer': ""Notice: The following paper fields have been elided by the publisher: {'abstract'}. Paper or abstract available at https://api.unpaywall.org/v2/10.1145/2998181.2998268?email=<INSERT_YOUR_EMAIL> or https://doi.org/10.1145/2998181.2998268, which is subject to the license by the author or copyright owner provided with this content. Please go to the source to verify the license and copyright information for your use.""}","[{'authorId': '2085843', 'name': 'Gabriel Culbertson'}, {'authorId': '36425853', 'name': 'Solace Shen'}, {'authorId': '2059599857', 'name': 'Erik Andersen'}, {'authorId': '8240331', 'name': 'Malte F. Jung'}]",
1a2d79459be9f9c24833f9bdf834e0306f108f19,"{'DBLP': 'conf/cscw/MarrinanLRF0J17', 'MAG': '2587884718', 'DOI': '10.1145/2998181.2998346', 'CorpusId': 12730969}",Mixed Presence Collaboration using Scalable Visualizations in Heterogeneous Display Spaces,Conference on Computer Supported Cooperative Work,2017,"{'url': '', 'status': 'CLOSED', 'license': None, 'disclaimer': ""Notice: The following paper fields have been elided by the publisher: {'abstract'}. Paper or abstract available at https://api.unpaywall.org/v2/10.1145/2998181.2998346?email=<INSERT_YOUR_EMAIL> or https://doi.org/10.1145/2998181.2998346, which is subject to the license by the author or copyright owner provided with this content. Please go to the source to verify the license and copyright information for your use.""}","[{'authorId': '144179501', 'name': 'T. Marrinan'}, {'authorId': '143983555', 'name': 'J. Leigh'}, {'authorId': '3247506', 'name': 'L. Renambot'}, {'authorId': '145604882', 'name': 'A. Forbes'}, {'authorId': '2115301164', 'name': 'Steven Jones'}, {'authorId': '145123492', 'name': 'Andrew E. Johnson'}]",
1b08953967ee2a48952e8e9b16ad3f9c037ebb19,"{'MAG': '2588117145', 'DBLP': 'conf/cscw/ParedesFSYKXCC17', 'DOI': '10.1145/2998181.2998363', 'CorpusId': 14550654}",Inquire: Large-scale Early Insight Discovery for Qualitative Research,Conference on Computer Supported Cooperative Work,2017,"{'url': '', 'status': 'CLOSED', 'license': None, 'disclaimer': ""Notice: The following paper fields have been elided by the publisher: {'abstract'}. Paper or abstract available at https://api.unpaywall.org/v2/10.1145/2998181.2998363?email=<INSERT_YOUR_EMAIL> or https://doi.org/10.1145/2998181.2998363, which is subject to the license by the author or copyright owner provided with this content. Please go to the source to verify the license and copyright information for your use.""}","[{'authorId': '145656681', 'name': 'P. Paredes'}, {'authorId': '40281383', 'name': 'Ana Sofia Rufino Ferreira'}, {'authorId': '40052010', 'name': 'C. Schillaci'}, {'authorId': '51231150', 'name': 'G. Yoo'}, {'authorId': '9041758', 'name': 'Lili Karashchuk'}, {'authorId': '9033573', 'name': 'Dennis Xing'}, {'authorId': '1707311', 'name': 'Coye Cheshire'}, {'authorId': '1729041', 'name': 'J. Canny'}]",
1b7e56b280613c284f4c16dba37045c8e66a139e,"{'MAG': '2588515875', 'DBLP': 'conf/cscw/SinghalNOAM17', 'DOI': '10.1145/2998181.2998247', 'CorpusId': 16831017}",Flex-N-Feel: The Design and Evaluation of Emotive Gloves for Couples to Support Touch Over Distance,Conference on Computer Supported Cooperative Work,2017,"{'url': '', 'status': 'CLOSED', 'license': None, 'disclaimer': ""Notice: The following paper fields have been elided by the publisher: {'abstract'}. Paper or abstract available at https://api.unpaywall.org/v2/10.1145/2998181.2998247?email=<INSERT_YOUR_EMAIL> or https://doi.org/10.1145/2998181.2998247, which is subject to the license by the author or copyright owner provided with this content. Please go to the source to verify the license and copyright information for your use.""}","[{'authorId': '3395919', 'name': 'Samarth Singhal'}, {'authorId': '1688400', 'name': 'Carman Neustaedter'}, {'authorId': '39852836', 'name': 'Yee Loong Ooi'}, {'authorId': '1693717', 'name': 'A. Antle'}, {'authorId': '2229911', 'name': 'Brendan Matkin'}]",
1bf75da317a04a7b2f84ef2ea07f498c31815e57,"{'MAG': '2588401322', 'DBLP': 'conf/cscw/BoerB17', 'DOI': '10.1145/2998181.2998263', 'CorpusId': 3174404}",Efficiently Identifying a Well-Performing Crowd Process for a Given Problem,Conference on Computer Supported Cooperative Work,2017,"{'url': 'https://www.zora.uzh.ch/id/eprint/126988/1/paper369.pdf', 'status': 'GREEN', 'license': 'other-oa', 'disclaimer': ""Notice: The following paper fields have been elided by the publisher: {'abstract'}. Paper or abstract available at https://api.unpaywall.org/v2/10.1145/2998181.2998263?email=<INSERT_YOUR_EMAIL> or https://doi.org/10.1145/2998181.2998263, which is subject to the license by the author or copyright owner provided with this content. Please go to the source to verify the license and copyright information for your use.""}","[{'authorId': '3442551', 'name': 'P. D. Boer'}, {'authorId': '145704191', 'name': 'A. Bernstein'}]",
1cd81be365da7fc247672129cea3bfbeaa4804a6,"{'DBLP': 'conf/cscw/ChoudhurySLEN17', 'MAG': '2588917609', 'DOI': '10.1145/2998181.2998220', 'CorpusId': 19000482}",Gender and Cross-Cultural Differences in Social Media Disclosures of Mental Illness,Conference on Computer Supported Cooperative Work,2017,"{'url': '', 'status': 'CLOSED', 'license': None, 'disclaimer': ""Notice: The following paper fields have been elided by the publisher: {'abstract'}. Paper or abstract available at https://api.unpaywall.org/v2/10.1145/2998181.2998220?email=<INSERT_YOUR_EMAIL> or https://doi.org/10.1145/2998181.2998220, which is subject to the license by the author or copyright owner provided with this content. Please go to the source to verify the license and copyright information for your use.""}","[{'authorId': '2583473', 'name': 'M. D. Choudhury'}, {'authorId': '2852293', 'name': 'Sanket S. Sharma'}, {'authorId': '12296149', 'name': 'Tomaz Logar'}, {'authorId': '9033581', 'name': 'Wouter Eekhout'}, {'authorId': '9034564', 'name': 'René Clausen Nielsen'}]",
21a45a77748e7da0167027ac4e161bec7af42f5b,"{'MAG': '2588187597', 'DBLP': 'conf/cscw/HuangDX17', 'DOI': '10.1145/2998181.2998312', 'CorpusId': 33204931}",Human Library: Understanding Experience Sharing for Community Knowledge Building,Conference on Computer Supported Cooperative Work,2017,"{'url': '', 'status': 'CLOSED', 'license': None, 'disclaimer': ""Notice: The following paper fields have been elided by the publisher: {'abstract'}. Paper or abstract available at https://api.unpaywall.org/v2/10.1145/2998181.2998312?email=<INSERT_YOUR_EMAIL> or https://doi.org/10.1145/2998181.2998312, which is subject to the license by the author or copyright owner provided with this content. Please go to the source to verify the license and copyright information for your use.""}","[{'authorId': '2108831382', 'name': 'Yun Huang'}, {'authorId': '3300352', 'name': 'Brian Dobreski'}, {'authorId': '1773892', 'name': 'Huichuan Xia'}]",
