paperId,externalIds,title,venue,year,openAccessPdf,authors,abstract
2a9293c966195e9c227d7d691b83acad484c39f5,"{'MAG': '1576866321', 'DBLP': 'conf/icwsm/RaaijmakersK10', 'DOI': '10.1609/icwsm.v4i1.14055', 'CorpusId': 6575275}",Classifier Calibration for Multi-Domain Sentiment Classification,International Conference on Web and Social Media,2010,"{'url': 'https://ojs.aaai.org/index.php/ICWSM/article/download/14055/13904', 'status': 'GOLD', 'license': None, 'disclaimer': 'Notice: Paper or abstract available at https://api.unpaywall.org/v2/10.1609/icwsm.v4i1.14055?email=<INSERT_YOUR_EMAIL> or https://doi.org/10.1609/icwsm.v4i1.14055, which is subject to the license by the author or copyright owner provided with this content. Please go to the source to verify the license and copyright information for your use.'}","[{'authorId': '144655242', 'name': 'S. Raaijmakers'}, {'authorId': '1740640', 'name': 'Wessel Kraaij'}]","
 
 Textual sentiment classifiers classify texts into a fixed number of affective classes, such as positive, negative or neutral sentiment, or subjective versus objective information. It has been observed that sentiment classifiers suffer from a lack of generalization capability: a classifier trained on a certain domain generally performs worse on data from another domain. This phenomenon has been attributed to domain-specific affective vocabulary. In this paper, we propose a voting-based thresholding approach, which calibrates a number of existing single-domain classifiers with respect to sentiment data from a new domain. The approach presupposes only a small amount of annotated data from the new domain. We evaluate three criteria for estimating thresholds, and discuss the ramifications of these criteria for the trade-off between classifier performance and manual annotation effort.
 
"
2b1b1fd234f8ee859b122f72bc691992a9a94284,"{'MAG': '1557940691', 'DBLP': 'conf/icwsm/TengA10', 'DOI': '10.1609/icwsm.v4i1.14071', 'CorpusId': 16027786}",Longevity in Second Life,International Conference on Web and Social Media,2010,"{'url': 'https://ojs.aaai.org/index.php/ICWSM/article/download/14071/13920', 'status': 'GOLD', 'license': None, 'disclaimer': 'Notice: Paper or abstract available at https://api.unpaywall.org/v2/10.1609/icwsm.v4i1.14071?email=<INSERT_YOUR_EMAIL> or https://doi.org/10.1609/icwsm.v4i1.14071, which is subject to the license by the author or copyright owner provided with this content. Please go to the source to verify the license and copyright information for your use.'}","[{'authorId': '2444631', 'name': 'ChunYuen Teng'}, {'authorId': '1778398', 'name': 'Lada A. Adamic'}]","
 
 User retention is important to the success of online social media, particularly in virtual world settings where users shape one another’s online experience. We study a rich set of variables, including social network and group membership, chatting, and transactions, in order to predict which users will stay and which ones will leave. We find that simple variables directly measuring the intensity and diversity of a user’s interaction with others are most predictive.
 
"
2ef5d9d8b2734054be2dfe911beabb809ab45ad3,"{'MAG': '1499088062', 'DBLP': 'conf/icwsm/Girju10', 'DOI': '10.1609/icwsm.v4i1.14030', 'CorpusId': 16777996}",Toward Social Causality: An Analysis of Interpersonal Relationships in Online Blogs and Forums,International Conference on Web and Social Media,2010,"{'url': 'https://doi.org/10.1609/icwsm.v4i1.14030', 'status': 'GOLD', 'license': None, 'disclaimer': 'Notice: Paper or abstract available at https://api.unpaywall.org/v2/10.1609/icwsm.v4i1.14030?email=<INSERT_YOUR_EMAIL> or https://doi.org/10.1609/icwsm.v4i1.14030, which is subject to the license by the author or copyright owner provided with this content. Please go to the source to verify the license and copyright information for your use.'}","[{'authorId': '2469966', 'name': 'Roxana Girju'}]","
 
 In this paper we present encouraging preliminary results into the problem of social causality (causal reasoning used by intelligent agents in a social environment) in online social interactions based on a model of reciprocity. At every level, social relationships are guided by the shared understanding that most actions call for appropriate reactions, and that inappropriate reactions require management. Thus, we present an analysis of interpersonal relationships in English reciprocal contexts. Specifically, we rely here on a large and recently built database of 10,882 reciprocal relation instances in online media. The resource is analyzed along a set of novel and important dimensions: symmetry, affective value, gender}, and {\em intentionality of action which are highly interconnected. At a larger level, we automatically generate {\em chains of causal relations} between verbs indicating interpersonal relationships. Statistics along these dimensions give insights into people's behavior, judgments, and thus their social interactions.
 
"
3833fa35490948dcc0e173fd27ae09cf6cccb3ad,"{'MAG': '2265685521', 'CorpusId': 55498202}","Photo Tagging Over Time - The Role of Motivations, Attention, and Ego-Network Density",International Conference on Web and Social Media,2010,"{'url': '', 'status': None, 'license': None}","[{'authorId': '153877423', 'name': 'P. Russo'}, {'authorId': '71575036', 'name': 'O. Nov'}]",
3925b9376ee88f818152ebee6391195c5eb54d8c,"{'MAG': '1559755104', 'DBLP': 'conf/icwsm/ZhaoL10', 'DOI': '10.1609/icwsm.v4i1.14047', 'CorpusId': 413060}",Finding Gold in Intranet Data: A Comparison of Mined and Surveyed Social Networks,International Conference on Web and Social Media,2010,"{'url': 'https://ojs.aaai.org/index.php/ICWSM/article/download/14047/13896', 'status': 'GOLD', 'license': None, 'disclaimer': 'Notice: Paper or abstract available at https://api.unpaywall.org/v2/10.1609/icwsm.v4i1.14047?email=<INSERT_YOUR_EMAIL> or https://doi.org/10.1609/icwsm.v4i1.14047, which is subject to the license by the author or copyright owner provided with this content. Please go to the source to verify the license and copyright information for your use.'}","[{'authorId': '144851415', 'name': 'Chen Zhao'}, {'authorId': '50678070', 'name': 'Baozhong Liu'}]","
 
 The goal of this research is to identify to what extent a social network extracted from public intranet data sources represents the actual interactions among people as reflected by a self-reported survey. We describe a case study we conducted within a large multinational software company comparing social networking information gathered from a traditional socio-centric network analysis (SNA) survey with various public intranet sources. Our results suggest that the value which automatically harvested social networks represent good percentage of actual ties with less privacy concern and low cost.
 
"
3994a8ff649f35517c8b023250b3f136454a2069,"{'MAG': '151433043', 'DBLP': 'conf/icwsm/CointetR10', 'DOI': '10.1609/icwsm.v4i1.14061', 'CorpusId': 17213499}","Local Networks, Local Topics: Structural and Semantic Proximity in Blogspace",International Conference on Web and Social Media,2010,"{'url': 'https://ojs.aaai.org/index.php/ICWSM/article/download/14061/13910', 'status': 'GOLD', 'license': None, 'disclaimer': 'Notice: Paper or abstract available at https://api.unpaywall.org/v2/10.1609/icwsm.v4i1.14061?email=<INSERT_YOUR_EMAIL> or https://doi.org/10.1609/icwsm.v4i1.14061, which is subject to the license by the author or copyright owner provided with this content. Please go to the source to verify the license and copyright information for your use.'}","[{'authorId': '3201151', 'name': 'Jean-Philippe Cointet'}, {'authorId': '49250210', 'name': 'Camille Roth'}]","
 
 Blog networks are often described as ""small world"" social networks where links are primarily created towards similar-minded individuals and well-connected bloggers. Examining a portion of the US blogosphere on several months, we find that bloggers relate to each other in a relatively local fashion, overwhelmingly and preferentially establishing links towards a limited neighborhood rather than the whole network. Furthermore, while long-distance interactions may indeed be dominated by homophily and authority effects, we show that close neighborhoods feature significantly more horizontal and diversified interactions — thereby challenging the conjecture of a widespread balkanization of Internet communities. We shed further light on this issue by describing the dual evolution of social and semantic proximity before and after two individuals interact with each other. We discuss in particular whether interactions are preceded or followed by a structural ""contraction"" and/or by an increasing similarity of the surrounding local social network.
 
"
39d9427984225287cc6e6ada176f3cb35c6ac46d,"{'DBLP': 'conf/icwsm/StrohmaierKK10', 'MAG': '1513751675', 'DOI': '10.1609/icwsm.v4i1.14056', 'CorpusId': 8365504}",Why do Users Tag? Detecting Users' Motivation for Tagging in Social Tagging Systems,International Conference on Web and Social Media,2010,"{'url': 'https://ojs.aaai.org/index.php/ICWSM/article/download/14056/13905', 'status': 'GOLD', 'license': None, 'disclaimer': 'Notice: Paper or abstract available at https://api.unpaywall.org/v2/10.1609/icwsm.v4i1.14056?email=<INSERT_YOUR_EMAIL> or https://doi.org/10.1609/icwsm.v4i1.14056, which is subject to the license by the author or copyright owner provided with this content. Please go to the source to verify the license and copyright information for your use.'}","[{'authorId': '1743043', 'name': 'M. Strohmaier'}, {'authorId': '2068032547', 'name': 'Christian Körner'}, {'authorId': '144361874', 'name': 'Roman Kern'}]","
 
 While recent progress has been achieved in understanding the structure and dynamics of social tagging systems, we know little about the underlying user motivations for tagging, and how they influence resulting folksonomies and tags. This paper addresses three issues related to this question: 1.) What motivates users to tag resources, and in what ways is user motivation amenable to quantitative analysis? 2.) Does users' motivation for tagging vary within and across social tagging systems, and if so how? and 3.) How does variability in user motivation influence resulting tags and folksonomies? In this paper, we present measures to detect whether a tagger is primarily motivated by categorizing or describing resources, and apply the measures to datasets from 8 different tagging systems. Our results show that a) users' motivation for tagging varies not only across, but also within tagging systems, and that b) tag agreement among users who are motivated by categorizing resources is significantly lower than among users who are motivated by describing resources. Our findings are relevant for (i) the development of tag recommenders, (ii) the analysis of tag semantics and (iii) the design of search algorithms for social tagging systems.
 
"
3e4a35ced9f7f81179028671b09129efae988baf,"{'MAG': '1590495275', 'DBLP': 'conf/icwsm/TumasjanSSW10', 'DOI': '10.1609/icwsm.v4i1.14009', 'CorpusId': 17539846}",Predicting Elections with Twitter: What 140 Characters Reveal about Political Sentiment,International Conference on Web and Social Media,2010,"{'url': 'https://ojs.aaai.org/index.php/ICWSM/article/download/14009/13858', 'status': 'GOLD', 'license': None, 'disclaimer': 'Notice: Paper or abstract available at https://api.unpaywall.org/v2/10.1609/icwsm.v4i1.14009?email=<INSERT_YOUR_EMAIL> or https://doi.org/10.1609/icwsm.v4i1.14009, which is subject to the license by the author or copyright owner provided with this content. Please go to the source to verify the license and copyright information for your use.'}","[{'authorId': '2584292', 'name': 'A. Tumasjan'}, {'authorId': '2469729', 'name': 'T. Sprenger'}, {'authorId': '34979132', 'name': 'Philipp G. Sandner'}, {'authorId': '2977208', 'name': 'I. Welpe'}]","
 
 Twitter is a microblogging website where users read and write millions of short messages on a variety of topics every day. This study uses the context of the German federal election to investigate whether Twitter is used as a forum for political deliberation and whether online messages on Twitter validly mirror offline political sentiment. Using LIWC text analysis software, we conducted a content-analysis of over 100,000 messages containing a reference to either a political party or a politician. Our results show that Twitter is indeed used extensively for political deliberation. We find that the mere number of messages mentioning a party reflects the election result. Moreover, joint mentions of two parties are in line with real world political ties and coalitions. An analysis of the tweets’ political sentiment demonstrates close correspondence to the parties' and politicians’ political positions indicating that the content of Twitter messages plausibly reflects the offline political landscape. We discuss the use of microblogging message content as a valid indicator of political sentiment and derive suggestions for further research.
 
"
3fee8e69b8e2df25030cf331b28b37f4dd13086c,"{'MAG': '2122369144', 'DBLP': 'conf/icwsm/OConnorBRS10', 'DOI': '10.1609/icwsm.v4i1.14031', 'CorpusId': 493963}",From Tweets to Polls: Linking Text Sentiment to Public Opinion Time Series,International Conference on Web and Social Media,2010,"{'url': 'https://ojs.aaai.org/index.php/ICWSM/article/download/14031/13880', 'status': 'GOLD', 'license': None, 'disclaimer': 'Notice: Paper or abstract available at https://api.unpaywall.org/v2/10.1609/icwsm.v4i1.14031?email=<INSERT_YOUR_EMAIL> or https://doi.org/10.1609/icwsm.v4i1.14031, which is subject to the license by the author or copyright owner provided with this content. Please go to the source to verify the license and copyright information for your use.'}","[{'authorId': '153724741', 'name': ""Brendan T. O'Connor""}, {'authorId': '2331270', 'name': 'R. Balasubramanyan'}, {'authorId': '3087875', 'name': 'Bryan R. Routledge'}, {'authorId': '144365875', 'name': 'Noah A. Smith'}]","
 
 We connect measures of public opinion measured from polls with sentiment measured from text. We analyze several surveys on consumer conﬁdence and political opinion over the 2008 to 2009 period, and ﬁnd they correlate to sentiment word frequencies in contempora- neous Twitter messages. While our results vary across datasets, in several cases the correlations are as high as 80%, and capture important large-scale trends. The re- sults highlight the potential of text streams as a substi- tute and supplement for traditional polling. consumer conﬁdence and political opinion, and can also pre- dict future movements in the polls. We ﬁnd that temporal smoothing is a critically important issue to support a suc- cessful model.
 
"
43a7cf1d51144212efa89e09b99f320a34606f2c,"{'DBLP': 'conf/icwsm/LeeEC10', 'MAG': '1506536743', 'DOI': '10.1609/icwsm.v4i1.14044', 'CorpusId': 16250087}","Devils, Angels, and Robots: Tempting Destructive Users in Social Media",International Conference on Web and Social Media,2010,"{'url': 'https://ojs.aaai.org/index.php/ICWSM/article/download/14044/13893', 'status': 'GOLD', 'license': None, 'disclaimer': 'Notice: Paper or abstract available at https://api.unpaywall.org/v2/10.1609/icwsm.v4i1.14044?email=<INSERT_YOUR_EMAIL> or https://doi.org/10.1609/icwsm.v4i1.14044, which is subject to the license by the author or copyright owner provided with this content. Please go to the source to verify the license and copyright information for your use.'}","[{'authorId': '2848353', 'name': 'Kyumin Lee'}, {'authorId': '2130169', 'name': 'B. Eoff'}, {'authorId': '1697232', 'name': 'James Caverlee'}]","
 
 Social media sites derive their value by providing a popular and dependable community for participants to engage, share, and interact. This community value and related services like search and advertising are threatened by spammers, content polluters, and malware disseminators. In an effort to preserve community value and ensure long-term success, we present a prototype system for automatically detecting and profiling destructive users in social media. We described the architecture of the system - inspired by the ""broken windows"" theory embraced by law enforcement - the results and insights gained from a preliminary study conducted to determine the efficacy of our approach, and a discussion of our ongoing research.
 
"
44d3340c80a5585d888b2a091c15728eec432409,"{'DBLP': 'conf/icwsm/MatsumuraY10', 'MAG': '1573885972', 'DOI': '10.1609/icwsm.v4i1.14053', 'CorpusId': 8213402}",Monetary Value of Customer Networks in Mobile Social Networking Services,International Conference on Web and Social Media,2010,"{'url': 'https://ojs.aaai.org/index.php/ICWSM/article/download/14053/13902', 'status': 'GOLD', 'license': None, 'disclaimer': 'Notice: Paper or abstract available at https://api.unpaywall.org/v2/10.1609/icwsm.v4i1.14053?email=<INSERT_YOUR_EMAIL> or https://doi.org/10.1609/icwsm.v4i1.14053, which is subject to the license by the author or copyright owner provided with this content. Please go to the source to verify the license and copyright information for your use.'}","[{'authorId': '2096729', 'name': 'N. Matsumura'}, {'authorId': '2491280', 'name': 'Hikaru Yamamoto'}]","
 
 Mobile Social Networking Services (SNS) are an emerging trend in which individuals of similar interests communicate with one another using mobile phones. In this paper, we calculate the monetary value of customers and their networks in mobile SNS using the official data provided by a service provider. The mobile SNS enable users to create their avatars to communicate with each other via blog comments and communities. The company sells various items for these avatars such as apparel and interiors. This service generates consumer purchase history data and user network data. In previous research, the value of the customer is often estimated using the purchase history, but the network value is neglected. In the field of computer science, the value of the network is evaluated via the network structure, but not much attention is paid to the economic aspect of each node. The aim of this paper is to incorporate the social factor with the customer purchase database and calculate the monetary value of each customer and his or her network. The results of empirical analysis show that our approach is useful in finding valuable customers for marketing activities and outperforms conventional metrics such as degree centrality.
 
"
478e23c417b578b8e578ba50419e118684c43796,"{'ArXiv': '1003.2469', 'MAG': '2166531833', 'DBLP': 'journals/corr/abs-1003-2469', 'DOI': '10.1609/icwsm.v4i1.14015', 'CorpusId': 6794729}","The Directed Closure Process in Hybrid Social-Information Networks, with an Analysis of Link Formation on Twitter",International Conference on Web and Social Media,2010,"{'url': 'https://ojs.aaai.org/index.php/ICWSM/article/download/14015/13864', 'status': 'GOLD', 'license': None, 'disclaimer': 'Notice: Paper or abstract available at https://arxiv.org/abs/1003.2469, which is subject to the license by the author or copyright owner provided with this content. Please go to the source to verify the license and copyright information for your use.'}","[{'authorId': '144463004', 'name': 'Daniel M. Romero'}, {'authorId': '3371403', 'name': 'J. Kleinberg'}]","
 
 It has often been taken as a working assumption that directed links in information networks are frequently formed by ""short-cutting'' a two-step path between the source and the destination — a kind of implicit ""link copying'' analogous to the process of triadic closure in social networks. Despite the role of this assumption in theoretical models such as preferential attachment, it has received very little direct empirical investigation. Here we develop a formalization and methodology for studying this type of directed closure process, and we provide evidence for its important role in the formation of links on Twitter. We then analyze a sequence of models designed to capture the structural phenomena related to directed closure that we observe in the Twitter data.
 
"
4d2f8a1e29ae4e82ee660c8edc107fa05b2e554f,"{'DBLP': 'conf/icwsm/ZhangS10', 'MAG': '1549869922', 'DOI': '10.1609/icwsm.v4i1.14075', 'CorpusId': 5683419}",Trading Strategies to Exploit Blog and News Sentiment,International Conference on Web and Social Media,2010,"{'url': 'https://ojs.aaai.org/index.php/ICWSM/article/download/14075/13924', 'status': 'GOLD', 'license': None, 'disclaimer': 'Notice: Paper or abstract available at https://api.unpaywall.org/v2/10.1609/icwsm.v4i1.14075?email=<INSERT_YOUR_EMAIL> or https://doi.org/10.1609/icwsm.v4i1.14075, which is subject to the license by the author or copyright owner provided with this content. Please go to the source to verify the license and copyright information for your use.'}","[{'authorId': '2155264880', 'name': 'Wenbin Zhang'}, {'authorId': '1721948', 'name': 'S. Skiena'}]","
 
 We use quantitative media (blogs, and news as a comparison) data generated by a large-scale natural language processing (NLP) text analysis system to perform a comprehensive and comparative study on how company related news variables anticipates or reflects the company's stock trading volumes and financial returns. Building on our findings, we give a sentiment-based market-neutral trading strategy which gives consistently favorable returns with low volatility over a long period. Our results are significant in confirming the performance of general blog and news sentiment analysis methods over broad domains and sources. Moreover, several remarkable differences between news and blogs are also identified.
 
"
53be8946e945ae3fc043fffe54be865be9423534,"{'DBLP': 'conf/icwsm/McGlohonGR10', 'MAG': '1495762646', 'DOI': '10.1609/icwsm.v4i1.14019', 'CorpusId': 7861759}",Star Quality: Aggregating Reviews to Rank Products and Merchants,International Conference on Web and Social Media,2010,"{'url': 'https://ojs.aaai.org/index.php/ICWSM/article/download/14019/13868', 'status': 'GOLD', 'license': None, 'disclaimer': 'Notice: Paper or abstract available at https://api.unpaywall.org/v2/10.1609/icwsm.v4i1.14019?email=<INSERT_YOUR_EMAIL> or https://doi.org/10.1609/icwsm.v4i1.14019, which is subject to the license by the author or copyright owner provided with this content. Please go to the source to verify the license and copyright information for your use.'}","[{'authorId': '1982698', 'name': 'Mary McGlohon'}, {'authorId': '1726974', 'name': 'N. Glance'}, {'authorId': '118962151', 'name': 'Z. Reiter'}]","
 
 Given a set of reviews of products or merchants from a wide range of authors and several reviews websites, how can we measure the true quality of the product or merchant?  How do we remove the bias of individual authors or sources?  How do we compare reviews obtained from different websites, where ratings may be on different scales (1-5 stars, A/B/C, etc.)?  How do we filter out unreliable reviews to use only the ones with ``star quality''?  Taking into account these considerations, we analyze data sets from a variety of different reviews sites (the first paper, to our knowledge, to do this). These data sets include 8 million product reviews and 1.5 million merchant reviews. We explore statistic- and heuristic- based models for estimating the true quality of a product or merchant, and compare the performance of these estimators on the task of ranking pairs of objects.  We also apply the same models to the task of using Netflix ratings data to rank pairs of movies, and discover that the performance of the different models is surprisingly similar on this data set.
 
"
5a58e486b8fd1fc46ef3692395cd003af9173d66,"{'DBLP': 'conf/icwsm/YangWAA10', 'MAG': '1510898630', 'DOI': '10.1609/icwsm.v4i1.14010', 'CorpusId': 9731600}",Activity Lifespan: An Analysis of User Survival Patterns in Online Knowledge Sharing Communities,International Conference on Web and Social Media,2010,"{'url': 'https://ojs.aaai.org/index.php/ICWSM/article/download/14010/13859', 'status': 'GOLD', 'license': None, 'disclaimer': 'Notice: Paper or abstract available at https://api.unpaywall.org/v2/10.1609/icwsm.v4i1.14010?email=<INSERT_YOUR_EMAIL> or https://doi.org/10.1609/icwsm.v4i1.14010, which is subject to the license by the author or copyright owner provided with this content. Please go to the source to verify the license and copyright information for your use.'}","[{'authorId': '2109760059', 'name': 'Jiang Yang'}, {'authorId': '2115492721', 'name': 'Xiao Wei'}, {'authorId': '1797833', 'name': 'M. Ackerman'}, {'authorId': '1778398', 'name': 'Lada A. Adamic'}]","
 
 Retaining participation is crucial for information services, online knowledge sharing services among them. We present the first comprehensive analysis of users’ activity lifespan across three predominant online knowledge-sharing communities. Extending previous work focusing on initial interactions of new users, we use survival analysis to quantify participation patterns that can be used to predict individual lifespan over the long term. We discuss how cross-site differences in user participation and the underlying factors can be related to differences in system design and culture. We conduct a longitudinal comparison of the communities’ evolvement between two distinct stages, the initial days just after the site launch and one year later. We also observe that sub-communities corresponding to different topics differ in their ability to sustain users. All results reveal the complexity and diversity in users’ engagement to a site and design implications are discussed.
 
"
