paperId,externalIds,title,venue,year,openAccessPdf,authors,abstract
a52f4488aa056f23e6be39f4cb4e6b4e66bba57f,"{'DOI': '10.1609/icwsm.v8i1.14502', 'CorpusId': 253292012}",Tutorial Program,Proceedings of the International AAAI Conference on Web and Social Media,2014,"{'url': 'https://ojs.aaai.org/index.php/ICWSM/article/download/14502/14351', 'status': 'GOLD', 'license': None, 'disclaimer': 'Notice: Paper or abstract available at https://api.unpaywall.org/v2/10.1609/icwsm.v8i1.14502?email=<INSERT_YOUR_EMAIL> or https://doi.org/10.1609/icwsm.v8i1.14502, which is subject to the license by the author or copyright owner provided with this content. Please go to the source to verify the license and copyright information for your use.'}","[{'authorId': None, 'name': 'Eytan Adar'}, {'authorId': '144741762', 'name': 'P. Resnick'}]","
 
 Descriptions of the tutorials presented at the Eighth International AAAI Conference on Weblogs and Social Media
 
"
a6e3a034b80d147964bcf3988f693689b125c0d0,"{'MAG': '774467674', 'DBLP': 'conf/icwsm/LuuLC14', 'DOI': '10.1609/icwsm.v8i1.14531', 'CorpusId': 18515336}",On Modeling Brand Preferences in Item Adoptions,International Conference on Web and Social Media,2014,"{'url': 'https://ojs.aaai.org/index.php/ICWSM/article/download/14531/14380', 'status': 'GOLD', 'license': None, 'disclaimer': 'Notice: Paper or abstract available at https://api.unpaywall.org/v2/10.1609/icwsm.v8i1.14531?email=<INSERT_YOUR_EMAIL> or https://doi.org/10.1609/icwsm.v8i1.14531, which is subject to the license by the author or copyright owner provided with this content. Please go to the source to verify the license and copyright information for your use.'}","[{'authorId': '3204594', 'name': 'Duc Minh Luu'}, {'authorId': '1709901', 'name': 'Ee-Peng Lim'}, {'authorId': '2630338', 'name': 'Freddy Chongtat Chua'}]","
 
 In marketing and advertising, developing and managingbrands value represent the core activities performedby companies. Successful brands attract buyers andadopters, which in turn increase the companies’ value.Given a set of user-item adoption data, can we inferbrand effects from users adopting items? To answerthis question, we develop the Brand Item Topic Model(BITM) that incorporates users’ brand preferences inthe process of item adoption by the users. We evaluateour model using synthetic and two real world datasetsagainst baseline models which do not consider brand effects.The results show that BITM can determine userswho demonstrate brand preferences and predict itemadoptions more accurately.
 
"
a86adea08283d67522a31e119b682fe04466cf2c,"{'MAG': '311908828', 'DBLP': 'conf/icwsm/Toma14', 'DOI': '10.1609/icwsm.v8i1.14509', 'CorpusId': 7027274}",Counting on Friends: Cues to Perceived Trustworthiness in Facebook Profiles,International Conference on Web and Social Media,2014,"{'url': 'https://ojs.aaai.org/index.php/ICWSM/article/download/14509/14358', 'status': 'GOLD', 'license': None, 'disclaimer': 'Notice: Paper or abstract available at https://api.unpaywall.org/v2/10.1609/icwsm.v8i1.14509?email=<INSERT_YOUR_EMAIL> or https://doi.org/10.1609/icwsm.v8i1.14509, which is subject to the license by the author or copyright owner provided with this content. Please go to the source to verify the license and copyright information for your use.'}","[{'authorId': '31575674', 'name': 'Catalina L. Toma'}]","
 
 Personal profiles on social network sites have become an important tool for social evaluation – that is, assessing profile owners’ characteristics (e.g., personality traits, narcissism, physical and social attractiveness). The present study is one of the first to examine how users’ trustworthiness is evaluated by naïve observers based on information contained in Facebook profiles, or profile cues. Drawing on uncertainty reduction theory, warranting theory, and hardwired perceptions of facial displays, we propose a framework that identifies cues associated with trustworthiness in Facebook profiles. Results show that six profile cues (number of friends, number of tagged photographs, number of “about me” categories filled out, number of comments and “likes” received from friends, and smiling profile photographs) explained about a third of the variance in Facebook users’ perceived trustworthiness. Number of friends had a curvilinear, U-shaped effect on trustworthiness perceptions, with an inflection point at about 500 friends. That is, trustworthiness decreased as number of friends increased up to 500, and then trustworthiness increased as number of friends increased beyond 500. Theoretical and design implications of the findings are discussed.
 
"
a8a888c879ed1c0b8a6b1f787377642325b8212b,"{'MAG': '2963914481', 'DBLP': 'journals/corr/HighamGMOL14', 'ArXiv': '1406.2017', 'DOI': '10.1609/icwsm.v9i3.14684', 'CorpusId': 5914675}",Anticipating Activity in Social Media Spikes,Proceedings of the International AAAI Conference on Web and Social Media,2014,"{'url': 'https://ojs.aaai.org/index.php/ICWSM/article/download/14684/14533', 'status': 'GOLD', 'license': 'public-domain', 'disclaimer': 'Notice: Paper or abstract available at https://arxiv.org/abs/1406.2017, which is subject to the license by the author or copyright owner provided with this content. Please go to the source to verify the license and copyright information for your use.'}","[{'authorId': '1719736', 'name': 'D. Higham'}, {'authorId': '3029780', 'name': 'P. Grindrod'}, {'authorId': '1961938', 'name': 'Alexander V. Mantzaris'}, {'authorId': '32129973', 'name': 'Amanda Otley'}, {'authorId': '2222044', 'name': 'P. Laflin'}]","
 
 We propose a novel mathematical model for the activity of microbloggers during an external, event-driven spike. The model leads to a testable prediction of who would become most active if a spike were to take place. This type of insight into human behaviour has many applications, as it identifies key players who can be targeted with information in real time when the network is most receptive. The model takes account of the fact that dynamic interactions evolve over an underlying, static network that records ""who listens to whom"". Our fundamental assumption is that, in the case where the entire community has become aware of an external news event, a key driver of activity is the motivation to participate by responding to incoming messages. We validate the resulting algorithm on a large scale Twitter conversation concerning the appointment of a UK Premier League football club manager. We also find that the half-life of a spike in activity can be quantified in terms of the network size and the typical response rate.
 
"
ae8b3a317e59dab046acae8907c6867daa983b82,"{'MAG': '230487065', 'DBLP': 'conf/icwsm/ChenM14', 'DOI': '10.1609/icwsm.v8i1.14566', 'CorpusId': 1227613}",Do Topic-Dependent Models Improve Microblog Sentiment Estimation?,International Conference on Web and Social Media,2014,"{'url': 'https://ojs.aaai.org/index.php/ICWSM/article/download/14566/14415', 'status': 'GOLD', 'license': None, 'disclaimer': 'Notice: Paper or abstract available at https://api.unpaywall.org/v2/10.1609/icwsm.v8i1.14566?email=<INSERT_YOUR_EMAIL> or https://doi.org/10.1609/icwsm.v8i1.14566, which is subject to the license by the author or copyright owner provided with this content. Please go to the source to verify the license and copyright information for your use.'}","[{'authorId': '27375808', 'name': 'Francine Chen'}, {'authorId': '2701917', 'name': 'Seyed Hamid Mirisaee'}]","
 
 A topic-independent sentiment model is commonly used to estimate sentiment in microblogs. But for movie and product reviews, domain adaptation has been shown to improve sentiment estimation performance. We examined whether topic-dependent models improve polarity estimation of microblogs. We considered both a model trained on Twitter tweets containing a target keyword and a model trained on an enlarged set of tweets containing terms related to a topic.  Comparing the performance of the topic-dependent models to a topic-independent model trained on a general sample of  tweets, we noted that for some topics, topic-dependent models performed better. We then propose a method for predicting which topics are likely to have better sentiment estimation performance when a topic-dependent sentiment model is used.
 
"
b08d90971375bd265307af914d57b1b039b5277c,"{'DBLP': 'conf/icwsm/HentschelACK14', 'MAG': '436581396', 'DOI': '10.1609/icwsm.v8i1.14569', 'CorpusId': 15147223}",Finding Users we Trust: Scaling up Verified Twitter Users Using their Communication Patterns,International Conference on Web and Social Media,2014,"{'url': 'https://ojs.aaai.org/index.php/ICWSM/article/download/14569/14418', 'status': 'GOLD', 'license': None, 'disclaimer': 'Notice: Paper or abstract available at https://api.unpaywall.org/v2/10.1609/icwsm.v8i1.14569?email=<INSERT_YOUR_EMAIL> or https://doi.org/10.1609/icwsm.v8i1.14569, which is subject to the license by the author or copyright owner provided with this content. Please go to the source to verify the license and copyright information for your use.'}","[{'authorId': '25770850', 'name': 'Martin Hentschel'}, {'authorId': '144419174', 'name': 'Omar Alonso'}, {'authorId': '1666505245', 'name': 'Scott Counts'}, {'authorId': '2613881', 'name': 'Vasileios Kandylas'}]","
 
 We present a technique to identify Twitter users we trust to be regular Twitter users and not spam or fake accounts. The technique starts with an initial set of trusted users based on Twitter's verified users and recursively includes other users the trusted users communicate with. Conversations must be initiated by trusted users. We show that this technique produces a set of users that is over 200 times larger than Twitter's verified users. Our evaluation shows that the share of non-spam users within the resulting set of trusted users is more than 92% while the share of non-spam users within all tweeting users is 74%.
 
"
b700d9d4eaa4df1e6f898c56fc4333c5e31faef9,"{'MAG': '2188875729', 'DBLP': 'conf/icwsm/ZambaldiPQA14', 'DOI': '10.1609/icwsm.v8i1.14560', 'CorpusId': 16656235}",Lightweight Contextual Ranking of City Pictures: Urban Sociology to the Rescue,International Conference on Web and Social Media,2014,"{'url': 'https://ojs.aaai.org/index.php/ICWSM/article/download/14560/14409', 'status': 'GOLD', 'license': None, 'disclaimer': 'Notice: Paper or abstract available at https://api.unpaywall.org/v2/10.1609/icwsm.v8i1.14560?email=<INSERT_YOUR_EMAIL> or https://doi.org/10.1609/icwsm.v8i1.14560, which is subject to the license by the author or copyright owner provided with this content. Please go to the source to verify the license and copyright information for your use.'}","[{'authorId': '3133079', 'name': 'V. Zambaldi'}, {'authorId': '2291666', 'name': 'João Paulo Pesce'}, {'authorId': '144041798', 'name': 'D. Quercia'}, {'authorId': '145624017', 'name': 'Virgílio A. F. Almeida'}]","
 
 To increase mobile user engagement, photo sharing sites are trying to identify interesting and memorable pictures. Past proposals for identifying such pictures have relied on either metadata (e.g., likes) or visual features. In practice, techniques based on  those two inputs  do not always work: metadata is sparse (only few pictures have considerable number of likes), and extracting visual features is computationally expensive. In mobile solutions,  geo-referenced content becomes increasingly important. The premise behind this work is that pictures of a neighborhood is linked to the way the neighborhood is perceived by people: whether it is, for instance, distinctive and beautiful or not.  Since 1970s, urban theories proposed by Lynch, Milgram and Peterson aimed at systematically capturing the way people perceive neighborhoods. Here we tested whether those theories could be put to use for automatically identifying appealing city pictures.  We did so by gathering geo-referenced Flickr pictures in the city of London; selecting six urban qualities associated with those urban theories; computing proxies for those qualities from online social media data; and ranking Flickr pictures based on those proxies. We find that our proposal enjoys three main desirable properties: it is effective, scalable, and aware of contextual changes such as  time of day and weather condition. All this suggests new promising research directions for multi-modal learning approaches that automatically identify appealing city pictures.
 
"
b78f9bb179c479565d9fe92e9930e4bdb846c622,"{'MAG': '2950864666', 'ArXiv': '1403.7657', 'DBLP': 'conf/icwsm/GeorgievNM14', 'DOI': '10.1609/icwsm.v8i1.14520', 'CorpusId': 10542299}",The Call of the Crowd: Event Participation in Location-Based Social Services,International Conference on Web and Social Media,2014,"{'url': 'https://ojs.aaai.org/index.php/ICWSM/article/download/14520/14369', 'status': 'GOLD', 'license': None, 'disclaimer': 'Notice: Paper or abstract available at https://arxiv.org/abs/1403.7657, which is subject to the license by the author or copyright owner provided with this content. Please go to the source to verify the license and copyright information for your use.'}","[{'authorId': '1737522', 'name': 'Petko Georgiev'}, {'authorId': '1718233', 'name': 'A. Noulas'}, {'authorId': '1733840', 'name': 'C. Mascolo'}]","
 
 Understanding the social and behavioral forces behind event participation is not only interesting from the viewpoint of social science, but also has important applications in the design of personalized event recommender systems.This paper takes advantage of data from a widely used location-based social network, Foursquare, to analyze event patterns in three metropolitan cities. We put forward several hypotheses on the motivating factors of user participation and confirm that social aspects play a major role in determining the likelihood of a user to participate in an event. While an explicit social filtering signal accounting for whether friends are attending dominates the factors, the popularity of an event proves to also be a strong attractor. Further, we capture an implicit social signal by performing random walks in a high dimensional graph that encodes the place type preferences of friends and that proves especially suited to identify relevant niche events for users. Our findings on the extent to which the various temporal, spatial and social aspects underlie users' event preferences lead us to further hypothesize that a combination of factors better models users' event interests. We verify this through a supervised learning framework. We show that for one in three users in London and one in five users in New York and Chicago it identifies the exact event the user would attend among the pool of suggestions.
 
"
b9bf949db3451cfde6ea96a8009672ca6fb7ed32,"{'DBLP': 'conf/icwsm/ZhangK14', 'MAG': '2216264721', 'DOI': '10.1609/icwsm.v8i1.14573', 'CorpusId': 12765698}",Anonymity in Social Media: Effects of Content Controversiality and Social Endorsement on Sharing Behavior,International Conference on Web and Social Media,2014,"{'url': 'https://ojs.aaai.org/index.php/ICWSM/article/download/14573/14422', 'status': 'GOLD', 'license': None, 'disclaimer': 'Notice: Paper or abstract available at https://api.unpaywall.org/v2/10.1609/icwsm.v8i1.14573?email=<INSERT_YOUR_EMAIL> or https://doi.org/10.1609/icwsm.v8i1.14573, which is subject to the license by the author or copyright owner provided with this content. Please go to the source to verify the license and copyright information for your use.'}","[{'authorId': '7151221', 'name': 'Kaiping Zhang'}, {'authorId': '2312841951', 'name': 'René F. Kizilcec'}]","
 
 The amount of information shared via social media is rapidly increasing amid growing concerns over online privacy. This study investigates the effect of controversiality and social endorsement of media content on sharing behavior when choosing between sharing publicly or anonymously. Anonymous sharing is found to be a popular choice (59% of shares), especially for controversial content which is 3.2x more likely to be shard anonymously. Social endorsement was not found to affect sharing behavior, except for sports-related content. Implications for social media interface design are discussed.
 
"
b9d4f95046fee429eb34db50653875de3539805f,"{'DBLP': 'conf/icwsm/AdarR14', 'CorpusId': 263864181}",Preface,International Conference on Web and Social Media,2014,"{'url': '', 'status': None, 'license': None, 'disclaimer': ""Notice: The following paper fields have been elided by the publisher: {'abstract'}. Paper or abstract available at http://www.aaai.org/ocs/index.php/ICWSM/ICWSM14/paper/view/8870, which is subject to the license by the author or copyright owner provided with this content. Please go to the source to verify the license and copyright information for your use.""}","[{'authorId': None, 'name': 'Eytan Adar'}, {'authorId': '2060117898', 'name': 'Paul Resnick'}]",
bcdc102c04fb0e7d4652e8bcc7edd2983bb9576d,"{'MAG': '2099813784', 'DBLP': 'conf/icwsm/HuttoG14', 'DOI': '10.1609/icwsm.v8i1.14550', 'CorpusId': 12233345}",VADER: A Parsimonious Rule-Based Model for Sentiment Analysis of Social Media Text,International Conference on Web and Social Media,2014,"{'url': 'https://ojs.aaai.org/index.php/ICWSM/article/download/14550/14399', 'status': 'GOLD', 'license': None, 'disclaimer': 'Notice: Paper or abstract available at https://api.unpaywall.org/v2/10.1609/icwsm.v8i1.14550?email=<INSERT_YOUR_EMAIL> or https://doi.org/10.1609/icwsm.v8i1.14550, which is subject to the license by the author or copyright owner provided with this content. Please go to the source to verify the license and copyright information for your use.'}","[{'authorId': '40320059', 'name': 'C. J. Hutto'}, {'authorId': '145280613', 'name': 'Eric Gilbert'}]","
 
 The inherent nature of social media content poses serious challenges to practical applications of sentiment analysis. We present VADER, a simple rule-based model for general sentiment analysis, and compare its effectiveness to eleven typical state-of-practice benchmarks including LIWC, ANEW, the General Inquirer, SentiWordNet, and machine learning oriented techniques relying on Naive Bayes, Maximum Entropy, and Support Vector Machine (SVM) algorithms. Using a combination of qualitative and quantitative methods, we first construct and empirically validate a gold-standard list of lexical features (along with their associated sentiment intensity measures) which are specifically attuned to sentiment in microblog-like contexts. We then combine these lexical features with consideration for five general rules that embody grammatical and syntactical conventions for expressing and emphasizing sentiment intensity. Interestingly, using our parsimonious rule-based model to assess the sentiment of tweets, we find that VADER outperforms individual human raters (F1 Classification Accuracy = 0.96 and 0.84, respectively), and generalizes more favorably across contexts than any of our benchmarks.
 
"
bd177fc7d5129a237d08a47b1f3090a37f23d26a,"{'MAG': '2963129265', 'ArXiv': '1411.3214', 'DBLP': 'journals/corr/RodriguezHA14', 'DOI': '10.1609/icwsm.v9i3.14683', 'CorpusId': 14670504}",Deciding what to display: maximizing the information value of social media,Proceedings of the International AAAI Conference on Web and Social Media,2014,"{'url': 'https://ojs.aaai.org/index.php/ICWSM/article/download/14683/14532', 'status': 'GOLD', 'license': None, 'disclaimer': 'Notice: Paper or abstract available at https://arxiv.org/abs/1411.3214, which is subject to the license by the author or copyright owner provided with this content. Please go to the source to verify the license and copyright information for your use.'}","[{'authorId': '2123513', 'name': 'S. S. Rodríguez'}, {'authorId': '1794321', 'name': 'B. Huberman'}, {'authorId': '1806968', 'name': 'S. Asur'}]","
 
 In information-rich environments, the competition for users' attention leads to a flood of content from which people often find hard to sort out the most relevant and useful pieces. Using Twitter as a case study, we applied an attention economy solution to generate the most informative tweets for its users. By considering the novelty and popularity of tweets as objective measures of their relevance and utility, we used the Huberman-Wu algorithm to automatically select the ones that will receive the most attention in the next time interval. Their predicted popularity was confirmed by using Twitter data collected for a period of 2 months.
 
"
c23064eb7b95c0affd296218b5f383de1e7174de,"{'MAG': '1462318385', 'DBLP': 'conf/icwsm/DiakopoulosZES14', 'DOI': '10.1609/icwsm.v8i1.14570', 'CorpusId': 935781}",Identifying and Analyzing Moral Evaluation Frames in Climate Change Blog Discourse,International Conference on Web and Social Media,2014,"{'url': 'https://ojs.aaai.org/index.php/ICWSM/article/download/14570/14419', 'status': 'GOLD', 'license': None, 'disclaimer': 'Notice: Paper or abstract available at https://api.unpaywall.org/v2/10.1609/icwsm.v8i1.14570?email=<INSERT_YOUR_EMAIL> or https://doi.org/10.1609/icwsm.v8i1.14570, which is subject to the license by the author or copyright owner provided with this content. Please go to the source to verify the license and copyright information for your use.'}","[{'authorId': '2943892', 'name': 'N. Diakopoulos'}, {'authorId': '144518215', 'name': 'Amy X. Zhang'}, {'authorId': '2678579', 'name': 'D. Elgesem'}, {'authorId': '1819004', 'name': 'A. Salway'}]","
 
 Media frames define distinctive perspectives or ways of communicating about issues and can be manifested through patterns of language use, such as preferences for various key terms and phrases. In this work we develop a novel operationalization of moral evaluation frames and study their use within a corpus of blogs discussing climate change. We compare moral evaluation frames between blogs marked as climate change skeptics and climate change acceptors. We develop a text visualization tool called Lingoscope that allows the user to observe and filter the contextual terms that convey moral framing across large volumes of text, as well as to drill down to specific examples. By focusing on climate-related topics and how they are discussed by climate change skeptics versus climate change acceptors, our approach uncovers and explores how numerous topics are framed in a different moral light in skeptical and acceptor blogs.
 
"
c5d539f35a0700b5be52e838429e824a3e50d464,"{'MAG': '2188540479', 'DBLP': 'conf/icwsm/GanuM14', 'DOI': '10.1609/icwsm.v8i1.14515', 'CorpusId': 12854371}",Personalizing Forum Search using Multidimensional Random Walks,International Conference on Web and Social Media,2014,"{'url': 'https://ojs.aaai.org/index.php/ICWSM/article/download/14515/14364', 'status': 'GOLD', 'license': None, 'disclaimer': 'Notice: Paper or abstract available at https://api.unpaywall.org/v2/10.1609/icwsm.v8i1.14515?email=<INSERT_YOUR_EMAIL> or https://doi.org/10.1609/icwsm.v8i1.14515, which is subject to the license by the author or copyright owner provided with this content. Please go to the source to verify the license and copyright information for your use.'}","[{'authorId': '2125359', 'name': 'Gayatree Ganu'}, {'authorId': '144173226', 'name': 'A. Marian'}]","
 
 Online forums are a vital resource for users to ask questions and to participate in discussions. Yet, the search functionality on such forum sites is very primitive; posts containing the searched keywords are retrieved in the order of their creation date. In these interactive and social web forum sites, users frequently make connections with other users due to shared interests, same information needs or similar profiles. A critical challenge then, is to score and rank the forum posts while taking into account these relations between users. In this paper, we present a personalized search over forums that leverages user similarities developed via multiple relations linking users. We build a novel multidimensional random walk model that uniformly incorporates the heterogeneous user relations to find similar forum participants. We then use this multi-relational user similarity to predict future interactions by personalizing answer search. Furthermore, we extend our methods to enhance keyword search for forum readers, by using expertise scores for all existing forum participants. Our results show that by leveraging the author dimension we can retrieve more relevant results than the traditional IR scoring alone.
 
"
