paperId,externalIds,title,venue,year,openAccessPdf,authors,abstract
773e202b0dfd9aada0c0789de356d65aaf80270c,"{'ArXiv': '2409.09467', 'DBLP': 'journals/corr/abs-2409-09467', 'DOI': '10.48550/arXiv.2409.09467', 'CorpusId': 272689332}",Keeping Humans in the Loop: Human-Centered Automated Annotation with Generative AI,International Conference on Web and Social Media,2024,"{'url': '', 'status': None, 'license': None, 'disclaimer': 'Notice: Paper or abstract available at https://arxiv.org/abs/2409.09467, which is subject to the license by the author or copyright owner provided with this content. Please go to the source to verify the license and copyright information for your use.'}","[{'authorId': '2219329724', 'name': 'Nicholas Pangakis'}, {'authorId': '2262460938', 'name': 'Samuel Wolken'}]","Automated text annotation is a compelling use case for generative large language models (LLMs) in social media research. Recent work suggests that LLMs can achieve strong performance on annotation tasks; however, these studies evaluate LLMs on a small number of tasks and likely suffer from contamination due to a reliance on public benchmark datasets. Here, we test a human-centered framework for responsibly evaluating artificial intelligence tools used in automated annotation. We use GPT-4 to replicate 27 annotation tasks across 11 password-protected datasets from recently published computational social science articles in high-impact journals. For each task, we compare GPT-4 annotations against human-annotated ground-truth labels and against annotations from separate supervised classification models fine-tuned on human-generated labels. Although the quality of LLM labels is generally high, we find significant variation in LLM performance across tasks, even within datasets. Our findings underscore the importance of a human-centered workflow and careful evaluation standards: Automated annotations significantly diverge from human judgment in numerous scenarios, despite various optimization strategies such as prompt tuning. Grounding automated annotation in validation labels generated by humans is essential for responsible evaluation."
798c013af1c954fd7170bb99b93fe37186d6be33,"{'DBLP': 'conf/icwsm/Oh24', 'DOI': '10.1609/icwsm.v18i1.31443', 'CorpusId': 270194365}",Sentibank: A Unified Resource of Sentiment Lexicons and Dictionaries,International Conference on Web and Social Media,2024,"{'url': 'https://ojs.aaai.org/index.php/ICWSM/article/download/31443/33603', 'status': 'GOLD', 'license': None, 'disclaimer': 'Notice: Paper or abstract available at https://api.unpaywall.org/v2/10.1609/icwsm.v18i1.31443?email=<INSERT_YOUR_EMAIL> or https://doi.org/10.1609/icwsm.v18i1.31443, which is subject to the license by the author or copyright owner provided with this content. Please go to the source to verify the license and copyright information for your use.'}","[{'authorId': '2390927242', 'name': 'Nick Oh'}]","Sentiment analysis is critical across computational social science domains, but faces challenges in interpretability. Rule-based methods relying on expert lexicons enable transparency, yet applying them is hindered by resource fragmentation and lack of validation. This paper introduces sentibank, a large-scale unified database consolidating 15 original sentiment dictionaries and 43 preprocessed dictionaries, spanning 7 genres and 6 domains."
7a4cb5908fe6ac205389fb89291b17c1cb36c736,"{'DBLP': 'conf/icwsm/HazmanMG25', 'ArXiv': '2407.11861', 'DOI': '10.48550/arXiv.2407.11861', 'CorpusId': 271218514}",What Makes a Meme a Meme? Identifying Memes for Memetics-Aware Dataset Creation,International Conference on Web and Social Media,2024,"{'url': '', 'status': None, 'license': None, 'disclaimer': 'Notice: Paper or abstract available at https://arxiv.org/abs/2407.11861, which is subject to the license by the author or copyright owner provided with this content. Please go to the source to verify the license and copyright information for your use.'}","[{'authorId': '2210392249', 'name': 'Muzhaffar Hazman'}, {'authorId': '2348464518', 'name': 'Susan Mckeever'}, {'authorId': '2311510467', 'name': 'Josephine Griffith'}]","Warning: This paper contains memes that may be offensive to some readers.
Multimodal Internet Memes are now a ubiquitous fixture in online discourse. One strand of meme-based research is the classification of memes according to various affects, such as sentiment and hate, supported by manually compiled meme datasets. Understanding the unique characteristics of memes is crucial for meme classification. Unlike other user-generated content, memes spread via memetics, i.e. the process by which memes are imitated and transformed into elements used to create new memes. In effect, there exists an ever-evolving pool of visual and linguistic elements that underpin meme culture and are crucial to interpreting the meaning of individual memes. The current approach of training supervised learning models on static datasets, without taking memetics into account, limits the depth and accuracy of meme interpretation. We argue that meme datasets must contain genuine memes, as defined via memetics, so that effective meme classifiers can be built. In this work, we develop a meme identification protocol which distinguishes meme from non-memetic content by recognising the memetic element within it. We apply our protocol to a random sample of the leading 7 meme classification datasets and observe that more than half (50. 4%) of the evaluated samples were found to contain no signs of memetics. Our work also provides a meme typology grounded in memetics, providing the basis for more effective approaches to the interpretation of memes and the creation of meme datasets."
7ae9651eb67f5908fbe2938826ab969f6b8b5ab2,"{'DBLP': 'conf/icwsm/MallickDE24', 'ArXiv': '2403.19903', 'DOI': '10.48550/arXiv.2403.19903', 'CorpusId': 268793845}",Keeping Up With the Winner! Targeted Advertisement to Communities in Social Networks,International Conference on Web and Social Media,2024,"{'url': '', 'status': None, 'license': None, 'disclaimer': 'Notice: Paper or abstract available at https://arxiv.org/abs/2403.19903, which is subject to the license by the author or copyright owner provided with this content. Please go to the source to verify the license and copyright information for your use.'}","[{'authorId': '2080125439', 'name': 'Shailaja Mallick'}, {'authorId': '1491320266', 'name': 'Vishwaraj Doshi'}, {'authorId': '1715160', 'name': 'Do Young Eun'}]","When a new product enters a market already dominated by an existing product, will it survive along with this dominant product? Most of the existing works have shown the coexistence of two competing products spreading/being adopted on overlaid graphs with same set of users. However, when it comes to the survival of a weaker product on the same graph, it has been established that the stronger one dominates the market and wipes out the other. This paper makes a step towards narrowing this gap so that a new/weaker product can also survive along with its competitor with a positive market share. Specifically, we identify a locally optimal set of users to induce a community that is targeted with advertisement by the product launching company under a given budget constraint. To this end, we model the system as competing Susceptible-Infected-Susceptible (SIS) epidemics and employ perturbation techniques to quantify and attain a positive market share in a cost-efficient manner. Our extensive simulation results with real-world graph dataset show that with our choice of target users, a new product can establish itself with positive market share, which otherwise would be dominated and eventually wiped out of the competitive market under the same budget constraint."
7bf57ef5ff385e2d7066920865b0fbf0ce51ba75,"{'DOI': '10.1609/icwsm.v13i01.22003', 'CorpusId': 278627617}",Statement of Removal,Proceedings of the International AAAI Conference on Web and Social Media,2024,"{'url': 'https://ojs.aaai.org/index.php/ICWSM/article/download/22003/27500', 'status': 'GOLD', 'license': None, 'disclaimer': 'Notice: Paper or abstract available at https://api.unpaywall.org/v2/10.1609/icwsm.v13i01.22003?email=<INSERT_YOUR_EMAIL> or https://doi.org/10.1609/icwsm.v13i01.22003, which is subject to the license by the author or copyright owner provided with this content. Please go to the source to verify the license and copyright information for your use.'}","[{'authorId': '3181655', 'name': 'Matteo Zignani'}, {'authorId': '1946683', 'name': 'C. Quadri'}, {'authorId': '2219804088', 'name': 'Alessia Galdeman'}, {'authorId': '2089200', 'name': 'S. Gaito'}, {'authorId': '120914670', 'name': 'G. P. Rossi'}]","This Statement of Removal refers to:  
Mastodon Content Warnings: Inappropriate Contents in a Microblogging Platform"
7d3c51813ef35fa797a84820d9946517f950a8f3,"{'DBLP': 'conf/icwsm/DoyleGSKVB24', 'DOI': '10.1609/icwsm.v18i1.31319', 'CorpusId': 270175147}",Stories That Heal: Characterizing and Supporting Narrative for Suicide Bereavement,International Conference on Web and Social Media,2024,"{'url': 'https://ojs.aaai.org/index.php/ICWSM/article/download/31319/33479', 'status': 'GOLD', 'license': None, 'disclaimer': 'Notice: Paper or abstract available at https://api.unpaywall.org/v2/10.1609/icwsm.v18i1.31319?email=<INSERT_YOUR_EMAIL> or https://doi.org/10.1609/icwsm.v18i1.31319, which is subject to the license by the author or copyright owner provided with this content. Please go to the source to verify the license and copyright information for your use.'}","[{'authorId': '2137560309', 'name': 'Dylan Thomas Doyle'}, {'authorId': '2304183645', 'name': 'Jay K. Ghosh'}, {'authorId': '2209984833', 'name': 'Reece Suchocki'}, {'authorId': '2286782377', 'name': 'Brian Keegan'}, {'authorId': '2259236389', 'name': 'S. Voida'}, {'authorId': '3299367', 'name': 'Jed R. Brubaker'}]","Clinical group bereavement therapy often promotes narrative sharing as a therapeutic intervention to facilitate grief processing. Increasingly, people turn to social media to express stories of loss and seek support surrounding bereavement experiences, specifically, the loss of loved ones from suicide. This paper reports the results of a computational linguistic analysis of narrative expression within an online suicide bereavement support community. We identify distinctive characteristics of narrative posts (compared to non-narrative posts) in linguistic style. We then develop and validate a machine-learning model for tagging narrative posts at scale and demonstrate the utility of applying this machine-learning model to a more general grief support community. Through comparison, we validate our model's narrative tagging accuracy and compare the proportion of narrative posts between the two communities we have analyzed. Narrative posts make up about half of all total posts in these two grief communities, demonstrating the importance of narrative posts to grief support online. Finally, we consider how the narrative tagging tool presented in this study can be applied to platform design to more effectively support people expressing the narrative sharing of grief in online grief support spaces."
7e15ee3a943f88521d82ab2276acf4d60d502d37,"{'ArXiv': '2407.21592', 'DBLP': 'conf/icwsm/Horne25', 'DOI': '10.48550/arXiv.2407.21592', 'CorpusId': 271571381}",Does the Source of a Warning Matter? Examining the Effectiveness of Veracity Warning Labels Across Warners,International Conference on Web and Social Media,2024,"{'url': '', 'status': None, 'license': None, 'disclaimer': 'Notice: Paper or abstract available at https://arxiv.org/abs/2407.21592, which is subject to the license by the author or copyright owner provided with this content. Please go to the source to verify the license and copyright information for your use.'}","[{'authorId': '2313917318', 'name': 'Benjamin D. Horne'}]","In this study, we conducted an online, between-subjects experiment (N = 2,049) to better understand the impact of warning label sources on information trust and sharing intentions. Across four warners (the social media platform, other social media users, Artificial Intelligence (AI), and fact checkers), we found that all significantly decreased trust in false information relative to control, but warnings from AI were modestly more effective. All warners significantly decreased the sharing intentions of false information, except warnings from other social media users. AI was again the most effective. These results were moderated by prior trust in media and the information itself. Most noteworthy, we found that warning labels from AI were significantly more effective than all other warning labels for participants who reported a low trust in news organizations, while warnings from AI were no more effective than any other warning label for participants who reported a high trust in news organizations."
7f8b6061a20862846f253d0c063d3b16fd333ee1,"{'ArXiv': '2401.08825', 'DBLP': 'journals/corr/abs-2401-08825', 'DOI': '10.48550/arXiv.2401.08825', 'CorpusId': 267028269}",AiGen-FoodReview: A Multimodal Dataset of Machine-Generated Restaurant Reviews and Images on Social Media,International Conference on Web and Social Media,2024,"{'url': '', 'status': None, 'license': None, 'disclaimer': 'Notice: Paper or abstract available at https://arxiv.org/abs/2401.08825, which is subject to the license by the author or copyright owner provided with this content. Please go to the source to verify the license and copyright information for your use.'}","[{'authorId': '40023024', 'name': 'Alessandro Gambetti'}, {'authorId': '2279734145', 'name': 'Qiwei Han'}]","Online reviews in the form of user-generated content (UGC) significantly impact consumer decision-making. However, the pervasive issue of not only human fake content but also machine-generated content challenges UGC's reliability. Recent advances in Large Language Models (LLMs) may pave the way to fabricate indistinguishable fake generated content at a much lower cost. Leveraging OpenAI's GPT-4-Turbo and DALL-E-2 models, we craft AiGen-FoodReview, a multimodal dataset of 20,144 restaurant review-image pairs divided into authentic and machine-generated. We explore unimodal and multimodal detection models, achieving 99.80% multimodal accuracy with FLAVA. We use attributes from readability and photographic theories to score reviews and images, respectively, demonstrating their utility as handcrafted features in scalable and interpretable detection models with comparable performance. This paper contributes by open-sourcing the dataset and releasing fake review detectors, recommending its use in unimodal and multimodal fake review detection tasks, and evaluating linguistic and visual features in synthetic versus authentic data."
800c6028664084c578614dd709159360bbed8a8b,"{'DBLP': 'conf/icwsm/WuR24', 'ArXiv': '2401.09329', 'DOI': '10.48550/arXiv.2401.09329', 'CorpusId': 267027865}",Calibrate-Extrapolate: Rethinking Prevalence Estimation with Black Box Classifiers,International Conference on Web and Social Media,2024,"{'url': '', 'status': None, 'license': None, 'disclaimer': 'Notice: Paper or abstract available at https://arxiv.org/abs/2401.09329, which is subject to the license by the author or copyright owner provided with this content. Please go to the source to verify the license and copyright information for your use.'}","[{'authorId': '2149346715', 'name': 'Siqi Wu'}, {'authorId': '2248265445', 'name': 'Paul Resnick'}]","In computational social science, researchers often use a pre-trained, black box classifier to estimate the frequency of each class in unlabeled datasets. A variety of prevalence estimation techniques have been developed in the literature, each yielding an unbiased estimate if certain stability assumption holds. This work introduces a framework to rethink the prevalence estimation process as calibrating the classifier outputs against ground truth labels to obtain the joint distribution of a base dataset and then extrapolating to the joint distribution of a target dataset. We call this framework ""Calibrate-Extrapolate"". It clarifies what stability assumptions must hold for a prevalence estimation technique to yield accurate estimates. In the calibration phase, the techniques assume only a stable calibration curve between a calibration dataset and the full base dataset. This allows for the classifier outputs to be used for disproportionate random sampling, thus improving the efficiency of calibration. In the extrapolation phase, some techniques assume a stable calibration curve while some assume stable class-conditional densities. We discuss the stability assumptions from a causal perspective. By specifying base and target joint distributions, we can generate simulated datasets, as a way to build intuitions about the impacts of assumption violations. This also leads to a better understanding of how the classifier's predictive power affects the accuracy of prevalence estimates: the greater the predictive power, the lower the sensitivity to violations of stability assumptions in the extrapolation phase. We illustrate the framework with an application that estimates the prevalence of toxic comments on news topics over time on Reddit, Twitter/X, and YouTube, using Jigsaw's Perspective API as a black box classifier. Finally, we summarize several practical advice for prevalence estimation."
820ec3c61b310058052da3812001bedc11a34902,"{'ArXiv': '2401.02191', 'DBLP': 'conf/icwsm/0003SQ24', 'DOI': '10.48550/arXiv.2401.02191', 'CorpusId': 266755892}",Characterizing Fake News Targeting Corporations,International Conference on Web and Social Media,2024,"{'url': '', 'status': None, 'license': None, 'disclaimer': 'Notice: Paper or abstract available at https://arxiv.org/abs/2401.02191, which is subject to the license by the author or copyright owner provided with this content. Please go to the source to verify the license and copyright information for your use.'}","[{'authorId': '2075359401', 'name': 'Ke Zhou'}, {'authorId': '2899841', 'name': 'S. Šćepanović'}, {'authorId': '2260707254', 'name': 'Daniele Quercia'}]","Misinformation proliferates in the online sphere, with evident impacts on the political and social realms, influencing democratic discourse and posing risks to public health and safety. The corporate world is also a prime target for fake news dissemination. While recent studies have attempted to characterize corporate misinformation and its effects on companies, their findings often suffer from limitations due to qualitative or narrative approaches and a narrow focus on specific industries. To address this gap, we conducted an analysis utilizing social media quantitative methods and crowd-sourcing studies to investigate corporate misinformation across a diverse array of industries within the S&P 500 companies. Our study reveals that corporate misinformation encompasses topics such as products, politics, and societal issues. We discovered companies affected by fake news also get reputable news coverage but less social media attention, leading to heightened negativity in social media comments, diminished stock growth, and increased stress mentions among employee reviews. Additionally, we observe that a company is not targeted by fake news all the time, but there are particular times when a critical mass of fake news emerges. These findings hold significant implications for regulators, business leaders, and investors, emphasizing the necessity to vigilantly monitor the escalating phenomenon of corporate misinformation."
85290ec8f436753cf5cdcc4c87d692252b1a14ee,"{'DBLP': 'conf/icwsm/LiebAM24', 'DOI': '10.1609/icwsm.v18i1.31441', 'CorpusId': 270192693}",Online News Coverage of Critical Race Theory Controversies: A Dataset of Annotated Headlines,International Conference on Web and Social Media,2024,"{'url': 'https://ojs.aaai.org/index.php/ICWSM/article/download/31441/33601', 'status': 'GOLD', 'license': None, 'disclaimer': 'Notice: Paper or abstract available at https://api.unpaywall.org/v2/10.1609/icwsm.v18i1.31441?email=<INSERT_YOUR_EMAIL> or https://doi.org/10.1609/icwsm.v18i1.31441, which is subject to the license by the author or copyright owner provided with this content. Please go to the source to verify the license and copyright information for your use.'}","[{'authorId': '2304266024', 'name': 'Anna Lieb'}, {'authorId': '2304265171', 'name': 'Maneesh Arora'}, {'authorId': '2304265082', 'name': 'Eni Mustafaraj'}]","In this paper, we introduce an annotated dataset of 11,704 unique U.S. news headlines related to critical race theory and its controversies from August 2020 through December 2022. Annotations generated by GPT-4 specify the headline stance and the primary actor in the headline. GPT-4 annotations performed well on the validation dataset, with weighted average F-scores of 0.8339 for headline stance annotations and 0.7625 for primary actor annotations. Along with the annotated headlines and URLs to the full article, we augment the dataset with metrics that are relevant to future research on political polarization, news frame analysis, and regional news coverage. The dataset includes partisan audience bias scores by news source domain, tags for mentions of U.S. states in the article body, and exposure and engagement metrics for articles shared on Reddit. Among other preliminary descriptive analyses, we find that the most prevalent headline stance in our headlines dataset is anti-CRT (43.06%), and the most prevalent primary actor in our headlines dataset is political influencers (56.56%). This paper describes the data collection methodology, preliminary descriptive analysis, and possible uses of the dataset for future research in political science, computational social sciences, and natural language processing. Our dataset and replication code is available to access on Zenodo at zenodo.org/doi/10.5281/zenodo.10516190"
860cdab037e1a4d320f3d08f98487a27b84774e4,"{'DBLP': 'conf/icwsm/KqikuR24', 'DOI': '10.1609/icwsm.v18i1.31357', 'CorpusId': 270181889}",SensitivAlert: Image Sensitivity Prediction in Online Social Networks Using Transformer-Based Deep Learning Models,International Conference on Web and Social Media,2024,"{'url': 'https://ojs.aaai.org/index.php/ICWSM/article/download/31357/33517', 'status': 'GOLD', 'license': 'public-domain', 'disclaimer': 'Notice: Paper or abstract available at https://api.unpaywall.org/v2/10.1609/icwsm.v18i1.31357?email=<INSERT_YOUR_EMAIL> or https://doi.org/10.1609/icwsm.v18i1.31357, which is subject to the license by the author or copyright owner provided with this content. Please go to the source to verify the license and copyright information for your use.'}","[{'authorId': '2155034921', 'name': 'Lindrit Kqiku'}, {'authorId': '2273474089', 'name': 'Delphine Reinhardt'}]","Billions images are shared daily on social networks.
When shared with an inappropriate audience, user-generated images can, however, compromise users' privacy and may have severe consequences, such as dismissals. To address this issue, different solutions were proposed, ranging from graphical user interfaces to Deep Learning (DL) models to alert users based on image sensitivity prediction. Although these models show promising results, they are evaluated on datasets relying on small participants' samples. 
To address this limitation, we first introduce SensitivAlert, a dataset that re-annotates the previously annotated images from two existing datasets, but using a German-speaking cohort of 907 participants.
We then leverage it to classify images according to two sensitivity classes---private or public---using recent transformer-based DL models. 
In our evaluation, we first consider consensus-based generic models using our dataset as benchmark based on image content itself and its associated user tags. Moreover, we show that our fine-tuned models trained on our dataset better reflect users' image privacy conceptions.
We finally focus on individual user's privacy estimation by investigating three approaches: (1) a generic approach based on participants' consensus for fine-tuning, (2) a user-wise approach based on user's privacy preferences only, and (3) a hybrid approach that combines individual preferences with consensus-based preferences. Our results finally show that the generic and hybrid approaches outperform the user-wise one for most users, thus ensuring the feasibility of image privacy prediction preferences at the individuals' level."
