paperId,externalIds,title,venue,year,openAccessPdf,authors,abstract
00e488c1eb3b35c7197c5f9360dda8414df704f8,"{'DBLP': 'conf/icwsm/ChoyLGK14', 'MAG': '2134677057', 'DOI': '10.1609/icwsm.v8i1.14534', 'CorpusId': 9271857}",Glaucus: Exploiting the Wisdom of Crowds for Location-Based Queries in Mobile Environments,International Conference on Web and Social Media,2014,"{'url': 'https://ojs.aaai.org/index.php/ICWSM/article/download/14534/14383', 'status': 'GOLD', 'license': None, 'disclaimer': 'Notice: Paper or abstract available at https://api.unpaywall.org/v2/10.1609/icwsm.v8i1.14534?email=<INSERT_YOUR_EMAIL> or https://doi.org/10.1609/icwsm.v8i1.14534, which is subject to the license by the author or copyright owner provided with this content. Please go to the source to verify the license and copyright information for your use.'}","[{'authorId': '39962082', 'name': 'M. Choy'}, {'authorId': '2108630569', 'name': 'Jae-Gil Lee'}, {'authorId': '2042342', 'name': 'G. Gweon'}, {'authorId': '2144078391', 'name': 'Daehoon Kim'}]","
 
 In this paper, we build a social search engine named Glaucus for location-based queries. They compose a significant portion of mobile searches, thus becoming more popular with the prevalence of mobile devices. However, most of existing social search engines are not designed for location-based queries and thus often produce poor-quality results for such queries. Glaucus is inherently designed to support location-based queries. It collects the check-in information, which pinpoints the places where each user visited, from location-based social networking services such as Foursquare. Then, it calculates the expertise of each user for a query by using our new probabilistic model called the location aspect model. We conducted two types of evaluation to prove the effectiveness of our engine. The results showed that Glaucus selected the users supported by stronger evidence for the required expertise than existing social search engines. In addition, the answers from the experts selected by Glaucus were highly rated by our human judges in terms of answer satisfaction.
 
"
01062d07181b9a42e95cdb8d76fd935bf23c8dd9,"{'DBLP': 'conf/icwsm/KootiHL14', 'MAG': '2951956792', 'ArXiv': '1403.7242', 'DOI': '10.1609/icwsm.v8i1.14543', 'CorpusId': 9840185}",Network Weirdness: Exploring the Origins of Network Paradoxes,International Conference on Web and Social Media,2014,"{'url': 'https://ojs.aaai.org/index.php/ICWSM/article/download/14543/14392', 'status': 'GOLD', 'license': None, 'disclaimer': 'Notice: Paper or abstract available at https://arxiv.org/abs/1403.7242, which is subject to the license by the author or copyright owner provided with this content. Please go to the source to verify the license and copyright information for your use.'}","[{'authorId': '1797355', 'name': 'F. Kooti'}, {'authorId': '1811944', 'name': 'Nathan Oken Hodas'}, {'authorId': '1782658', 'name': 'Kristina Lerman'}]","
 
 Social networks have many counter-intuitive properties, including the ""friendship paradox"" that states, on average, your friends have more friends than you do. Recently, a variety of other paradoxes were demonstrated in online social networks. This paper explores the origins of these network paradoxes. Specifically, we ask whether they arise from mathematical properties of the networks or whether they have a behavioral origin. We show that sampling from heavy-tailed distributions always gives rise to a paradox in the mean, but not the median. We propose a strong form of network paradoxes, based on utilizing the median, and validate it empirically using data from two online social networks. Specifically, we show that for any user the majority of user’s friends and followers have more friends, followers, etc. than the user, and that this cannot be explained by statistical properties of sampling. Next, we explore the behavioral origins of the paradoxes by using the shuffle test to remove correlations between node degrees and attributes. We find that paradoxes for the mean persist in the shuffled network, but not for the median. We demonstrate that strong paradoxes arise due to the assortativity of user attributes, including degree, and correlation between degree and attribute. 
 
"
01f98bebc4232b0c470d139f979f541c5f5a9968,"{'MAG': '1768510677', 'DBLP': 'conf/icwsm/SchmidtFB14', 'DOI': '10.1609/icwsm.v8i1.14568', 'CorpusId': 15176660}",Topical Engagement on Twitter: Using Consistency of Activity as a Means of User Segmentation,International Conference on Web and Social Media,2014,"{'url': 'https://ojs.aaai.org/index.php/ICWSM/article/download/14568/14417', 'status': 'GOLD', 'license': None, 'disclaimer': 'Notice: Paper or abstract available at https://api.unpaywall.org/v2/10.1609/icwsm.v8i1.14568?email=<INSERT_YOUR_EMAIL> or https://doi.org/10.1609/icwsm.v8i1.14568, which is subject to the license by the author or copyright owner provided with this content. Please go to the source to verify the license and copyright information for your use.'}","[{'authorId': '2997019', 'name': 'Aurora C. Schmidt'}, {'authorId': '145523489', 'name': 'Clayton Fink'}, {'authorId': '145301662', 'name': 'Nathan D. Bos'}]","
 
 In this paper we introduce a measure for the consistency of Twitter user behavior as a way of measuring engagement with a topic. Using this measure of topical engagement, we filter tweets collected from over 90,000 Nigerian users over a three-year period concerning that country’s head of state, President Goodluck Jonathan. We show that this measure effectively identifies a small set of highly engaged users that produce a disproportionate amount of activity, both in tweet volume and mentions of other users. Additionally, we show preferential within-group activity, with these users disproportionately mentioning other highly engaged users. Lastly, we show the potential of using changes in the percentage of engaged users within the overall user set for gauging the significance of events that occurred in Nigeria over the 2011 to early 2013 period.
 
"
0227770ef95b03ef5c1fe1d5756ed6bf903d8bd3,"{'DBLP': 'conf/icwsm/MagdyE14', 'MAG': '2263984121', 'DOI': '10.1609/icwsm.v8i1.14540', 'CorpusId': 5986867}",Adaptive Method for Following Dynamic Topics on Twitter,International Conference on Web and Social Media,2014,"{'url': 'https://ojs.aaai.org/index.php/ICWSM/article/download/14540/14389', 'status': 'GOLD', 'license': None, 'disclaimer': 'Notice: Paper or abstract available at https://api.unpaywall.org/v2/10.1609/icwsm.v8i1.14540?email=<INSERT_YOUR_EMAIL> or https://doi.org/10.1609/icwsm.v8i1.14540, which is subject to the license by the author or copyright owner provided with this content. Please go to the source to verify the license and copyright information for your use.'}","[{'authorId': '1745226', 'name': 'Walid Magdy'}, {'authorId': '143928505', 'name': 'Tamer Elsayed'}]","
 
 Many research social studies of public response on social media require following (i.e., tracking) topics on Twitter for long periods of time. The current approaches rely on streaming tweets based on some hashtags or keywords, or following some Twitter accounts. Such approaches lead to limited coverage of on-topic tweets. In this paper, we introduce a novel technique for following such topics in a more effective way. A topic is defined as a set of well-prepared queries that cover the static side of the topic. We propose an automatic approach that adapts to emerging aspects of a tracked broad topic over time. We tested our tracking approach on three broad dynamic topics that are hot in different categories: Egyptian politics, Syrian conflict, and international sports. We measured the effectiveness of our approach over four full days spanning a period of four months to ensure consistency in effectiveness. Experimental results showed that, on average, our approach achieved over 100% increase in recall relative to the baseline Boolean approach, while maintaining an acceptable precision of 83%.
 
"
027506b146ee349149c45ebf43b58786203b16df,"{'MAG': '2175066711', 'DBLP': 'conf/icwsm/SolomonW14', 'DOI': '10.1609/icwsm.v8i1.14546', 'CorpusId': 6450529}",Critical Mass of What? Exploring Community Growth in WikiProjects,International Conference on Web and Social Media,2014,"{'url': 'https://ojs.aaai.org/index.php/ICWSM/article/download/14546/14395', 'status': 'GOLD', 'license': None, 'disclaimer': 'Notice: Paper or abstract available at https://api.unpaywall.org/v2/10.1609/icwsm.v8i1.14546?email=<INSERT_YOUR_EMAIL> or https://doi.org/10.1609/icwsm.v8i1.14546, which is subject to the license by the author or copyright owner provided with this content. Please go to the source to verify the license and copyright information for your use.'}","[{'authorId': '49583721', 'name': 'Jacob Solomon'}, {'authorId': '2927440', 'name': 'Rick Wash'}]","
 
 Fledgling online communities often hope to achieve critical mass so that the community becomes sustainable. This concept however is not well understood. At what point does a community achieve critical mass, and how does the community know this? Furthermore, online communities become sustainable when they achieve a mass of what? We explore this question by analyzing growth in a large number of online communities on Wikipedia. We find that individual communities often have different patterns of growth of membership from its pattern of growth of contribution or production. We also find that in the early stages of community development, building membership has a greater impact on community production and activity in later periods than accumulating many contributions early on, and this is especially true when there is more diversity in the early participants in a community. We also show that participation from a community's ""power users"" in its early stage is not as valuable to sustainability as the collective contributions of those who make only small contributions. We argue that critical mass is established by developing a diverse set of community members with heterogeneous interests and resources, and not purely by accumulating content.
 
"
03662804d908f06f8da48476575ee81325c184d7,"{'DBLP': 'conf/icwsm/MeierEW14', 'MAG': '2181871624', 'DOI': '10.1609/icwsm.v8i1.14541', 'CorpusId': 11346647}",More than Liking and Bookmarking? Towards Understanding Twitter Favouriting Behaviour,International Conference on Web and Social Media,2014,"{'url': 'https://ojs.aaai.org/index.php/ICWSM/article/download/14541/14390', 'status': 'GOLD', 'license': None, 'disclaimer': 'Notice: Paper or abstract available at https://api.unpaywall.org/v2/10.1609/icwsm.v8i1.14541?email=<INSERT_YOUR_EMAIL> or https://doi.org/10.1609/icwsm.v8i1.14541, which is subject to the license by the author or copyright owner provided with this content. Please go to the source to verify the license and copyright information for your use.'}","[{'authorId': '2061746922', 'name': 'F. Meier'}, {'authorId': '1735704', 'name': 'David Elsweiler'}, {'authorId': '8530169', 'name': 'Max L. Wilson'}]","
 
 Microblogging services, such as Twitter, offer a variety of interactive features that allow users to engage with contacts in their social network and the content they produce. One such feature is the favourite button on Twitter, an icon in the form of a star that users can click on to assign a special status to a particular tweet. Despite evidence suggesting that users increasingly make use of favouriting, little is known about the reasons people have for favouriting or the utility the feature offers. This contrasts with other core features, such as “following” and “retweeting”, which have been studied extensively. In this paper we argue that by investigating the motivations for favouriting tweets we can enhance our understanding of what people want to achieve with Twitter and the types of content users find interesting or useful. With these goals in mind we conducted a large-scale survey (n=606), questioning Twitter users on various aspects of their favouriting behaviour. Of these users only 395 were aware of the function and 290 make use of the functionality. The survey responses from these users demonstrate that motives for favouriting tweets are extremely heterogeneous and not always consistent within and between users. Moreover, our findings reveal that user needs when favouriting such as the need for re-finding a tweet or the wish for a more private conversation are often poorly supported and sometimes even go unmet by the Twitter user interface.
 
"
044a732d091be7d29a2c924d1f4878c714146a7c,"{'DBLP': 'conf/icwsm/WengL14', 'MAG': '2258143483', 'DOI': '10.1609/icwsm.v8i1.14577', 'CorpusId': 1705553}",Topic-Based Clusters in Egocentric Networks on Facebook,International Conference on Web and Social Media,2014,"{'url': 'https://ojs.aaai.org/index.php/ICWSM/article/download/14577/14426', 'status': 'GOLD', 'license': None, 'disclaimer': 'Notice: Paper or abstract available at https://api.unpaywall.org/v2/10.1609/icwsm.v8i1.14577?email=<INSERT_YOUR_EMAIL> or https://doi.org/10.1609/icwsm.v8i1.14577, which is subject to the license by the author or copyright owner provided with this content. Please go to the source to verify the license and copyright information for your use.'}","[{'authorId': '2617057', 'name': 'L. Weng'}, {'authorId': '2148602', 'name': 'Thomas M. Lento'}]","
 
 Homophily suggests that people tend to befriend others with shared traits, such as similar topical interests or overlapping social circles. We study how people communicate online in term of conversation topics from an egocentric viewpoint using a dataset from Facebook. We find that friends who favor similar topics form topic-based clusters; these clusters have dense connectivities, large growth rates, and little overlap.
 
"
0f3d930caaf5fc75e1861736900f346b287eef54,"{'MAG': '1945308718', 'DBLP': 'conf/icwsm/MahmudG14', 'ArXiv': '1403.6067', 'DOI': '10.1609/icwsm.v8i1.14561', 'CorpusId': 1664608}",Why Do You Spread This Message? Understanding Users Sentiment in Social Media Campaigns,International Conference on Web and Social Media,2014,"{'url': 'https://ojs.aaai.org/index.php/ICWSM/article/download/14561/14410', 'status': 'GOLD', 'license': None, 'disclaimer': 'Notice: Paper or abstract available at https://arxiv.org/abs/1403.6067, which is subject to the license by the author or copyright owner provided with this content. Please go to the source to verify the license and copyright information for your use.'}","[{'authorId': '145359935', 'name': 'J. Mahmud'}, {'authorId': '1722362', 'name': 'Huiji Gao'}]","
 
 Twitter has been increasingly used for spreading messages about campaigns. Such campaigns try to gain followers through their Twitter accounts, influence the followers and spread messages through them. In this paper, we explore the relationship between followers’ sentiment towards the cam-paign topic and their rate of retweeting of messages gener-ated by the campaign. Our analysis with followers of mul-tiple social-media campaigns found statistical significant correlations between such sentiment and retweeting rate. Based on our analysis, we have conducted an online inter-vention study among the followers of different social-media campaigns. Our study shows that targeting followers based on their sentiment towards the campaign can give higher re-tweet rate than a number of other baseline approaches.
 
"
18feed47d69894a3555ee2c5710bbee94f5fea2d,"{'DBLP': 'conf/icwsm/Luczak-RoschTSKSS14', 'MAG': '50843133', 'DOI': '10.1609/icwsm.v8i1.14539', 'CorpusId': 106297}",Why Won't Aliens Talk to Us? Content and Community Dynamics in Online Citizen Science,International Conference on Web and Social Media,2014,"{'url': 'https://ojs.aaai.org/index.php/ICWSM/article/download/14539/14388', 'status': 'GOLD', 'license': None, 'disclaimer': 'Notice: Paper or abstract available at https://api.unpaywall.org/v2/10.1609/icwsm.v8i1.14539?email=<INSERT_YOUR_EMAIL> or https://doi.org/10.1609/icwsm.v8i1.14539, which is subject to the license by the author or copyright owner provided with this content. Please go to the source to verify the license and copyright information for your use.'}","[{'authorId': '1403045617', 'name': 'Markus Luczak-Rösch'}, {'authorId': '2050678', 'name': 'Ramine Tinati'}, {'authorId': '2927032', 'name': 'E. Simperl'}, {'authorId': '2341082', 'name': 'M. V. Kleek'}, {'authorId': '1705314', 'name': 'N. Shadbolt'}, {'authorId': '2054294810', 'name': 'R. J. Simpson'}]","
 
 We conducted a quantitative analysis of ten citizen science projects hosted on the Zooniverse platform, using a data set of over 50 million activity records and more than 250,000 users, collected between December 2010 and July 2013. We examined the level of participation of users in Zooniverse discussion forums in relation to their contributions toward the completion of scientific (micro-)tasks. As Zooniverse is home to a multitude of projects, we were also interested in the emergence of cross-projects effects, and identified those project characteristics, most importantly the subject domain and the duration of a project. We also looked into the adoption of expert terminology, showing that this phenomenon is dependent on the scientific domain which a project addresses but also affected by how the communication features are actually used by a community. This is the first study of this kind in this increasingly important class of online community, and its insights will inform the design and further development of the Zooniverse platform, and of citizen science systems as a whole.
 
"
1db98c71324efa517cd0107d08e81195d4419629,"{'MAG': '2274752596', 'DBLP': 'conf/icwsm/HechtS14', 'DOI': '10.1609/icwsm.v8i1.14554', 'CorpusId': 15385148}",A Tale of Cities: Urban Biases in Volunteered Geographic Information,International Conference on Web and Social Media,2014,"{'url': 'https://ojs.aaai.org/index.php/ICWSM/article/download/14554/14403', 'status': 'GOLD', 'license': None, 'disclaimer': 'Notice: Paper or abstract available at https://api.unpaywall.org/v2/10.1609/icwsm.v8i1.14554?email=<INSERT_YOUR_EMAIL> or https://doi.org/10.1609/icwsm.v8i1.14554, which is subject to the license by the author or copyright owner provided with this content. Please go to the source to verify the license and copyright information for your use.'}","[{'authorId': '32980371', 'name': 'Brent J. Hecht'}, {'authorId': '32206142', 'name': 'Monica Stephens'}]","
 
 Geotagged tweets, Foursquare check-ins and other forms of volunteered geographic information (VGI) play a critical role in numerous studies and a large range of intelligent technologies. We show that three of the most commonly used sources of VGI – Twitter, Flickr, and Foursquare – are biased towards urban perspectives at the expense of rural ones. Utilizing a geostatistics-based approach, we demonstrate that, on a per capita basis, these important VGI datasets have more users, more information, and higher quality information within metropolitan areas than outside of them. VGI is a subset of user-generated content (UGC) and we discuss how our results suggest that urban biases might exist in non-geographically referenced UGC as well. Finally, because Foursquare is exclusively made up of VGI, we argue that Foursquare (and possibly other location-based social networks) has fundamentally failed to appeal to rural populations.
 
"
1e3d1055fc65966bc2c64505785207d7e8d71022,"{'DBLP': 'conf/icwsm/FriggeriAEC14', 'DOI': '10.1609/icwsm.v8i1.14559', 'CorpusId': 11369897}",Rumor Cascades,International Conference on Web and Social Media,2014,"{'url': 'https://ojs.aaai.org/index.php/ICWSM/article/download/14559/14408', 'status': 'GOLD', 'license': None, 'disclaimer': 'Notice: Paper or abstract available at https://api.unpaywall.org/v2/10.1609/icwsm.v8i1.14559?email=<INSERT_YOUR_EMAIL> or https://doi.org/10.1609/icwsm.v8i1.14559, which is subject to the license by the author or copyright owner provided with this content. Please go to the source to verify the license and copyright information for your use.'}","[{'authorId': '34760887', 'name': 'Adrien Friggeri'}, {'authorId': '1778398', 'name': 'Lada A. Adamic'}, {'authorId': '1996878', 'name': 'Dean Eckles'}, {'authorId': '144500753', 'name': 'Justin Cheng'}]","
 
 Online social networks provide a rich substrate for rumor propagation. Information received via friends tends to be trusted, and online social networks allow individuals to transmit information to many friends at once. By referencing known rumors from Snopes.com, a popular website documenting memes and urban legends, we track the propagation of thousands of rumors appearing on Facebook. From this sample we infer the rates at which rumors from different categories and of varying truth value are uploaded and reshared. We find that rumor cascades run deeper in the social network than reshare cascades in general. We then examine the effect of individual reshares receiving a comment containing a link to a Snopes article on the evolution of the cascade. We find that receiving such a comment increases the likelihood that a reshare of a rumor will be deleted. Furthermore, large cascades are able to accumulate hundreds of Snopes comments while continuing to propagate. Finally, using a dataset of rumors copied and pasted from one status update to another, we show that rumors change over time and that different variants tend to dominate different bursts in popularity.
 
"
204aee5a95e231378c2016c2ea6462d8a405b0f8,"{'DBLP': 'conf/icwsm/GuptaVJKK14', 'DOI': '10.1609/icwsm.v8i1.14505', 'CorpusId': 14076523}",Identifying Purchase Intent from Social Posts,International Conference on Web and Social Media,2014,"{'url': 'https://ojs.aaai.org/index.php/ICWSM/article/download/14505/14354', 'status': 'GOLD', 'license': None, 'disclaimer': 'Notice: Paper or abstract available at https://api.unpaywall.org/v2/10.1609/icwsm.v8i1.14505?email=<INSERT_YOUR_EMAIL> or https://doi.org/10.1609/icwsm.v8i1.14505, which is subject to the license by the author or copyright owner provided with this content. Please go to the source to verify the license and copyright information for your use.'}","[{'authorId': '2110652431', 'name': 'Vineet Gupta'}, {'authorId': '40566637', 'name': 'Devesh Varshney'}, {'authorId': '2006291', 'name': 'Harsh Jhamtani'}, {'authorId': '2353831854', 'name': 'D. Kedia'}, {'authorId': '1979956', 'name': 'Shweta Karwa'}]","
 
 In present times, social forums such as Quora and Yahoo! Answers constitute powerful media through which people discuss on a variety of topics and express their intentions and thoughts. Here they often reveal their potential intent to purchase - 'Purchase Intent' (PI). A purchase intent is defined as a text expression showing a desire to purchase a product or a service in future. Extracting posts having PI from a user's social posts gives huge opportunities towards web personalization, targeted marketing and improving community observing systems. In this paper, we explore the novel problem of detecting PIs from social posts and classifying them. We find that using linguistic features along with statistical features of PI expressions achieves a significant improvement in PI classification over 'bag-of-words' based features used in many present day social-media classification tasks. Our approach takes into consideration the specifics of social posts like limited contextual information, incorrect grammar, language ambiguities, etc. by extracting features at two different levels of text granularity - word and phrase based features and grammatical dependency based features. Apart from these, the patterns observed in PI posts help us to identify some specific features.
 
"
