paperId,externalIds,title,venue,year,openAccessPdf,authors,abstract
551558995669a43113c85b638a89adb5775cc2ce,"{'DBLP': 'conf/icwsm/Akoglu14', 'MAG': '2160450239', 'DOI': '10.1609/icwsm.v8i1.14524', 'CorpusId': 11166004}",Quantifying Political Polarity Based on Bipartite Opinion Networks,International Conference on Web and Social Media,2014,"{'url': 'https://ojs.aaai.org/index.php/ICWSM/article/download/14524/14373', 'status': 'GOLD', 'license': None, 'disclaimer': 'Notice: Paper or abstract available at https://api.unpaywall.org/v2/10.1609/icwsm.v8i1.14524?email=<INSERT_YOUR_EMAIL> or https://doi.org/10.1609/icwsm.v8i1.14524, which is subject to the license by the author or copyright owner provided with this content. Please go to the source to verify the license and copyright information for your use.'}","[{'authorId': '3255268', 'name': 'L. Akoglu'}]","
 
 Political inclinations of individuals (liberal vs. conservative) largely shape their opinions on several issues such as abortion, gun control, nuclear power, etc. These opinions are openly exerted inonline forums, news sites, the parliament, and so on. In this paper, we address the problem of quantifying political polarity of individuals and of political issues for classification and ranking. We use signed bipartite networks to represent the opinions of individuals on issues, and formulate the problem as a node classification task. We propose a linear algorithm that exploits network effects to learn both the polarity labels as well as the rankings of people and issues in a completely unsupervised manner. Through extensive experiments we demonstrate that our proposed method provides an effective, fast, and easy-to-implement solution, while outperforming three existing baseline algorithms adapted to signed networks, on real political forum and US Congress datasets.Experiments on a wide variety of synthetic graphs with varying polarity and degree distributions of the nodes further demonstrate the robustness of our approach.
 
"
55f509cb1ebc7c803295134788300949c9519a50,"{'DBLP': 'conf/icwsm/WengMA14', 'ArXiv': '1403.6199', 'MAG': '2964320510', 'DOI': '10.1609/icwsm.v8i1.14530', 'CorpusId': 16142777}",Predicting Successful Memes Using Network and Community Structure,International Conference on Web and Social Media,2014,"{'url': 'https://ojs.aaai.org/index.php/ICWSM/article/download/14530/14379', 'status': 'GOLD', 'license': None, 'disclaimer': 'Notice: Paper or abstract available at https://arxiv.org/abs/1403.6199, which is subject to the license by the author or copyright owner provided with this content. Please go to the source to verify the license and copyright information for your use.'}","[{'authorId': '2617057', 'name': 'L. Weng'}, {'authorId': '143653472', 'name': 'F. Menczer'}, {'authorId': '36663090', 'name': 'Yong-Yeol Ahn'}]","
 
 We investigate the predictability of successful memes using their early spreading patterns in the underlying social networks. We propose and analyze a comprehensive set of features and develop an accurate model to predict future popularity of a meme given its early spreading patterns. Our paper provides the first comprehensive comparison of existing predictive frameworks. We categorize our features into three groups: influence of early adopters, community concentration, and characteristics of adoption time series. We find that features based on community structure are the most powerful predictors of future success. We also find that early popularity of a meme is not a good predictor of its future popularity, contrary to common belief. Our methods outperform other approaches, particularly in the task of detecting very popular or unpopular memes.
 
"
56bb1818f9c29e3cc5511c3d5bfc8e45d6b870b5,"{'DBLP': 'conf/icwsm/WeberG14', 'MAG': '234257683', 'DOI': '10.1609/icwsm.v8i1.14497', 'CorpusId': 18788838}",Using Co-Following for Personalized Out-of-Context Twitter Friend Recommendation,International Conference on Web and Social Media,2014,"{'url': 'https://ojs.aaai.org/index.php/ICWSM/article/download/14497/14346', 'status': 'GOLD', 'license': None, 'disclaimer': 'Notice: Paper or abstract available at https://api.unpaywall.org/v2/10.1609/icwsm.v8i1.14497?email=<INSERT_YOUR_EMAIL> or https://doi.org/10.1609/icwsm.v8i1.14497, which is subject to the license by the author or copyright owner provided with this content. Please go to the source to verify the license and copyright information for your use.'}","[{'authorId': '1684687', 'name': 'Ingmar Weber'}, {'authorId': '1699369', 'name': 'Venkata Rama Kiran Garimella'}]","
 
 We present two demos that give personalized `""out-of-context"" recommendations of Twitter users to follow. By out-of-context we mean that a user wants to receive recommendation on, say, musicians to follow even though the user's tweets' contents and social links have no connection to the ""context"" of music. In this setting, where a user has never expressed interest in the context of music, many existing methods fail. Our approach exploits co-following information and hidden correlations where, say, a user's political preference might actually provide clues about their likely music preference. We implement this framework in two very distinct settings: one for recommending musicians and one for recommending political parties in Tunisia. Our framework is simple and similar to Amazon's ""users who bought X also bought Y"" and can be used not only for explainable out-of-context recommendations but also for social studies on, say, which music is ""closest"" to users of a particular political affiliation. It also helps to introduce and to ""link"" a user to an unknown domain, say, politics in Tunisia.
 
"
58c29d022f6c7547777e89b1de2b7bee6e92a936,"{'MAG': '2952686826', 'DBLP': 'journals/corr/LimaRM14', 'ArXiv': '1407.2535', 'DOI': '10.1609/icwsm.v8i1.14552', 'CorpusId': 13817139}",Coding Together at Scale: GitHub as a Collaborative Social Network,International Conference on Web and Social Media,2014,"{'url': 'https://ojs.aaai.org/index.php/ICWSM/article/download/14552/14401', 'status': 'GOLD', 'license': None, 'disclaimer': 'Notice: Paper or abstract available at https://arxiv.org/abs/1407.2535, which is subject to the license by the author or copyright owner provided with this content. Please go to the source to verify the license and copyright information for your use.'}","[{'authorId': '145328119', 'name': 'A. Lima'}, {'authorId': '145187738', 'name': 'L. Rossi'}, {'authorId': '1806767', 'name': 'Mirco Musolesi'}]","
 
 GitHub is the most popular repository for open source code. It has more than 3.5 million users, as the company declared in April 2013, and more than 10 million repositories, as of December 2013. It has a publicly accessible API and, since March 2012, it also publishes a stream of all the events occurring on public projects. Interactions among GitHub users are of a complex nature and take place in different forms. Developers create and fork repositories, push code, approve code pushed by others, bookmark their favorite projects and follow other developers to keep track of their activities.In this paper we present a characterization of GitHub, as both a social network and a collaborative platform. To the best of our knowledge, this is the first quantitative study about the interactions happening on GitHub. We analyze the logs from the service over 18 months (between March 11, 2012 and September 11, 2013), describing 183.54 million events and we obtain information about 2.19 million users and 5.68 million repositories, both growing linearly in time. We show that the distributions of the number of contributors per project, watchers per project and followers per user show a power-law-like shape. We analyze social ties and repository-mediated collaboration patterns, and we observe a remarkably low level of reciprocity of the social connections. We also measure the activity of each user in terms of authored events and we observe that very active users do not necessarily have a large number of followers. Finally, we provide a geographic characterization of the centers of activity and we investigate how distance influences collaboration.
 
"
5e1834357870f3b5bedcbd1e862a0d62165d0bda,"{'MAG': '2277095315', 'DBLP': 'conf/icwsm/TchokniSQ14', 'DOI': '10.1609/icwsm.v8i1.14545', 'CorpusId': 14771639}",Emoticons and Phrases: Status Symbols in Social Media,International Conference on Web and Social Media,2014,"{'url': 'https://ojs.aaai.org/index.php/ICWSM/article/download/14545/14394', 'status': 'GOLD', 'license': None, 'disclaimer': 'Notice: Paper or abstract available at https://api.unpaywall.org/v2/10.1609/icwsm.v8i1.14545?email=<INSERT_YOUR_EMAIL> or https://doi.org/10.1609/icwsm.v8i1.14545, which is subject to the license by the author or copyright owner provided with this content. Please go to the source to verify the license and copyright information for your use.'}","[{'authorId': '2235835', 'name': 'Simo Editha Tchokni'}, {'authorId': '8311581', 'name': 'Diarmuid Ó Séaghdha'}, {'authorId': '144041798', 'name': 'D. Quercia'}]","
 
 There is a sociolinguistic interest in studying the socialpower dynamics that arise on online social networksand how these are reflected in their users’ use of lan-guage. Online social power prediction can also be usedto build tools for marketing and political campaigns thathelp them build an audience. Existing work has focusedon finding correlations between status and linguistic fea-tures in email, Wikipedia discussions, and court hearings.While a few studies have tried predicting status on thebasis of language on Twitter, they have proved less fruit-ful. We derive a rich set of features from literature ina variety of disciplines and build classifiers that assignTwitter users to different levels of status based on theirlanguage use. Using various metrics such as number offollowers and Klout score, we achieve a classification ac-curacy of individual users as high as 82.4%. In a secondstep, we reached up to 71.6% accuracy on the task of pre-dicting the more powerful user in a dyadic conversation.We find that the manner in which powerful users writediffers from low status users in a number of differentways: not only in the extent to which they deviate fromtheir usual writing habits when conversing with othersbut also in pronoun use, language complexity, sentimentexpression, and emoticon use. By extending our analysisto Facebook, we also assess the generalisability of ourresults and discuss differences and similarities betweenthese two sites.
 
"
6053788472fc36ecce57e2a72e3d84987765fa81,"{'ArXiv': '1405.3282', 'DBLP': 'journals/corr/AlthoffDJ14', 'MAG': '1568554595', 'DOI': '10.1609/icwsm.v8i1.14547', 'CorpusId': 8809599}",How to Ask for a Favor: A Case Study on the Success of Altruistic Requests,International Conference on Web and Social Media,2014,"{'url': 'https://ojs.aaai.org/index.php/ICWSM/article/download/14547/14396', 'status': 'GOLD', 'license': None, 'disclaimer': 'Notice: Paper or abstract available at https://arxiv.org/abs/1405.3282, which is subject to the license by the author or copyright owner provided with this content. Please go to the source to verify the license and copyright information for your use.'}","[{'authorId': '1745524', 'name': 'Tim Althoff'}, {'authorId': '1388368997', 'name': 'Cristian Danescu-Niculescu-Mizil'}, {'authorId': '1746807', 'name': 'Dan Jurafsky'}]","
 
 Requests are at the core of many social media systems such as question & answer sites and online philanthropy communities. While the success of such requests is critical to the success of the community, the factors that lead community members to satisfy a request are largely unknown. Success of a request depends on factors like who is asking, how they are asking, when are they asking, and most critically what is being requested, ranging from small favors to substantial monetary donations. We present a case study of altruistic requests in an online community where all requests ask for the very same contribution and do not offer anything tangible in return, allowing us to disentangle what is requested from textual and social factors. Drawing from social psychology literature, we extract high-level social features from text that operationalize social relations between recipient and donor and demonstrate that these extracted relations are predictive of success. More speciﬁcally, we ﬁnd that clearly communicating need through the narrative is essential and that linguistic indications of gratitude, evidentiality, and generalized reciprocity, as well as high status of the asker further increase the likelihood of success. Building on this understanding, we develop a model that can predict the success of unseen requests, signiﬁcantly improving over several baselines. We link these ﬁndings to research in psychology on helping behavior, providing a basis for further analysis of success in social media systems.
 
"
6a399bb44f77c0ec2e1f0711d54b49e968ecd448,"{'ArXiv': '1403.8034', 'DBLP': 'conf/icwsm/HristovaMM14', 'MAG': '1780950168', 'DOI': '10.1609/icwsm.v8i1.14544', 'CorpusId': 10781253}",Keep Your Friends Close and Your Facebook Friends Closer: A Multiplex Network Approach to the Analysis of Offline and Online Social Ties,International Conference on Web and Social Media,2014,"{'url': 'https://ojs.aaai.org/index.php/ICWSM/article/download/14544/14393', 'status': 'GOLD', 'license': 'other-oa', 'disclaimer': 'Notice: Paper or abstract available at https://arxiv.org/abs/1403.8034, which is subject to the license by the author or copyright owner provided with this content. Please go to the source to verify the license and copyright information for your use.'}","[{'authorId': '3293575', 'name': 'Desislava Hristova'}, {'authorId': '1806767', 'name': 'Mirco Musolesi'}, {'authorId': '1733840', 'name': 'C. Mascolo'}]","
 
 Social media allow for an unprecedented amount of interaction between people online. A fundamental aspect of human social behavior, however, is the tendency of people to associate themselves with like-minded individuals, forming homogeneous social circles both online and offline. In this work, we apply a new model that allows us to distinguish between social ties of varying strength, and to observe evidence of homophily with regards to politics, music, health, residential sector and year in college, within the online and offline social network of 74 college students. We present a multiplex network approach to social tie strength, here applied to mobile communication data — calls, text messages, and co-location, allowing us to dimensionally identify relationships by considering the number of communication channels utilized between students. We find that strong social ties are characterized by maximal use of communication channels, while weak ties by minimal use. We are able to identify 75% of close friendships, 90% of weaker ties, and 90% of Facebook friendships as compared to reported ground truth. We then show that stronger ties exhibit greater profile similarity than weaker ones. Apart from high homogeneity in social circles with respect to political and health aspects, we observe strong homophily driven by music, residential sector and year in college. Despite Facebook friendship being highly dependent on residence and year, exposure to less homogeneous content can be found in the online rather than the offline social circles of students, most notably in political and music aspects. 
 
"
6a3fc8b65018d247253218cd5b7514db4b6eb1fa,"{'DBLP': 'conf/icwsm/RiehJYL14', 'MAG': '73185499', 'DOI': '10.1609/icwsm.v8i1.14525', 'CorpusId': 17859752}",Audience-Aware Credibility: From Understanding Audience to Establishing Credible Blogs,International Conference on Web and Social Media,2014,"{'url': 'https://ojs.aaai.org/index.php/ICWSM/article/download/14525/14374', 'status': 'GOLD', 'license': None, 'disclaimer': 'Notice: Paper or abstract available at https://api.unpaywall.org/v2/10.1609/icwsm.v8i1.14525?email=<INSERT_YOUR_EMAIL> or https://doi.org/10.1609/icwsm.v8i1.14525, which is subject to the license by the author or copyright owner provided with this content. Please go to the source to verify the license and copyright information for your use.'}","[{'authorId': '2460511', 'name': 'Soo Young Rieh'}, {'authorId': '3112886', 'name': 'Grace YoungJoo Jeon'}, {'authorId': '2109869195', 'name': 'J. Yang'}, {'authorId': '145856934', 'name': 'Cliff Lampe'}]","
 
 This study examines how bloggers establish and enhance the credibility of their blogs through a series of blogging practices. Based on an analysis of interviews with 22 independent bloggers who blog on a range of topics, we present audience-aware credibility as a theoretical construct. Audience-aware credibility is defined as how bloggers signal their credibility based on who they think their audience is and how they provide value to that perceived audience. The analysis of bloggers’ credibility constructs, conceptualizations of audience, and perceived blog value identified four types of bloggers who constructed audience-aware credibility in distinctive ways: Community Builder, Expertise Provider, Topic Synthesizer, and Information Filterer. We then report on these bloggers’ blogging practices for establishing credibility and strategies for interacting with their audience to enhance credibility. The contributions of this study are to expand credibility constructs for social media research and to demonstrate the role of credibility perceptions in content contributors’ online activities. The findings reveal that a multi-dimensional construct of audience-aware credibility serves as a driving factor influencing and shaping blogging practices of all four types of bloggers. Copyright © 2014, Association for the Advancement of Artificial Intelligence (www.aaai.org). All rights reserved.  
 
"
6b2921eb65968fb68974b7701e0f3101fdf92eef,"{'MAG': '253442954', 'DBLP': 'conf/icwsm/Kivran-SwaineTBTN14', 'DOI': '10.1609/icwsm.v8i1.14506', 'CorpusId': 16074582}",Understanding Loneliness in Social Awareness Streams: Expressions and Responses,International Conference on Web and Social Media,2014,"{'url': 'https://ojs.aaai.org/index.php/ICWSM/article/download/14506/14355', 'status': 'GOLD', 'license': None, 'disclaimer': 'Notice: Paper or abstract available at https://api.unpaywall.org/v2/10.1609/icwsm.v8i1.14506?email=<INSERT_YOUR_EMAIL> or https://doi.org/10.1609/icwsm.v8i1.14506, which is subject to the license by the author or copyright owner provided with this content. Please go to the source to verify the license and copyright information for your use.'}","[{'authorId': '1403433464', 'name': 'Funda Kivran-Swaine'}, {'authorId': '1707770', 'name': 'Jeremy Ting'}, {'authorId': '3299367', 'name': 'Jed R. Brubaker'}, {'authorId': '37945919', 'name': 'R. Teodoro'}, {'authorId': '1687465', 'name': 'Mor Naaman'}]","
 
 We studied the experience of loneliness as communicated by thousands of people on Twitter. Using a data set of public Twitter posts containing explicit expressions of loneliness, we qualitatively developed a categorization scheme for these expressions, showing how the context of loneliness expressed on Twitter relates to existing theories about loneliness. A quantitative analysis of the data exposed categories and patterns in communication practices around loneliness. For example, users expressing more severe, enduring loneliness are more likely to be female, and less likely to include requests for social interaction in their tweets. Further, we studied the responses to expressions of loneliness in Twitter’s social settings. Deriving from the same dataset, we examined factors that correlate with the existence and type of response, showing, for example, that men were more likely to receive responses to lonely tweets, and expressions of enduring loneliness are critically less likely to receive responses.
 
"
6c78a1358f38995462c7358d1679b817edf88b6c,"{'DBLP': 'conf/icwsm/OsborneD14', 'MAG': '2180721559', 'DOI': '10.1609/icwsm.v8i1.14572', 'CorpusId': 31566441}","Facebook, Twitter and Google Plus for Breaking News: Is There a Winner?",International Conference on Web and Social Media,2014,"{'url': 'https://ojs.aaai.org/index.php/ICWSM/article/download/14572/14421', 'status': 'GOLD', 'license': None, 'disclaimer': 'Notice: Paper or abstract available at https://api.unpaywall.org/v2/10.1609/icwsm.v8i1.14572?email=<INSERT_YOUR_EMAIL> or https://doi.org/10.1609/icwsm.v8i1.14572, which is subject to the license by the author or copyright owner provided with this content. Please go to the source to verify the license and copyright information for your use.'}","[{'authorId': '2057788', 'name': 'M. Osborne'}, {'authorId': '1782853', 'name': 'Mark Dredze'}]","
 
 Twitter is widely seen as being the go to place for breaking news.Recently however, competing Social Media have begun to carry news.Here we examine how Facebook, Google Plus and Twitter report on breaking news. We consider coverage (whether news events are reported) and latency (the time when they are reported). Using data drawn from three weeks in December 2013, we identify 29 major news events, ranging from celebrity deaths, plague outbreaks to sports events. We find that all media carry the same major events, but Twitter continues to be the preferred medium for breaking news, almost consistently leading Facebook or Google Plus. Facebook and Google Plus largely repost newswire stories and their main research value is that they conveniently package multitple sources of information together.
 
"
7054bd6c657846e96b1b2cbec0f3c04e26a809f7,"{'DBLP': 'journals/corr/GeorgievNM14', 'MAG': '2949624481', 'ArXiv': '1403.7654', 'DOI': '10.1609/icwsm.v8i1.14523', 'CorpusId': 13063963}",Where Businesses Thrive: Predicting the Impact of the Olympic Games on Local Retailers through Location-based Services Data,International Conference on Web and Social Media,2014,"{'url': 'https://ojs.aaai.org/index.php/ICWSM/article/download/14523/14372', 'status': 'GOLD', 'license': None, 'disclaimer': 'Notice: Paper or abstract available at https://arxiv.org/abs/1403.7654, which is subject to the license by the author or copyright owner provided with this content. Please go to the source to verify the license and copyright information for your use.'}","[{'authorId': '1737522', 'name': 'Petko Georgiev'}, {'authorId': '1718233', 'name': 'A. Noulas'}, {'authorId': '1733840', 'name': 'C. Mascolo'}]","
 
 The Olympic Games are an important sporting event with notable consequences for the general economic landscape of the host city. Traditional economic assessments focus on the aggregated impact of the event on the national income, but fail to provide micro-scale insights on why local businesses will benefit from the increased activity during the Games.In this paper we provide a novel approach to modeling the impact of the Olympic Games on local retailers by analyzing a dataset mined from a large location-based social service, Foursquare. We hypothesize that the spatial positioning of businesses as well as the mobility trends of visitors are primary indicators of whether retailers will rise their popularity during the event. To confirm this we formulate a retail winners prediction task in the context of which we evaluate a set of geographic and mobility metrics. We find that the proximity to stadiums, the diversity of activity in the neighborhood, the nearby area sociability, as well as the probability of customer flows from and to event places such as stadiums and parks are all vital factors. Through supervised learning techniques we demonstrate that the success of businesses hinges on a combination of both geographic and mobility factors. Our results suggest that location-based social networks, where crowdsourced information about the dynamic interaction of users with urban spaces becomes publicly available, present an alternative medium to assess the economic impact of large scale events in a city.
 
"
