paperId,externalIds,title,venue,year,openAccessPdf,authors,abstract
3c2ba965bf5837d01056352412e43b1351acf0a4,"{'ArXiv': '2405.18374', 'DOI': '10.1609/icwsm.v20i1.42679', 'CorpusId': 270067740}","Assessing How Hate, Counterspeech, and Toxicity Affect Hate Group Newcomers",Proceedings of the International AAAI Conference on Web and Social Media,2024,"{'url': 'https://doi.org/10.1609/icwsm.v20i1.42679', 'status': 'GOLD', 'license': None, 'disclaimer': 'Notice: Paper or abstract available at https://arxiv.org/abs/2405.18374, which is subject to the license by the author or copyright owner provided with this content. Please go to the source to verify the license and copyright information for your use.'}","[{'authorId': '152426008', 'name': 'Daniel Hickey'}, {'authorId': '2133452483', 'name': 'Matheus Schmitz'}, {'authorId': '144227945', 'name': 'D. Fessler'}, {'authorId': '1700820', 'name': 'P. Smaldino'}, {'authorId': '2295194921', 'name': 'Kristina Lerman'}, {'authorId': '2133453630', 'name': ""Goran Muri'c""}, {'authorId': '2279042413', 'name': 'Keith Burghardt'}]","Counterspeech has gained attention as a strategy to reduce hate speech on social media. Although previous studies suggest that counterspeech can reduce hate speech, little is known about its effects on participation in online hate communities. Relatedly, we lack an understanding about the degree of hostility in counterspeech. Hostile counterspeech may increase online conflict, potentially hardening the positions of hate adherents, and further eroding online environments. Here, we analyzed the effect of counterspeech on 16,513 newcomers across 104 hate subreddits (forums within Reddit.com). We devised an LLM-based counterspeech detection approach that outperforms specialized models trained on existing datasets, then examined the presence, and effects of, hostility. While counterspeech comments are less toxic than hate speech comments, they are almost twice as toxic as other discourse within hate subreddits. We then evaluated the effect of counterspeech on newcomer engagement in hate subreddits. We found that newcomers using hate speech who receive counterspeech are less likely to continue posting within these hate subreddits, rather than becoming galvanized. We speculate that, instead of constituting ardent hate adherents, readily-dissuaded newcomers may merely be toying with beliefs that are proscribed in other contexts. Although we found no association between the toxicity of counterspeech and its effects on user retention, consistent with prior research regarding the harmful effects of toxic speech, we found that toxic counterspeech increases the probability of continued hostility from hate users within the same discussion."
3d94d0ab091ac7f760e6b16d8ea21da9e6af0e8f,"{'DBLP': 'conf/icwsm/AnBNSJ24', 'DOI': '10.1609/icwsm.v18i1.31298', 'CorpusId': 270175712}",Curated and Asymmetric Exposure: A Case Study of Partisan Talk during COVID on Twitter,International Conference on Web and Social Media,2024,"{'url': 'https://ojs.aaai.org/index.php/ICWSM/article/download/31298/33458', 'status': 'GOLD', 'license': None, 'disclaimer': 'Notice: Paper or abstract available at https://api.unpaywall.org/v2/10.1609/icwsm.v18i1.31298?email=<INSERT_YOUR_EMAIL> or https://doi.org/10.1609/icwsm.v18i1.31298, which is subject to the license by the author or copyright owner provided with this content. Please go to the source to verify the license and copyright information for your use.'}","[{'authorId': '2067764277', 'name': 'Zijian An'}, {'authorId': '2304184287', 'name': 'Jessica Breuhaus'}, {'authorId': '2056282778', 'name': 'Jason Niu'}, {'authorId': '1749777', 'name': 'Ahmet Erdem Sarıyüce'}, {'authorId': '2298930197', 'name': 'Kenneth Joseph'}]","Social media has been at the center of discussions about political polarization in the United States. However, scholars are actively debating both the scale of political polarization online, and how important online polarization is to the offline world. One question at the center of this debate is what interactions across parties look like online, and in particular 1) whether increasing the number of such interactions is likely to increase or reduce polarization, and 2) what technological affordances may make it more likely that these cross-party interactions benefit, rather than detract from, existing political challenges. The present work aims to provide insights into the latter; that is, we focus on providing a better understanding of how a set of 400,000 partisan users on a particular social media platform, Twitter, used the platform's affordances to interact within and across parties in a large dataset of tweets about COVID in 2021. Our findings suggest that Republican use of cross-party interaction were both more potent and potentially more strategic during COVID, that cross-party interaction was driven heavily by a small set of users and conversations, and that there exist non-obvious indirect pathways to cross-party exposure when different modes of interaction are chained together (especially retweets of quotes). These findings have implications beyond Twitter, we believe, in understanding how affordances of platforms can help to shape partisan exposure and interaction."
3e4ebb97d273d26f122a57dc87e66b156498536e,"{'DBLP': 'conf/icwsm/AliZ24', 'DOI': '10.1609/icwsm.v18i1.31296', 'CorpusId': 270189378}",From Isolation to Desolation: Investigating Self-Harm Discussions in Incel Communities,International Conference on Web and Social Media,2024,"{'url': 'https://ojs.aaai.org/index.php/ICWSM/article/download/31296/33456', 'status': 'GOLD', 'license': None, 'disclaimer': 'Notice: Paper or abstract available at https://api.unpaywall.org/v2/10.1609/icwsm.v18i1.31296?email=<INSERT_YOUR_EMAIL> or https://doi.org/10.1609/icwsm.v18i1.31296, which is subject to the license by the author or copyright owner provided with this content. Please go to the source to verify the license and copyright information for your use.'}","[{'authorId': '2241792539', 'name': 'Moonis Ali'}, {'authorId': '3447293', 'name': 'Savvas Zannettou'}]","Incel communities have recently attracted the public's interest mainly due to their high degree of extreme views and involvement in real-world violence.
A common theme in Incel communities is self-harm discussions. Despite this, beyond small-scale qualitative analyses of self-harm discussions in Incel communities, we lack a large-scale quantitative understanding of how Incels discuss self-harm and how it differs from mainstream communities.
In this work, we aim to demystify self-harm discussions in Incel communities using a data-driven approach and understand how Incels differentiate from mainstream communities.
We use a dataset of 6.4M posts from 18 Incel subreddits and 2.4M posts from an Incel forum, as well as 5.8M posts from two mainstream subreddits discussing mental health. 
Using word embedding approaches, temporal analyses, topic modeling, and qualitative analysis, we shed light on self-harm discussions in Incel and mainstream communities and their evolution over time.
We find substantial differences in the language related to self-harm deployed among the communities; we find that Incels use niche terms related to self-harm, which is not the case in mainstream communities. 
We observe that over time, language related to self-harm evolves considerably more among Incels than in mainstream communities.
Also, we observe that negative perception of their physical appearance is the most recurrent theme in self-harm conversations for Incels, which does not feature in mainstream communities. 
Finally, by analyzing social factors, we find that Substance abuse is the most closely associated social factor to self-harm in Incel and mainstream communities and that Physical Appearance, over time, is becoming increasingly closely related to self-harm discussions in Incel communities."
40c1d327486d0cf16112b091d71c756afe1f1a27,"{'DBLP': 'conf/icwsm/ChandioDN24', 'DOI': '10.1609/icwsm.v18i1.31311', 'CorpusId': 270188361}",How Audit Methods Impact Our Understanding of YouTube's Recommendation Systems,International Conference on Web and Social Media,2024,"{'url': 'https://ojs.aaai.org/index.php/ICWSM/article/download/31311/33471', 'status': 'GOLD', 'license': None, 'disclaimer': 'Notice: Paper or abstract available at https://api.unpaywall.org/v2/10.1609/icwsm.v18i1.31311?email=<INSERT_YOUR_EMAIL> or https://doi.org/10.1609/icwsm.v18i1.31311, which is subject to the license by the author or copyright owner provided with this content. Please go to the source to verify the license and copyright information for your use.'}","[{'authorId': '2210857841', 'name': 'Sarmad Chandio'}, {'authorId': '1574617745', 'name': 'Muhammad Daniyal Dar'}, {'authorId': '2405355', 'name': 'Rishab Nithyanand'}]","Computational audits of social media websites have generated data that forms the basis of our understanding of the problematic behaviors of algorithmic recommendation systems. Focusing on YouTube, this paper demonstrates that conducting audits to make specific inferences about the underlying content recommendation system is more methodologically challenging than one might expect. Obtaining scientifically valid results requires considering many methodological decisions, and each of these decisions incurs costs. For example, should an auditor use logged-in YouTube accounts while gathering recommendations to ensure more accurate inferences from the collected data? We systematically explore the impact of this and many other decisions and make important discoveries about the methodological choices that impact YouTube’s recommendations. Assessed together, our research suggests auditing configurations that can be used by researchers and auditors to reduce economic and computing costs, without sacrificing inference quality and accuracy."
428c92f16a56e79794d4935a7f49bf10773a24a2,"{'ArXiv': '2402.10938', 'DBLP': 'conf/icwsm/AminiB0MT25', 'DOI': '10.48550/arXiv.2402.10938', 'CorpusId': 267750272}",News Source Credibility Assessment: A Reddit Case Study,International Conference on Web and Social Media,2024,"{'url': '', 'status': None, 'license': None, 'disclaimer': 'Notice: Paper or abstract available at https://arxiv.org/abs/2402.10938, which is subject to the license by the author or copyright owner provided with this content. Please go to the source to verify the license and copyright information for your use.'}","[{'authorId': '2284678166', 'name': 'Arash Amini'}, {'authorId': '1802486825', 'name': 'Y. E. Bayiz'}, {'authorId': '2284702347', 'name': 'Ashwin Ram'}, {'authorId': '1702532', 'name': 'R. Marculescu'}, {'authorId': '3199888', 'name': 'U. Topcu'}]","We present a transformer-based model for credibility assessment, CREDiBERT (CREDibility assessment using Bi-directional Encoder Representations from Transformers), fine-tuned for Reddit submissions focusing on political discourse. We adopt a semi-supervised training approach for CREDiBERT, leveraging the community structure of Reddit. By encoding submission content using CREDiBERT and integrating it with a classification neural network, we improve the credibility assessment for Reddit submission by 3% in F1 score compared to existing methods. Additionally, we introduce a new version of the post-to-post network in Reddit that efficiently encodes user interactions to enhance the credibility assessment task by 8% in the F1 score. We demonstrate CREDiBERT's applicability by evaluating the susceptibility of Reddit communities to different topics and assessing the credibility score of unseen sources."
430bbd9cd7340f53d911788a59d9f128215515c7,"{'DBLP': 'conf/icwsm/XiaMKK25', 'ArXiv': '2410.04923', 'DOI': '10.48550/arXiv.2410.04923', 'CorpusId': 273186376}",Integrated or Segregated? User Behavior Change after Cross-Party Interactions on Reddit,International Conference on Web and Social Media,2024,"{'url': '', 'status': None, 'license': None, 'disclaimer': 'Notice: Paper or abstract available at https://arxiv.org/abs/2410.04923, which is subject to the license by the author or copyright owner provided with this content. Please go to the source to verify the license and copyright information for your use.'}","[{'authorId': '2324837466', 'name': 'Yan Xia'}, {'authorId': '47286020', 'name': 'Corrado Monti'}, {'authorId': '144106174', 'name': 'Barbara Keller'}, {'authorId': '2277613815', 'name': 'Mikko Kivelä'}]","It has been a widely shared concern that social media reinforces echo chambers of like-minded users and exacerbate political polarization. While fostering interactions across party lines is recognized as an important strategy to break echo chambers, there is a lack of empirical evidence on whether users will actually become more integrated or instead more segregated following such interactions on real social media platforms. We fill this gap by inspecting how users change their community engagement after receiving a cross-party reply in the U.S. politics discussion on Reddit. More specifically, we investigate if they increase their activity in communities of the opposing party, or in communities of their own party. We find that receiving a cross-party reply to a comment in a non-partisan discussion space is not significantly associated with increased out-party subreddit activity, unless the comment itself is already a reply to another comment. Meanwhile, receiving a cross-party reply is significantly associated with increased in-party subreddit activity, but the effect is comparable to that of receiving a same-party reply. Our results reveal a highly conditional depolarization effect following cross-party interactions in spurring out-party community engagement, which is likely part of a more general dynamic of feedback-boosted activity."
4368a67fb97aaa53e95fc47d3bc5edc5d66ecf50,"{'DBLP': 'conf/icwsm/DaeppC25', 'ArXiv': '2404.11988', 'DOI': '10.1609/icwsm.v19i1.35825', 'CorpusId': 269214065}",The Emerging Generative Artificial Intelligence Divide in the United States,International Conference on Web and Social Media,2024,"{'url': 'https://ojs.aaai.org/index.php/ICWSM/article/download/35825/37979', 'status': 'GOLD', 'license': None, 'disclaimer': 'Notice: Paper or abstract available at https://arxiv.org/abs/2404.11988, which is subject to the license by the author or copyright owner provided with this content. Please go to the source to verify the license and copyright information for your use.'}","[{'authorId': '49974784', 'name': 'Madeleine I. G. Daepp'}, {'authorId': '2238768931', 'name': 'Scott Counts'}]","The digital divide refers to disparities in access to and use of digital tooling across social and economic groups. This divide can reinforce marginalization both at the individual level and at the level of places, because persistent economic advantages accrue to places where new technologies are adopted early. To what extent are emerging generative artificial intelligence (AI) tools subject to these social and spatial divides? We leverage a large-scale search query database to characterize U.S. residents' knowledge of a novel generative AI tool, ChatGPT, during its first six months of release. We identify hotspots of higher-than-expected search volumes for ChatGPT in coastal metropolitan areas, while coldspots are evident in the American South, Appalachia, and the Midwest. Nationwide, counties with the highest rates of search have proportionally more educated and more economically advantaged populations, as well as proportionally more technology and finance-sector jobs in comparison with other counties or with the national average. Observed associations with race/ethnicity and urbanicity are attenuated in fully adjusted hierarchical models, but education emerges as the strongest positive predictor of generative AI awareness. In the absence of intervention, early differences in uptake show a potential to reinforce existing spatial and socioeconomic divides."
4566e8543975f2a29de8ac0bc4bb86879be6ad9b,"{'ArXiv': '2409.12320', 'DBLP': 'journals/corr/abs-2409-12320', 'DOI': '10.48550/arXiv.2409.12320', 'CorpusId': 272753028}",The Effect of Education in Prompt Engineering: Evidence from Journalists,Proceedings of the International AAAI Conference on Web and Social Media,2024,"{'url': '', 'status': None, 'license': None, 'disclaimer': 'Notice: Paper or abstract available at https://arxiv.org/abs/2409.12320, which is subject to the license by the author or copyright owner provided with this content. Please go to the source to verify the license and copyright information for your use.'}","[{'authorId': '2207416712', 'name': 'Amirsiavosh Bashardoust'}, {'authorId': '2321903464', 'name': 'Yuanjun Feng'}, {'authorId': '2066388695', 'name': 'Dominique Geissler'}, {'authorId': '3207649', 'name': 'S. Feuerriegel'}, {'authorId': '2698101', 'name': 'Y. Shrestha'}]","Large language models (LLMs) are increasingly used to create content for social media, specifically in the context of journalism. In this paper, we analyze whether training in prompt engineering can improve the interactions of users with LLMs. For this, we conducted an experiment where we asked journalists to write short texts before and after training in prompt engineering. We then analyzed the effect of training on three dimensions: (1) the user experience of journalists when interacting with LLMs, (2) the domain expert perception, and (3) the non-expert reader perception, such as clarity, engagement, and other text quality dimensions. Our results show: (1) Our training improved the perceived expertise of journalists but also decreased the perceived helpfulness of LLM use. (2) The effect on expert perception varied by the difficulty of the task. (3) There is a mixed impact of training on reader perception across different text quality dimensions."
4a402c7f4f2a5aaa1f8429be9dd19469d24b6d67,"{'ArXiv': '2402.01681', 'DBLP': 'journals/corr/abs-2402-01681', 'DOI': '10.48550/arXiv.2402.01681', 'CorpusId': 267412924}",Emojis Decoded: Leveraging ChatGPT for Enhanced Understanding in Social Media Communications,International Conference on Web and Social Media,2024,"{'url': '', 'status': None, 'license': None, 'disclaimer': 'Notice: Paper or abstract available at https://arxiv.org/abs/2402.01681, which is subject to the license by the author or copyright owner provided with this content. Please go to the source to verify the license and copyright information for your use.'}","[{'authorId': '2266789873', 'name': 'Yuhang Zhou'}, {'authorId': '103226724', 'name': 'Paiheng Xu'}, {'authorId': '2282902714', 'name': 'Xiyao Wang'}, {'authorId': '2282572921', 'name': 'Xuan Lu'}, {'authorId': '2282528493', 'name': 'Ge Gao'}, {'authorId': '2218202090', 'name': 'Wei Ai'}]","Emojis, which encapsulate semantics beyond words or phrases, have become prevalent in social network communications. This has spurred increasing scholarly interest in exploring their attributes and functionalities. However, emoji-related research and application face two primary challenges. First, researchers typically rely on crowd-sourcing to annotate emojis in order to understand their sentiments, usage intentions, and semantic meanings. Second, subjective interpretations by users can often lead to misunderstandings of emojis and cause a communication barrier. Large Language Models (LLMs) have achieved significant success in various annotation tasks, with ChatGPT demonstrating expertise across multiple domains. In our study, we assess ChatGPT's effectiveness in handling previously emoji-annotated and downstream tasks. Our objective is to validate the hypothesis that ChatGPT can serve as an alternative to human annotators in emoji research and that its ability to explain emoji meanings can enhance clarity and transparency in online communications. Our findings indicate that ChatGPT has extensive knowledge of emojis. It is adept at explaining the meaning of emojis across various application scenarios and demonstrates the potential to replace human annotators in a range of tasks."
4af5f5a1eac0660f228cd4c5e3ae07bd95b1a151,"{'DBLP': 'conf/icwsm/QuattroneC24', 'DOI': '10.1609/icwsm.v18i1.31389', 'CorpusId': 270189643}",Diversity and Inclusion in the Sharing Economy: An Airbnb Case Study,International Conference on Web and Social Media,2024,"{'url': 'https://ojs.aaai.org/index.php/ICWSM/article/download/31389/33549', 'status': 'GOLD', 'license': None, 'disclaimer': 'Notice: Paper or abstract available at https://api.unpaywall.org/v2/10.1609/icwsm.v18i1.31389?email=<INSERT_YOUR_EMAIL> or https://doi.org/10.1609/icwsm.v18i1.31389, which is subject to the license by the author or copyright owner provided with this content. Please go to the source to verify the license and copyright information for your use.'}","[{'authorId': '1742046', 'name': 'G. Quattrone'}, {'authorId': '47809306', 'name': 'L. Capra'}]","The sharing economy model is a contested concept: on one hand, its proponents have praised it to be enabler of fair marketplaces, with all participants receiving equal opportunities; on the other hand, its detractors have criticised it for actually exacerbating preexisting societal inequalities. In this paper, we propose a scalable quantitative method to measure participants' diversity and inclusion in such marketplaces, with the aim to offer evidence to ground this debate. We apply the method to the case of the Airbnb hospitality service for the city of London, UK. Our findings reveal that diversity is high for gender, but not so for age and ethnicity. As for inclusion, we find strong signals of homophily both in terms of gender, age and ethnicity, thus suggesting that under-represented groups have significantly fewer opportunities to gain from this market model. Interestingly, the sentiment associated to same-group (homophilic) interactions is just as positive as that associated to heterophilic ones, even after controlling for Airbnb property's type, price and location. This suggests that increased diversity and inclusion are desirable not only for moral but also for economic and market reasons."
4ba882b7dc5f3ec3dd21669cf0cb00111d3e649d,"{'DBLP': 'conf/icwsm/Shang0YCZ024', 'DOI': '10.1609/icwsm.v18i1.31398', 'CorpusId': 270190944}",A Domain Adaptive Graph Learning Framework to Early Detection of Emergent Healthcare Misinformation on Social Media,International Conference on Web and Social Media,2024,"{'url': 'https://ojs.aaai.org/index.php/ICWSM/article/download/31398/33558', 'status': 'GOLD', 'license': None, 'disclaimer': 'Notice: Paper or abstract available at https://api.unpaywall.org/v2/10.1609/icwsm.v18i1.31398?email=<INSERT_YOUR_EMAIL> or https://doi.org/10.1609/icwsm.v18i1.31398, which is subject to the license by the author or copyright owner provided with this content. Please go to the source to verify the license and copyright information for your use.'}","[{'authorId': '65855502', 'name': 'Lanyu Shang'}, {'authorId': '2145953897', 'name': 'Yang Zhang'}, {'authorId': '2028213158', 'name': 'Zhenrui Yue'}, {'authorId': '2124760158', 'name': 'YeonJung Choi'}, {'authorId': '2113559163', 'name': 'Huimin Zeng'}, {'authorId': '2254248851', 'name': 'Dong Wang'}]","A fundamental issue in healthcare misinformation detection is the lack of timely resources (e.g., medical knowledge, annotated data), making it challenging to accurately detect emergent healthcare misinformation at an early stage. In this paper, we develop a crowdsourcing-based early healthcare misinformation detection framework that jointly exploits the medical expertise of expert crowd workers and adapts the medical knowledge from a source domain (e.g., COVID-19) to detect misleading posts in an emergent target domain (e.g., Mpox, Polio). Two important challenges exist in developing our solution: (i) How to leverage the complex and noisy knowledge from the source domain to facilitate the detection of misinformation in the target domain? (ii) How to effectively utilize the limited amount of expert workers to correct the inapplicable knowledge facts in the source domain and adapt the corrected facts to examine the truthfulness of the posts in the emergent target domain? To address these challenges, we develop CrowdAdapt, a crowdsourcing-based domain adaptive approach that effectively identifies and adapts relevant knowledge facts from the source domain to accurately detect misinformation in the target domain. Evaluation results from two real-world case studies demonstrate the superiority of CrowdAdapt over state-of-the-art baselines in accurately detecting emergent healthcare misinformation."
