paperId,externalIds,title,venue,year,openAccessPdf,authors,abstract
004e4cbaf54b1e83ea475df4b04b6705856e1c0e,"{'DBLP': 'conf/icwsm/RuffinSX024', 'DOI': '10.1609/icwsm.v18i1.31392', 'CorpusId': 269460216}",Does It Matter Who Said It? Exploring the Impact of Deepfake-Enabled Profiles on User Perception towards Disinformation,International Conference on Web and Social Media,2024,"{'url': 'https://ojs.aaai.org/index.php/ICWSM/article/download/31392/33552', 'status': 'GOLD', 'license': None, 'disclaimer': 'Notice: Paper or abstract available at https://api.unpaywall.org/v2/10.1609/icwsm.v18i1.31392?email=<INSERT_YOUR_EMAIL> or https://doi.org/10.1609/icwsm.v18i1.31392, which is subject to the license by the author or copyright owner provided with this content. Please go to the source to verify the license and copyright information for your use.'}","[{'authorId': '2188817804', 'name': 'Margie Ruffin'}, {'authorId': '150127148', 'name': 'H. Seo'}, {'authorId': '2261997735', 'name': 'Aiping Xiong'}, {'authorId': '2299175131', 'name': 'Gang Wang'}]","Recently, deepfake techniques have been adopted by real-world adversaries to fabricate believable personas (posing as experts or insiders) in disinformation campaigns to promote false narratives and deceive the public. In this paper, we investigate how fake personas influence the user perception of the disinformation shared by such accounts. Using Twitter as an exemplary platform, we conduct a user study (N=417) where participants read tweets of fake news with (and without) the presence of the tweet authors' profiles. Our study examines and compares three types of fake profiles: deepfake profiles, profiles of relevant organizations, and simple bot profiles. Our results highlight the significant impact of deepfake and organization profiles on increasing the perceived information accuracy of and engagement with fake news. Moreover, deepfake profiles are rated as significantly more real than other profile types. Finally, we observe that users may like/reply/share a tweet even though they believe it was inaccurate (e.g., for fun or truth-seeking), which could further disseminate false information. We then discuss the implications of our findings and directions for future research."
00c852ea7158b5fdc872f460dbeb6db8236ab7c7,"{'DBLP': 'conf/icwsm/HoseiniMBFZ24', 'DOI': '10.1609/icwsm.v18i1.31336', 'CorpusId': 270196975}",Characterizing Information Propagation in Fringe Communities on Telegram,International Conference on Web and Social Media,2024,"{'url': 'https://ojs.aaai.org/index.php/ICWSM/article/download/31336/33496', 'status': 'GOLD', 'license': None, 'disclaimer': 'Notice: Paper or abstract available at https://api.unpaywall.org/v2/10.1609/icwsm.v18i1.31336?email=<INSERT_YOUR_EMAIL> or https://doi.org/10.1609/icwsm.v18i1.31336, which is subject to the license by the author or copyright owner provided with this content. Please go to the source to verify the license and copyright information for your use.'}","[{'authorId': '2304279833', 'name': 'M. Hoseini'}, {'authorId': '40594032', 'name': 'P. Melo'}, {'authorId': '2304192680', 'name': 'Fabrício Benevenuto'}, {'authorId': '2304192654', 'name': 'Anja Feldmann'}, {'authorId': '3447293', 'name': 'Savvas Zannettou'}]","Online messaging platforms are key communication tools but are vulnerable to fake news and conspiracy theories. Mainstream platforms such as Facebook are increasing content moderation of harmful and conspiratorial content. In response, users from fringe communities are migrating to alternative platforms like Telegram. These platforms offer more freedom and less intervention. Currently, Telegram is one of the leading messaging platforms hosting fringe communities. Despite the popularity, as a research community, we lack knowledge of how content spreads over this network. Motivated by the importance and impact of messaging platforms on society, we aim to measure the information propagation within fringe communities on the Telegram network, focusing on how public groups and channels exchange messages. We collect and explore about 140 million messages from 9,000 channels and groups on Telegram. We examine message forwarding and the lifetime of the messages from different aspects. Among other things, we find inequality in content creation; 6% of the users are responsible for 90% of forwarded messages. We also discover that while the forwarding feature considerably amplifies the reach of messages, the spread of content within our dataset remains largely localized. Additionally, we find that 5% of the channels are responsible for 40% of the forwarded messages in the entire dataset. Finally, our lifetime analysis shows that messages disseminated in groups with numerous active users exhibit significantly longer lifespans compared to those circulated in channels."
029634a9fb93b9f5c6562556275b9d0e6b13a93f,"{'DBLP': 'journals/corr/abs-2407-17045', 'ArXiv': '2407.17045', 'DOI': '10.48550/arXiv.2407.17045', 'CorpusId': 271404167}",NewsUnfold: Creating a News-Reading Application That Indicates Linguistic Media Bias and Collects Feedback,International Conference on Web and Social Media,2024,"{'url': '', 'status': None, 'license': None, 'disclaimer': 'Notice: Paper or abstract available at https://arxiv.org/abs/2407.17045, which is subject to the license by the author or copyright owner provided with this content. Please go to the source to verify the license and copyright information for your use.'}","[{'authorId': '2150710278', 'name': 'Smilla Hinterreiter'}, {'authorId': '2225914566', 'name': 'Martin Wessel'}, {'authorId': '2312750892', 'name': 'Fabian Schliski'}, {'authorId': '2312740679', 'name': 'Isao Echizen'}, {'authorId': '2142582172', 'name': 'M. Latoschik'}, {'authorId': '1845794923', 'name': 'Timo Spinde'}]","Media bias is a multifaceted problem, leading to one-sided views and impacting decision-making. A way to address digital media bias is to detect and indicate it automatically through machine-learning methods. However, such detection is limited due to the difficulty of obtaining reliable training data. Human-in-the-loop-based feedback mechanisms have proven an effective way to facilitate the data-gathering process. Therefore, we introduce and test feedback mechanisms for the media bias domain, which we then implement on NewsUnfold, a news-reading web application to collect reader feedback on machine-generated bias highlights within online news articles. Our approach augments dataset quality by significantly increasing inter-annotator agreement by 26.31% and improving classifier performance by 2.49%. As the first human-in-the-loop application for media bias, the feedback mechanism shows that a user-centric approach to media bias data collection can return reliable data while being scalable and evaluated as easy to use. NewsUnfold demonstrates that feedback mechanisms are a promising strategy to reduce data collection expenses and continuously update datasets to changes in context."
02b21c6751acef4c2dd7d607def4355df06f110f,"{'DBLP': 'conf/icwsm/AleksandricRPWN24', 'DOI': '10.1609/icwsm.v18i1.31295', 'CorpusId': 270185153}",Users' Behavioral and Emotional Response to Toxicity in Twitter Conversations,International Conference on Web and Social Media,2024,"{'url': 'https://ojs.aaai.org/index.php/ICWSM/article/download/31295/33455', 'status': 'GOLD', 'license': None, 'disclaimer': 'Notice: Paper or abstract available at https://api.unpaywall.org/v2/10.1609/icwsm.v18i1.31295?email=<INSERT_YOUR_EMAIL> or https://doi.org/10.1609/icwsm.v18i1.31295, which is subject to the license by the author or copyright owner provided with this content. Please go to the source to verify the license and copyright information for your use.'}","[{'authorId': '2150914019', 'name': 'Ana Aleksandric'}, {'authorId': '47115854', 'name': 'S. Roy'}, {'authorId': '2258957569', 'name': 'Hanani Pankaj'}, {'authorId': '2258962305', 'name': 'Gabriela Mustata Wilson'}, {'authorId': '2267110', 'name': 'Shirin Nilizadeh'}]","Prior works have shown connections between online toxicity attacks, such as harassment, cyberbullying, and hate speech, and the subsequent increase in offline violence, as well as negative psychological effects on victims. These correlations are primarily identified through user studies conducted via virtual environments, simulations, and questionnaires. However, no work has investigated how, in practice and authentically, people react to online toxicity both emotionally, showing anger, anxiety, and sadness, and behaviorally in terms of engaging with and responding to toxicity instigators, considering conversations as a whole and the relation between emotions and behaviors. This data-driven study investigates the effect of toxicity on Twitter users' behaviors and emotions considering confounding factors, such as account identifiability, activity, and conversation's structure and topic. We collected about 80K Twitter conversations and identified those with and without toxic replies. Performing statistical tests along with propensity score matching, we investigated the causal association of receiving toxicity and users' responses. We found that authors of conversations with toxic replies are more likely to engage in conversations, reply in a toxic way, and unfollow toxicity instigators. In terms of users' emotional responses, we found that sadness and anger after the first toxic reply are more likely to increase as the amount of toxicity increases. These findings not only emphasize the negative emotional and behavioral effects of online toxicity on social media users but also, as demonstrated in this paper, can be utilized to build prediction models for users' reactions, which could then aid the implementation of proactive detection and intervention measures helping users in such situations."
03ef1e2e7c72b39a809b34ee5f88bd1c74a3dd58,"{'DBLP': 'conf/icwsm/NguyenJCSLLBTKC25', 'ArXiv': '2407.02662', 'PubMedCentral': '12365693', 'DOI': '10.48550/arXiv.2407.02662', 'CorpusId': 270924421, 'PubMed': '40842885'}",Supporters and Skeptics: LLM-based Analysis of Engagement with Mental Health (Mis)Information Content on Video-sharing Platforms,International Conference on Web and Social Media,2024,"{'url': '', 'status': None, 'license': None, 'disclaimer': 'Notice: Paper or abstract available at https://arxiv.org/abs/2407.02662, which is subject to the license by the author or copyright owner provided with this content. Please go to the source to verify the license and copyright information for your use.'}","[{'authorId': '2214602928', 'name': 'Viet Cuong Nguyen'}, {'authorId': '2309483423', 'name': 'Mini Jain'}, {'authorId': '2309481103', 'name': 'Abhijat Chauhan'}, {'authorId': '2365860761', 'name': 'H. J. Soled'}, {'authorId': '2309480719', 'name': 'Santiago Alvarez Lesmes'}, {'authorId': '2309671350', 'name': 'Zihang Li'}, {'authorId': '2264234742', 'name': 'Michael L. Birnbaum'}, {'authorId': '2387072558', 'name': 'Sunny X. Tang'}, {'authorId': '2109543348', 'name': 'Srijan Kumar'}, {'authorId': '2203915239', 'name': 'M. D. Choudhury'}]","Over one in five adults in the US lives with a mental illness. In the face of a shortage of mental health professionals and offline resources, online short-form video content has grown to serve as a crucial conduit for disseminating mental health help and resources. However, the ease of content creation and access also contributes to the spread of misinformation, posing risks to accurate diagnosis and treatment. Detecting and understanding engagement with such content is crucial to mitigating their harmful effects on public health. We perform the first quantitative study of the phenomenon using YouTube Shorts and Bitchute as the sites of study. We contribute MentalMisinfo, a novel labeled mental health misinformation (MHMisinfo) dataset of 739 videos (639 from Youtube and 100 from Bitchute) and 135372 comments in total, using an expert-driven annotation schema. We first found that few-shot in-context learning with large language models (LLMs) are effective in detecting MHMisinfo videos. Next, we discover distinct and potentially alarming linguistic patterns in how audiences engage with MHMisinfo videos through commentary on both video-sharing platforms. Across the two platforms, comments could exacerbate prevailing stigma with some groups showing heightened susceptibility to and alignment with MHMisinfo. We discuss technical and public health-driven adaptive solutions to tackling the “epidemic” of mental health misinformation online."
03fdbef3c0ab0bad9a114aefea25ee3ca8bde196,"{'DBLP': 'conf/icwsm/MatsuiMM24', 'DOI': '10.1609/icwsm.v18i1.31370', 'CorpusId': 270184473}",Throw Your Hat in the Ring (of Wikipedia): Exploring Urban-Rural Disparities in Local Politicians' Information Supply,International Conference on Web and Social Media,2024,"{'url': 'https://ojs.aaai.org/index.php/ICWSM/article/download/31370/33530', 'status': 'GOLD', 'license': None, 'disclaimer': 'Notice: Paper or abstract available at https://api.unpaywall.org/v2/10.1609/icwsm.v18i1.31370?email=<INSERT_YOUR_EMAIL> or https://doi.org/10.1609/icwsm.v18i1.31370, which is subject to the license by the author or copyright owner provided with this content. Please go to the source to verify the license and copyright information for your use.'}","[{'authorId': '2304237112', 'name': 'Akira Matsui'}, {'authorId': '2303849884', 'name': 'Kunihiro Miyazaki'}, {'authorId': '2303848334', 'name': 'Taichi Murayama'}]","In this era of digital politics, understanding the factors that influence the supply of political information is important. This study investigates the relationship between socio-economic status and the political information supplied on Wikipedia. To this end, it employs a dataset of politicians who ran for local elections in Japan over approximately 20 years and discovers that the creation and revisions of local politicians' pages are associated with socio-economic factors such as the employment ratio by industry and age distribution. We find that the majority of the suppliers of politicians' information are unregistered and primarily interested in politicians' pages compared to registered users. Additional analysis reveals that users who supply information about politicians before and after an election are more active on Wikipedia than the average user. The findings presented imply that the information supply on Wikipedia, which relies on voluntary contributions, may reflect regional socio-economic disparities."
0456500888643044415317b676e5cb7bb701a85b,"{'ArXiv': '2409.10168', 'DBLP': 'journals/corr/abs-2409-10168', 'DOI': '10.48550/arXiv.2409.10168', 'CorpusId': 272689584}",Algorithmic Behaviors Across Regions: A Geolocation Audit of YouTube Search for COVID-19 Misinformation between the United States and South Africa,International Conference on Web and Social Media,2024,"{'url': '', 'status': None, 'license': None, 'disclaimer': 'Notice: Paper or abstract available at https://arxiv.org/abs/2409.10168, which is subject to the license by the author or copyright owner provided with this content. Please go to the source to verify the license and copyright information for your use.'}","[{'authorId': '2300424756', 'name': 'Hayoung Jung'}, {'authorId': '32227215', 'name': 'Prerna Juneja'}, {'authorId': '2300368790', 'name': 'Tanushree Mitra'}]","Despite being an integral tool for finding health-related information online, YouTube has faced criticism for disseminating COVID-19 misinformation globally to its users. Yet, prior audit studies have predominantly investigated YouTube within the Global North contexts, often overlooking the Global South. To address this gap, we conducted a comprehensive 10-day geolocation-based audit on YouTube to compare the prevalence of COVID-19 misinformation in search results between the United States (US) and South Africa (SA), the countries heavily affected by the pandemic in the Global North and the Global South, respectively. For each country, we selected 3 geolocations and placed sock-puppets, or bots emulating ""real"" users, that collected search results for 48 search queries sorted by 4 search filters for 10 days, yielding a dataset of 915K results. We found that 31.55% of the top-10 search results contained COVID-19 misinformation. Among the top-10 search results, bots in SA faced significantly more misinformative search results than their US counterparts. Overall, our study highlights the contrasting algorithmic behaviors of YouTube search between two countries, underscoring the need for the platform to regulate algorithmic behavior consistently across different regions of the Globe. 

Warning: We caution the readers that some examples provided to better contextualize our data can be offensive."
04b301ac7d327a2ddf05e8cb3d13eb4b2caa63a2,"{'DBLP': 'conf/icwsm/YangDSD24', 'DOI': '10.1609/icwsm.v18i1.31420', 'CorpusId': 270185723}",Detection and Categorization of Needs during Crises Based on Twitter Data,International Conference on Web and Social Media,2024,"{'url': 'https://ojs.aaai.org/index.php/ICWSM/article/download/31420/33580', 'status': 'GOLD', 'license': None, 'disclaimer': 'Notice: Paper or abstract available at https://api.unpaywall.org/v2/10.1609/icwsm.v18i1.31420?email=<INSERT_YOUR_EMAIL> or https://doi.org/10.1609/icwsm.v18i1.31420, which is subject to the license by the author or copyright owner provided with this content. Please go to the source to verify the license and copyright information for your use.'}","[{'authorId': '2304425490', 'name': 'Pingjing Yang'}, {'authorId': '145198825', 'name': 'Ly Dinh'}, {'authorId': '145542763', 'name': 'Alex Stratton'}, {'authorId': '2304241617', 'name': 'Jana Diesner'}]","The Ukraine-Russia conflict has brought sizable detrimental impact to the global energy, food, finance, and manufacturing industries, as well to many affected people. In this paper, we use Twitter (now X) to automatically identify who needs what from text data and how the types of needs that we categorized and standardize evolved throughout this conflict. Our findings suggest that the Ukraine expresses a need for weapons, Russia for land, Europe for gas, and America for leadership. The majority of needs expressed on Twitter during this conflict are related to the categories transportation, military, health & medical, financial and money, energy, and essential items (food, water, shelter, non-food items). Stated needs changed as the conflict escalated or fell into stalemate. Needs also varied depending on the tweet's location, with tweets from Ukraine's neighboring countries being related to food and medicine, while tweets from non-neighboring countries stated needs for clothing and tents. Tweets written in Ukrainian and Russian shared similar need terms, such as medicines and kits, compared to English tweets, which expressed needs such as ammunition and humanitarian aid. Our comparison of needs across four different disaster events, namely this conflict, an earthquake, a major hurricane, and the COVID-19 pandemic, showed how needs differ depending on the nature of the crisis and how domain-adjustment of needs categories is necessary. We contribute to the crisis informatics literature by (1) validating a methodology for using tweets to study the demand and supply of things that different stakeholders need during crisis events and (2) testing, comparing, and improving the fit of widely used need classification schemas for studying crisis from different domains."
05844ee726915cb3b1448c5776fd9e345282f84f,"{'DBLP': 'conf/icwsm/HouL024', 'DOI': '10.1609/icwsm.v18i1.31338', 'CorpusId': 270178822}",ChatGPT Giving Relationship Advice - How Reliable Is It?,International Conference on Web and Social Media,2024,"{'url': 'https://ojs.aaai.org/index.php/ICWSM/article/download/31338/33498', 'status': 'GOLD', 'license': None, 'disclaimer': 'Notice: Paper or abstract available at https://api.unpaywall.org/v2/10.1609/icwsm.v18i1.31338?email=<INSERT_YOUR_EMAIL> or https://doi.org/10.1609/icwsm.v18i1.31338, which is subject to the license by the author or copyright owner provided with this content. Please go to the source to verify the license and copyright information for your use.'}","[{'authorId': '2332596790', 'name': 'Haonan Hou'}, {'authorId': '2265679346', 'name': 'Kevin Leach'}, {'authorId': '2218350387', 'name': 'Yu Huang'}]","In the evolving realm of natural language processing (NLP), generative AI models like ChatGPT are increasingly utilized across various applications. Among the possible purposes, many people are considering asking ChatGPT for relationship advice. However, the lack of in-depth examination of ChatGPT's response quality could be concerning when it is used for personal topics like mental health issues and intimate relationship problems. In these topics, a piece of misleading advice could cause harmful repercussions. In response to people's growing interest in using ChatGPT as a relationship advisor, our research evaluates ChatGPT's proficiency in discerning relationship advice. Specifically, we investigate its alignment with human judgements. We conducted our analysis with 13,138 Reddit posts about intimate relationship problems to examine the overall alignment. Furthermore, we investigate ChatGPT's consistency in judging intimate relationship advice by re-prompting identical queries. Our results indicate a significant disparity between ChatGPT and human judgments, with the model displaying inconsistency in its own decisions. Our findings emphasize the need for comprehensive insights into ChatGPT's mechanisms for intimacy problems and future improvements in its proficiency in helping people's relationship struggles."
063c862bb355f73e7fc513271812db0e469686e4,"{'DBLP': 'conf/icwsm/HuWJ0024', 'DOI': '10.1609/icwsm.v18i1.31341', 'CorpusId': 270182810}",A Multi-modal Prompt Learning Framework for Early Detection of Fake News,International Conference on Web and Social Media,2024,"{'url': 'https://ojs.aaai.org/index.php/ICWSM/article/download/31341/33501', 'status': 'GOLD', 'license': None, 'disclaimer': 'Notice: Paper or abstract available at https://api.unpaywall.org/v2/10.1609/icwsm.v18i1.31341?email=<INSERT_YOUR_EMAIL> or https://doi.org/10.1609/icwsm.v18i1.31341, which is subject to the license by the author or copyright owner provided with this content. Please go to the source to verify the license and copyright information for your use.'}","[{'authorId': '2278778264', 'name': 'Weiqi Hu'}, {'authorId': '2115740555', 'name': 'Yechen Wang'}, {'authorId': '2268435498', 'name': 'Yan Jia'}, {'authorId': '2268395018', 'name': 'Qing Liao'}, {'authorId': '2304305108', 'name': 'Bin Zhou'}]","Information spreads quickly through social media platforms, especially fake news with negative or even malicious intentions. In recent years, psychological studies have found that explicit reminders of fake news would diminish its consequence. Therefore, it is crucial to identify their authenticity at an early stage to avoid serious consequences. However, existing methods for fake news detection either utilize auxiliary information including users’ profiles and related events propagation networks or require sufficient and high-quality training data, which is not suitable for early fake news detection in real. An increasing number of social media news not only involves natural language content but also visual content such as images and videos, which give us a new view of fake news detection at an early stage by multi-modal data. In this paper, we propose a Multi-modal Prompt Learning framework (MPL) based on the multi-modal pre-trained model CLIP for early detection of fake news. A learnable prompt module is developed to adaptively and efficiently generate prompt representations to boost the semantic context. MPL can be implemented in supervised or few-shot settings. Extensive experiments show that the proposed MPL obtains substantial performance and efficiency improvement for the early-stage fake news detection task. The results demonstrate that MPL performs considerably well compared to both the state-ofthe-art supervised multi-modal models and the latest promptbased few-shot multi-modal models. Especially, the high recall of fake news and the high precision of real news that MPL achieved compared to other baselines verify that it will better approach one of the motivations that providing early notification of “maybe real” or “maybe fake” with the release of the news."
