paperId,externalIds,title,venue,year,openAccessPdf,authors,abstract
c615a0d3f429094c1223be8b6e3bb158547709f3,"{'MAG': '1577585001', 'DBLP': 'conf/icwsm/KimCM10', 'DOI': '10.1609/icwsm.v4i1.14073', 'CorpusId': 8550111}",Generating Domain-Specific Clues Using News Corpus for Sentiment Classification,International Conference on Web and Social Media,2010,"{'url': 'https://ojs.aaai.org/index.php/ICWSM/article/download/14073/13922', 'status': 'GOLD', 'license': None, 'disclaimer': 'Notice: Paper or abstract available at https://api.unpaywall.org/v2/10.1609/icwsm.v4i1.14073?email=<INSERT_YOUR_EMAIL> or https://doi.org/10.1609/icwsm.v4i1.14073, which is subject to the license by the author or copyright owner provided with this content. Please go to the source to verify the license and copyright information for your use.'}","[{'authorId': '2108358125', 'name': 'Youngho Kim'}, {'authorId': '50657651', 'name': 'Yoonjung Choi'}, {'authorId': '1754166', 'name': 'Sung-Hyon Myaeng'}]","
 
 This paper addresses the problem of automatically generating domain-specific sentiment clues. The main idea is to bootstrap from a small seed set and generate new clues by using dependencies and collocation information between sentiment clues and sentence-level topics that would be a primary subject of sentiment expression (e.g., event, company, and person). The experiments show that the aggregated clues are effective for sentiment classification.
 
"
c99d758380477673ed79845c45a1f24038f4b45f,"{'DBLP': 'conf/icwsm/DenoyerG10', 'MAG': '1571637021', 'DOI': '10.1609/icwsm.v4i1.14045', 'CorpusId': 1958765}",A Ranking Based Model for Automatic Image Annotation in a Social Network,International Conference on Web and Social Media,2010,"{'url': 'https://ojs.aaai.org/index.php/ICWSM/article/download/14045/13894', 'status': 'GOLD', 'license': None, 'disclaimer': 'Notice: Paper or abstract available at https://api.unpaywall.org/v2/10.1609/icwsm.v4i1.14045?email=<INSERT_YOUR_EMAIL> or https://doi.org/10.1609/icwsm.v4i1.14045, which is subject to the license by the author or copyright owner provided with this content. Please go to the source to verify the license and copyright information for your use.'}","[{'authorId': '8905591', 'name': 'Ludovic Denoyer'}, {'authorId': '1741426', 'name': 'P. Gallinari'}]","
 
 We propose a relational ranking model for learning to tag images in social media sharing systems. This model learns to associate a ranked list of tags to unlabeled images, by considering simultaneously content information (visual or textual) and relational information among the images. It is able to handle implicit relations like content similarities, and explicit ones like friendship or authorship. The model itself is based on a transductive algorithm thats learns from both labeled and unlabeled data. Experiments on a real corpus extracted from Flickr show the effectiveness of this model.
 
"
cf2f35fd6b5f2ff3f830b327bc35a608b7a414db,"{'DBLP': 'conf/icwsm/RussoN10', 'MAG': '153398450', 'DOI': '10.1609/icwsm.v4i1.14022', 'CorpusId': 14997110}","Photo Tagging Over Time: A Longitudinal Study of the Role of Attention, Network Density, and Motivations",International Conference on Web and Social Media,2010,"{'url': 'https://ojs.aaai.org/index.php/ICWSM/article/download/14022/13871', 'status': 'GOLD', 'license': None, 'disclaimer': 'Notice: Paper or abstract available at https://api.unpaywall.org/v2/10.1609/icwsm.v4i1.14022?email=<INSERT_YOUR_EMAIL> or https://doi.org/10.1609/icwsm.v4i1.14022, which is subject to the license by the author or copyright owner provided with this content. Please go to the source to verify the license and copyright information for your use.'}","[{'authorId': '153877423', 'name': 'P. Russo'}, {'authorId': '71575036', 'name': 'O. Nov'}]","
 
 Along with the growth in artifact sharing in online communities such as Flickr, YouTube, and Facebook comes the demand for adding descriptive meta-information, or tags. Tags help individuals to organize and communicate the content and context of their work for themselves and for others. This longitudinal study draws on research in social psychology, network theory and online communities to explain tagging over time. Our findings suggest that tagging increases as a contributor receives attention from others in the community. Further, we find that the more a user's network neighbors are connected to each other directly, the less the focal user will tend to tag his photos. However, density interacts with attention such that those who are surrounded by a dense ego network respond more to attention than others whose ego networks are sparsely interconnected. Unexpectedly, we find no direct correlation between tagging and the individual motivations of enjoyment and commitment. While commitment is not directly associated with tagging, there is an interaction effect such that the effect of commitment on tagging is positive for users with low-density ego networks and negative when a user is surrounded by a high-density network. Directions for future research as well as implications for theory and practice are discussed.
 
"
d013336af53173a17727560094c12b60bb7a1e20,"{'MAG': '1555064250', 'DBLP': 'conf/icwsm/EhrlichS10', 'DOI': '10.1609/icwsm.v4i1.14020', 'CorpusId': 14036077}",Microblogging Inside and Outside the Workplace,International Conference on Web and Social Media,2010,"{'url': 'https://ojs.aaai.org/index.php/ICWSM/article/download/14020/13869', 'status': 'GOLD', 'license': None, 'disclaimer': 'Notice: Paper or abstract available at https://api.unpaywall.org/v2/10.1609/icwsm.v4i1.14020?email=<INSERT_YOUR_EMAIL> or https://doi.org/10.1609/icwsm.v4i1.14020, which is subject to the license by the author or copyright owner provided with this content. Please go to the source to verify the license and copyright information for your use.'}","[{'authorId': '1717233', 'name': 'Kate Ehrlich'}, {'authorId': '145117064', 'name': 'N. Shami'}]","
 
 Microblogging has recently generated a lot of research interest. Yet very little is known about how corporate employees use microblogging tools. This study examined microblogging in the workplace by conducting a content analysis comparing posts from individuals who were using an internal proprietary tool and Twitter simultaneously. In both settings, posts that provided information or were directed to others were more common than posts on status. Within these categories, it was more frequent to provide information externally than internally but more common to ask questions either through broadcast or directed posts internally than externally. Qualitative interviews explored users’ motivations regarding microblogging behavior. The paper concludes with a discussion of the implications of microblogging for business use.
 
"
d07fda9c7d8162a26f645627c1371e8314eaa2d2,"{'ArXiv': '1009.1555', 'MAG': '2962745292', 'DBLP': 'conf/icwsm/LiuPF10', 'DOI': '10.1609/icwsm.v4i1.14059', 'CorpusId': 8677173}",User Interest and Interaction Structure in Online Forums,International Conference on Web and Social Media,2010,"{'url': 'https://ojs.aaai.org/index.php/ICWSM/article/download/14059/13908', 'status': 'GOLD', 'license': None, 'disclaimer': 'Notice: Paper or abstract available at https://arxiv.org/abs/1009.1555, which is subject to the license by the author or copyright owner provided with this content. Please go to the source to verify the license and copyright information for your use.'}","[{'authorId': '2157571512', 'name': 'Diao Liu'}, {'authorId': '144267687', 'name': 'Daniel Percival'}, {'authorId': '1684961', 'name': 'S. Fienberg'}]","
 
 We present a new similarity measure tailored to posts in an online forum. Our measure takes into account all the available information about user interest and interaction — the content of posts, the threads in the forum, and the author of the posts. We use this post similarity to build a similarity between users, based on principal coordinate analysis. This allows easy visualization of the user activity as well. Similarity between users has numerous applications, such as clustering or classification. We show that including the author of a post in the post similarity has a smoothing effect on principal coordinate projections. We demonstrate our method on real data drawn from an internal corporate forum, and compare our results to those given by a standard document classification method. We conclude our method gives a more detailed picture of both the local and global network structure.
 
"
d32d96a27b4ece34e9769b8b0897f3e54a3a5387,"{'MAG': '1547213408', 'DBLP': 'conf/icwsm/MorrisTP10', 'DOI': '10.1609/icwsm.v4i1.14069', 'CorpusId': 10483382}",A Comparison of Information Seeking Using Search Engines and Social Networks,International Conference on Web and Social Media,2010,"{'url': 'https://ojs.aaai.org/index.php/ICWSM/article/download/14069/13918', 'status': 'GOLD', 'license': None, 'disclaimer': 'Notice: Paper or abstract available at https://api.unpaywall.org/v2/10.1609/icwsm.v4i1.14069?email=<INSERT_YOUR_EMAIL> or https://doi.org/10.1609/icwsm.v4i1.14069, which is subject to the license by the author or copyright owner provided with this content. Please go to the source to verify the license and copyright information for your use.'}","[{'authorId': '144844426', 'name': 'M. Morris'}, {'authorId': '144113253', 'name': 'J. Teevan'}, {'authorId': '1814699', 'name': 'Katrina Panovich'}]","
 
 The Web has become an important information repository; often it is the first source a person turns to with an informa-tion need. One common way to search the Web is with a search engine. However, it is not always easy for people to find what they are looking for with keyword search, and at times the desired information may not be readily available online. An alternative, facilitated by the rise of social media, is to pose a question to one‟s online social network. In this paper, we explore the pros and cons of using a social net-working tool to fill an information need, as compared with a search engine. We describe a study in which 12 participants searched the Web while simultaneously posing a question on the same topic to their social network, and we compare the results they found by each method.
 
"
dd81ffa05581939b4b6b8f4401dc960610d5231c,"{'MAG': '1480526336', 'DBLP': 'conf/icwsm/ShahSU10', 'DOI': '10.1609/icwsm.v4i1.14036', 'CorpusId': 7895083}",Modeling Group Dynamics in Virtual Worlds,International Conference on Web and Social Media,2010,"{'url': 'https://ojs.aaai.org/index.php/ICWSM/article/download/14036/13885', 'status': 'GOLD', 'license': None, 'disclaimer': 'Notice: Paper or abstract available at https://api.unpaywall.org/v2/10.1609/icwsm.v4i1.14036?email=<INSERT_YOUR_EMAIL> or https://doi.org/10.1609/icwsm.v4i1.14036, which is subject to the license by the author or copyright owner provided with this content. Please go to the source to verify the license and copyright information for your use.'}","[{'authorId': '144160735', 'name': 'Fahad Shah'}, {'authorId': '1727071', 'name': 'G. Sukthankar'}, {'authorId': '2073403575', 'name': 'C. Usher'}]","
 
 In this study, we examine human social interactions within virtual worlds and address the question of how group interactions are affected by the game environment. To investigate this problem, we introduced a set of conversational agents into the social environment of Second Life, a massively multi-player online environment that allows users to construct and inhabit their own 3D world. Our agents were created to be sufficiently lifelike to casual observers, so as not to perturb neighboring social interactions. Using our partitioning algorithm, we separated continuous public chat logs from each region into separate conversations which were used to construct a social network of the participants. Unlike many groups formed in communities and workplaces, groups in Second Life can be rapidly-forming (arising from few interactions), persistent (remaining stable over a long period), and are less affected by socio-cultural influences. In this paper, we analyze regional differences in Second Life by measuring characteristics of the network as a whole, determined from the statistics mined from public conversations in the virtual world, rather than focusing on egocentric actors and their attributes.
 
"
e0c54e18cf2372414042bf67eed0272b0a432190,"{'MAG': '253197790', 'DBLP': 'conf/icwsm/2010', 'CorpusId': 34868088}","Proceedings of the Fourth International Conference on Weblogs and Social Media, ICWSM 2010, Washington, DC, USA, May 23-26, 2010",International Conference on Web and Social Media,2010,"{'url': '', 'status': None, 'license': None}","[{'authorId': '50056360', 'name': 'William W. Cohen'}, {'authorId': '2705485', 'name': 'S. Gosling'}]",
e43fcb770528f8b10a6294835f5aca1e4aa94ff9,"{'DBLP': 'conf/icwsm/GiuraGPZ10', 'MAG': '8987881', 'DOI': '10.1609/icwsm.v4i1.14043', 'CorpusId': 2752269}",Socio-Legal Analysis of Criminal Sentences: A Preliminary Study,International Conference on Web and Social Media,2010,"{'url': 'https://ojs.aaai.org/index.php/ICWSM/article/download/14043/13892', 'status': 'GOLD', 'license': None, 'disclaimer': 'Notice: Paper or abstract available at https://api.unpaywall.org/v2/10.1609/icwsm.v4i1.14043?email=<INSERT_YOUR_EMAIL> or https://doi.org/10.1609/icwsm.v4i1.14043, which is subject to the license by the author or copyright owner provided with this content. Please go to the source to verify the license and copyright information for your use.'}","[{'authorId': '1879519', 'name': 'G. Giura'}, {'authorId': '40534125', 'name': 'G. Giuffrida'}, {'authorId': '2081278169', 'name': 'C. Pennisi'}, {'authorId': '3338819', 'name': 'C. Zarba'}]","
 
 This paper discusses a research based on analyzing criminal sentences on criminal trials on organized crime activity in Sicily pronounced from 2000 through 2006. Large criminal sentences related dataset collection activity in Italy is severely constrained for various reasons such as difficulty of data collection at the courthouses, unavailability of data in digital format, and classification criteria used in the public archives. Thus, in general, judicial statistics suffer from lack of reliability and informativeness. The objective of this research is to analyze the text of criminal sentences in a revisable and verifiable way, so that information is extracted on the trial leading to the sentence, the socio-economic environment in which the relevant events occurred, and the differences between the various districts conducting the trials. The purpose is to elaborate a tool of automated analysis of the text of the sentences that is generalizable to other areas of jurisprudence, and, outside of jurisprudence, to other temporal and geographical contexts. The 726 criminal sentences that have been converted into text files have been pronounced at all judicial levels in the four Sicilian districts for mafia-related crimes. This research is relevant because, for the first time in Italy, we aim to empirically describe the juridical response to the phenomenon of organized crime, by using a large and extendable database of criminal sentences that can be analyzed with data mining techniques, rather than deriving general conclusions from a focused small set of sentences.
 
"
eb1293703a8b5285c9023d0cb6dd22d58d7f4c0a,"{'MAG': '2118124930', 'DBLP': 'conf/icwsm/LanaganFOS10', 'DOI': '10.1609/icwsm.v4i1.14040', 'CorpusId': 8724311}",Coping With Noise in a Real-World Weblog Crawler and Retrieval System,International Conference on Web and Social Media,2010,"{'url': 'https://ojs.aaai.org/index.php/ICWSM/article/download/14040/13889', 'status': 'GOLD', 'license': None, 'disclaimer': 'Notice: Paper or abstract available at https://api.unpaywall.org/v2/10.1609/icwsm.v4i1.14040?email=<INSERT_YOUR_EMAIL> or https://doi.org/10.1609/icwsm.v4i1.14040, which is subject to the license by the author or copyright owner provided with this content. Please go to the source to verify the license and copyright information for your use.'}","[{'authorId': '3204209', 'name': 'J. Lanagan'}, {'authorId': '144558956', 'name': 'Paul Ferguson'}, {'authorId': '1401255262', 'name': ""Neil O'Hare""}, {'authorId': '1680223', 'name': 'A. Smeaton'}]","
 
 In this paper we examine the effects of noise when creating a real-world weblog corpus for information retrieval. We focus on the DiffPost (Lee et al. 2008) approach to noise removal from blog pages, examining the difficulties encountered when crawling the blogosphere during the creation of a real-world corpus of blog pages. We introduce and evaluate a number of enhancements to the original DiffPost approach in order to increase the robustness of the algorithm. We then extend DiffPost by looking at the anchor-text to text ratio, and discover that the time-interval between crawls is more important to the successful application of noise-removal algorithms within the blog context, than any additional improvements to the removal algorithm itself.
 
"
ebe915a36981eda4c146a04c372f45c54e33733d,"{'DBLP': 'conf/icwsm/KimGPH10', 'MAG': '1519856792', 'DOI': '10.1609/icwsm.v4i1.14070', 'CorpusId': 17063279}",Ranking Social News Articles Based on Voter Credibility,International Conference on Web and Social Media,2010,"{'url': 'https://ojs.aaai.org/index.php/ICWSM/article/download/14070/13919', 'status': 'GOLD', 'license': None, 'disclaimer': 'Notice: Paper or abstract available at https://api.unpaywall.org/v2/10.1609/icwsm.v4i1.14070?email=<INSERT_YOUR_EMAIL> or https://doi.org/10.1609/icwsm.v4i1.14070, which is subject to the license by the author or copyright owner provided with this content. Please go to the source to verify the license and copyright information for your use.'}","[{'authorId': '2900820', 'name': 'Kanghak Kim'}, {'authorId': '2842997', 'name': 'Geonhyeok Go'}, {'authorId': '2145165068', 'name': 'Hyunwoo Park'}, {'authorId': '49107138', 'name': 'S. S. Han'}]","
 
 Given the wide spread of web-based tools and social news media services which are facilitating grassroots journalism, there is a growing interest in selecting credible news content among a huge number of articles. Currently, most of social news services rely on reader votes to select articles for their front pages. However, the fundamental problem is that users’ votes often stand for popularity rather than credibility. In this paper, we propose a system to address this problem using a weighted voting system. Specifically, we trace thousands of users and their votes, differentiating them depending on how credible the articles voted for are. We then calculate each user’s voting credibility and use it as the user’s voting weight in our system. The results indicate that our method performs better in selecting credible news articles than other methods replying on a “one person, one vote” system. The results suggest feasible solutions to problems in social news media concerning media credibility.
 
"
ed3b8877c457cc330e38b02c18227af2812be78d,"{'MAG': '1511318802', 'DBLP': 'conf/icwsm/BielG10', 'DOI': '10.1609/icwsm.v4i1.14057', 'CorpusId': 8684235}",Voices of Vlogging,International Conference on Web and Social Media,2010,"{'url': 'https://ojs.aaai.org/index.php/ICWSM/article/download/14057/13906', 'status': 'GOLD', 'license': None, 'disclaimer': 'Notice: Paper or abstract available at https://api.unpaywall.org/v2/10.1609/icwsm.v4i1.14057?email=<INSERT_YOUR_EMAIL> or https://doi.org/10.1609/icwsm.v4i1.14057, which is subject to the license by the author or copyright owner provided with this content. Please go to the source to verify the license and copyright information for your use.'}","[{'authorId': '46534662', 'name': 'Joan-Isaac Biel'}, {'authorId': '1403029865', 'name': 'D. Gática-Pérez'}]","
 
 Vlogs have rapidly evolved from the ’chat from your bedroom’ format to a highly creative form of expression and communication. However, despite the high popularity of vlogging, automatic analysis of conversational vlogs have not been attempted in the literature. In this paper, we present a novel analysis of conversational vlogs based on the characterization of vloggers’ nonverbal behavior. We investigate the use of four nonverbal cues extracted automatically from the audio channel to measure the behavior of vloggers and explore the relation to their degree of popularity and that of their videos. Our study is validated on over 2200 videos and 150 hours of data, and shows that one nonverbal cue (speaking time) is correlated with levels of popularity with a medium size effect.
 
"
ee8fa62a303a450349a5b0989801624eeca34f18,"{'DBLP': 'conf/icwsm/YangC10', 'MAG': '1480788117', 'DOI': '10.1609/icwsm.v4i1.14038', 'CorpusId': 10333182}",Comparing Information Diffusion Structure in Weblogs and Microblogs,International Conference on Web and Social Media,2010,"{'url': 'https://ojs.aaai.org/index.php/ICWSM/article/download/14038/13887', 'status': 'GOLD', 'license': None, 'disclaimer': 'Notice: Paper or abstract available at https://api.unpaywall.org/v2/10.1609/icwsm.v4i1.14038?email=<INSERT_YOUR_EMAIL> or https://doi.org/10.1609/icwsm.v4i1.14038, which is subject to the license by the author or copyright owner provided with this content. Please go to the source to verify the license and copyright information for your use.'}","[{'authorId': '2109760059', 'name': 'Jiang Yang'}, {'authorId': '1666505245', 'name': 'Scott Counts'}]","
 
 To better understand and characterize the emerging social medium of microblogging we conducted a comparison between Twitter and a weblog network for their respective information diffusion structures. We found systematic differences between the two social media in their contribution, navigation, and interactive structural patterns. Findings revealed the unique role and characteristics of microblogs in the social media design space. Implications are discussed.
 
"
f0d02767bdf5e5076f8b4026de3686d0d6a3f671,"{'MAG': '67595626', 'DBLP': 'conf/icwsm/LetiercePBD10', 'DOI': '10.1609/icwsm.v4i1.14072', 'CorpusId': 32878309}",Using Twitter During an Academic Conference: The #iswc2009 Use-Case,International Conference on Web and Social Media,2010,"{'url': 'https://ojs.aaai.org/index.php/ICWSM/article/download/14072/13921', 'status': 'GOLD', 'license': None, 'disclaimer': 'Notice: Paper or abstract available at https://api.unpaywall.org/v2/10.1609/icwsm.v4i1.14072?email=<INSERT_YOUR_EMAIL> or https://doi.org/10.1609/icwsm.v4i1.14072, which is subject to the license by the author or copyright owner provided with this content. Please go to the source to verify the license and copyright information for your use.'}","[{'authorId': '2494418', 'name': 'Julie Letierce'}, {'authorId': '1733056', 'name': 'Alexandre Passant'}, {'authorId': '1707342', 'name': 'J. Breslin'}, {'authorId': '1685642', 'name': 'S. Decker'}]","
 
 We recently addressed a survey to Semantic Web researchers, in which Twitter was ranked in the top three services used in order to spread information and reach peer researchers, students, as well as a broader audience. In order to figure out how Twitter is really used by this community, we conducted an analysis of the Twitter feed of the recent 8th International Semantic Web Conference (#iswc2009).
 
"
f7b1f98c367d854e99c090c960c03449bc8bca9d,"{'MAG': '2110772811', 'DBLP': 'conf/icwsm/FlanaginM10', 'DOI': '10.1609/icwsm.v4i1.14034', 'CorpusId': 17945629}",The Perceived Credibility of Online Encyclopedias Among Children,International Conference on Web and Social Media,2010,"{'url': 'https://ojs.aaai.org/index.php/ICWSM/article/download/14034/13883', 'status': 'GOLD', 'license': None, 'disclaimer': 'Notice: Paper or abstract available at https://api.unpaywall.org/v2/10.1609/icwsm.v4i1.14034?email=<INSERT_YOUR_EMAIL> or https://doi.org/10.1609/icwsm.v4i1.14034, which is subject to the license by the author or copyright owner provided with this content. Please go to the source to verify the license and copyright information for your use.'}","[{'authorId': '2691789', 'name': 'Andrew J. Flanagin'}, {'authorId': '1976593', 'name': 'Miriam J. Metzger'}]","
 
 This study examined young people’s trust of Wikipedia as an information resource. A large-scale probability-based survey with embedded quasi-experiments was conducted with 2,747 children in the U.S. ranging from 11 to 18 years old. Results show that young people find Wikipedia to be fairly credible, but also exhibit an awareness of potential problems with non-expert, user-generated content in anonymous environments. Children tend to evaluate the credibility of online encyclopedia information with this in mind, at times with what appears to be an unwarranted devaluation of this information.
 
"
