paperId,externalIds,title,venue,year,openAccessPdf,authors,abstract
5bde7726806b7418b0531f9152a3e920990f49d3,"{'DBLP': 'conf/icwsm/ShammaKC10', 'MAG': '1513341017', 'DOI': '10.1609/icwsm.v4i1.14065', 'CorpusId': 13390993}",Conversational Shadows: Describing Live Media Events Using Short Messages,International Conference on Web and Social Media,2010,"{'url': 'https://ojs.aaai.org/index.php/ICWSM/article/download/14065/13914', 'status': 'GOLD', 'license': None, 'disclaimer': 'Notice: Paper or abstract available at https://api.unpaywall.org/v2/10.1609/icwsm.v4i1.14065?email=<INSERT_YOUR_EMAIL> or https://doi.org/10.1609/icwsm.v4i1.14065, which is subject to the license by the author or copyright owner provided with this content. Please go to the source to verify the license and copyright information for your use.'}","[{'authorId': '1760364', 'name': 'David A. Shamma'}, {'authorId': '144557123', 'name': 'Lyndon S. Kennedy'}, {'authorId': '1801572', 'name': 'E. Churchill'}]","
 
 Microblogging concurrently with live media events is becoming commonplace. The resulting comment stream represents a parallel, social conversational reflection on the event. Although not formally `attached' to the actual event stream itself, we demonstrate it is possible to establish a relationship between the two streams by mapping their structural properties. In this article, we examine: How do people produce and consume real-time commentary? And how does the structure of commentary and conversation change in response to moments of interest? Using a dataset of 53,712 Twitter posts, or tweets, sampled during the inauguration of Barack Obama in January 2009, we develop methods for exploring these questions. We find that short message activity reflects the structure and content of this media event. Specifically, messages directed at large audiences can serve as broadcast announcements, while variations in the level of conversation can reflect levels of interest in the media event itself. Finally, we present some implications for the design of future tools for a variety of users ranging from consumers to journalists.
 
"
620772a8eac7f0faba58e57f01d66699d63b2c9e,"{'MAG': '2951097239', 'DBLP': 'conf/icwsm/LeskovecHK10', 'ArXiv': '1004.3547', 'DOI': '10.1609/icwsm.v4i1.14013', 'CorpusId': 3110066}",Governance in Social Media: A Case Study of the Wikipedia Promotion Process,International Conference on Web and Social Media,2010,"{'url': 'https://ojs.aaai.org/index.php/ICWSM/article/download/14013/13862', 'status': 'GOLD', 'license': None, 'disclaimer': 'Notice: Paper or abstract available at https://arxiv.org/abs/1004.3547, which is subject to the license by the author or copyright owner provided with this content. Please go to the source to verify the license and copyright information for your use.'}","[{'authorId': '1702139', 'name': 'J. Leskovec'}, {'authorId': '1713089', 'name': 'D. Huttenlocher'}, {'authorId': '3371403', 'name': 'J. Kleinberg'}]","
 
 Social media sites are often guided by a core group of committed users engaged in various forms of {governance. A crucial aspect of this type of governance is deliberation, in which such a group reaches decisions on issues of importance to the site. Despite its crucial — though subtle — role in how a number of prominent social media sites function, there has been relatively little investigation of the deliberative aspects of social media governance. Here we explore this issue, investigating a particular deliberative process that is extensive, public, and recorded: the promotion of Wikipedia admins, which is determined by elections that engage committed members of the Wikipedia community. We find that the group decision-making at the heart of this process exhibits several fundamental forms of relative assessment. First we observe that the chance that a voter will support a candidate is strongly dependent on the relationship between characteristics of the voter and the candidate. Second we investigate how both individual voter decisions and overall election outcomes can be based on models that take into account the sequential, public nature of the voting.
 
"
623d391736ec809e82e441b148740be688168743,"{'MAG': '1532871584', 'DBLP': 'conf/icwsm/RangwalaJ10', 'DOI': '10.1609/icwsm.v4i1.14035', 'CorpusId': 46303683}",Co-Participation Networks Using Comment Information,International Conference on Web and Social Media,2010,"{'url': 'https://ojs.aaai.org/index.php/ICWSM/article/download/14035/13884', 'status': 'GOLD', 'license': None, 'disclaimer': 'Notice: Paper or abstract available at https://api.unpaywall.org/v2/10.1609/icwsm.v4i1.14035?email=<INSERT_YOUR_EMAIL> or https://doi.org/10.1609/icwsm.v4i1.14035, which is subject to the license by the author or copyright owner provided with this content. Please go to the source to verify the license and copyright information for your use.'}","[{'authorId': '145344187', 'name': 'H. Rangwala'}, {'authorId': '34776899', 'name': 'Salman Jamali'}]","
 
 Using comment information available from Digg we define a co-participation network between users. We focus on the analysis of this implicit network, and study the behavioral characteristics of users. We use the comment data and social network derived features to predict the popularity of online content linked at Digg using a classification and regression framework. We also compare network properties of our co-participation network to a previously defined reply-answer network on news forums.
 
"
63b2e7906c620c7f62709bd3a5bd6ab97d299a93,"{'MAG': '2612785542', 'DBLP': 'conf/icwsm/TreemT10', 'DOI': '10.1609/icwsm.v4i1.14076', 'CorpusId': 34458886}","What Makes a Blog a Blog? Exploring User Conceptualizations of an Old ""New"" Online Medium",International Conference on Web and Social Media,2010,"{'url': 'https://ojs.aaai.org/index.php/ICWSM/article/download/14076/13925', 'status': 'GOLD', 'license': None, 'disclaimer': 'Notice: Paper or abstract available at https://api.unpaywall.org/v2/10.1609/icwsm.v4i1.14076?email=<INSERT_YOUR_EMAIL> or https://doi.org/10.1609/icwsm.v4i1.14076, which is subject to the license by the author or copyright owner provided with this content. Please go to the source to verify the license and copyright information for your use.'}","[{'authorId': '2054189', 'name': 'J. Treem'}, {'authorId': '32185260', 'name': 'K. Y. Thomas'}]","
 
 What is a blog? While this may seem like a basic question, it is the subject of dispute among researchers, and hardly settled among users of the medium. We return to this fundamental inquiry by asking 89 blog-reading college students how they conceptualize the term and what purpose blogs serve for them. Our findings suggest that perceptions of blogs are varied and ambiguous, and definitions largely fail to distinguish blogs from other online media. We discuss what this means for the study of blogs and other “new” media and argue that more constructionist approaches are necessary to develop ecologically valid theories of media perceptions and use.
 
"
64de173f2fca73bf59d46f9b1d8778f27bf73dba,"{'DBLP': 'conf/icwsm/NodaKN10', 'MAG': '16358254', 'DOI': '10.1609/icwsm.v4i1.14077', 'CorpusId': 30968133}",Discovering Serendipitous Information from Wikipedia by Using Its Network Structure,International Conference on Web and Social Media,2010,"{'url': 'https://ojs.aaai.org/index.php/ICWSM/article/download/14077/13926', 'status': 'GOLD', 'license': None, 'disclaimer': 'Notice: Paper or abstract available at https://api.unpaywall.org/v2/10.1609/icwsm.v4i1.14077?email=<INSERT_YOUR_EMAIL> or https://doi.org/10.1609/icwsm.v4i1.14077, which is subject to the license by the author or copyright owner provided with this content. Please go to the source to verify the license and copyright information for your use.'}","[{'authorId': '2077247781', 'name': 'Yohei Noda'}, {'authorId': '2082937', 'name': 'Yoji Kiyota'}, {'authorId': '153510134', 'name': 'H. Nakagawa'}]","
 
 Many researchers conducted studies on extracting relevant information from web documents. However, there are few studies on extracting serendipitous information. We propose methods to discover unexpected information from Wikipedia by using its network structure, for example, the distance between two categories. We evaluated two methods: a classification-based method using support vector machines (SVMs), and a ranking-based method using regression. We demonstrate advantages of regression over classification.
 
"
672ab8f1b8d41780dc00a98585a41a1b91c2bdca,"{'MAG': '1495447650', 'DBLP': 'conf/icwsm/SakakiM10', 'DOI': '10.1609/icwsm.v4i1.14064', 'CorpusId': 6304121}",How to Become Famous in the Microblog World,International Conference on Web and Social Media,2010,"{'url': 'https://ojs.aaai.org/index.php/ICWSM/article/download/14064/13913', 'status': 'GOLD', 'license': None, 'disclaimer': 'Notice: Paper or abstract available at https://api.unpaywall.org/v2/10.1609/icwsm.v4i1.14064?email=<INSERT_YOUR_EMAIL> or https://doi.org/10.1609/icwsm.v4i1.14064, which is subject to the license by the author or copyright owner provided with this content. Please go to the source to verify the license and copyright information for your use.'}","[{'authorId': '3091472', 'name': 'Takeshi Sakaki'}, {'authorId': '49484314', 'name': 'Y. Matsuo'}]","
 
 Microblogging services are a social media platform in which users post their current states as a short text, similar to instant messaging (IM). Recently, microblogging services, including Twitter, have become extremely popular. Concomitantly with the growth of Twitter, several companies have begun to use Twitter as business tools. Some companies have succeeded in increasing sales. However, most companies are troubled at how to use Twitter and how to win popularity in the Twitter milieu. As described herein, we analyze how the number of followers changes in a certain period and determine which parameters dominate popularity in the Twitter world. We also classify Twitter users into groups based on social tagging and propose methods to become popular when using microblogging services.
 
"
6c2261badbfb4d83239e73c523daa363e87c0dec,"{'DBLP': 'conf/icwsm/AhnGDM10', 'MAG': '2140630207', 'DOI': '10.1609/icwsm.v4i1.14060', 'CorpusId': 11569812}","""How Incredibly Awesome!"" - Click Here to Read More",International Conference on Web and Social Media,2010,"{'url': 'https://ojs.aaai.org/index.php/ICWSM/article/download/14060/13909', 'status': 'GOLD', 'license': None, 'disclaimer': 'Notice: Paper or abstract available at https://api.unpaywall.org/v2/10.1609/icwsm.v4i1.14060?email=<INSERT_YOUR_EMAIL> or https://doi.org/10.1609/icwsm.v4i1.14060, which is subject to the license by the author or copyright owner provided with this content. Please go to the source to verify the license and copyright information for your use.'}","[{'authorId': '2259303', 'name': 'Hyung-il Ahn'}, {'authorId': '143774641', 'name': 'Werner Geyer'}, {'authorId': '2391727', 'name': 'Casey Dugan'}, {'authorId': '2673368', 'name': 'D. Millen'}]","
 
 We investigate the impact of a discussion snippet's overall sentiment on a user's willingness to read more of a discussion. Using sentiment analysis, we constructed positive, neutral, and negative discussion snippets using the discussion topic and a sample comment from discussions taking place around content on an enterprise social networking site. We computed personalized snippet recommendations for a subset of users and conducted a survey to test how these recommendations were perceived. Our experimental results show that snippets with high sentiments are better discussion ""teasers.""
 
"
802965bc69694a0c709acb5a98951a76f0880316,"{'DBLP': 'conf/icwsm/HsuCC10', 'MAG': '1562688011', 'DOI': '10.1609/icwsm.v4i1.14049', 'CorpusId': 14781628}",Temporal Correlation between Social Tags and Emerging Long-Term Trend Detection,International Conference on Web and Social Media,2010,"{'url': 'https://ojs.aaai.org/index.php/ICWSM/article/download/14049/13898', 'status': 'GOLD', 'license': None, 'disclaimer': 'Notice: Paper or abstract available at https://api.unpaywall.org/v2/10.1609/icwsm.v4i1.14049?email=<INSERT_YOUR_EMAIL> or https://doi.org/10.1609/icwsm.v4i1.14049, which is subject to the license by the author or copyright owner provided with this content. Please go to the source to verify the license and copyright information for your use.'}","[{'authorId': '2058152263', 'name': 'Ming-Hung Hsu'}, {'authorId': '41070719', 'name': 'Yu-Hui Chang'}, {'authorId': '153924342', 'name': 'Hsin-Hsi Chen'}]","
 
 Social annotation has become a popular manner for web users to manage and share their information and interests. While users' interests vary with time, tag correlation also changes from users' perspectives. In this work, we explore four methods for estimating temporal correlation between social tags and detect if a long-term trend emerges from the history of temporal correlation between two tags. Three types of trends are specified: steadily-shifting, stabilizing, and cyclic. To compare the results of the four estimation methods, an indirect evaluation is realized by applying detected trends to tag recommendation.
 
"
80b8743f1a56964adb8a1fc5a18d40da08335094,"{'DBLP': 'conf/icwsm/FisherC10', 'MAG': '1522166108', 'DOI': '10.1609/icwsm.v4i1.14014', 'CorpusId': 14290851}",Your Brain on Facebook: Neuropsychological Associations with Social Versus other Media,International Conference on Web and Social Media,2010,"{'url': 'https://ojs.aaai.org/index.php/ICWSM/article/download/14014/13863', 'status': 'GOLD', 'license': None, 'disclaimer': 'Notice: Paper or abstract available at https://api.unpaywall.org/v2/10.1609/icwsm.v4i1.14014?email=<INSERT_YOUR_EMAIL> or https://doi.org/10.1609/icwsm.v4i1.14014, which is subject to the license by the author or copyright owner provided with this content. Please go to the source to verify the license and copyright information for your use.'}","[{'authorId': '3061671', 'name': 'Kristie J. Fisher'}, {'authorId': '1666505245', 'name': 'Scott Counts'}]","
 
 We measured individuals’ mental associations between four types of media (books, television, social/Facebook, and general informational web pages) and relevant concepts (Addictive, Story, Interesting, Frivolous, Personal, and Useful) using three different measurements: a Likert scale questionnaire, a speeded Yes/No judgment task, and electrical brain activity. The three measures were designed to capture associations at different levels of mental processing, from very automatic (electrical brain activity) to conscious and reasoned (questionnaire). At more conscious levels of cognitive processing, Facebook was seen as interesting, addictive, and highly personal. Results for the electrical brain activity measure show that Facebook tells less of a story and, surprisingly, is less personal than other forms of media. We discuss differences in results across the three measures and how our findings can inform the design of future social media systems.
 
"
87512988cfb1a2f811cff33a927496a5ca536787,"{'MAG': '1518807168', 'DBLP': 'conf/icwsm/BarashDIB10', 'DOI': '10.1609/icwsm.v4i1.14037', 'CorpusId': 8309855}",Faceplant: Impression (Mis)management in Facebook Status Updates,International Conference on Web and Social Media,2010,"{'url': 'https://ojs.aaai.org/index.php/ICWSM/article/download/14037/13886', 'status': 'GOLD', 'license': None, 'disclaimer': 'Notice: Paper or abstract available at https://api.unpaywall.org/v2/10.1609/icwsm.v4i1.14037?email=<INSERT_YOUR_EMAIL> or https://doi.org/10.1609/icwsm.v4i1.14037, which is subject to the license by the author or copyright owner provided with this content. Please go to the source to verify the license and copyright information for your use.'}","[{'authorId': '40365869', 'name': 'Vladimir Barash'}, {'authorId': '1697237', 'name': 'Nicolas Ducheneaut'}, {'authorId': '1731031', 'name': 'E. Isaacs'}, {'authorId': '1690707', 'name': 'V. Bellotti'}]","
 
 While recent research examined the impressions projected by users of Social Network Sites through their relatively static online profiles, the addition of status updates to Facebook offers the opportunity to study a more fluid type of impression management. In this paper, we take a first look at data collected with a custom application designed to capture the impressions both “given” and “given off” by a user’s status updates. We show that while users generally succeed at presenting a positive image of themselves, they are only partially aware of how they are coming across and tend to underestimate the strength of the impressions they foster. This is particularly prevalent in the case of self-importance, giving credence to the notion that projecting an inflated sense of self can be a risk in a world where impressions are formed based on “micro updates.”
 
"
88f113b902cc1e14e569e62438d96e1dc9db309b,"{'MAG': '1603392039', 'DBLP': 'conf/icwsm/StoicaCB10', 'DOI': '10.1609/icwsm.v4i1.14012', 'CorpusId': 18303084}",To Be a Star Is Not Only Metaphoric: From Popularity to Social Linkage,International Conference on Web and Social Media,2010,"{'url': 'https://ojs.aaai.org/index.php/ICWSM/article/download/14012/13861', 'status': 'GOLD', 'license': None, 'disclaimer': 'Notice: Paper or abstract available at https://api.unpaywall.org/v2/10.1609/icwsm.v4i1.14012?email=<INSERT_YOUR_EMAIL> or https://doi.org/10.1609/icwsm.v4i1.14012, which is subject to the license by the author or copyright owner provided with this content. Please go to the source to verify the license and copyright information for your use.'}","[{'authorId': '153903623', 'name': 'Alina Stoica'}, {'authorId': '2987228', 'name': 'T. Couronné'}, {'authorId': '2071801176', 'name': 'Jean-Samuel Beuscart'}]","
 
 The emergence of online platforms allowing to mix self publishing activities and social networking offers new possibilities for building online reputation and visibility. In this paper we present a method to analyze the online popularity that takes into consideration both the success of the published content and the social network topology. First, we adapt the Kohonen self organizing maps in order to cluster the users of online platforms depending on their audience and authority characteristics. Then, we perform a detailed analysis of the manner nodes are organized in the social network. Finally, we study the relationship between the network local structure around each node and the corresponding user’s popularity. We apply this method to the MySpace music social network. We observe that the most popular artists are centers of star shaped social structures and that it exists a fraction of artists who are involved in community and social activity dynamics independently of their popularity. This method based on a learning algorithm and on network analysis appears to be a robust and intuitive technique for a rich description of the online behavior.
 
"
893dfc0ea7938242535eed29bc45587f06b1d81d,"{'MAG': '2113135969', 'DBLP': 'conf/icwsm/NagarajanPS10', 'DOI': '10.1609/icwsm.v4i1.14051', 'CorpusId': 8168192}",A Qualitative Examination of Topical Tweet and Retweet Practices,International Conference on Web and Social Media,2010,"{'url': 'https://ojs.aaai.org/index.php/ICWSM/article/download/14051/13900', 'status': 'GOLD', 'license': None, 'disclaimer': 'Notice: Paper or abstract available at https://api.unpaywall.org/v2/10.1609/icwsm.v4i1.14051?email=<INSERT_YOUR_EMAIL> or https://doi.org/10.1609/icwsm.v4i1.14051, which is subject to the license by the author or copyright owner provided with this content. Please go to the source to verify the license and copyright information for your use.'}","[{'authorId': '144318808', 'name': 'Meena Nagarajan'}, {'authorId': '7147418', 'name': 'Hemant Purohit'}, {'authorId': '144463965', 'name': 'A. Sheth'}]","
 
 This work contributes to the study of retweet behavior on Twitter surrounding real-world events. We analyze over a million tweets pertaining to three events, present general tweet properties in such topical datasets and qualitatively analyze the properties of the retweet behavior surrounding the most tweeted/viral content pieces. Findings include a clear relationship between sparse/dense retweet patterns and the content and type of a tweet itself; suggesting the need to study content properties in link-based diffusion models.
 
"
8db98b8f29c68bbe5394e2fb69dfee25e0c00536,"{'DBLP': 'journals/corr/HillMO15', 'MAG': '1576168000', 'ArXiv': '1507.01284', 'DOI': '10.1609/icwsm.v4i1.14028', 'CorpusId': 545818}",Responses to Remixing on a Social Media Sharing Website,International Conference on Web and Social Media,2010,"{'url': 'https://ojs.aaai.org/index.php/ICWSM/article/download/14028/13877', 'status': 'GOLD', 'license': None, 'disclaimer': 'Notice: Paper or abstract available at https://arxiv.org/abs/1507.01284, which is subject to the license by the author or copyright owner provided with this content. Please go to the source to verify the license and copyright information for your use.'}","[{'authorId': '37264444', 'name': 'Benjamin Mako Hill'}, {'authorId': '1403171029', 'name': 'A. Monroy-Hernández'}, {'authorId': '40311829', 'name': 'K. Olson'}]","
 
 In this paper we describe the ways participants of the Scratch online community, primarily young people, engage in remixing of each others' shared animations, games, and interactive projects. In particular, we try to answer the following questions: How do users respond to remixing in a social media environment where remixing is explicitly permitted? What qualities of originators and their projects correspond to a higher likelihood of plagiarism accusations? Is there a connection between plagiarism complaints and similarities between a remix and the work it is based on? Our findings indicate that users have a very wide range of reactions to remixing and that as many users react positively as accuse remixers of plagiarism. We test several hypotheses that might explain the high number of plagiarism accusations related to original project complexity, cumulative remixing, originators' integration into remixing practice, and remixee-remixer project similarity, and find support for the first and last explanations.
 
"
8eb1d3d571163783fa9c67fccefb6a98c408e428,"{'MAG': '49973572', 'DBLP': 'conf/icwsm/ChoudhuryLSCXK10', 'DOI': '10.1609/icwsm.v4i1.14024', 'CorpusId': 17335609}",How Does the Data Sampling Strategy Impact the Discovery of Information Diffusion in Social Media?,International Conference on Web and Social Media,2010,"{'url': 'https://ojs.aaai.org/index.php/ICWSM/article/download/14024/13873', 'status': 'GOLD', 'license': None, 'disclaimer': 'Notice: Paper or abstract available at https://api.unpaywall.org/v2/10.1609/icwsm.v4i1.14024?email=<INSERT_YOUR_EMAIL> or https://doi.org/10.1609/icwsm.v4i1.14024, which is subject to the license by the author or copyright owner provided with this content. Please go to the source to verify the license and copyright information for your use.'}","[{'authorId': '2583473', 'name': 'M. D. Choudhury'}, {'authorId': '34821764', 'name': 'Y. Lin'}, {'authorId': '145372008', 'name': 'Hari Sundaram'}, {'authorId': '1720972', 'name': 'K. Candan'}, {'authorId': '33650938', 'name': 'Lexing Xie'}, {'authorId': '1820838', 'name': 'A. Kelliher'}]","
 
 Platforms such as Twitter have provided researchers with ample opportunities to analytically study social phenomena. There are however, significant computational challenges due to the enormous rate of production of new information: researchers are therefore, often forced to analyze a judiciously selected “sample” of the data. Like other social media phenomena, information diffusion is a social process–it is affected by user context, and topic, in addition to the graph topology. This paper studies the impact of different attribute and topology based sampling strategies on the discovery of an important social media phenomena–information diffusion.We examine several widely-adopted sampling methods that select nodes based on attribute (random, location, and activity) and topology (forest fire) as well as study the impact of attribute based seed selection on topology based sampling. Then we develop a series of metrics for evaluating the quality of the sample, based on user activity (e.g. volume, number of seeds), topological (e.g. reach, spread) and temporal characteristics (e.g. rate). We additionally correlate the diffusion volume metric with two external variables–search and news trends. Our experiments reveal that for small sample sizes (30%), a sample that incorporates both topology and user context (e.g. location, activity) can improve on naive methods by a significant margin of ~15-20%.
 
"
