paperId,externalIds,title,venue,year,openAccessPdf,authors,abstract
a7cecd117c91fdb1dc361097160039520b6b18ac,"{'DBLP': 'conf/icwsm/ChoiSY24', 'DOI': '10.1609/icwsm.v18i1.31451', 'CorpusId': 270188123}",Scientific Appearance in Telegram,International Conference on Web and Social Media,2024,"{'url': 'https://ojs.aaai.org/index.php/ICWSM/article/download/31451/33611', 'status': 'GOLD', 'license': None, 'disclaimer': 'Notice: Paper or abstract available at https://api.unpaywall.org/v2/10.1609/icwsm.v18i1.31451?email=<INSERT_YOUR_EMAIL> or https://doi.org/10.1609/icwsm.v18i1.31451, which is subject to the license by the author or copyright owner provided with this content. Please go to the source to verify the license and copyright information for your use.'}","[{'authorId': '2237743677', 'name': 'Jeong-Eun Choi'}, {'authorId': '2237628021', 'name': 'Karla Schäfer'}, {'authorId': '2181832', 'name': 'York Yannikos'}]","This paper examines the influence of scientific appearance (SA) on post dissemination and analyses a dataset of important actors in Germany, specifically those involved in the dissemination of disinformation on the social media platform Telegram. SA is identified through textual elements such as predefined keywords or digital object identifiers (DOIs). Characteristics and behaviours of actors with and without SA are compared using metadata such as forward counts and original posts. The additional content analysis provides insights into SA's usage and impact. The findings indicate that SA may influence the dissemination of posts and demonstrate how different methods can be applied for studying social media platforms."
a7e86de90c5fcc9ed513c1cf47d33995e232c290,"{'DBLP': 'conf/icwsm/UmarovaOLSXZOLL24', 'DOI': '10.1609/icwsm.v18i1.31406', 'CorpusId': 270185322}",Xenophobia Meter: Defining and Measuring Online Sentiment toward Foreigners on Twitter,International Conference on Web and Social Media,2024,"{'url': 'https://ojs.aaai.org/index.php/ICWSM/article/download/31406/33566', 'status': 'GOLD', 'license': None, 'disclaimer': 'Notice: Paper or abstract available at https://api.unpaywall.org/v2/10.1609/icwsm.v18i1.31406?email=<INSERT_YOUR_EMAIL> or https://doi.org/10.1609/icwsm.v18i1.31406, which is subject to the license by the author or copyright owner provided with this content. Please go to the source to verify the license and copyright information for your use.'}","[{'authorId': '2304239910', 'name': 'Khonzoda Umarova'}, {'authorId': '2304235727', 'name': 'Oluchi Okorafor'}, {'authorId': '2386565818', 'name': 'Pinxian Lu'}, {'authorId': '2304190586', 'name': 'S. Shan'}, {'authorId': '2353971609', 'name': 'Alex Xu'}, {'authorId': '2316493113', 'name': 'Ray Zhou'}, {'authorId': '2304239005', 'name': 'Jennifer Otiono'}, {'authorId': '2270311623', 'name': 'Beth Lyon'}, {'authorId': '3031161', 'name': 'Gilly Leshed'}]","Xenophobia, a form of hatred directed at foreigners, immigrants, and sometimes even people who are just perceived as foreigners, has been flooding social media in recent political climates. In order to capture language related to foreigners and those perceived-as-foreigners (F&PAF) we present the 7-scale Xenophobia Meter, ranging from anti– to pro- F&PAF sentiments with examples and application rationale. We also publish a dataset of over 7,000 tweets labeled according to this meter, from 11 U.S.-based accounts that are on the forefront of defining the rhetoric related to immigration and policy. We apply a number of models to automatically identify xenophobic and F&PAF-related language. We also present findings from qualitative interviews with human annotators about their labeling experiences. While we find xenophobia is a complex social phenomenon to identify by both humans and machine learning algorithms, we hope that our work inspires researchers, policymakers, and the public to learn about xenophobia and to make efforts to shift the rhetoric and policies toward allyship, equity and inclusion."
a8da40079ee111aa9757bb1d8ee3fca62f98e382,"{'DBLP': 'conf/icwsm/VitiuginP24', 'DOI': '10.1609/icwsm.v18i1.31410', 'CorpusId': 270174415}",Multilingual Serviceability Model for Detecting and Ranking Help Requests on Social Media during Disasters,International Conference on Web and Social Media,2024,"{'url': 'https://ojs.aaai.org/index.php/ICWSM/article/download/31410/33570', 'status': 'GOLD', 'license': None, 'disclaimer': 'Notice: Paper or abstract available at https://api.unpaywall.org/v2/10.1609/icwsm.v18i1.31410?email=<INSERT_YOUR_EMAIL> or https://doi.org/10.1609/icwsm.v18i1.31410, which is subject to the license by the author or copyright owner provided with this content. Please go to the source to verify the license and copyright information for your use.'}","[{'authorId': '1516914336', 'name': 'Fedor Vitiugin'}, {'authorId': '7147418', 'name': 'Hemant Purohit'}]","Social media users expect quick and high-quality responses from emergency services when seeking help. However, these organizations face difficulties in detecting and prioritizing critical requests due to the overwhelming amount of information on social media and their limited human resources to tackle it during mass emergencies or disaster events. The situation is exacerbated when users communicate in different or native languages, which can be expected during disasters. While recent studies have focused on characterizing and automatically detecting help requests on social media, they focused on non-behavioral features and monolingual data, primarily in English. Thus, a key gap exists in analyzing multilingual requests on social media for public services. 
In this paper, we introduce a knowledge distillation framework called MulTMR (Multiple Teachers Model for detecting and Ranking), which combines the power of both task-related and behavior-guided models as diverse teachers for training a student model to efficiently detect serviceable request messages across languages and regions on social media during natural disaster events. We demonstrate that the presented framework can enhance performance (with an AUC improvement of up to 10%) in various scenarios of multilingual test data. Our results, which were validated on real-world data collected in three languages during ten disasters across seven countries, indicate the use of behavior-guided teacher models in MulTMR can increase attention to relevant indicators of serviceability characteristics. The application of the MulTMR framework through a streaming data analytics tool could reduce the cognitive load on personnel within social media teams of emergency services. Further, its application could inform how to leverage human behavior characteristics in creating automated models for social media analytics to design systems in other public service domains beyond emergency management."
aaa2cfb5930045d1fb6e584be5cd317f943655f0,"{'DBLP': 'journals/corr/abs-2404-01329', 'ArXiv': '2404.01329', 'DOI': '10.48550/arXiv.2404.01329', 'CorpusId': 268856505}",Unraveling the Dynamics of Television Debates and Social Media Engagement: Insights from an Indian News Show,International Conference on Web and Social Media,2024,"{'url': '', 'status': None, 'license': None, 'disclaimer': 'Notice: Paper or abstract available at https://arxiv.org/abs/2404.01329, which is subject to the license by the author or copyright owner provided with this content. Please go to the source to verify the license and copyright information for your use.'}","[{'authorId': '2319576409', 'name': 'Kiran Garimella'}, {'authorId': '2294562935', 'name': 'Abhilash Datta'}]","The relationship between television shows and social media has become increasingly intertwined in recent years. Social media platforms, particularly Twitter, have emerged as significant sources of public opinion and discourse on topics discussed in television shows. In India, news debates leverage the popularity of social media to promote hashtags and engage users in discussions and debates on a daily basis.

This paper focuses on the analysis of one of India's most prominent and widely-watched TV news debate shows: 'Arnab Goswami -- The Debate'. The study examines the content of the show by analyzing the hashtags used to promote it and the social media data corresponding to these hashtags. The goal is to understand the composition of the audience engaged in social media discussions related to the show.
The findings reveal that the show exhibits a strong bias towards the ruling Bharatiya Janata Party (BJP), with over 60% of the debates featuring either pro-BJP or anti-opposition content. Social media support for the show primarily comes from BJP supporters. Notably, BJP leaders and influencers play a significant role in promoting the show on social media, leveraging their existing networks and resources to artificially trend specific hashtags.
Furthermore, the study uncovers a reciprocal flow of information between the TV show and social media. We find evidence that the show's choice of topics is linked to social media posts made by party workers, suggesting a dynamic interplay between traditional media and online platforms.

By exploring the complex interaction between television debates and social media support, this study contributes to a deeper understanding of the evolving relationship between these two domains in the digital age. The findings hold implications for media researchers and practitioners, offering insights into the ways in which social media can influence traditional media and vice versa."
ad81cdbf931c88b98c2d16d288cbef017c0fde49,"{'ArXiv': '2406.15809', 'DOI': '10.1609/icwsm.v20i1.42651', 'CorpusId': 270702549}",LaMSUM: Amplifying Voices Against Harassment Through LLM Guided Extractive Summarization of User Incident Reports,Proceedings of the International AAAI Conference on Web and Social Media,2024,"{'url': 'https://doi.org/10.1609/icwsm.v20i1.42651', 'status': 'GOLD', 'license': None, 'disclaimer': 'Notice: Paper or abstract available at https://arxiv.org/abs/2406.15809, which is subject to the license by the author or copyright owner provided with this content. Please go to the source to verify the license and copyright information for your use.'}","[{'authorId': '2176922612', 'name': 'Garima Chhikara'}, {'authorId': '2273779477', 'name': 'Anurag Sharma'}, {'authorId': '102704485', 'name': 'V. Gurucharan'}, {'authorId': '2273712492', 'name': 'Kripabandhu Ghosh'}, {'authorId': '2287929592', 'name': 'Abhijnan Chakraborty'}]","Citizen reporting platforms help the public and authorities stay informed about sexual harassment incidents. However, the high volume of data shared on these platforms makes reviewing each individual case challenging. Therefore, a summarization algorithm capable of processing and understanding various code-mixed languages is essential. In recent years, Large Language Models (LLMs) have shown exceptional performance in NLP tasks, including summarization. LLMs inherently produce abstractive summaries by paraphrasing the original text, while the generation of extractive summaries – selecting specific subsets from the original text – through LLMs remains largely unexplored. Moreover, LLMs have a limited context window size, restricting the amount of data that can be processed at once. We tackle these challenges by introducing LaMSUM, a novel multi-level framework combining summarization with different voting methods to generate extractive summaries for large collections of incident reports using LLMs. Extensive evaluation using four popular LLMs (Llama, Mistral, Claude and GPT-4o) demonstrates that LaMSUM outperforms state-of-the-art extractive summarization methods. Overall, this work represents one of the first attempts to achieve extractive summarization through LLMs, and is likely to support stakeholders by offering a comprehensive overview and enabling them to develop effective policies to minimize incidents of unwarranted harassment."
b30d9fbfb4acbbe5943fbd974d29f9d81e4f71ff,"{'DBLP': 'conf/icwsm/Yang0F24', 'DOI': '10.1609/icwsm.v18i1.31419', 'CorpusId': 270186248}",TeC: A Novel Method for Text Clustering with Large Language Models Guidance and Weakly-Supervised Contrastive Learning,International Conference on Web and Social Media,2024,"{'url': 'https://ojs.aaai.org/index.php/ICWSM/article/download/31419/33579', 'status': 'GOLD', 'license': None, 'disclaimer': 'Notice: Paper or abstract available at https://api.unpaywall.org/v2/10.1609/icwsm.v18i1.31419?email=<INSERT_YOUR_EMAIL> or https://doi.org/10.1609/icwsm.v18i1.31419, which is subject to the license by the author or copyright owner provided with this content. Please go to the source to verify the license and copyright information for your use.'}","[{'authorId': '2301589391', 'name': 'Chen Yang'}, {'authorId': '2276664312', 'name': 'Bin Cao'}, {'authorId': '152223743', 'name': 'Jing Fan'}]","Text clustering has become an important branch in unsupervised learning methods and has been widely used in social media. Recently, Large Language Models (LLMs) represent a significant advancement in the field of AI. Therefore, some works have been dedicated to improving the clustering performance of embedding models with feedback from LLMs. However, current approaches hardly take into consideration the cluster label information between text instances when fine-tuning embedding models, leading to the problem of cluster collision. To tackle this issue, this paper proposes TeC, a novel method operating through teaching and correcting phases. In these phases, LLMs take on the role of teachers, guiding embedding models as students to enhance their clustering performance. The teaching phase imparts guidance on cluster label information to embedding models by querying LLMs in a batch-wise manner and utilizes a proposed weakly-supervised contrastive learning loss to fine-tune embedding models based on the provided cluster label information. Subsequently, the correcting phase refines clustering outcomes obtained by the teaching phase by instructing LLMs to correct cluster assignments of low-confidence samples. The extensive experimental evaluation of six text datasets across three different clustering tasks shows the superior performance of our proposed method over existing state-of-the-art approaches."
b35b6148e322155b841fab96bee672fd5a4de712,"{'ArXiv': '2405.17838', 'DOI': '10.1609/icwsm.v20i1.42643', 'CorpusId': 270068468}",Posts of Peril: Detecting Information About Hazards in Text,Proceedings of the International AAAI Conference on Web and Social Media,2024,"{'url': 'https://doi.org/10.1609/icwsm.v20i1.42643', 'status': 'GOLD', 'license': None, 'disclaimer': 'Notice: Paper or abstract available at https://arxiv.org/abs/2405.17838, which is subject to the license by the author or copyright owner provided with this content. Please go to the source to verify the license and copyright information for your use.'}","[{'authorId': '2279042413', 'name': 'Keith Burghardt'}, {'authorId': '144227945', 'name': 'D. Fessler'}, {'authorId': '2304173794', 'name': 'Chyna Tang'}, {'authorId': '4960047', 'name': 'Anne C. Pisor'}, {'authorId': '2295194921', 'name': 'Kristina Lerman'}]","Socio-linguistic indicators of affectively-relevant phenomena, such as emotion or sentiment, are often extracted from text to better understand features of human-computer interactions, including on social media. However, an indicator that is often overlooked is the presence or absence of information concerning harms or hazards. Detecting such indicators in text is important because substantial research demonstrates that negative events are more likely to be attended to, and more likely to elicit a response. In addition, statements about hazards are often found to be more believable than statements about benefits. Here, we develop a new model to detect information concerning hazards, trained on a new collection of annotated X posts. We show that not only does this model perform well (outperforming, e.g., dictionary approaches), but that the hazard information it extracts is not strongly correlated with such widely used indicators as moral outrage, sentiment, and emotions. (That said, in accord with expectations, hazard information does correlate positively with such emotions as fear, and negatively with emotions like joy.) To demonstrate the utility of our tool, we apply it to two datasets of X posts that discuss important geopolitical events, namely the Israel-Hamas war and the 2022 French national election. In both cases, we find that hazard information, especially information concerning conflict, is common. We extract accounts associated with information campaigns from each data set to explore how information about hazards could be used to attempt to influence geopolitical events. We find that inorganic accounts representing the viewpoints of weaker sides in a conflict often discuss hazards to civilians, potentially as a way to elicit aid for the weaker side. Moreover, the rate at which these hazards are mentioned differs markedly from organic accounts, likely reflecting information operators' efforts to frame the given geopolitical event for strategic purposes. These results are first steps towards exploring hazards within an information warfare environment. The model is shared as a Python package to help researchers and journalists analyze hazard content."
b71e067b85daf7c926722e40c4cf257a6422bf62,"{'DBLP': 'journals/corr/abs-2404-00141', 'ArXiv': '2404.00141', 'DOI': '10.48550/arXiv.2404.00141', 'CorpusId': 268819271}",Classifying Conspiratorial Narratives At Scale: False Alarms and Erroneous Connections,International Conference on Web and Social Media,2024,"{'url': '', 'status': None, 'license': None, 'disclaimer': 'Notice: Paper or abstract available at https://arxiv.org/abs/2404.00141, which is subject to the license by the author or copyright owner provided with this content. Please go to the source to verify the license and copyright information for your use.'}","[{'authorId': '2400281687', 'name': 'Ahmad Diab'}, {'authorId': '2294358175', 'name': 'Rr. Nefriana'}, {'authorId': '2294380043', 'name': 'Yu-Ru Lin'}]","Online discussions frequently involve conspiracy theories, which can contribute to the proliferation of belief in them. However, not all discussions surrounding conspiracy theories promote them, as some are intended to debunk them. Existing research has relied on simple proxies or focused on a constrained set of signals to identify conspiracy theories, which limits our understanding of conspiratorial discussions across different topics and online communities. This work establishes a general scheme for classifying discussions related to conspiracy theories based on authors' perspectives on the conspiracy belief, which can be expressed explicitly through narrative elements, such as the agent, action, or objective, or implicitly through references to known theories, such as chemtrails or the New World Order. We leverage human-labeled ground truth to train a BERT-based model for classifying online CTs, which we then compared to the Generative Pre-trained Transformer machine (GPT) for detecting online conspiratorial content. Despite GPT's known strengths in its expressiveness and contextual understanding, our study revealed significant flaws in its logical reasoning, while also demonstrating comparable strengths from our classifiers. We present the first large-scale classification study using posts from the most active conspiracy-related Reddit forums and find that only one-third of the posts are classified as positive. This research sheds light on the potential applications of large language models in tasks demanding nuanced contextual comprehension."
b7ce596828e6e64aa01c57fc516f05ad5d625c13,"{'DBLP': 'conf/icwsm/DanikenDRC24', 'DOI': '10.1609/icwsm.v18i1.31411', 'CorpusId': 270180185}",Improving Quantification with Minimal In-Domain Annotations: Beyond Classify and Count,International Conference on Web and Social Media,2024,"{'url': 'https://ojs.aaai.org/index.php/ICWSM/article/download/31411/33571', 'status': 'GOLD', 'license': None, 'disclaimer': 'Notice: Paper or abstract available at https://api.unpaywall.org/v2/10.1609/icwsm.v18i1.31411?email=<INSERT_YOUR_EMAIL> or https://doi.org/10.1609/icwsm.v18i1.31411, which is subject to the license by the author or copyright owner provided with this content. Please go to the source to verify the license and copyright information for your use.'}","[{'authorId': '1737826518', 'name': 'P. von Däniken'}, {'authorId': '145116511', 'name': 'Jan Deriu'}, {'authorId': '2304215580', 'name': 'Alvaro Rodrigo'}, {'authorId': '2648584', 'name': 'Mark Cieliebak'}]","Quantification is the task of estimating the class distribution in a given collection. With the growing availability of classification models, the use of classifiers for quantification has become increasingly popular, carrying the promise of eliminating the need for manual annotation. However, the naive classify and count approach presents clear limitations, especially evident in the face of domain discrepancies. In this work, we introduce two novel quantification methods, called CPCC and BCC, which can adapt to new target datasets with a small number of annotated in-domain samples (N = 100). To explore their real-world applicability, we apply our methods to a range of quantification tasks in the realm of hateful and offensive language, where they perform markedly better than classify and count and other existing methods."
bb4d20e0bdfe1b9e23fe66072f31304aadd3e157,"{'DBLP': 'conf/icwsm/SobolTFLG24', 'DOI': '10.1609/icwsm.v18i1.31403', 'CorpusId': 270181366}",280 Characters to Employment: Using Twitter to Quantify Job Vacancies,International Conference on Web and Social Media,2024,"{'url': 'https://ojs.aaai.org/index.php/ICWSM/article/download/31403/33563', 'status': 'GOLD', 'license': None, 'disclaimer': 'Notice: Paper or abstract available at https://api.unpaywall.org/v2/10.1609/icwsm.v18i1.31403?email=<INSERT_YOUR_EMAIL> or https://doi.org/10.1609/icwsm.v18i1.31403, which is subject to the license by the author or copyright owner provided with this content. Please go to the source to verify the license and copyright information for your use.'}","[{'authorId': '2304226908', 'name': 'Boris Sobol'}, {'authorId': '2159207178', 'name': 'Manuel Tonneau'}, {'authorId': '2273710014', 'name': 'Samuel Fraiberger'}, {'authorId': '2304289749', 'name': 'Do Lee'}, {'authorId': '2304217518', 'name': 'Nir Grinberg'}]","Accurate assessment of workforce needs is critical for designing well-informed economic policy and improving market efficiency. 
While surveys are the gold standard for estimating when and where workers are needed, they also have important limitations, most notably their substantial costs, dependence on existing and extensive surveying infrastructure, and limited temporal, geographical, and sectorial resolution. 
Here, we investigate the potential of social media to provide a complementary signal for estimating labor market demand. 
We introduce a novel statistical approach for extracting information about the location and occupation advertised in job vacancies posted on Twitter. We then construct an aggregate index of labor market demand by occupational class in every major U.S. city from 2015 to 2022, which we evaluate against two sources of official statistics and an index from a large aggregator of online job postings.
We find that the newly constructed index is strongly correlated with official statistics and, in some cases, advantageous compared to statistics from job aggregators. 
Moreover, we demonstrate that our index can robustly improve the prediction of official statistics across occupations and states."
