paperId,externalIds,title,venue,year,openAccessPdf,authors,abstract
8b67877c9896f241c3bc8bc2f18582cb59029c59,"{'MAG': '2227516423', 'DBLP': 'conf/icwsm/XuHBZ14', 'DOI': '10.1609/icwsm.v8i1.14563', 'CorpusId': 2469559}",School Bullying in Twitter and Weibo: A Comparative Study,International Conference on Web and Social Media,2014,"{'url': 'https://ojs.aaai.org/index.php/ICWSM/article/download/14563/14412', 'status': 'GOLD', 'license': None, 'disclaimer': 'Notice: Paper or abstract available at https://api.unpaywall.org/v2/10.1609/icwsm.v8i1.14563?email=<INSERT_YOUR_EMAIL> or https://doi.org/10.1609/icwsm.v8i1.14563, which is subject to the license by the author or copyright owner provided with this content. Please go to the source to verify the license and copyright information for your use.'}","[{'authorId': '2150636897', 'name': 'Jun-Ming Xu'}, {'authorId': '2481825', 'name': 'Hsun-Chih Huang'}, {'authorId': '3009549', 'name': 'Amy Bellmore'}, {'authorId': '1832364', 'name': 'Xiaojin Zhu'}]","
 
 School-based bullying is a serious health issue among adolescents world wide. We identify several differences in microblogs of school-based bullying between Twitter (mostly representing the USA) and Weibo (mostly representing China). First, we see a smaller fraction of victim authors in Weibo than in Twitter. We hypothesize that this may be due to Asian culture's emphasis on saving face where it is more of a taboo to be a victim or label someone a victim. Second, we see different temporal dynamics of school bullying posts due to differences in holidays and length of school days. Finally, bullying posts from Weibo contain more mentions of family than those from Twitter. This may be due to the greater emphasis on family in Asian cultures.
 
"
8eaf220cb8b7a8d9f51264f78cd92440b7635357,"{'DBLP': 'conf/icwsm/ZignaniGRZZZ14', 'MAG': '2274257646', 'DOI': '10.1609/icwsm.v8i1.14507', 'CorpusId': 8940955}",Link and Triadic Closure Delay: Temporal Metrics for Social Network Dynamics,International Conference on Web and Social Media,2014,"{'url': 'https://ojs.aaai.org/index.php/ICWSM/article/download/14507/14356', 'status': 'GOLD', 'license': None, 'disclaimer': 'Notice: Paper or abstract available at https://api.unpaywall.org/v2/10.1609/icwsm.v8i1.14507?email=<INSERT_YOUR_EMAIL> or https://doi.org/10.1609/icwsm.v8i1.14507, which is subject to the license by the author or copyright owner provided with this content. Please go to the source to verify the license and copyright information for your use.'}","[{'authorId': '3181655', 'name': 'Matteo Zignani'}, {'authorId': '2089200', 'name': 'S. Gaito'}, {'authorId': '120914670', 'name': 'G. P. Rossi'}, {'authorId': '3000939', 'name': 'Xiaohan Zhao'}, {'authorId': '2704852', 'name': 'Haitao Zheng'}, {'authorId': '145970007', 'name': 'Ben Y. Zhao'}]","
 
 Today, numerous models and metrics are available to capture and characterize static properties of online social networks. When it comes to understanding their dynamics and evolution, however, research offers little interms of metrics or models. Current metrics are limited to logical time clocks, and unable to capture interactions with external factors that rely on physical time clocks. In this paper, our goal is to take initial steps towards building a set of metrics for characterizing social network dynamics based on physical time. We focus our attention on two metrics that capture the ""eagerness"" of users in building social structure. More specifically, we propose metrics of link delay and triadic closure delay, two metrics that capture the time delay between when a link or triadic closure is possible,and when they actually instantiate in the trace. Considered over time or across traces, the value of these metrics can provide insight on the speed at which users act in building and extending their social neighborhoods. We apply these metrics to two real traces of social network dynamics from the Renren and Facebook networks. We show that these metrics are generally consistent across networks, but their differences reveal interesting properties of each system. We argue that they can be attributed to factors such as network maturity, environmental and social contexts, and services offered by network provider, all factors independent of the network topology and captured by our proposed metrics. Finally, we find that triadic closure delays capture the ease of neighbor discovery in social networks, and can be strongly influenced by friend recommendation systems.
 
"
8f840b8e64092b274eb344ff50d6996970770fcb,"{'MAG': '2231703831', 'DBLP': 'conf/icwsm/WeberG14a', 'DOI': '10.1609/icwsm.v8i1.14496', 'CorpusId': 241496}","Visualizing User-Defined, Discriminative Geo-Temporal Twitter Activity",International Conference on Web and Social Media,2014,"{'url': 'https://ojs.aaai.org/index.php/ICWSM/article/download/14496/14345', 'status': 'GOLD', 'license': None, 'disclaimer': 'Notice: Paper or abstract available at https://api.unpaywall.org/v2/10.1609/icwsm.v8i1.14496?email=<INSERT_YOUR_EMAIL> or https://doi.org/10.1609/icwsm.v8i1.14496, which is subject to the license by the author or copyright owner provided with this content. Please go to the source to verify the license and copyright information for your use.'}","[{'authorId': '1684687', 'name': 'Ingmar Weber'}, {'authorId': '1699369', 'name': 'Venkata Rama Kiran Garimella'}]","
 
 We present a system that visualizes geo-temporal Twitter activity. The distinguishing features our system offers include, (i) a large degree of user freedom in specifying the subset of data to visualize and (ii) a focus on *discriminative* patterns rather than high volume patterns. Tweets with precise GPS co-ordinates are assigned to geographical cells and grouped by (i) tweet language, (ii) tweet topic, (iii) day of week, and (iv) time of day. The spatial resolutions of the cells is determined in a data-driven manner using quad-trees and recursive splitting. The user can then choose to see data for, say, English tweets on weekend evenings for the topic ""party"". This system has been implemented for 1.8 million geo-tagged tweets from Qatar (http://qtr.qcri.org/) and for 4.8 million geo-tagged tweets from New York City (http://nyc.qcri.org/) and can be easily extended to other cities/countries.
 
"
916461bb130deaae55985eec737c9c29fefd2df9,"{'MAG': '1494336933', 'DBLP': 'conf/icwsm/KempterSMP14', 'DOI': '10.1609/icwsm.v8i1.14556', 'CorpusId': 1921011}",EmotionWatch: Visualizing Fine-Grained Emotions in Event-Related Tweets,International Conference on Web and Social Media,2014,"{'url': 'https://ojs.aaai.org/index.php/ICWSM/article/download/14556/14405', 'status': 'GOLD', 'license': None, 'disclaimer': 'Notice: Paper or abstract available at https://api.unpaywall.org/v2/10.1609/icwsm.v8i1.14556?email=<INSERT_YOUR_EMAIL> or https://doi.org/10.1609/icwsm.v8i1.14556, which is subject to the license by the author or copyright owner provided with this content. Please go to the source to verify the license and copyright information for your use.'}","[{'authorId': '37807102', 'name': 'Renato Kempter'}, {'authorId': '2712578', 'name': 'V. Sintsova'}, {'authorId': '144620464', 'name': 'C. Musat'}, {'authorId': '1781996', 'name': 'P. Pu'}]","
 
 Spectators are increasingly using social platforms to express their opinions and share their emotions during big public events. Those reactions reveal the subjective perception of the event and extend its understanding. This has motivated us to develop a system to explore and visualize volume, patterns, and trends of user sentiments as they evolve over time.  Previous work in sentiment analysis and opinion mining has addressed these issues. But the majority of them distinguish only two polarity categories, leaving a more detailed and insightful analysis to be desired.  In this paper, we suggest using a fine-grained, multi-category emotion model to classify and visualize users' emotional reactions in public events. We describe EmotionWatch, a tool that constructs visual summaries of public emotions, and apply it to the 2012 Olympics as a test case. We report findings from a user study evaluating the usability of the tool and validating the emotion model. Results show that users prefer a more detailed inspection of public emotions over the simplified analysis. Despite its complexity, users were able to effectively grasp, understand, and interpret the emotional reactions using EmotionWatch. The same user study also pointed out few design improvements for the future development of analogous systems.
 
"
92e70e895526ff27465cee455e3a63f471c4bddf,"{'DBLP': 'conf/icwsm/WienbergG14', 'MAG': '2108495787', 'DOI': '10.1609/icwsm.v8i1.14565', 'CorpusId': 16417636}",Privacy Considerations for Public Storytelling,International Conference on Web and Social Media,2014,"{'url': 'https://ojs.aaai.org/index.php/ICWSM/article/download/14565/14414', 'status': 'GOLD', 'license': None, 'disclaimer': 'Notice: Paper or abstract available at https://api.unpaywall.org/v2/10.1609/icwsm.v8i1.14565?email=<INSERT_YOUR_EMAIL> or https://doi.org/10.1609/icwsm.v8i1.14565, which is subject to the license by the author or copyright owner provided with this content. Please go to the source to verify the license and copyright information for your use.'}","[{'authorId': '2424407', 'name': 'C. Wienberg'}, {'authorId': '35168946', 'name': 'A. Gordon'}]","
 
 The popularity of the web and social media have afforded researchers unparalleled access to content about the daily lives of people. Human research ethics guidelines, while actively expanding to meet the new challenges posed by web research, still rely on offline principles of interaction that are a poor fit to modern technology. In this context, we present a study of the identifiability of authors of socially sensitive content. With the goal of identity obfuscation, we compare this to the identifiability of the same content translated to and then back from a foreign language, focusing on how easily a person could locate the original source of the content. We discuss the risk to these authors presented by dissemination of their content, and consider the implications for research ethics guidelines.
 
"
959b7a2fe517a1d40f8482e02fece7c553a54faa,"{'MAG': '2962764888', 'ArXiv': '1405.1429', 'DBLP': 'conf/icwsm/ChengDL14', 'DOI': '10.1609/icwsm.v8i1.14518', 'CorpusId': 7403868}",How Community Feedback Shapes User Behavior,International Conference on Web and Social Media,2014,"{'url': 'https://ojs.aaai.org/index.php/ICWSM/article/download/14518/14367', 'status': 'GOLD', 'license': None, 'disclaimer': 'Notice: Paper or abstract available at https://arxiv.org/abs/1405.1429, which is subject to the license by the author or copyright owner provided with this content. Please go to the source to verify the license and copyright information for your use.'}","[{'authorId': '144500753', 'name': 'Justin Cheng'}, {'authorId': '1388368997', 'name': 'Cristian Danescu-Niculescu-Mizil'}, {'authorId': '1702139', 'name': 'J. Leskovec'}]","
 
 Social media systems rely on user feedback and rating mechanisms for personalization, ranking, and content filtering. However, when users evaluate content contributed by fellow users (e.g., by liking a post or voting on a comment), these evaluations create complex social feedback effects. This paper investigates how ratings on a piece of content affect its author's future behavior. By studying four large comment-based news communities, we find that negative feedback leads to significant behavioral changes that are detrimental to the community. Not only do authors of negatively-evaluated content contribute more, but also their future posts are of lower quality, and are perceived by the community as such. Moreover, these authors are more likely to subsequently evaluate their fellow users negatively, percolating these effects through the community. In contrast, positive feedback does not carry similar effects, and neither encourages rewarded authors to write more, nor improves the quality of their posts. Interestingly, the authors that receive no feedback are most likely to leave a community. Furthermore, a structural analysis of the voter network reveals that evaluations polarize the community the most when positive and negative votes are equally split.
 
"
95d01c9c436f8c4b82869430de0a7bd5a5394917,"{'MAG': '2182274767', 'DBLP': 'conf/icwsm/GlasgowFB14', 'DOI': '10.1609/icwsm.v8i1.14535', 'CorpusId': 216652659}","""Our Grief is Unspeakable"": Automatically Measuring the Community Impact of a Tragedy",International Conference on Web and Social Media,2014,"{'url': 'https://ojs.aaai.org/index.php/ICWSM/article/download/14535/14384', 'status': 'GOLD', 'license': None, 'disclaimer': 'Notice: Paper or abstract available at https://api.unpaywall.org/v2/10.1609/icwsm.v8i1.14535?email=<INSERT_YOUR_EMAIL> or https://doi.org/10.1609/icwsm.v8i1.14535, which is subject to the license by the author or copyright owner provided with this content. Please go to the source to verify the license and copyright information for your use.'}","[{'authorId': '2503494', 'name': 'K. Glasgow'}, {'authorId': '145523489', 'name': 'Clayton Fink'}, {'authorId': '1389036863', 'name': 'J. Boyd-Graber'}]","
 
 Social media offer a real-time, unfiltered view of how disasters affect communities. Crisis response, disaster mental health, and — more broadly — public health can benefit from automated analysis of the public’s mental state as exhibited on social media. Our focus is on Twitter data from a community that lost members in a mass shooting and another community—geographically removed from the shooting — that was indirectly exposed. We show that a common approach for understanding emotional response in text: Linguistic Inquiry and Word Count (LIWC) can be substantially improved using machine learning. Starting with tweets flagged by LIWC as containing content related to the issue of death, we devise a categorization scheme for death-related tweets to induce automatic text classification of such content. This improved methodology reveals striking differences in the magnitude and duration of increases in death-related talk between these communities. It also detects subtle shifts in the nature of death-related talk. Our results offer lessons for gauging public response and for developing interventions in the wake of a tragedy.
 
"
99b72a8ddf08a0f4e3eba861e0fec35053765812,"{'DBLP': 'conf/icwsm/RakeshSVR14', 'MAG': '2187646572', 'DOI': '10.1609/icwsm.v8i1.14558', 'CorpusId': 11910298}",Personalized Recommendation of Twitter Lists using Content and Network Information,International Conference on Web and Social Media,2014,"{'url': 'https://ojs.aaai.org/index.php/ICWSM/article/download/14558/14407', 'status': 'GOLD', 'license': None, 'disclaimer': 'Notice: Paper or abstract available at https://api.unpaywall.org/v2/10.1609/icwsm.v8i1.14558?email=<INSERT_YOUR_EMAIL> or https://doi.org/10.1609/icwsm.v8i1.14558, which is subject to the license by the author or copyright owner provided with this content. Please go to the source to verify the license and copyright information for your use.'}","[{'authorId': '144060189', 'name': 'Vineeth Rakesh'}, {'authorId': '48715976', 'name': 'Dilpreet Singh'}, {'authorId': '3236313', 'name': 'B. Vinzamuri'}, {'authorId': '144417522', 'name': 'Chandan K. Reddy'}]","
 
 Lists in social networks have become popular tools to orga-nize content. This paper proposes a novel framework for rec-ommending lists to users by combining several features thatjointly capture their personal interests. Our contribution is oftwo-fold. First, we develop a ListRec model that leveragesthe dynamically varying tweet content, the network of twitterers and the popularity of lists to collectively model the users’preference towards social lists. Second, we use the topicalinterests of users, and the list network structure to developa novel network-based model called the LIST-PAGERANK.We use this model to recommend auxiliary lists that are morepopular than the lists that are currently subscribed by theusers. We evaluate our ListRec model using the Twitterdataset consisting of 2988 direct list subscriptions. Using au-tomatic evaluation technique, we compare the performanceof the ListRec model with different baseline methods andother competing approaches and show that our model deliversbetter precision in terms of the prediction of the subscribedlists of the twitterers. Furthermore, we also demonstrate the importance of combining different weighting schemes andtheir effect on capturing users’ interest towards Twitter lists.To evaluate the LIST-PAGERANK model, we employ a user-study based evaluation to show that the model is effective inrecommending auxiliary lists that are more authoritative thanthe lists subscribed by the users.
 
"
9cbd26a1d0d68ed14e063d61cd7d568653f7f7e8,"{'MAG': '2261508469', 'DBLP': 'conf/icwsm/ChierichettiKKMP14', 'DOI': '10.1609/icwsm.v8i1.14536', 'CorpusId': 16891502}",Event Detection via Communication Pattern Analysis,International Conference on Web and Social Media,2014,"{'url': 'https://ojs.aaai.org/index.php/ICWSM/article/download/14536/14385', 'status': 'GOLD', 'license': None, 'disclaimer': 'Notice: Paper or abstract available at https://api.unpaywall.org/v2/10.1609/icwsm.v8i1.14536?email=<INSERT_YOUR_EMAIL> or https://doi.org/10.1609/icwsm.v8i1.14536, which is subject to the license by the author or copyright owner provided with this content. Please go to the source to verify the license and copyright information for your use.'}","[{'authorId': '34996452', 'name': 'Flavio Chierichetti'}, {'authorId': '3371403', 'name': 'J. Kleinberg'}, {'authorId': '1683442', 'name': 'Ravi Kumar'}, {'authorId': '145967611', 'name': 'Mohammad Mahdian'}, {'authorId': '49071449', 'name': 'Sandeep Pandey'}]","
 
 Social media applications such as Twitter provide a powerful medium through which users can communicate their observations with friends and with the world at large. We have witnessed live reporting of many events, from soccer games in Johannesburg to revolutions in Cairo and Tunis, and these reports have in many ways rivaled the content provided by the official media. Tapping into this valuable resource is a challenge, due to the heterogeneity and noise inherent in realtime text, diversity of languages, and fast-evolving linguistic norms. In this paper we seek to analyze a tweet stream to automatically discover points in time when an important event happens, and to classify such events based on the type of the sentiments they evoke, using only non-textual features of the tweeting pattern. This results not only in a robust way of analyzing tweet streams independent of the languages used; it also provides insights about how users behave on social media websites. For example, we observe that users often react to an exciting external event by decreasing the volume of communication with other users. We explain this effect through a model of how users switch between producing information or sentiments and sharing others’ news or sentiments. We develop and evaluate our models and algorithms using several Twitter data sets, focusing in particular on the tweets sent during the soccer World Cup of 2010. This data set has the feature that the underlying ground truth is welldefined and known whereby goals serve as events.
 
"
a0b0536445dd5243f01da07a91c1d887879c7798,"{'DBLP': 'conf/icwsm/RaviPRK14', 'MAG': '2286400365', 'DOI': '10.1609/icwsm.v8i1.14529', 'CorpusId': 13041791}",Great Question! Question Quality in Community Q&A,International Conference on Web and Social Media,2014,"{'url': 'https://ojs.aaai.org/index.php/ICWSM/article/download/14529/14378', 'status': 'GOLD', 'license': None, 'disclaimer': 'Notice: Paper or abstract available at https://api.unpaywall.org/v2/10.1609/icwsm.v8i1.14529?email=<INSERT_YOUR_EMAIL> or https://doi.org/10.1609/icwsm.v8i1.14529, which is subject to the license by the author or copyright owner provided with this content. Please go to the source to verify the license and copyright information for your use.'}","[{'authorId': '35014893', 'name': 'Sujith Ravi'}, {'authorId': '2063096671', 'name': 'Bo Pang'}, {'authorId': '39638593', 'name': 'Vibhor Rastogi'}, {'authorId': '1683442', 'name': 'Ravi Kumar'}]","
 
 Asking the right question in the right way is an art (and a science). In a community question-answering setting, a good question is not just one that is found to be useful by other people: a question is good if it is also presented clearly and shows prior research.  Using a community question-answering site that allows voting over the questions, we show that there is a notion of question quality that goes beyond mere popularity. We present techniques using latent topic models to automatically predict the quality of questions based on their content. Our best system achieves a prediction accuracy of 72%, beating out strong baselines by a significant amount. We also examine the effect of  question quality on the dynamics of user behavior and the longevity of questions. 
 
"
a313694833cb13219ccae1165ae43e814577fb86,"{'MAG': '2185623511', 'DBLP': 'conf/icwsm/RuizHI14', 'DOI': '10.1609/icwsm.v8i1.14537', 'CorpusId': 8275074}",Efficient Filtering on Hidden Document Streams,International Conference on Web and Social Media,2014,"{'url': 'https://ojs.aaai.org/index.php/ICWSM/article/download/14537/14386', 'status': 'GOLD', 'license': None, 'disclaimer': 'Notice: Paper or abstract available at https://api.unpaywall.org/v2/10.1609/icwsm.v8i1.14537?email=<INSERT_YOUR_EMAIL> or https://doi.org/10.1609/icwsm.v8i1.14537, which is subject to the license by the author or copyright owner provided with this content. Please go to the source to verify the license and copyright information for your use.'}","[{'authorId': '144795428', 'name': 'Eduardo J. Ruiz'}, {'authorId': '1754970', 'name': 'V. Hristidis'}, {'authorId': '2942126', 'name': 'Panagiotis G. Ipeirotis'}]","
 
 Many online services like Twitter and GNIP offer streaming programming interfaces that allow real-time information filtering based on keyword or other conditions. However, all these services specify strict access constraints, or charge a cost based on the usage. We refer to such streams as ``hidden streams'' to draw a parallel to the well-studied hidden Web, which similarly restricts access to the contents of a database through a querying interface. At the same time, the users' interest is often captured by complex classification models that, implicitly or explicitly, specify hundreds of keyword-based rules, along with the rules' accuracies. In this paper, we study how to best utilize a constrained streaming access interface to maximize the number of retrieved relevant items, with respect to a classifier, expressed as a set of rules. We consider two problem variants. The static version assumes that the popularity of the keywords is known and constant across time. The dynamic version lifts this assumption, and can be viewed as an exploration-vs.-exploitation problem. We show that both problems are NP-hard, and propose exact and bounded approximation algorithms for various settings, including various access constraint types. We experimentally evaluate our algorithms on real Twitter data.
 
"
a43618ad120c253d8f376cbcaa99ad6364cd1fe2,"{'MAG': '641710284', 'DBLP': 'conf/icwsm/OlteanuCDV14', 'DOI': '10.1609/icwsm.v8i1.14538', 'CorpusId': 11083789}",CrisisLex: A Lexicon for Collecting and Filtering Microblogged Communications in Crises,International Conference on Web and Social Media,2014,"{'url': 'https://ojs.aaai.org/index.php/ICWSM/article/download/14538/14387', 'status': 'GOLD', 'license': None, 'disclaimer': 'Notice: Paper or abstract available at https://api.unpaywall.org/v2/10.1609/icwsm.v8i1.14538?email=<INSERT_YOUR_EMAIL> or https://doi.org/10.1609/icwsm.v8i1.14538, which is subject to the license by the author or copyright owner provided with this content. Please go to the source to verify the license and copyright information for your use.'}","[{'authorId': '39824354', 'name': 'Alexandra Olteanu'}, {'authorId': '153191671', 'name': 'Carlos Castillo'}, {'authorId': '145472333', 'name': 'Fernando Diaz'}, {'authorId': '3681090', 'name': 'Sarah Vieweg'}]","
 
 Locating timely, useful information during crises and mass emergencies is critical for those forced to make potentially life-altering decisions. As the use of Twitter to broadcast useful information during such situations becomes more widespread, the problem of finding it becomes more difficult. We describe an approach toward improving the recall in the sampling of Twitter communications that can lead to greater situational awareness during crisis situations. First, we create a lexicon of crisis-related terms that frequently appear in relevant messages posted during different types of crisis situations. Next, we demonstrate how we use the lexicon to automatically identify new terms that describe a given crisis. Finally, we explain how to efficiently query Twitter to extract crisis-related messages during emergency events. In our experiments, using a crisis lexicon leads to substantial improvements in terms of recall when added to a set of crisis-specific keywords manually chosen by experts; it also helps to preserve the original distribution of message types.
 
"
