paperId,externalIds,title,venue,year,openAccessPdf,authors,abstract
004f280305fe3b5c830e257e187f2eb5c0a30106,"{'DBLP': 'conf/nips/Wagner13', 'MAG': '2105675791', 'CorpusId': 14328031}",Optimistic policy iteration and natural actor-critic: A unifying view and a non-optimality result,Neural Information Processing Systems,2013,"{'url': '', 'status': None, 'license': None, 'disclaimer': ""Notice: The following paper fields have been elided by the publisher: {'abstract'}. Paper or abstract available at http://machinelearning.wustl.edu/mlpapers/paper_files/NIPS2013_5188.pdf, which is subject to the license by the author or copyright owner provided with this content. Please go to the source to verify the license and copyright information for your use.""}","[{'authorId': '152893347', 'name': 'Paul Wagner'}]",
0080118b0eb02af581ff32b85a1bb6aed7081f45,"{'DBLP': 'conf/nips/Cuturi13', 'MAG': '1511358834', 'ArXiv': '1306.0895', 'CorpusId': 15966283}",Sinkhorn Distances: Lightspeed Computation of Optimal Transport,Neural Information Processing Systems,2013,"{'url': '', 'status': None, 'license': None, 'disclaimer': 'Notice: Paper or abstract available at https://arxiv.org/abs/1306.0895, which is subject to the license by the author or copyright owner provided with this content. Please go to the source to verify the license and copyright information for your use.'}","[{'authorId': '1711979', 'name': 'Marco Cuturi'}]","Optimal transportation distances are a fundamental family of parameterized distances for histograms. Despite their appealing theoretical properties, excellent performance in retrieval tasks and intuitive formulation, their computation involves the resolution of a linear program whose cost is prohibitive whenever the histograms' dimension exceeds a few hundreds. We propose in this work a new family of optimal transportation distances that look at transportation problems from a maximum-entropy perspective. We smooth the classical optimal transportation problem with an entropic regularization term, and show that the resulting optimum is also a distance which can be computed through Sinkhorn-Knopp's matrix scaling algorithm at a speed that is several orders of magnitude faster than that of transportation solvers. We also report improved performance over classical optimal transportation distances on the MNIST benchmark problem."
01d37398ca7a18c75491c1aab26719ed7ae592f7,"{'MAG': '2530469788', 'CorpusId': 20590881}",Hearing Aid Personalization,Neural Information Processing Systems,2013,"{'url': '', 'status': None, 'license': None, 'disclaimer': ""Notice: The following paper fields have been elided by the publisher: {'abstract'}. Paper or abstract available at http://eprints.gla.ac.uk/119556/1/119556.pdf, which is subject to the license by the author or copyright owner provided with this content. Please go to the source to verify the license and copyright information for your use.""}","[{'authorId': '40458549', 'name': 'J. Nielsen'}, {'authorId': '2117719763', 'name': 'Jakob Nielsen'}, {'authorId': '11002730', 'name': 'B. S. Jensen'}, {'authorId': '153443132', 'name': 'Jan Larsen'}]",
025b7711a2f29272d8a7238d89ebd6e011305785,"{'DBLP': 'conf/nips/SavinDL13', 'MAG': '2134876084', 'CorpusId': 9208725}",Correlations strike back (again): the case of associative memory retrieval,Neural Information Processing Systems,2013,"{'url': '', 'status': None, 'license': None, 'disclaimer': ""Notice: The following paper fields have been elided by the publisher: {'abstract'}. Paper or abstract available at http://papers.nips.cc/paper/4871-correlations-strike-back-again-the-case-of-associative-memory-retrieval.pdf, which is subject to the license by the author or copyright owner provided with this content. Please go to the source to verify the license and copyright information for your use.""}","[{'authorId': '29406516', 'name': 'Cristina Savin'}, {'authorId': '1790646', 'name': 'P. Dayan'}, {'authorId': '40599065', 'name': 'M. Lengyel'}]",
0340ef4a39e79482e6e62efd217037c2a130e6cf,"{'MAG': '2577466617', 'CorpusId': 9167112}",On Actively Teaching the Crowd to Classify,Neural Information Processing Systems,2013,"{'url': '', 'status': None, 'license': None, 'disclaimer': ""Notice: The following paper fields have been elided by the publisher: {'abstract'}. Paper or abstract available at http://www.ics.uci.edu/~qliu1/nips13_workshop/Papers/ActivePaper8.pdf, which is subject to the license by the author or copyright owner provided with this content. Please go to the source to verify the license and copyright information for your use.""}","[{'authorId': '1703727', 'name': 'A. Singla'}, {'authorId': '1764328', 'name': 'Ilija Bogunovic'}, {'authorId': '145144587', 'name': 'Gábor Bartók'}, {'authorId': '1697131', 'name': 'Amin Karbasi'}, {'authorId': '153243248', 'name': 'A. Krause'}]",
037d59d68799d83d2083f9496dbc6a6c34de1452,"{'MAG': '2964305490', 'ArXiv': '1312.0451', 'DBLP': 'conf/nips/BerendK14', 'CorpusId': 14785967}",Consistency of weighted majority votes,Neural Information Processing Systems,2013,"{'url': '', 'status': None, 'license': None, 'disclaimer': 'Notice: Paper or abstract available at https://arxiv.org/abs/1312.0451, which is subject to the license by the author or copyright owner provided with this content. Please go to the source to verify the license and copyright information for your use.'}","[{'authorId': '1742978', 'name': 'D. Berend'}, {'authorId': '5333251', 'name': 'A. Kontorovich'}]","We revisit the classical decision-theoretic problem of weighted expert voting from a statistical learning perspective. In particular, we examine the consistency (both asymptotic and finitary) of the optimal Nitzan-Paroush weighted majority and related rules. In the case of known expert competence levels, we give sharp error estimates for the optimal rule. When the competence levels are unknown, they must be empirically estimated. We provide frequentist and Bayesian analyses for this situation. Some of our proof techniques are non-standard and may be of independent interest. The bounds we derive are nearly optimal, and several challenging open problems are posed. Experimental results are provided to illustrate the theory."
038ee42fc9180e2e9c9b817d23942d837fa3618c,"{'MAG': '2161105493', 'DBLP': 'journals/corr/PetraliaVD13', 'ArXiv': '1312.1099', 'DOI': '10.6084/M9.FIGSHARE.1284161.V1', 'CorpusId': 7123589}",Multiscale Dictionary Learning for Estimating Conditional Distributions,Neural Information Processing Systems,2013,"{'url': '', 'status': None, 'license': None, 'disclaimer': 'Notice: Paper or abstract available at https://arxiv.org/abs/1312.1099, which is subject to the license by the author or copyright owner provided with this content. Please go to the source to verify the license and copyright information for your use.'}","[{'authorId': '2302191294', 'name': 'Francesca Petralia'}, {'authorId': '1717958', 'name': 'J. Vogelstein'}, {'authorId': '39775017', 'name': 'D. Dunson'}]","Nonparametric estimation of the conditional distribution of a response given high-dimensional features is a challenging problem. It is important to allow not only the mean but also the variance and shape of the response density to change flexibly with features, which are massive-dimensional. We propose a multiscale dictionary learning model, which expresses the conditional response density as a convex combination of dictionary densities, with the densities used and their weights dependent on the path through a tree decomposition of the feature space. A fast graph partitioning algorithm is applied to obtain the tree decomposition, with Bayesian methods then used to adaptively prune and average over different sub-trees in a soft probabilistic manner. The algorithm scales efficiently to approximately one million features. State of the art predictive performance is demonstrated for toy examples and two neuroscience applications including up to a million features."
03b7e757cbac12fa840035cb8b4f4318528b6096,"{'MAG': '2951018312', 'ArXiv': '1311.1903', 'DBLP': 'conf/nips/TelgarskyD13', 'CorpusId': 2048519}",Moment-based Uniform Deviation Bounds for k-means and Friends,Neural Information Processing Systems,2013,"{'url': '', 'status': None, 'license': None, 'disclaimer': 'Notice: Paper or abstract available at https://arxiv.org/abs/1311.1903, which is subject to the license by the author or copyright owner provided with this content. Please go to the source to verify the license and copyright information for your use.'}","[{'authorId': '1750943', 'name': 'Matus Telgarsky'}, {'authorId': '1880237', 'name': 'S. Dasgupta'}]","Suppose $k$ centers are fit to $m$ points by heuristically minimizing the $k$-means cost; what is the corresponding fit over the source distribution? This question is resolved here for distributions with $p\geq 4$ bounded moments; in particular, the difference between the sample cost and distribution cost decays with $m$ and $p$ as $m^{\min\{-1/4, -1/2+2/p\}}$. The essential technical contribution is a mechanism to uniformly control deviations in the face of unbounded parameter sets, cost functions, and source distributions. To further demonstrate this mechanism, a soft clustering variant of $k$-means cost is also considered, namely the log likelihood of a Gaussian mixture, subject to the constraint that all covariance matrices have bounded spectrum. Lastly, a rate with refined constants is provided for $k$-means instances possessing some cluster structure."
03f56ade9538f02afed27affd8e7101879d32328,"{'DBLP': 'conf/nips/Romera-ParedesP13', 'ArXiv': '1307.4653', 'MAG': '2963980562', 'CorpusId': 208427}",A New Convex Relaxation for Tensor Completion,Neural Information Processing Systems,2013,"{'url': '', 'status': None, 'license': None, 'disclaimer': 'Notice: Paper or abstract available at https://arxiv.org/abs/1307.4653, which is subject to the license by the author or copyright owner provided with this content. Please go to the source to verify the license and copyright information for your use.'}","[{'authorId': '1403031665', 'name': 'B. Romera-Paredes'}, {'authorId': '1704699', 'name': 'M. Pontil'}]","We study the problem of learning a tensor from a set of linear measurements. A prominent methodology for this problem is based on a generalization of trace norm regularization, which has been used extensively for learning low rank matrices, to the tensor setting. In this paper, we highlight some limitations of this approach and propose an alternative convex relaxation on the Euclidean ball. We then describe a technique to solve the associated regularization problem, which builds upon the alternating direction method of multipliers. Experiments on one synthetic dataset and two real datasets indicate that the proposed method improves significantly over tensor trace norm regularization in terms of estimation error, while remaining computationally tractable."
04902871e402deb4b5c80c6096fbf48c6e92cb85,"{'MAG': '2146463561', 'DBLP': 'conf/nips/GolshanBT13', 'CorpusId': 9066739}",What do row and column marginals reveal about your dataset?,Neural Information Processing Systems,2013,"{'url': '', 'status': None, 'license': None, 'disclaimer': ""Notice: The following paper fields have been elided by the publisher: {'abstract'}. Paper or abstract available at http://cs-people.bu.edu/evimaria/papers/nips2013.pdf, which is subject to the license by the author or copyright owner provided with this content. Please go to the source to verify the license and copyright information for your use.""}","[{'authorId': '3047778', 'name': 'Behzad Golshan'}, {'authorId': '1687432', 'name': 'John W. Byers'}, {'authorId': '1839624', 'name': 'Evimaria Terzi'}]",
06eaa5f24492f59fda7d9c1da94f414012f4235c,"{'MAG': '2128336967', 'DBLP': 'conf/nips/HouZSL13', 'CorpusId': 17335490}",On the Linear Convergence of the Proximal Gradient Method for Trace Norm Regularization,Neural Information Processing Systems,2013,"{'url': '', 'status': None, 'license': None, 'disclaimer': ""Notice: The following paper fields have been elided by the publisher: {'abstract'}. Paper or abstract available at http://machinelearning.wustl.edu/mlpapers/paper_files/NIPS2013_4936.pdf, which is subject to the license by the author or copyright owner provided with this content. Please go to the source to verify the license and copyright information for your use.""}","[{'authorId': '2064900405', 'name': 'K. Hou'}, {'authorId': '2610961', 'name': 'Zirui Zhou'}, {'authorId': '1734000', 'name': 'A. M. So'}, {'authorId': '144657347', 'name': 'Z. Luo'}]",
089e5a3cb3848800f7a3e909ae4c7e672fe3cd62,"{'MAG': '2962994581', 'DBLP': 'conf/nips/AchlioptasKL13', 'ArXiv': '1311.4643', 'CorpusId': 7313263}",Near-Optimal Entrywise Sampling for Data Matrices,Neural Information Processing Systems,2013,"{'url': '', 'status': None, 'license': None, 'disclaimer': 'Notice: Paper or abstract available at https://arxiv.org/abs/1311.4643, which is subject to the license by the author or copyright owner provided with this content. Please go to the source to verify the license and copyright information for your use.'}","[{'authorId': '1705268', 'name': 'D. Achlioptas'}, {'authorId': '3386660', 'name': 'Zohar S. Karnin'}, {'authorId': '2941680', 'name': 'Edo Liberty'}]","We consider the problem of selecting non-zero entries of a matrix $A$ in order to produce a sparse sketch of it, $B$, that minimizes $\|A-B\|_2$. For large $m \times n$ matrices, such that $n \gg m$ (for example, representing $n$ observations over $m$ attributes) we give sampling distributions that exhibit four important properties. First, they have closed forms computable from minimal information regarding $A$. Second, they allow sketching of matrices whose non-zeros are presented to the algorithm in arbitrary order as a stream, with $O(1)$ computation per non-zero. Third, the resulting sketch matrices are not only sparse, but their non-zero entries are highly compressible. Lastly, and most importantly, under mild assumptions, our distributions are provably competitive with the optimal offline distribution. Note that the probabilities in the optimal offline distribution may be complex functions of all the entries in the matrix. Therefore, regardless of computational complexity, the optimal distribution might be impossible to compute in the streaming model."
08b1b8bf9212c6de1c09ee9b992a2904fbaad3b6,"{'MAG': '2123876144', 'DBLP': 'conf/nips/ZhaoL13', 'CorpusId': 5002604}",Sparse Inverse Covariance Estimation with Calibration,Neural Information Processing Systems,2013,"{'url': '', 'status': None, 'license': None, 'disclaimer': ""Notice: The following paper fields have been elided by the publisher: {'abstract'}. Paper or abstract available at http://papers.nips.cc/paper/5173-sparse-inverse-covariance-estimation-with-calibration, which is subject to the license by the author or copyright owner provided with this content. Please go to the source to verify the license and copyright information for your use.""}","[{'authorId': '36345161', 'name': 'T. Zhao'}, {'authorId': '49957601', 'name': 'Han Liu'}]",
0a477140cbac47acebb3397d3ed948c2a1e2d959,"{'MAG': '2113063048', 'DBLP': 'conf/nips/WuLC13', 'CorpusId': 6310023}",Analyzing the Harmonic Structure in Graph-Based Learning,Neural Information Processing Systems,2013,"{'url': '', 'status': None, 'license': None, 'disclaimer': ""Notice: The following paper fields have been elided by the publisher: {'abstract'}. Paper or abstract available at http://www.ee.columbia.edu/~xmwu/posters/NIPS-2013-Harmonic-Poster.pdf, which is subject to the license by the author or copyright owner provided with this content. Please go to the source to verify the license and copyright information for your use.""}","[{'authorId': '2154602551', 'name': 'Xiao-Ming Wu'}, {'authorId': '7718952', 'name': 'Zhenguo Li'}, {'authorId': '9546964', 'name': 'Shih-Fu Chang'}]",
0a7efae9a866863155edf7aa4aa727706d1b67b4,"{'MAG': '2153863985', 'DBLP': 'conf/nips/NarasimhanA13', 'CorpusId': 8094049}","On the Relationship Between Binary Classification, Bipartite Ranking, and Binary Class Probability Estimation",Neural Information Processing Systems,2013,"{'url': '', 'status': None, 'license': None, 'disclaimer': ""Notice: The following paper fields have been elided by the publisher: {'abstract'}. Paper or abstract available at http://clweb.csa.iisc.ernet.in/harikrishna/Talks/csa-perspective-seminar-2013-relationship-between-classification-ranking-cpe.pdf, which is subject to the license by the author or copyright owner provided with this content. Please go to the source to verify the license and copyright information for your use.""}","[{'authorId': '1727387', 'name': 'H. Narasimhan'}, {'authorId': '2797063', 'name': 'S. Agarwal'}]",
0ca6cccbfcf3df972a470c7fe18f7eaed9420cd6,"{'ArXiv': '1312.6110', 'DBLP': 'journals/corr/TangSS13', 'MAG': '2950181755', 'CorpusId': 16440891}",Learning Generative Models with Visual Attention,Neural Information Processing Systems,2013,"{'url': '', 'status': None, 'license': None, 'disclaimer': 'Notice: Paper or abstract available at https://arxiv.org/abs/1312.6110, which is subject to the license by the author or copyright owner provided with this content. Please go to the source to verify the license and copyright information for your use.'}","[{'authorId': '34312504', 'name': 'Y. Tang'}, {'authorId': '2897313', 'name': 'Nitish Srivastava'}, {'authorId': '145124475', 'name': 'R. Salakhutdinov'}]","Attention has long been proposed by psychologists to be important for efficiently dealing with the massive amounts of sensory stimulus in the neocortex. Inspired by the attention models in visual neuroscience and the need for object-centered data for generative models, we propose a deep-learning based generative framework using attention. The attentional mechanism propagates signals from the region of interest in a scene to an aligned canonical representation for generative modeling. By ignoring scene background clutter, the generative model can concentrate its resources on the object of interest. A convolutional neural net is employed to provide good initializations during posterior inference which uses Hamiltonian Monte Carlo. Upon learning images of faces, our model can robustly attend to the face region of novel test subjects. More importantly, our model can learn generative models of new faces from a novel dataset of large images where the face locations are not known."
0cd5bf52161c8e2f02e54f1f97580ac011fa668a,"{'MAG': '2134820110', 'DBLP': 'conf/nips/AlbersWP13', 'CorpusId': 14122129}",Perfect Associative Learning with Spike-Timing-Dependent Plasticity,Neural Information Processing Systems,2013,"{'url': '', 'status': None, 'license': None, 'disclaimer': ""Notice: The following paper fields have been elided by the publisher: {'abstract'}. Paper or abstract available at http://papers.nips.cc/paper/5054-perfect-associative-learning-with-spike-timing-dependent-plasticity.pdf, which is subject to the license by the author or copyright owner provided with this content. Please go to the source to verify the license and copyright information for your use.""}","[{'authorId': '34590237', 'name': 'Christian Albers'}, {'authorId': '3012545', 'name': 'Maren Westkott'}, {'authorId': '144902080', 'name': 'K. Pawelzik'}]",
0ce019a5cc033cb3ad3aefb5d8aa9dca5e393def,"{'MAG': '2170246608', 'DBLP': 'conf/nips/MevissenRY13', 'CorpusId': 8167933}",Data-driven Distributionally Robust Polynomial Optimization,Neural Information Processing Systems,2013,"{'url': '', 'status': None, 'license': None, 'disclaimer': ""Notice: The following paper fields have been elided by the publisher: {'abstract'}. Paper or abstract available at http://machinelearning.wustl.edu/mlpapers/paper_files/NIPS2013_4943.pdf, which is subject to the license by the author or copyright owner provided with this content. Please go to the source to verify the license and copyright information for your use.""}","[{'authorId': '40371976', 'name': 'M. Mevissen'}, {'authorId': '2902973', 'name': 'E. Ragnoli'}, {'authorId': '3152306', 'name': 'Jia Yuan Yu'}]",
0e303f034108de9f7a777bea6063aa30e8964def,"{'DBLP': 'conf/nips/ZhouLVM13', 'MAG': '2149951699', 'CorpusId': 14045435}",Latent Maximum Margin Clustering,Neural Information Processing Systems,2013,"{'url': '', 'status': None, 'license': None, 'disclaimer': ""Notice: The following paper fields have been elided by the publisher: {'abstract'}. Paper or abstract available at http://cs.stanford.edu/~taranlan/pdf/zhou-nips13.pdf, which is subject to the license by the author or copyright owner provided with this content. Please go to the source to verify the license and copyright information for your use.""}","[{'authorId': '2057809', 'name': 'Guang-Tong Zhou'}, {'authorId': '2113225771', 'name': 'Tian Lan'}, {'authorId': '3214848', 'name': 'Arash Vahdat'}, {'authorId': '10771328', 'name': 'Greg Mori'}]",
0e53f13021746d195c298cceb2d7b43a5088c9da,"{'DBLP': 'journals/corr/McWilliamsBB13', 'MAG': '2162892577', 'ArXiv': '1306.5554', 'CorpusId': 6301172}",Correlated random features for fast semi-supervised learning,Neural Information Processing Systems,2013,"{'url': '', 'status': None, 'license': None, 'disclaimer': 'Notice: Paper or abstract available at https://arxiv.org/abs/1306.5554, which is subject to the license by the author or copyright owner provided with this content. Please go to the source to verify the license and copyright information for your use.'}","[{'authorId': '2953855', 'name': 'B. McWilliams'}, {'authorId': '1722983', 'name': 'David Balduzzi'}, {'authorId': '1682548', 'name': 'J. Buhmann'}]","This paper presents Correlated Nystrom Views (XNV), a fast semi-supervised algorithm for regression and classification. The algorithm draws on two main ideas. First, it generates two views consisting of computationally inexpensive random features. Second, multiview regression, using Canonical Correlation Analysis (CCA) on unlabeled data, biases the regression towards useful features. It has been shown that CCA regression can substantially reduce variance with a minimal increase in bias if the views contains accurate estimators. Recent theoretical and empirical work shows that regression with random features closely approximates kernel regression, implying that the accuracy requirement holds for random views. We show that XNV consistently outperforms a state-of-the-art algorithm for semi-supervised learning: substantially improving predictive performance and reducing the variability of performance on a wide variety of real-world datasets, whilst also reducing runtime by orders of magnitude."
0e6d7b913596465bff4745e1b541ada722e83ecd,"{'MAG': '2126229007', 'CorpusId': 6001135}",On the Representational Efficiency of Restricted Boltzmann Machines,Neural Information Processing Systems,2013,"{'url': '', 'status': None, 'license': None, 'disclaimer': ""Notice: The following paper fields have been elided by the publisher: {'abstract'}. Paper or abstract available at http://papers.nips.cc/paper/5020-on-the-representational-efficiency-of-restricted-boltzmann-machines.pdf, which is subject to the license by the author or copyright owner provided with this content. Please go to the source to verify the license and copyright information for your use.""}","[{'authorId': '145704247', 'name': 'James Martens'}, {'authorId': '102226917', 'name': 'Arkadev Chattopadhya'}, {'authorId': '1695317', 'name': 'T. Pitassi'}, {'authorId': '1804104', 'name': 'R. Zemel'}]",
0f4f58578f73a7a03a89dd4df80bf9311f474b4e,"{'ArXiv': '1309.7598', 'DBLP': 'conf/nips/HazanMJ13', 'MAG': '2118853346', 'CorpusId': 7889497}",On Sampling from the Gibbs Distribution with Random Maximum A-Posteriori Perturbations,Neural Information Processing Systems,2013,"{'url': '', 'status': None, 'license': None, 'disclaimer': 'Notice: Paper or abstract available at https://arxiv.org/abs/1309.7598, which is subject to the license by the author or copyright owner provided with this content. Please go to the source to verify the license and copyright information for your use.'}","[{'authorId': '1918412', 'name': 'Tamir Hazan'}, {'authorId': '35208858', 'name': 'Subhransu Maji'}, {'authorId': '35132120', 'name': 'T. Jaakkola'}]","In this paper we describe how MAP inference can be used to sample efficiently from Gibbs distributions. Specifically, we provide means for drawing either approximate or unbiased samples from Gibbs' distributions by introducing low dimensional perturbations and solving the corresponding MAP assignments. Our approach also leads to new ways to derive lower bounds on partition functions. We demonstrate empirically that our method excels in the typical ""high signal -high coupling"" regime. The setting results in ragged energy landscapes that are challenging for alternative approaches to sampling and/or lower bounds."
