paperId,externalIds,title,venue,year,openAccessPdf,authors,abstract
bac43b8b79b69edeb7cefe9e6f57c6ec70c889cf,"{'DBLP': 'conf/nips/GlazerLM13', 'MAG': '2139373187', 'CorpusId': 6586709}",q-OCSVM: A q-Quantile Estimator for High-Dimensional Distributions,Neural Information Processing Systems,2013,"{'url': '', 'status': None, 'license': None, 'disclaimer': ""Notice: The following paper fields have been elided by the publisher: {'abstract'}. Paper or abstract available at http://machinelearning.wustl.edu/mlpapers/paper_files/NIPS2013_5125.pdf, which is subject to the license by the author or copyright owner provided with this content. Please go to the source to verify the license and copyright information for your use.""}","[{'authorId': '35636803', 'name': 'Assaf Glazer'}, {'authorId': '1727935', 'name': 'M. Lindenbaum'}, {'authorId': '2309269', 'name': 'Shaul Markovitch'}]",
bba961a96d1cddfc88c790c950499118a2efc51b,"{'ArXiv': '1311.4296', 'MAG': '2134220221', 'DBLP': 'journals/corr/JegelkaBS13', 'CorpusId': 220623774}",Reflection methods for user-friendly submodular optimization,Neural Information Processing Systems,2013,"{'url': '', 'status': None, 'license': None, 'disclaimer': 'Notice: Paper or abstract available at https://arxiv.org/abs/1311.4296, which is subject to the license by the author or copyright owner provided with this content. Please go to the source to verify the license and copyright information for your use.'}","[{'authorId': '2594093', 'name': 'S. Jegelka'}, {'authorId': '144570279', 'name': 'F. Bach'}, {'authorId': '3072326', 'name': 'S. Sra'}]","Recently, it has become evident that submodularity naturally captures widely occurring concepts in machine learning, signal processing and computer vision. Consequently, there is need for efficient optimization procedures for submodular functions, especially for minimization problems. While general submodular minimization is challenging, we propose a new method that exploits existing decomposability of submodular functions. In contrast to previous approaches, our method is neither approximate, nor impractical, nor does it need any cumbersome parameter tuning. Moreover, it is easy to implement and parallelize. A key component of our method is a formulation of the discrete submodular minimization problem as a continuous best approximation problem that is solved through a sequence of reflections, and its solution can be easily thresholded to obtain an optimal discrete solution. This method solves both the continuous and discrete formulations of the problem, and therefore has applications in learning, inference, and reconstruction. In our experiments, we illustrate the benefits of our method on two image segmentation tasks."
bc792f1b77fcb99ee54fbdfd25606ac8071ca6c6,"{'DBLP': 'conf/nips/2013', 'CorpusId': 260453085}","Advances in Neural Information Processing Systems 26: 27th Annual Conference on Neural Information Processing Systems 2013. Proceedings of a meeting held December 5-8, 2013, Lake Tahoe, Nevada, United States",Neural Information Processing Systems,2013,"{'url': '', 'status': None, 'license': None, 'disclaimer': ""Notice: The following paper fields have been elided by the publisher: {'abstract'}. Paper or abstract available at http://papers.nips.cc/book/advances-in-neural-information-processing-systems-26-2013, which is subject to the license by the author or copyright owner provided with this content. Please go to the source to verify the license and copyright information for your use.""}",[],
bcaa62d93e5b276c69c2ea3bbf0626f51f0ea109,"{'MAG': '2131312351', 'DBLP': 'conf/nips/RaghavanKFT13', 'CorpusId': 527077}",Symbolic Opportunistic Policy Iteration for Factored-Action MDPs,Neural Information Processing Systems,2013,"{'url': '', 'status': None, 'license': None, 'disclaimer': ""Notice: The following paper fields have been elided by the publisher: {'abstract'}. Paper or abstract available at http://www.cs.tufts.edu/~roni/PUB/nips13-opi.pdf, which is subject to the license by the author or copyright owner provided with this content. Please go to the source to verify the license and copyright information for your use.""}","[{'authorId': '2384353', 'name': 'Aswin Raghavan'}, {'authorId': '1746048', 'name': 'R. Khardon'}, {'authorId': '145841336', 'name': 'Alan Fern'}, {'authorId': '1729906', 'name': 'Prasad Tadepalli'}]",
bcae2859871d2ff69ce376e47b882d59f0922d8a,"{'MAG': '2167682446', 'DBLP': 'conf/nips/VossRB13', 'CorpusId': 8061467}",Fast Algorithms for Gaussian Noise Invariant Independent Component Analysis,Neural Information Processing Systems,2013,"{'url': '', 'status': None, 'license': None, 'disclaimer': ""Notice: The following paper fields have been elided by the publisher: {'abstract'}. Paper or abstract available at http://papers.nips.cc/paper/5134-fast-algorithms-for-gaussian-noise-invariant-independent-component-analysis.pdf, which is subject to the license by the author or copyright owner provided with this content. Please go to the source to verify the license and copyright information for your use.""}","[{'authorId': '37452799', 'name': 'James R. Voss'}, {'authorId': '1768081', 'name': 'Luis Rademacher'}, {'authorId': '145520115', 'name': 'Mikhail Belkin'}]",
bdbd5a8487ccec41d303ea09ee598f432084f258,"{'MAG': '2125666396', 'DBLP': 'conf/nips/XiaoG13', 'CorpusId': 13451577}",A Novel Two-Step Method for Cross Language Representation Learning,Neural Information Processing Systems,2013,"{'url': '', 'status': None, 'license': None, 'disclaimer': ""Notice: The following paper fields have been elided by the publisher: {'abstract'}. Paper or abstract available at http://cis-linux1.temple.edu/~yuhong/research/papers/nips13b.pdf, which is subject to the license by the author or copyright owner provided with this content. Please go to the source to verify the license and copyright information for your use.""}","[{'authorId': '2099594128', 'name': 'Min Xiao'}, {'authorId': '1798719', 'name': 'Yuhong Guo'}]",
be0ab19169eca4e973ada9122896384c332cfc6f,"{'MAG': '2145183542', 'DBLP': 'conf/nips/LindseyMHP13', 'CorpusId': 9955979}",Optimizing Instructional Policies,Neural Information Processing Systems,2013,"{'url': '', 'status': None, 'license': None, 'disclaimer': ""Notice: The following paper fields have been elided by the publisher: {'abstract'}. Paper or abstract available at http://machinelearning.wustl.edu/mlpapers/paper_files/NIPS2013_4887.pdf, which is subject to the license by the author or copyright owner provided with this content. Please go to the source to verify the license and copyright information for your use.""}","[{'authorId': '152958038', 'name': 'Robert V. Lindsey'}, {'authorId': '144473519', 'name': 'M. Mozer'}, {'authorId': '145287043', 'name': 'W. Huggins'}, {'authorId': '2310380', 'name': 'H. Pashler'}]",
be4675f1739e9c4a803f8a0855c0531532d0505d,"{'ArXiv': '1307.0032', 'DBLP': 'journals/corr/MitliagkasC013', 'MAG': '2953310052', 'CorpusId': 6271317}","Memory Limited, Streaming PCA",Neural Information Processing Systems,2013,"{'url': '', 'status': None, 'license': None, 'disclaimer': 'Notice: Paper or abstract available at https://arxiv.org/abs/1307.0032, which is subject to the license by the author or copyright owner provided with this content. Please go to the source to verify the license and copyright information for your use.'}","[{'authorId': '3168518', 'name': 'Ioannis Mitliagkas'}, {'authorId': '1764494', 'name': 'C. Caramanis'}, {'authorId': '48964143', 'name': 'Prateek Jain'}]","We consider streaming, one-pass principal component analysis (PCA), in the high-dimensional regime, with limited memory. Here, p-dimensional samples are presented sequentially, and the goal is to produce the k-dimensional subspace that best approximates these points. Standard algorithms require O(p2) memory; meanwhile no algorithm can do better than O(kp) memory, since this is what the output itself requires. Memory (or storage) complexity is most meaningful when understood in the context of computational and sample complexity. Sample complexity for high-dimensional PCA is typically studied in the setting of the spiked covariance model, where p-dimensional points are generated from a population covariance equal to the identity (white noise) plus a low-dimensional perturbation (the spike) which is the signal to be recovered. It is now well-understood that the spike can be recovered when the number of samples, n, scales proportionally with the dimension, p. Yet, all algorithms that provably achieve this, have memory complexity O(p2). Meanwhile, algorithms with memory-complexity O(kp) do not have provable bounds on sample complexity comparable to p. We present an algorithm that achieves both: it uses O(kp) memory (meaning storage of any kind) and is able to compute the k-dimensional spike with O(p log p) sample-complexity - the first algorithm of its kind. While our theoretical analysis focuses on the spiked covariance model, our simulations show that our algorithm is successful on much more general models for the data."
bff3adbc1ceaf5fb9fe9c3e5e726551ef25c186e,"{'DBLP': 'conf/nips/HughesS13', 'MAG': '2131593562', 'CorpusId': 5776049}",Memoized Online Variational Inference for Dirichlet Process Mixture Models,Neural Information Processing Systems,2013,"{'url': '', 'status': None, 'license': None, 'disclaimer': ""Notice: The following paper fields have been elided by the publisher: {'abstract'}. Paper or abstract available at http://www.dtic.mil/get-tr-doc/pdf?AD=ADA621678&Location=U2&doc=GetTRDoc.pdf, which is subject to the license by the author or copyright owner provided with this content. Please go to the source to verify the license and copyright information for your use.""}","[{'authorId': '2169240', 'name': 'M. Hughes'}, {'authorId': '1799035', 'name': 'Erik B. Sudderth'}]",
c0a417bf5325151babf268ed7beeb69c3b31fbab,"{'ArXiv': '1312.5179', 'MAG': '2102306708', 'DBLP': 'conf/nips/HeinSJR13', 'CorpusId': 6601188}",The Total Variation on Hypergraphs - Learning on Hypergraphs Revisited,Neural Information Processing Systems,2013,"{'url': '', 'status': None, 'license': None, 'disclaimer': 'Notice: Paper or abstract available at https://arxiv.org/abs/1312.5179, which is subject to the license by the author or copyright owner provided with this content. Please go to the source to verify the license and copyright information for your use.'}","[{'authorId': '143610806', 'name': 'Matthias Hein'}, {'authorId': '1743254', 'name': 'S. Setzer'}, {'authorId': '37174308', 'name': 'Leonardo Jost'}, {'authorId': '26320653', 'name': 'Syama Sundar Rangapuram'}]","Hypergraphs allow one to encode higher-order relationships in data and are thus a very flexible modeling tool. Current learning methods are either based on approximations of the hypergraphs via graphs or on tensor methods which are only applicable under special conditions. In this paper, we present a new learning framework on hypergraphs which fully uses the hypergraph structure. The key element is a family of regularization functionals based on the total variation on hypergraphs."
c17c7512d6477580d7b6202d73b49da0cf0a4ccd,"{'MAG': '2952328120', 'ArXiv': '1309.4859', 'DBLP': 'conf/nips/ShaliziK13', 'PubMedCentral': '4551412', 'CorpusId': 15898173, 'PubMed': '26321855'}",Predictive PAC Learning and Process Decompositions,Neural Information Processing Systems,2013,"{'url': '', 'status': None, 'license': None, 'disclaimer': 'Notice: Paper or abstract available at https://arxiv.org/abs/1309.4859, which is subject to the license by the author or copyright owner provided with this content. Please go to the source to verify the license and copyright information for your use.'}","[{'authorId': '1788415', 'name': 'C. Shalizi'}, {'authorId': '5333251', 'name': 'A. Kontorovich'}]","We informally call a stochastic process learnable if it admits a generalization error approaching zero in probability for any concept class with finite VC-dimension (IID processes are the simplest example). A mixture of learnable processes need not be learnable itself, and certainly its generalization error need not decay at the same rate. In this paper, we argue that it is natural in predictive PAC to condition not on the past observations but on the mixture component of the sample path. This definition not only matches what a realistic learner might demand, but also allows us to sidestep several otherwise grave problems in learning from dependent data. In particular, we give a novel PAC generalization bound for mixtures of learnable processes with a generalization error that is not worse than that of each mixture component. We also provide a characterization of mixtures of absolutely regular (β-mixing) processes, of independent probability-theoretic interest."
c184d4cd258f1860cd05d8b94e3f4aba72044677,"{'DBLP': 'conf/nips/Bresson0UB13', 'MAG': '2950556234', 'ArXiv': '1306.1185', 'DOI': '10.21236/ada612811', 'CorpusId': 9655496}",Multiclass Total Variation Clustering,Neural Information Processing Systems,2013,"{'url': 'http://arxiv.org/pdf/1306.1185', 'status': 'GREEN', 'license': None, 'disclaimer': 'Notice: Paper or abstract available at https://arxiv.org/abs/1306.1185, which is subject to the license by the author or copyright owner provided with this content. Please go to the source to verify the license and copyright information for your use.'}","[{'authorId': '2549032', 'name': 'X. Bresson'}, {'authorId': '81634721', 'name': 'T. Laurent'}, {'authorId': '2478725', 'name': 'D. Uminsky'}, {'authorId': '144952860', 'name': 'J. V. Brecht'}]","Ideas from the image processing literature have recently motivated a new set of clustering algorithms that rely on the concept of total variation. While these algorithms perform well for bi-partitioning tasks, their recursive extensions yield unimpressive results for multiclass clustering tasks. This paper presents a general framework for multiclass total variation clustering that does not rely on recursion. The results greatly outperform previous total variation algorithms and compare well with state-of-the-art NMF approaches."
c22abaae7b67ffa367403fe31477c079442d0936,"{'MAG': '2166560602', 'DBLP': 'conf/nips/KpotufeG13', 'CorpusId': 869736}",Adaptivity to Local Smoothness and Dimension in Kernel Regression,Neural Information Processing Systems,2013,"{'url': '', 'status': None, 'license': None, 'disclaimer': ""Notice: The following paper fields have been elided by the publisher: {'abstract'}. Paper or abstract available at http://papers.nips.cc/paper/5103-adaptivity-to-local-smoothness-and-dimension-in-kernel-regression, which is subject to the license by the author or copyright owner provided with this content. Please go to the source to verify the license and copyright information for your use.""}","[{'authorId': '2248336', 'name': 'Samory Kpotufe'}, {'authorId': '3307138', 'name': 'Vikas K. Garg'}]",
c28f810187c9c9983313e27ed6d2e5567a4298de,"{'MAG': '2128531008', 'DBLP': 'conf/nips/DaiEL13', 'CorpusId': 14713884}",What Are the Invariant Occlusive Components of Image Patches? A Probabilistic Generative Approach,Neural Information Processing Systems,2013,"{'url': '', 'status': None, 'license': None, 'disclaimer': ""Notice: The following paper fields have been elided by the publisher: {'abstract'}. Paper or abstract available at http://papers.nips.cc/paper/5195-what-are-the-invariant-occlusive-components-of-image-patches-a-probabilistic-generative-approach.pdf, which is subject to the license by the author or copyright owner provided with this content. Please go to the source to verify the license and copyright information for your use.""}","[{'authorId': '2024189708', 'name': 'Zhenwen Dai'}, {'authorId': '2969624', 'name': 'Georgios Exarchakis'}, {'authorId': '1790122', 'name': 'Jörg Lücke'}]",
c2a6d81925268a879abc9ee5260832ea4b317d61,"{'MAG': '2151044107', 'DBLP': 'conf/nips/DuranteSD13', 'CorpusId': 15126327}",Locally Adaptive Bayesian Multivariate Time Series,Neural Information Processing Systems,2013,"{'url': '', 'status': None, 'license': None, 'disclaimer': ""Notice: The following paper fields have been elided by the publisher: {'abstract'}. Paper or abstract available at http://papers.nips.cc/paper/5115-locally-adaptive-bayesian-multivariate-time-series.pdf, which is subject to the license by the author or copyright owner provided with this content. Please go to the source to verify the license and copyright information for your use.""}","[{'authorId': '1709414', 'name': 'Daniele Durante'}, {'authorId': '47157127', 'name': 'B. Scarpa'}, {'authorId': '39775017', 'name': 'D. Dunson'}]",
c2c610df7be0e49becedc9cd3e7342662e6ad73b,"{'MAG': '2149571656', 'DBLP': 'conf/nips/Cesa-BianchiGZ13', 'ArXiv': '1306.0811', 'CorpusId': 2301835}",A Gang of Bandits,Neural Information Processing Systems,2013,"{'url': '', 'status': None, 'license': None, 'disclaimer': 'Notice: Paper or abstract available at https://arxiv.org/abs/1306.0811, which is subject to the license by the author or copyright owner provided with this content. Please go to the source to verify the license and copyright information for your use.'}","[{'authorId': '1388387856', 'name': 'N. Cesa-Bianchi'}, {'authorId': '1895207', 'name': 'C. Gentile'}, {'authorId': '3024156', 'name': 'Giovanni Zappella'}]","Multi-armed bandit problems formalize the exploration-exploitation trade-offs arising in several industrially relevant applications, such as online advertisement and, more generally, recommendation systems. In many cases, however, these applications have a strong social component, whose integration in the bandit algorithm could lead to a dramatic performance increase. For instance, content may be served to a group of users by taking advantage of an underlying network of social relationships among them. In this paper, we introduce novel algorithmic approaches to the solution of such networked bandit problems. More specifically, we design and analyze a global recommendation strategy which allocates a bandit algorithm to each network node (user) and allows it to ""share"" signals (contexts and payoffs) with the neghboring nodes. We then derive two more scalable variants of this strategy based on different ways of clustering the graph nodes. We experimentally compare the algorithm and its variants to state-of-the-art methods for contextual bandits that do not use the relational information. Our experiments, carried out on synthetic and real-world datasets, show a consistent increase in prediction performance obtained by exploiting the network structure."
c4bde56ae92435be337b222ca33d364cace20696,"{'MAG': '2130107494', 'DBLP': 'conf/nips/SinzSGB13', 'CorpusId': 650224}",Least Informative Dimensions,Neural Information Processing Systems,2013,"{'url': '', 'status': None, 'license': None, 'disclaimer': ""Notice: The following paper fields have been elided by the publisher: {'abstract'}. Paper or abstract available at http://machinelearning.wustl.edu/mlpapers/paper_files/NIPS2013_4946.pdf, which is subject to the license by the author or copyright owner provided with this content. Please go to the source to verify the license and copyright information for your use.""}","[{'authorId': '50095217', 'name': 'Fabian H Sinz'}, {'authorId': '2350064', 'name': 'Anna Stockl'}, {'authorId': '31859965', 'name': 'J. Grewe'}, {'authorId': '70068598', 'name': 'J. Benda'}]",
c5c82b0ca656702f4deda2a677156c5d8dbff8a2,"{'MAG': '2125566565', 'DBLP': 'conf/nips/ZhangW13a', 'CorpusId': 601334}",Non-Uniform Camera Shake Removal Using a Spatially-Adaptive Sparse Penalty,Neural Information Processing Systems,2013,"{'url': '', 'status': None, 'license': None, 'disclaimer': ""Notice: The following paper fields have been elided by the publisher: {'abstract'}. Paper or abstract available at http://research.microsoft.com/pubs/216839/4864-non-uniform-camera-shake-removal-using-a-spatially-adaptive-sparse-penalty.pdf, which is subject to the license by the author or copyright owner provided with this content. Please go to the source to verify the license and copyright information for your use.""}","[{'authorId': None, 'name': 'Haichao Zhang'}, {'authorId': '2242717', 'name': 'D. Wipf'}]",
c5c9bc4d7ee8b04a591018995a8c2d3470655e66,"{'MAG': '2150234726', 'DBLP': 'conf/nips/ZiminN13', 'CorpusId': 8276941}",Online learning in episodic Markovian decision processes by relative entropy policy search,Neural Information Processing Systems,2013,"{'url': '', 'status': None, 'license': None, 'disclaimer': ""Notice: The following paper fields have been elided by the publisher: {'abstract'}. Paper or abstract available at https://hal.archives-ouvertes.fr/hal-01079423/file/ZN13.pdf, which is subject to the license by the author or copyright owner provided with this content. Please go to the source to verify the license and copyright information for your use.""}","[{'authorId': '144757635', 'name': 'Alexander Zimin'}, {'authorId': '1741549', 'name': 'Gergely Neu'}]",
c628bc12c9c5d787ac1af7f8db891aee362454c5,"{'MAG': '1515797810', 'CorpusId': 15098509}",A Distributed Approximation Algorithm for Mixed Packing-Covering Linear Programs,Neural Information Processing Systems,2013,"{'url': '', 'status': None, 'license': None, 'disclaimer': ""Notice: The following paper fields have been elided by the publisher: {'abstract'}. Paper or abstract available at http://people.mpi-inf.mpg.de/~rgemulla/publications/makari13mpc.pdf, which is subject to the license by the author or copyright owner provided with this content. Please go to the source to verify the license and copyright information for your use.""}","[{'authorId': '2650172', 'name': 'Faraz Makari'}, {'authorId': '1777107', 'name': 'Rainer Gemulla'}]",
c6f70ce1818409a50bdd705538f4f1e203092799,"{'MAG': '2131437840', 'DBLP': 'conf/nips/ZhangYS13', 'CorpusId': 1969996}",Polar Operators for Structured Sparse Estimation,Neural Information Processing Systems,2013,"{'url': '', 'status': None, 'license': None, 'disclaimer': ""Notice: The following paper fields have been elided by the publisher: {'abstract'}. Paper or abstract available at http://papers.nips.cc/paper/4935-polar-operators-for-structured-sparse-estimation.pdf, which is subject to the license by the author or copyright owner provided with this content. Please go to the source to verify the license and copyright information for your use.""}","[{'authorId': '2108029096', 'name': 'Xinhua Zhang'}, {'authorId': '40508553', 'name': 'Yaoliang Yu'}, {'authorId': '1714772', 'name': 'Dale Schuurmans'}]",
c7cfb1f5047cc6ce6771040dcb588e5c38a04d24,"{'DBLP': 'conf/nips/ArcherPP13', 'MAG': '2134876548', 'CorpusId': 10512495}",Bayesian entropy estimation for binary spike train data using parametric prior knowledge,Neural Information Processing Systems,2013,"{'url': '', 'status': None, 'license': None, 'disclaimer': ""Notice: The following paper fields have been elided by the publisher: {'abstract'}. Paper or abstract available at http://www.evanarcher.com/blog/wp-content/uploads/2013/11/Archer_BDPentropy_NIPS2013.pdf, which is subject to the license by the author or copyright owner provided with this content. Please go to the source to verify the license and copyright information for your use.""}","[{'authorId': '2749836', 'name': 'Evan Archer'}, {'authorId': '41159691', 'name': 'Il-Su Park'}, {'authorId': '1791723', 'name': 'Jonathan W. Pillow'}]",
c7dd300d2ca02b76e2fad3ba33e1d0bc9676dc79,"{'MAG': '2169422098', 'CorpusId': 61971249}",Visual word representation in the brain,Neural Information Processing Systems,2013,"{'url': '', 'status': None, 'license': None, 'disclaimer': ""Notice: The following paper fields have been elided by the publisher: {'abstract'}. Paper or abstract available at https://01bd0cad-a-62cb3a1a-s-sites.googlegroups.com/site/mlininips2013/proceedings-of-mlini-2012-1/Paper%2015.pdf?attachauth=ANoY7cp-Nlo2BGYTdIUW7LkWtCMY0YAf46bQ_aPmtsBKQrHyYtUlDPx538NZQ4OWd7m0XeQbQTL8PgRmSqJFS8i2_85cZ2dRYlCNeVxcjTyfkjNtJzRsI3JzdAlU-zxFGXdHjnJ4vXUXT5DXCZ79qt2YX719OluJRuJSu_SCICMnfYpvVBb4zK3mOTKqqVRz0X9RGa5UB09oYKYXMzRkqZPjycFRS9r0EIUXK0yiNK6GNOysaJznO6bkB4cIMrGH-fSpy2Rvyi9g&attredirects=1, which is subject to the license by the author or copyright owner provided with this content. Please go to the source to verify the license and copyright information for your use.""}","[{'authorId': '40544169', 'name': 'K. Ramakrishnan'}, {'authorId': '145937014', 'name': 'I. Groen'}, {'authorId': '67197193', 'name': 'S. Scholte'}, {'authorId': '144638781', 'name': 'A. Smeulders'}, {'authorId': '1682828', 'name': 'S. Ghebreab'}]",
c8b31d37225e082395f212200eaaf68918195b41,"{'MAG': '2107366978', 'DBLP': 'conf/nips/YaminsHCD13', 'CorpusId': 15981075}",Hierarchical Modular Optimization of Convolutional Networks Achieves Representations Similar to Macaque IT and Human Ventral Stream,Neural Information Processing Systems,2013,"{'url': '', 'status': None, 'license': None, 'disclaimer': ""Notice: The following paper fields have been elided by the publisher: {'abstract'}. Paper or abstract available at http://dspace.mit.edu/openaccess-disseminate/1721.1/95910, which is subject to the license by the author or copyright owner provided with this content. Please go to the source to verify the license and copyright information for your use.""}","[{'authorId': '2292273', 'name': 'Daniel Yamins'}, {'authorId': '145270377', 'name': 'Ha Hong'}, {'authorId': '3202046', 'name': 'C. Cadieu'}, {'authorId': '1865831', 'name': 'J. DiCarlo'}]",
