paperId,externalIds,title,venue,year,openAccessPdf,authors,abstract
42dba99d9e8ffd5d4a97dfd4043b4ae3ccb756a1,"{'DBLP': 'journals/corr/DuSGZ13', 'PubMedCentral': '4704803', 'ArXiv': '1311.3669', 'MAG': '2950468916', 'CorpusId': 8527579, 'PubMed': '26752940'}",Scalable Influence Estimation in Continuous-Time Diffusion Networks,Neural Information Processing Systems,2013,"{'url': '', 'status': None, 'license': None, 'disclaimer': 'Notice: Paper or abstract available at https://arxiv.org/abs/1311.3669, which is subject to the license by the author or copyright owner provided with this content. Please go to the source to verify the license and copyright information for your use.'}","[{'authorId': '145585757', 'name': 'Nan Du'}, {'authorId': '1779453', 'name': 'Le Song'}, {'authorId': '1388404108', 'name': 'M. Gomez-Rodriguez'}, {'authorId': '145203884', 'name': 'H. Zha'}]","If a piece of information is released from a media site, can we predict whether it may spread to one million web pages, in a month ? This influence estimation problem is very challenging since both the time-sensitive nature of the task and the requirement of scalability need to be addressed simultaneously. In this paper, we propose a randomized algorithm for influence estimation in continuous-time diffusion networks. Our algorithm can estimate the influence of every node in a network with |V| nodes and |ε| edges to an accuracy of ε using n = O(1/ε2) randomizations and up to logarithmic factors O(n|ε|+n|V|) computations. When used as a subroutine in a greedy influence maximization approach, our proposed algorithm is guaranteed to find a set of C nodes with the influence of at least (1 − 1/e) OPT − 2Cε, where OPT is the optimal value. Experiments on both synthetic and real-world data show that the proposed algorithm can easily scale up to networks of millions of nodes while significantly improves over previous state-of-the-arts in terms of the accuracy of the estimated influence and the quality of the selected nodes in maximizing the influence."
4309659506e8aaf642aee9c191722b5e0d2b5453,"{'MAG': '2963820200', 'DBLP': 'conf/nips/JavanmardM13a', 'ArXiv': '1305.0355', 'CorpusId': 6448637}",Model Selection for High-Dimensional Regression under the Generalized Irrepresentability Condition,Neural Information Processing Systems,2013,"{'url': '', 'status': None, 'license': None, 'disclaimer': 'Notice: Paper or abstract available at https://arxiv.org/abs/1305.0355, which is subject to the license by the author or copyright owner provided with this content. Please go to the source to verify the license and copyright information for your use.'}","[{'authorId': '2548570', 'name': 'Adel Javanmard'}, {'authorId': '145071265', 'name': 'A. Montanari'}]","In the high-dimensional regression model a response variable is linearly related to $p$ covariates, but the sample size $n$ is smaller than $p$. We assume that only a small subset of covariates is `active' (i.e., the corresponding coefficients are non-zero), and consider the model-selection problem of identifying the active covariates. A popular approach is to estimate the regression coefficients through the Lasso ($\ell_1$-regularized least squares). This is known to correctly identify the active set only if the irrelevant covariates are roughly orthogonal to the relevant ones, as quantified through the so called `irrepresentability' condition. In this paper we study the `Gauss-Lasso' selector, a simple two-stage method that first solves the Lasso, and then performs ordinary least squares restricted to the Lasso active set. We formulate `generalized irrepresentability condition' (GIC), an assumption that is substantially weaker than irrepresentability. We prove that, under GIC, the Gauss-Lasso correctly recovers the active set."
4334a431b67a1cee9c63de19a2fb2fb8b793d54e,"{'DBLP': 'journals/corr/TaghipourDB13', 'ArXiv': '1306.0751', 'MAG': '2137820498', 'CorpusId': 6561299}",First-order Decomposition Trees,Neural Information Processing Systems,2013,"{'url': '', 'status': None, 'license': None, 'disclaimer': 'Notice: Paper or abstract available at https://arxiv.org/abs/1306.0751, which is subject to the license by the author or copyright owner provided with this content. Please go to the source to verify the license and copyright information for your use.'}","[{'authorId': '3061599', 'name': 'N. Taghipour'}, {'authorId': '144815446', 'name': 'Jesse Davis'}, {'authorId': '1755851', 'name': 'H. Blockeel'}]","Lifting attempts to speedup probabilistic inference by exploiting symmetries in the model. Exact lifted inference methods, like their propositional counterparts, work by recursively decomposing the model and the problem. In the propositional case, there exist formal structures, such as decomposition trees (dtrees), that represent such a decomposition and allow us to determine the complexity of inference a priori. However, there is currently no equivalent structure nor analogous complexity results for lifted inference. In this paper, we introduce FO-dtrees, which upgrade propositional dtrees to the first-order level. We show how these trees can characterize a lifted inference solution for a probabilistic logical model (in terms of a sequence of lifted operations), and make a theoretical analysis of the complexity of lifted inference in terms of the novel notion of lifted width for the tree."
43c05444fbc239321f6676f3cd539cac34fde7b8,"{'MAG': '2107438106', 'DBLP': 'conf/nips/Johnson013', 'CorpusId': 6587578}",Accelerating Stochastic Gradient Descent using Predictive Variance Reduction,Neural Information Processing Systems,2013,"{'url': '', 'status': None, 'license': None, 'disclaimer': ""Notice: The following paper fields have been elided by the publisher: {'abstract'}. Paper or abstract available at http://papers.nips.cc/paper/4937-accelerating-stochastic-gradient-descent-using-predictive-variance-reduction.pdf, which is subject to the license by the author or copyright owner provided with this content. Please go to the source to verify the license and copyright information for your use.""}","[{'authorId': '2108925678', 'name': 'Rie Johnson'}, {'authorId': '50728655', 'name': 'Tong Zhang'}]",
447d6bc9600f8be29d1a29f3d3011cb4d159ec47,"{'DBLP': 'conf/nips/AslanCZS13', 'MAG': '2625024868', 'CorpusId': 2632960}",Convex Two-Layer Modeling,Neural Information Processing Systems,2013,"{'url': '', 'status': None, 'license': None, 'disclaimer': ""Notice: The following paper fields have been elided by the publisher: {'abstract'}. Paper or abstract available at http://citeseerx.ist.psu.edu/viewdoc/download;jsessionid=78FE396C2C5A4130680B4BEC4965FD13?doi=10.1.1.470.4137&rep=rep1&type=pdf, which is subject to the license by the author or copyright owner provided with this content. Please go to the source to verify the license and copyright information for your use.""}","[{'authorId': '2166611', 'name': 'Özlem Aslan'}, {'authorId': '47413820', 'name': 'Hao Cheng'}, {'authorId': '2108029096', 'name': 'Xinhua Zhang'}, {'authorId': '1714772', 'name': 'Dale Schuurmans'}]",
449385ba21a81889dd66412d9b8257b6ffb288aa,"{'MAG': '2106728335', 'ArXiv': '1305.2581', 'DBLP': 'conf/nips/Shalev-Shwartz013', 'CorpusId': 7316764}",Accelerated Mini-Batch Stochastic Dual Coordinate Ascent,Neural Information Processing Systems,2013,"{'url': '', 'status': None, 'license': None, 'disclaimer': 'Notice: Paper or abstract available at https://arxiv.org/abs/1305.2581, which is subject to the license by the author or copyright owner provided with this content. Please go to the source to verify the license and copyright information for your use.'}","[{'authorId': '1389955537', 'name': 'S. Shalev-Shwartz'}, {'authorId': '49104973', 'name': 'Tong Zhang'}]","Stochastic dual coordinate ascent (SDCA) is an effective technique for solving regularized loss minimization problems in machine learning. This paper considers an extension of SDCA under the mini-batch setting that is often used in practice. Our main contribution is to introduce an accelerated mini-batch version of SDCA and prove a fast convergence rate for this method. We discuss an implementation of our method over a parallel computing system, and compare the results to both the vanilla stochastic dual coordinate ascent and to the accelerated deterministic gradient descent method of Nesterov [2007]."
44a3bb365c89bd3cd28adde48a1d166d9ed98650,"{'MAG': '2150783909', 'DBLP': 'conf/nips/JoganS13', 'CorpusId': 14409211}",Optimal integration of visual speed across different spatiotemporal frequency channels,Neural Information Processing Systems,2013,"{'url': '', 'status': None, 'license': None, 'disclaimer': ""Notice: The following paper fields have been elided by the publisher: {'abstract'}. Paper or abstract available at http://machinelearning.wustl.edu/mlpapers/paper_files/NIPS2013_5203.pdf, which is subject to the license by the author or copyright owner provided with this content. Please go to the source to verify the license and copyright information for your use.""}","[{'authorId': '3270844', 'name': 'M. Jogan'}, {'authorId': '2100708', 'name': 'A. Stocker'}]",
450ae94f84eba33e2ed60a1ea9657fbe93989c51,"{'DBLP': 'conf/nips/SugiyamaB13', 'MAG': '2113060550', 'CorpusId': 9454581}",Rapid Distance-Based Outlier Detection via Sampling,Neural Information Processing Systems,2013,"{'url': '', 'status': None, 'license': None, 'disclaimer': ""Notice: The following paper fields have been elided by the publisher: {'abstract'}. Paper or abstract available at http://papers.nips.cc/paper/5127-rapid-distance-based-outlier-detection-via-sampling.pdf, which is subject to the license by the author or copyright owner provided with this content. Please go to the source to verify the license and copyright information for your use.""}","[{'authorId': '1692426', 'name': 'M. Sugiyama'}, {'authorId': '1704422', 'name': 'Karsten M. Borgwardt'}]",
450fe4ec08b439b4a410b27452b794b893f3e374,"{'DBLP': 'conf/nips/TuragaBPDPHM13', 'MAG': '2104979528', 'CorpusId': 1099404}",Inferring neural population dynamics from multiple partial recordings of the same neural circuit,Neural Information Processing Systems,2013,"{'url': '', 'status': None, 'license': None, 'disclaimer': ""Notice: The following paper fields have been elided by the publisher: {'abstract'}. Paper or abstract available at http://www.kyb.tuebingen.mpg.de/fileadmin/user_upload/files/publications/2013/NIPS-2013-Turaga.pdf, which is subject to the license by the author or copyright owner provided with this content. Please go to the source to verify the license and copyright information for your use.""}","[{'authorId': '3178417', 'name': 'Srinivas C. Turaga'}, {'authorId': '1981334', 'name': 'L. Buesing'}, {'authorId': '2036306', 'name': 'Adam Packer'}, {'authorId': '2127039572', 'name': 'H. Dalgleish'}, {'authorId': '39975149', 'name': 'Noah L. Pettit'}, {'authorId': '3323247', 'name': 'M. Häusser'}, {'authorId': '1748468', 'name': 'J. Macke'}]",
46f01e31c451971b1cf9a6c708a477861845c5d2,"{'MAG': '2715830020', 'DBLP': 'conf/nips/ZhangLT13', 'CorpusId': 14745019}",Learning with Invariance via Linear Functionals on Reproducing Kernel Hilbert Space,Neural Information Processing Systems,2013,"{'url': '', 'status': None, 'license': None, 'disclaimer': ""Notice: The following paper fields have been elided by the publisher: {'abstract'}. Paper or abstract available at https://www.cs.uic.edu/~zhangx/papers/ZhaLeeTeh13.pdf, which is subject to the license by the author or copyright owner provided with this content. Please go to the source to verify the license and copyright information for your use.""}","[{'authorId': '2108029096', 'name': 'Xinhua Zhang'}, {'authorId': '1740222', 'name': 'Wee Sun Lee'}, {'authorId': '1725303', 'name': 'Y. Teh'}]",
4794596da548a2e62c28911c0d0224fbdf330622,"{'DBLP': 'conf/nips/0005MJ13', 'MAG': '2098741260', 'CorpusId': 5730975}",Linear Convergence with Condition Number Independent Access of Full Gradients,Neural Information Processing Systems,2013,"{'url': '', 'status': None, 'license': None, 'disclaimer': ""Notice: The following paper fields have been elided by the publisher: {'abstract'}. Paper or abstract available at http://papers.nips.cc/paper/4940-linear-convergence-with-condition-number-independent-access-of-full-gradients, which is subject to the license by the author or copyright owner provided with this content. Please go to the source to verify the license and copyright information for your use.""}","[{'authorId': '2108876951', 'name': 'Lijun Zhang'}, {'authorId': '1694826', 'name': 'M. Mahdavi'}, {'authorId': '144723884', 'name': 'Rong Jin'}]",
47aaa0ab99a3f23c9dd508c6feec644a3ddaa4bb,"{'DBLP': 'conf/nips/ErmonGSS13', 'MAG': '2112904372', 'CorpusId': 4895784}",Embed and Project: Discrete Sampling with Universal Hashing,Neural Information Processing Systems,2013,"{'url': '', 'status': None, 'license': None, 'disclaimer': ""Notice: The following paper fields have been elided by the publisher: {'abstract'}. Paper or abstract available at http://papers.nips.cc/paper/4965-embed-and-project-discrete-sampling-with-universal-hashing, which is subject to the license by the author or copyright owner provided with this content. Please go to the source to verify the license and copyright information for your use.""}","[{'authorId': '2490652', 'name': 'Stefano Ermon'}, {'authorId': '144659218', 'name': 'C. Gomes'}, {'authorId': '48229640', 'name': 'Ashish Sabharwal'}, {'authorId': '1744679', 'name': 'B. Selman'}]",
47f77ba1b0bd629de3b8c6c1b7c95849228afd63,"{'MAG': '2951081543', 'DBLP': 'conf/nips/KordaKM13', 'ArXiv': '1307.3400', 'CorpusId': 7462917}",Thompson Sampling for 1-Dimensional Exponential Family Bandits,Neural Information Processing Systems,2013,"{'url': '', 'status': None, 'license': None, 'disclaimer': 'Notice: Paper or abstract available at https://arxiv.org/abs/1307.3400, which is subject to the license by the author or copyright owner provided with this content. Please go to the source to verify the license and copyright information for your use.'}","[{'authorId': '33656309', 'name': 'N. Korda'}, {'authorId': '2578263', 'name': 'E. Kaufmann'}, {'authorId': '1708654', 'name': 'R. Munos'}]","Thompson Sampling has been demonstrated in many complex bandit models, however the theoretical guarantees available for the parametric multi-armed bandit are still limited to the Bernoulli case. Here we extend them by proving asymptotic optimality of the algorithm using the Jeffreys prior for 1-dimensional exponential family bandits. Our proof builds on previous work, but also makes extensive use of closed forms for Kullback-Leibler divergence and Fisher information (through the Jeffreys prior) available in an exponential family. This allow us to give a finite time exponential concentration inequality for posterior distributions on exponential families that may be of interest in its own right. Moreover our analysis covers some distributions for which no optimistic algorithm has yet been proposed, including heavy-tailed exponential families."
481c6895ebba98a5fbff546ae1ff3f27d9f87f5b,"{'MAG': '2950813414', 'DBLP': 'conf/nips/FidanerC13', 'ArXiv': '1310.0509', 'CorpusId': 1928787}",Summary Statistics for Partitionings and Feature Allocations,Neural Information Processing Systems,2013,"{'url': '', 'status': None, 'license': None, 'disclaimer': 'Notice: Paper or abstract available at https://arxiv.org/abs/1310.0509, which is subject to the license by the author or copyright owner provided with this content. Please go to the source to verify the license and copyright information for your use.'}","[{'authorId': '67032095', 'name': 'I. B. Fidaner'}, {'authorId': '9235290', 'name': 'Ali Taylan Cemgil'}]","Infinite mixture models are commonly used for clustering. One can sample from the posterior of mixture assignments by Monte Carlo methods or find its maximum a posteriori solution by optimization. However, in some problems the posterior is diffuse and it is hard to interpret the sampled partitionings. In this paper, we introduce novel statistics based on block sizes for representing sample sets of partitionings and feature allocations. We develop an element-based definition of entropy to quantify segmentation among their elements. Then we propose a simple algorithm called entropy agglomeration (EA) to summarize and visualize this information. Experiments on various infinite mixture posteriors as well as a feature allocation dataset demonstrate that the proposed statistics are useful in practice."
489709f8b452adb3178a400d1716204c84b25368,"{'MAG': '2552361213', 'CorpusId': 14811921}",Approximate Gaussian process inference for the drift of stochastic differential equations,Neural Information Processing Systems,2013,"{'url': '', 'status': None, 'license': None, 'disclaimer': ""Notice: The following paper fields have been elided by the publisher: {'abstract'}. Paper or abstract available at http://papers.nips.cc/paper/4967-approximate-gaussian-process-inference-for-the-drift-function-in-stochastic-differential-equations.pdf, which is subject to the license by the author or copyright owner provided with this content. Please go to the source to verify the license and copyright information for your use.""}","[{'authorId': '2203137', 'name': 'Andreas Ruttor'}, {'authorId': '3218651', 'name': 'Philipp Batz'}, {'authorId': '1691022', 'name': 'M. Opper'}]",
4a7bec5222f4b3f3dc13799582fc3a89c59a5149,"{'DBLP': 'conf/nips/LouppeWSG13', 'MAG': '2169178923', 'CorpusId': 11259771}",Understanding variable importances in forests of randomized trees,Neural Information Processing Systems,2013,"{'url': '', 'status': None, 'license': None, 'disclaimer': ""Notice: The following paper fields have been elided by the publisher: {'abstract'}. Paper or abstract available at http://papers.nips.cc/paper/4928-understanding-variable-importances-in-forests-of-randomized-trees.pdf, which is subject to the license by the author or copyright owner provided with this content. Please go to the source to verify the license and copyright information for your use.""}","[{'authorId': '1881041', 'name': 'Gilles Louppe'}, {'authorId': '1695713', 'name': 'L. Wehenkel'}, {'authorId': '31999245', 'name': 'Antonio Sutera'}, {'authorId': '50206577', 'name': 'P. Geurts'}]",
4aa4069693bee00d1b0759ca3df35e59284e9845,"{'MAG': '2123024445', 'DBLP': 'conf/nips/FromeCSBDRM13', 'CorpusId': 261138}",DeViSE: A Deep Visual-Semantic Embedding Model,Neural Information Processing Systems,2013,"{'url': '', 'status': None, 'license': None, 'disclaimer': ""Notice: The following paper fields have been elided by the publisher: {'abstract'}. Paper or abstract available at http://machinelearning.wustl.edu/mlpapers/paper_files/NIPS2013_5204.pdf, which is subject to the license by the author or copyright owner provided with this content. Please go to the source to verify the license and copyright information for your use.""}","[{'authorId': '2279670', 'name': 'Andrea Frome'}, {'authorId': '32131713', 'name': 'G. Corrado'}, {'authorId': '1789737', 'name': 'Jonathon Shlens'}, {'authorId': '1751569', 'name': 'Samy Bengio'}, {'authorId': '49959210', 'name': 'J. Dean'}, {'authorId': '1706809', 'name': ""Marc'Aurelio Ranzato""}, {'authorId': '2047446108', 'name': 'Tomas Mikolov'}]",
4aba54ea82bf99ed4690d45051f1b25d8b9554b5,"{'DBLP': 'conf/nips/LuL13', 'MAG': '2128892113', 'CorpusId': 14617645}",A Deep Architecture for Matching Short Texts,Neural Information Processing Systems,2013,"{'url': '', 'status': None, 'license': None, 'disclaimer': ""Notice: The following paper fields have been elided by the publisher: {'abstract'}. Paper or abstract available at http://machinelearning.wustl.edu/mlpapers/paper_files/NIPS2013_5019.pdf, which is subject to the license by the author or copyright owner provided with this content. Please go to the source to verify the license and copyright information for your use.""}","[{'authorId': '11955007', 'name': 'Zhengdong Lu'}, {'authorId': '49404233', 'name': 'Hang Li'}]",
4b42bf82aaa2fec0c3513ecf9fbb9efb630b7448,"{'MAG': '2952779184', 'DBLP': 'conf/nips/0002L13', 'ArXiv': '1311.2079', 'CorpusId': 8666602}",Nonparametric Multi-group Membership Model for Dynamic Networks,Neural Information Processing Systems,2013,"{'url': '', 'status': None, 'license': None, 'disclaimer': 'Notice: Paper or abstract available at https://arxiv.org/abs/1311.2079, which is subject to the license by the author or copyright owner provided with this content. Please go to the source to verify the license and copyright information for your use.'}","[{'authorId': '39345585', 'name': 'Myunghwan Kim'}, {'authorId': '1702139', 'name': 'J. Leskovec'}]","Relational data—like graphs, networks, and matrices—is often dynamic, where the relational structure evolves over time. A fundamental problem in the analysis of time-varying network data is to extract a summary of the common structure and the dynamics of the underlying relations between the entities. Here we build on the intuition that changes in the network structure are driven by dynamics at the level of groups of nodes. We propose a nonparametric multi-group membership model for dynamic networks. Our model contains three main components: We model the birth and death of individual groups with respect to the dynamics of the network structure via a distance dependent Indian Buffet Process. We capture the evolution of individual node group memberships via a Factorial Hidden Markov model. And, we explain the dynamics of the network structure by explicitly modeling the connectivity structure of groups. We demonstrate our model's capability of identifying the dynamics of latent groups in a number of different types of network data. Experimental results show that our model provides improved predictive performance over existing dynamic network models on future network forecasting and missing link prediction."
4bdf6e14344ea686bfaa1da90060871090bb5af8,"{'DBLP': 'conf/nips/LuDFU13', 'MAG': '2135921993', 'CorpusId': 9436994}",Faster Ridge Regression via the Subsampled Randomized Hadamard Transform,Neural Information Processing Systems,2013,"{'url': '', 'status': None, 'license': None, 'disclaimer': ""Notice: The following paper fields have been elided by the publisher: {'abstract'}. Paper or abstract available at http://papers.nips.cc/paper/5106-faster-ridge-regression-via-the-subsampled-randomized-hadamard-transform.pdf, which is subject to the license by the author or copyright owner provided with this content. Please go to the source to verify the license and copyright information for your use.""}","[{'authorId': '2505474', 'name': 'Y. Lu'}, {'authorId': '1939367', 'name': 'Paramveer S. Dhillon'}, {'authorId': '145346319', 'name': 'Dean Phillips Foster'}, {'authorId': '1412391493', 'name': 'L. Ungar'}]",
4cd08195d287fc821ca6446fd1e2d74b72bb720f,"{'MAG': '2118508845', 'DBLP': 'conf/nips/SmithGF13', 'CorpusId': 5908218}",Learning and using language via recursive pragmatic reasoning about other agents,Neural Information Processing Systems,2013,"{'url': '', 'status': None, 'license': None, 'disclaimer': ""Notice: The following paper fields have been elided by the publisher: {'abstract'}. Paper or abstract available at https://vorpus.org/~njs/tmp/praglearn.pdf, which is subject to the license by the author or copyright owner provided with this content. Please go to the source to verify the license and copyright information for your use.""}","[{'authorId': '50463401', 'name': 'Nathaniel J. Smith'}, {'authorId': '144002017', 'name': 'Noah D. Goodman'}, {'authorId': '2536223', 'name': 'Michael C. Frank'}]",
4e24312b93845be78cd6d58e1c99e8eaa2af07f2,"{'DBLP': 'conf/nips/HanLC13', 'MAG': '2118812382', 'CorpusId': 1311221}",Integrated Non-Factorized Variational Inference,Neural Information Processing Systems,2013,"{'url': '', 'status': None, 'license': None, 'disclaimer': ""Notice: The following paper fields have been elided by the publisher: {'abstract'}. Paper or abstract available at http://papers.nips.cc/paper/5068-integrated-non-factorized-variational-inference.pdf, which is subject to the license by the author or copyright owner provided with this content. Please go to the source to verify the license and copyright information for your use.""}","[{'authorId': '34288854', 'name': 'Shaobo Han'}, {'authorId': '2585822', 'name': 'X. Liao'}, {'authorId': '145006560', 'name': 'L. Carin'}]",
50d53cc562225549457cbc782546bfbe1ac6f0cf,"{'MAG': '2127426251', 'DBLP': 'conf/nips/SocherCMN13', 'CorpusId': 8429835}",Reasoning With Neural Tensor Networks for Knowledge Base Completion,Neural Information Processing Systems,2013,"{'url': '', 'status': None, 'license': None, 'disclaimer': ""Notice: The following paper fields have been elided by the publisher: {'abstract'}. Paper or abstract available at http://nlp.stanford.edu/~socherr/SocherChenManningNg_NIPS2013.pdf, which is subject to the license by the author or copyright owner provided with this content. Please go to the source to verify the license and copyright information for your use.""}","[{'authorId': '2166511', 'name': 'R. Socher'}, {'authorId': '50536468', 'name': 'Danqi Chen'}, {'authorId': '144783904', 'name': 'Christopher D. Manning'}, {'authorId': '34699434', 'name': 'A. Ng'}]",
