paperId,externalIds,title,venue,year,openAccessPdf,authors,abstract
8a1d0d8f2cce1a180c6b41c733262fe81ce35a9c,"{'MAG': '2950791045', 'DBLP': 'conf/nips/Cesa-BianchiDS13', 'ArXiv': '1302.4387', 'CorpusId': 443043}",Online Learning with Switching Costs and Other Adaptive Adversaries,Neural Information Processing Systems,2013,"{'url': '', 'status': None, 'license': None, 'disclaimer': 'Notice: Paper or abstract available at https://arxiv.org/abs/1302.4387, which is subject to the license by the author or copyright owner provided with this content. Please go to the source to verify the license and copyright information for your use.'}","[{'authorId': '1388387856', 'name': 'N. Cesa-Bianchi'}, {'authorId': '1716876', 'name': 'O. Dekel'}, {'authorId': '1768909', 'name': 'Ohad Shamir'}]","We study the power of different types of adaptive (nonoblivious) adversaries in the setting of prediction with expert advice, under both full-information and bandit feedback. We measure the player's performance using a new notion of regret, also known as policy regret, which better captures the adversary's adaptiveness to the player's behavior. In a setting where losses are allowed to drift, we characterize —in a nearly complete manner— the power of adaptive adversaries with bounded memories and switching costs. In particular, we show that with switching costs, the attainable rate with bandit feedback is Θ(T2/3). Interestingly, this rate is significantly worse than the Θ(√T) rate attainable with switching costs in the full-information case. Via a novel reduction from experts to bandits, we also show that a bounded memory adversary can force ****Θ(T2/3) regret even in the full information case, proving that switching costs are easier to control than bounded memory adversaries. Our lower bounds rely on a new stochastic adversary strategy that generates loss processes with strong dependencies."
8a5e1b4d47ed338bb74d960b0db85887fea95c55,"{'DBLP': 'conf/nips/DingBX13', 'MAG': '2135033879', 'CorpusId': 16387049}",k-Prototype Learning for 3D Rigid Structures,Neural Information Processing Systems,2013,"{'url': '', 'status': None, 'license': None, 'disclaimer': ""Notice: The following paper fields have been elided by the publisher: {'abstract'}. Paper or abstract available at http://papers.nips.cc/paper/5095-k-prototype-learning-for-3d-rigid-structures, which is subject to the license by the author or copyright owner provided with this content. Please go to the source to verify the license and copyright information for your use.""}","[{'authorId': '144060957', 'name': 'Hu Ding'}, {'authorId': '1854690', 'name': 'R. Berezney'}, {'authorId': '2257379523', 'name': 'Jinhui Xu'}]",
8aa520d43132f4662ed883f77cec2b6e007c0cc0,"{'MAG': '2132275248', 'DBLP': 'conf/nips/WagerCMN14', 'CorpusId': 14196506}",Feedback Detection for Live Predictors,Neural Information Processing Systems,2013,"{'url': '', 'status': None, 'license': None, 'disclaimer': ""Notice: The following paper fields have been elided by the publisher: {'abstract'}. Paper or abstract available at http://papers.nips.cc/paper/5394-feedback-detection-for-live-predictors.pdf, which is subject to the license by the author or copyright owner provided with this content. Please go to the source to verify the license and copyright information for your use.""}","[{'authorId': '3160667', 'name': 'Stefan Wager'}, {'authorId': '7545763', 'name': 'N. Chamandy'}, {'authorId': '2726238', 'name': 'Omkar Muralidharan'}, {'authorId': '145248524', 'name': 'A. Najmi'}]",
8ab5f6f7bb5d0f2c3ef378df599c9f2c728a1109,"{'MAG': '754962642', 'CorpusId': 2994346}",Unsupervised spectral learning of FSTs,Neural Information Processing Systems,2013,"{'url': '', 'status': None, 'license': None, 'disclaimer': ""Notice: The following paper fields have been elided by the publisher: {'abstract'}. Paper or abstract available at http://upcommons.upc.edu/bitstream/handle/2117/23685/Bailly%20et%20al.pdf?sequence=1, which is subject to the license by the author or copyright owner provided with this content. Please go to the source to verify the license and copyright information for your use.""}","[{'authorId': '1844132', 'name': 'Raphaël Bailly'}, {'authorId': '1701734', 'name': 'Xavier Carreras'}, {'authorId': '3171632', 'name': 'A. Quattoni'}]",
8ac0461d648a0299c0ff265dc72e391eec7a3731,"{'MAG': '2119464254', 'ArXiv': '1304.5575', 'DBLP': 'journals/corr/abs-1304-5575', 'CorpusId': 9479236}",Inverse Density as an Inverse Problem: the Fredholm Equation Approach,Neural Information Processing Systems,2013,"{'url': '', 'status': None, 'license': None, 'disclaimer': 'Notice: Paper or abstract available at https://arxiv.org/abs/1304.5575, which is subject to the license by the author or copyright owner provided with this content. Please go to the source to verify the license and copyright information for your use.'}","[{'authorId': '3136339', 'name': 'Qichao Que'}, {'authorId': '145520115', 'name': 'Mikhail Belkin'}]","In this paper we address the problem of estimating the ratio $\frac{q}{p}$ where $p$ is a density function and $q$ is another density, or, more generally an arbitrary function. Knowing or approximating this ratio is needed in various problems of inference and integration, in particular, when one needs to average a function with respect to one probability distribution, given a sample from another. It is often referred as {\it importance sampling} in statistical inference and is also closely related to the problem of {\it covariate shift} in transfer learning as well as to various MCMC methods. It may also be useful for separating the underlying geometry of a space, say a manifold, from the density function defined on it. 
Our approach is based on reformulating the problem of estimating $\frac{q}{p}$ as an inverse problem in terms of an integral operator corresponding to a kernel, and thus reducing it to an integral equation, known as the Fredholm problem of the first kind. This formulation, combined with the techniques of regularization and kernel methods, leads to a principled kernel-based framework for constructing algorithms and for analyzing them theoretically. 
The resulting family of algorithms (FIRE, for Fredholm Inverse Regularized Estimator) is flexible, simple and easy to implement. 
We provide detailed theoretical analysis including concentration bounds and convergence rates for the Gaussian kernel in the case of densities defined on $\R^d$, compact domains in $\R^d$ and smooth $d$-dimensional sub-manifolds of the Euclidean space. 
We also show experimental results including applications to classification and semi-supervised learning within the covariate shift framework and demonstrate some encouraging experimental comparisons. We also show how the parameters of our algorithms can be chosen in a completely unsupervised manner."
8ba555d9587688bd3225d71ef9d686dad288e1f1,"{'MAG': '2148516480', 'DBLP': 'conf/nips/Kang13', 'CorpusId': 3142457}",Fast Determinantal Point Process Sampling with Application to Clustering,Neural Information Processing Systems,2013,"{'url': '', 'status': None, 'license': None, 'disclaimer': ""Notice: The following paper fields have been elided by the publisher: {'abstract'}. Paper or abstract available at http://papers.nips.cc/paper/5008-fast-determinantal-point-process-sampling-with-application-to-clustering.pdf, which is subject to the license by the author or copyright owner provided with this content. Please go to the source to verify the license and copyright information for your use.""}","[{'authorId': '37768245', 'name': 'Byungkon Kang'}]",
8bf84420bf5027f71801ed500d2b018f35f5e29a,"{'MAG': '2556957722', 'CorpusId': 9996801}",Fisher-optimal neural population codes for high-dimensional diffeomorphic stimulus representations,Neural Information Processing Systems,2013,"{'url': '', 'status': None, 'license': None, 'disclaimer': ""Notice: The following paper fields have been elided by the publisher: {'abstract'}. Paper or abstract available at http://machinelearning.wustl.edu/mlpapers/paper_files/NIPS2013_4994.pdf, which is subject to the license by the author or copyright owner provided with this content. Please go to the source to verify the license and copyright information for your use.""}","[{'authorId': '2108367677', 'name': 'Zhuo Wang'}, {'authorId': '2100708', 'name': 'A. Stocker'}, {'authorId': '145675444', 'name': 'Daniel D. Lee'}]",
8c845143f2f971b2435f01dd97352cdb3a2e7390,"{'MAG': '2159023782', 'DBLP': 'conf/nips/TomiokaS13', 'ArXiv': '1303.6370', 'CorpusId': 12193593}",Convex Tensor Decomposition via Structured Schatten Norm Regularization,Neural Information Processing Systems,2013,"{'url': '', 'status': None, 'license': None, 'disclaimer': 'Notice: Paper or abstract available at https://arxiv.org/abs/1303.6370, which is subject to the license by the author or copyright owner provided with this content. Please go to the source to verify the license and copyright information for your use.'}","[{'authorId': '2870603', 'name': 'Ryota Tomioka'}, {'authorId': '2026193813', 'name': 'Taiji Suzuki'}]","We discuss structured Schatten norms for tensor decomposition that includes two recently proposed norms (""overlapped"" and ""latent"") for convex-optimization-based tensor decomposition, and connect tensor decomposition with wider literature on structured sparsity. Based on the properties of the structured Schatten norms, we mathematically analyze the performance of ""latent"" approach for tensor decomposition, which was empirically found to perform better than the ""overlapped"" approach in some settings. We show theoretically that this is indeed the case. In particular, when the unknown true tensor is low-rank in a specific mode, this approach performs as good as knowing the mode with the smallest rank. Along the way, we show a novel duality result for structures Schatten norms, establish the consistency, and discuss the identifiability of this approach. We confirm through numerical simulations that our theoretical prediction can precisely predict the scaling behavior of the mean squared error."
8da0ce1d1ffc8cdb7c75faed23a3a621a8774790,"{'MAG': '2147860430', 'DBLP': 'conf/nips/HanasusantoK13', 'CorpusId': 12659154}",Robust Data-Driven Dynamic Programming,Neural Information Processing Systems,2013,"{'url': '', 'status': None, 'license': None, 'disclaimer': ""Notice: The following paper fields have been elided by the publisher: {'abstract'}. Paper or abstract available at http://papers.nips.cc/paper/5123-robust-data-driven-dynamic-programming, which is subject to the license by the author or copyright owner provided with this content. Please go to the source to verify the license and copyright information for your use.""}","[{'authorId': '1822072', 'name': 'G. A. Hanasusanto'}, {'authorId': '2500534', 'name': 'D. Kuhn'}]",
8dcdc1efe29fc1418f28af6c542575f2ca0b9c35,"{'DBLP': 'conf/nips/SoufianiDLP13', 'MAG': '2128720307', 'CorpusId': 7769450}",Generalized Random Utility Models with Multiple Types,Neural Information Processing Systems,2013,"{'url': '', 'status': None, 'license': None, 'disclaimer': ""Notice: The following paper fields have been elided by the publisher: {'abstract'}. Paper or abstract available at https://dash.harvard.edu/bitstream/handle/1/12363923/25885776.pdf?sequence=1, which is subject to the license by the author or copyright owner provided with this content. Please go to the source to verify the license and copyright information for your use.""}","[{'authorId': '1753515', 'name': 'Hossein Azari Soufiani'}, {'authorId': '2400576954', 'name': 'Hansheng Diao'}, {'authorId': '2072863476', 'name': 'Zhenyu Lai'}, {'authorId': '30907562', 'name': 'D. Parkes'}]",
8fb73cebbaa86379d15a621df4a7aef2d5b7a0fd,"{'MAG': '2735622759', 'CorpusId': 65163205}",Modeling single-trial V1 population response to dynamic natural scenes,Neural Information Processing Systems,2013,"{'url': '', 'status': None, 'license': None}","[{'authorId': '2328257120', 'name': 'M. Zhu'}, {'authorId': '1690427', 'name': 'C. Rozell'}]",
90276bc747024a1251f4c9e119210e6a5225cfe8,"{'DBLP': 'conf/nips/MaungS13', 'MAG': '2129314216', 'CorpusId': 6924167}",Pass-efficient unsupervised feature selection,Neural Information Processing Systems,2013,"{'url': '', 'status': None, 'license': None, 'disclaimer': ""Notice: The following paper fields have been elided by the publisher: {'abstract'}. Paper or abstract available at http://papers.nips.cc/paper/4933-pass-efficient-unsupervised-feature-selection.pdf, which is subject to the license by the author or copyright owner provided with this content. Please go to the source to verify the license and copyright information for your use.""}","[{'authorId': '2524263', 'name': 'Crystal Maung'}, {'authorId': '1720169', 'name': 'H. Schweitzer'}]",
9109082b6e6b30b271841de49c4ae5dce23acccd,"{'MAG': '2991186648', 'CorpusId': 198974894}",Towards entertaining and efficient educational games,Neural Information Processing Systems,2013,"{'url': '', 'status': None, 'license': None, 'disclaimer': ""Notice: The following paper fields have been elided by the publisher: {'abstract'}. Paper or abstract available at http://pedagogus.edia.hu/sites/default/files/public/3/lorinczetal.pdf, which is subject to the license by the author or copyright owner provided with this content. Please go to the source to verify the license and copyright information for your use.""}","[{'authorId': '32197908', 'name': 'A. Lorincz'}, {'authorId': '39201903', 'name': 'G. Molnár'}, {'authorId': '2331345', 'name': 'László A. Jeni'}, {'authorId': '3395662', 'name': 'Z. Tősér'}, {'authorId': '2064020785', 'name': 'Attila Rausch'}, {'authorId': '1737918', 'name': 'J. Cohn'}, {'authorId': '67065538', 'name': 'B. Csapó'}]",
91291cd4c1be878c114c45741203d4a603560fdb,"{'DBLP': 'conf/nips/LiuP13', 'PubMedCentral': '4232941', 'MAG': '2130045679', 'CorpusId': 5962632, 'PubMed': '25404848'}",Bayesian Estimation of Latently-grouped Parameters in Undirected Graphical Models,Neural Information Processing Systems,2013,"{'url': '', 'status': None, 'license': None, 'disclaimer': 'Notice: Paper or abstract available at https://pmc.ncbi.nlm.nih.gov/articles/PMC4232941, which is subject to the license by the author or copyright owner provided with this content. Please go to the source to verify the license and copyright information for your use.'}","[{'authorId': '2146652216', 'name': 'Jie Liu'}, {'authorId': '144334798', 'name': 'David Page'}]","In large-scale applications of undirected graphical models, such as social networks and biological networks, similar patterns occur frequently and give rise to similar parameters. In this situation, it is beneficial to group the parameters for more efficient learning. We show that even when the grouping is unknown, we can infer these parameter groups during learning via a Bayesian approach. We impose a Dirichlet process prior on the parameters. Posterior inference usually involves calculating intractable terms, and we propose two approximation algorithms, namely a Metropolis-Hastings algorithm with auxiliary variables and a Gibbs sampling algorithm with “stripped” Beta approximation (Gibbs_SBA). Simulations show that both algorithms outperform conventional maximum likelihood estimation (MLE). Gibbs_SBA’s performance is close to Gibbs sampling with exact likelihood calculation. Models learned with Gibbs_SBA also generalize better than the models learned by MLE on real-world Senate voting data."
91608e4567959f331f3b231f4f8fb5e33ce71a15,"{'MAG': '2164773304', 'DBLP': 'conf/nips/KimGBS13', 'CorpusId': 6513464}",Efficient Online Inference for Bayesian Nonparametric Relational Models,Neural Information Processing Systems,2013,"{'url': '', 'status': None, 'license': None, 'disclaimer': ""Notice: The following paper fields have been elided by the publisher: {'abstract'}. Paper or abstract available at http://cs.brown.edu/people/daeil/docs/hdpr_2013.pdf, which is subject to the license by the author or copyright owner provided with this content. Please go to the source to verify the license and copyright information for your use.""}","[{'authorId': '2111888647', 'name': 'D. Kim'}, {'authorId': '2141648', 'name': 'Prem Gopalan'}, {'authorId': '1796335', 'name': 'D. Blei'}, {'authorId': '1799035', 'name': 'Erik B. Sudderth'}]",
93ad47fcd8dd0b3ca01e26cf16f66a3e6b400f3d,"{'MAG': '2143072755', 'DBLP': 'conf/nips/LeeST13', 'CorpusId': 9611584}",On model selection consistency of penalized M-estimators: a geometric theory,Neural Information Processing Systems,2013,"{'url': '', 'status': None, 'license': None, 'disclaimer': ""Notice: The following paper fields have been elided by the publisher: {'abstract'}. Paper or abstract available at http://papers.nips.cc/paper/5175-on-model-selection-consistency-of-penalized-m-estimators-a-geometric-theory, which is subject to the license by the author or copyright owner provided with this content. Please go to the source to verify the license and copyright information for your use.""}","[{'authorId': '2421201', 'name': 'J. Lee'}, {'authorId': '3340442', 'name': 'Yuekai Sun'}, {'authorId': '2110315433', 'name': 'Jonathan E. Taylor'}]",
93cb661b2d0dd846d99fa93a889d1c700caf4aae,"{'DBLP': 'conf/nips/LawlorZ13', 'MAG': '2949950285', 'ArXiv': '1306.3285', 'CorpusId': 591164}","Third-Order Edge Statistics: Contour Continuation, Curvature, and Cortical Connections",Neural Information Processing Systems,2013,"{'url': '', 'status': None, 'license': None, 'disclaimer': 'Notice: Paper or abstract available at https://arxiv.org/abs/1306.3285, which is subject to the license by the author or copyright owner provided with this content. Please go to the source to verify the license and copyright information for your use.'}","[{'authorId': '33496203', 'name': 'Matthew Lawlor'}, {'authorId': '1698824', 'name': 'S. Zucker'}]","Association field models have attempted to explain human contour grouping performance, and to explain the mean frequency of long-range horizontal connections across cortical columns in V1. However, association fields only depend on the pairwise statistics of edges in natural scenes. We develop a spectral test of the sufficiency of pairwise statistics and show there is significant higher order structure. An analysis using a probabilistic spectral embedding reveals curvature-dependent components."
94b6026526375caefe093e19733ee8bc05b16e2c,"{'DBLP': 'conf/nips/ShinGC13', 'MAG': '2950846366', 'ArXiv': '1306.1167', 'CorpusId': 14196031}",A Graphical Transformation for Belief Propagation: Maximum Weight Matchings and Odd-Sized Cycles,Neural Information Processing Systems,2013,"{'url': '', 'status': None, 'license': None, 'disclaimer': 'Notice: Paper or abstract available at https://arxiv.org/abs/1306.1167, which is subject to the license by the author or copyright owner provided with this content. Please go to the source to verify the license and copyright information for your use.'}","[{'authorId': '143720148', 'name': 'Jinwoo Shin'}, {'authorId': '145515598', 'name': 'A. Gelfand'}, {'authorId': '143930409', 'name': 'M. Chertkov'}]","We study the Maximum Weight Matching (MWM) problem for general graphs through the max-product Belief Propagation (BP) and related Linear Programming (LP). The BP approach provides distributed heuristics for finding the Maximum A Posteriori (MAP) assignment in a joint probability distribution represented by a Graphical Model (GM) and respective LPs can be considered as continuous relaxations of the discrete MAP problem. It was recently shown that a BP algorithm converges to the correct MWM assignment under a simple GM formulation of MAP/MWM as long as the corresponding LP relaxation is tight. First, under the motivation for forcing the tightness condition, we consider a new GM formulation of MWM, say C-GM, using non-intersecting odd-sized cycles in the graph: the new corresponding LP relaxation, say C-LP, becomes tight for more MWM instances. However, the tightness of C-LP now does not guarantee such convergence and correctness of the new BP on C-GM. To address the issue, we introduce a novel graph transformation applied to C-GM, which results in another GM formulation of MWM, and prove that the respective BP on it converges to the correct MAP/MWM assignment as long as C-LP is tight. Finally, we also show that C-LP always has half-integral solutions, which leads to an efficient BP-based MWM heuristic consisting of making sequential, `cutting plane', modifications to the underlying GM. Our experiments show that this BP-based cutting plane heuristic performs as well as that based on traditional LP solvers."
955a26f7288c9fd2d9ad73083dd10d308740565e,"{'DBLP': 'conf/nips/BlundellT13', 'MAG': '2096297741', 'CorpusId': 12032866}",Bayesian Hierarchical Community Discovery,Neural Information Processing Systems,2013,"{'url': '', 'status': None, 'license': None, 'disclaimer': ""Notice: The following paper fields have been elided by the publisher: {'abstract'}. Paper or abstract available at http://www.stats.ox.ac.uk/~teh/research/npbayes/BluTeh2013a.pdf, which is subject to the license by the author or copyright owner provided with this content. Please go to the source to verify the license and copyright information for your use.""}","[{'authorId': '1723876', 'name': 'C. Blundell'}, {'authorId': '1725303', 'name': 'Y. Teh'}]",
957795dabc24195acc89060a1553c771e6eaab8a,"{'DBLP': 'conf/nips/RogersLR13', 'MAG': '2139845993', 'CorpusId': 5957147}",Multilinear Dynamical Systems for Tensor Time Series,Neural Information Processing Systems,2013,"{'url': '', 'status': None, 'license': None, 'disclaimer': ""Notice: The following paper fields have been elided by the publisher: {'abstract'}. Paper or abstract available at http://www.cs.cmu.edu/~leili/pubs/rogers-nips2013-mlds.pdf, which is subject to the license by the author or copyright owner provided with this content. Please go to the source to verify the license and copyright information for your use.""}","[{'authorId': '2239806875', 'name': 'Mark Rogers'}, {'authorId': '143900005', 'name': 'Lei Li'}, {'authorId': '145107462', 'name': 'Stuart J. Russell'}]",
96ad725286674696012376ebc2f9a8c31564ea5a,"{'DBLP': 'conf/nips/Grabska-BarwinskaBPL13', 'MAG': '2103289252', 'CorpusId': 13472347}",Demixing odors - fast inference in olfaction,Neural Information Processing Systems,2013,"{'url': '', 'status': None, 'license': None, 'disclaimer': ""Notice: The following paper fields have been elided by the publisher: {'abstract'}. Paper or abstract available at https://www.unige.ch/medecine/neuf/files/2714/6598/8798/GrabskaetalNIPS13.pdf, which is subject to the license by the author or copyright owner provided with this content. Please go to the source to verify the license and copyright information for your use.""}","[{'authorId': '1398898827', 'name': 'A. Grabska-Barwinska'}, {'authorId': '31788123', 'name': 'J. Beck'}, {'authorId': '2469356', 'name': 'A. Pouget'}, {'authorId': '9967304', 'name': 'P. Latham'}]",
974651c4c4629504fdfb206f6d8becfd7814b168,"{'DBLP': 'conf/nips/Zhu13', 'ArXiv': '1306.4947', 'MAG': '2100046253', 'CorpusId': 7593961}",Machine Teaching for Bayesian Learners in the Exponential Family,Neural Information Processing Systems,2013,"{'url': '', 'status': None, 'license': None, 'disclaimer': 'Notice: Paper or abstract available at https://arxiv.org/abs/1306.4947, which is subject to the license by the author or copyright owner provided with this content. Please go to the source to verify the license and copyright information for your use.'}","[{'authorId': '1832364', 'name': 'Xiaojin Zhu'}]","What if there is a teacher who knows the learning goal and wants to design good training data for a machine learner? We propose an optimal teaching framework aimed at learners who employ Bayesian models. Our framework is expressed as an optimization problem over teaching examples that balance the future loss of the learner and the effort of the teacher. This optimization problem is in general hard. In the case where the learner employs conjugate exponential family models, we present an approximate algorithm for finding the optimal teaching set. Our algorithm optimizes the aggregate sufficient statistics, then unpacks them into actual teaching examples. We give several examples to illustrate our framework."
9778e2d3b3eac327c0370589e9c10394ca7b866e,"{'DBLP': 'conf/nips/YuHSZ13', 'MAG': '2147915981', 'CorpusId': 5650765}",Modeling Clutter Perception using Parametric Proto-object Partitioning,Neural Information Processing Systems,2013,"{'url': '', 'status': None, 'license': None, 'disclaimer': ""Notice: The following paper fields have been elided by the publisher: {'abstract'}. Paper or abstract available at http://www.psychology.sunysb.edu/gzelinsky-/index_htm_files/YHSZ2013.pdf, which is subject to the license by the author or copyright owner provided with this content. Please go to the source to verify the license and copyright information for your use.""}","[{'authorId': '2576295', 'name': 'Chen-Ping Yu'}, {'authorId': '39104865', 'name': 'Wen-Yu Hua'}, {'authorId': '145654220', 'name': 'D. Samaras'}, {'authorId': '1696991', 'name': 'G. Zelinsky'}]",
97806effc39ae85bbcc70cd98dcfca28e7cef9d3,"{'MAG': '2123589260', 'DBLP': 'conf/nips/RoughgardenK13', 'CorpusId': 495000}",Marginals-to-Models Reducibility,Neural Information Processing Systems,2013,"{'url': '', 'status': None, 'license': None, 'disclaimer': ""Notice: The following paper fields have been elided by the publisher: {'abstract'}. Paper or abstract available at http://papers.nips.cc/paper/4959-marginals-to-models-reducibility.pdf, which is subject to the license by the author or copyright owner provided with this content. Please go to the source to verify the license and copyright information for your use.""}","[{'authorId': '1712542', 'name': 'Tim Roughgarden'}, {'authorId': '81338045', 'name': 'Michael Kearns'}]",
